Sheet: balance
A1: of:=[$military_assets.A1] -> Title | B1: of:=[$military_assets.J1] -> Type | C1: of:=[$military_assets.E1] -> Attack | E1: of:=[$military_assets.F1] -> ShoreAttack | F1: of:=[$military_assets.G1] -> Defense | G1: of:=[$military_assets.H1] -> Logistics | I1: of:=[$military_assets.I1] -> Rosters | J1: Add bonus | K1: norm bonus | L1: Normalized Attack | M1: Normalized Defense | N1: NormShore | O1: Norm Combined | P1: Norm Combat | Q1: Combined
A2: of:=[$military_assets.A2] -> Nimitz Class CVN | B2: of:=[$military_assets.J2] -> Ship | C2: of:=[$military_assets.E2] -> 0 | E2: of:=[$military_assets.F2] -> 0 | F2: of:=[$military_assets.G2] -> 2 | G2: of:=[$military_assets.H2] -> 6 | I2: of:=[$military_assets.I2] -> USN | J2: of:=[.T17]+[.T7]+[.T8] -> 10.5 | K2: of:=[.J2]/[.G2] -> 1.75 | L2: of:=[.C2]/[.G2] -> 0 | M2: of:=[.F2]/[.G2] -> 0.333333333333333 | N2: of:=[.E2]/[.G2] -> 0 | O2: of:=[.M2]+[.L2]+[.N2]+[.K2] -> 2.08333333333333 | P2: of:=[.L2]+[.M2] -> 0.333333333333333 | Q2: of:=[.C2]+[.E2]/2+[.F2]+[.J2] -> 12.5
A3: of:=[$military_assets.A3] -> Gerald R Ford CVN | B3: of:=[$military_assets.J3] -> Ship | C3: of:=[$military_assets.E3] -> 0 | E3: of:=[$military_assets.F3] -> 0 | F3: of:=[$military_assets.G3] -> 2 | G3: of:=[$military_assets.H3] -> 7 | I3: of:=[$military_assets.I3] -> USN | J3: of:=[.T17]+[.T7]+[.T12]+[.T8] -> 11 | K3: of:=[.J3]/[.G3] -> 1.57142857142857 | L3: of:=[.C3]/[.G3] -> 0 | M3: of:=[.F3]/[.G3] -> 0.285714285714286 | N3: of:=[.E3]/[.G3] -> 0 | O3: of:=[.M3]+[.L3]+[.N3]+[.K3] -> 1.85714285714286 | P3: of:=[.L3]+[.M3] -> 0.285714285714286 | Q3: of:=[.C3]+[.E3]/2+[.F3]+[.J3] -> 13
A4: of:=[$military_assets.A4] -> Wasp Class LHA | B4: of:=[$military_assets.J4] -> Ship | C4: of:=[$military_assets.E4] -> 0 | E4: of:=[$military_assets.F4] -> 4 | F4: of:=[$military_assets.G4] -> 2 | G4: of:=[$military_assets.H4] -> 3 | I4: of:=[$military_assets.I4] -> USN | J4: of:=[.T19]+[.T16] -> 1.5 | K4: of:=[.J4]/[.G4] -> 0.5 | L4: of:=[.C4]/[.G4] -> 0 | M4: of:=[.F4]/[.G4] -> 0.666666666666667 | N4: of:=[.E4]/[.G4] -> 1.33333333333333 | O4: of:=[.M4]+[.L4]+[.N4]+[.K4] -> 2.5 | P4: of:=[.L4]+[.M4] -> 0.666666666666667 | Q4: of:=[.C4]+[.E4]/2+[.F4]+[.J4] -> 5.5 | S4: Ability Bonuses
A5: of:=[$military_assets.A5] -> America Class LHA | B5: of:=[$military_assets.J5] -> Ship | C5: of:=[$military_assets.E5] -> 0 | E5: of:=[$military_assets.F5] -> 3 | F5: of:=[$military_assets.G5] -> 2 | G5: of:=[$military_assets.H5] -> 5 | I5: of:=[$military_assets.I5] -> USN | J5: of:=[.T18]+[.T16] -> 2.5 | K5: of:=[.J5]/[.G5] -> 0.5 | L5: of:=[.C5]/[.G5] -> 0 | M5: of:=[.F5]/[.G5] -> 0.4 | N5: of:=[.E5]/[.G5] -> 0.6 | O5: of:=[.M5]+[.L5]+[.N5]+[.K5] -> 1.5 | P5: of:=[.L5]+[.M5] -> 0.4 | Q5: of:=[.C5]+[.E5]/2+[.F5]+[.J5] -> 6 | S5: Ambush | T5: 2
A6: of:=[$military_assets.A6] -> Seawolf Class SSN | B6: of:=[$military_assets.J6] -> Submarine | C6: of:=[$military_assets.E6] -> 4 | E6: of:=[$military_assets.F6] -> 0 | F6: of:=[$military_assets.G6] -> 4 | G6: of:=[$military_assets.H6] -> 5 | I6: of:=[$military_assets.I6] -> USN | J6: of:=[.T12]+[.T10]+[.T6]+[.T5] -> 4 | K6: of:=[.J6]/[.G6] -> 0.8 | L6: of:=[.C6]/[.G6] -> 0.8 | M6: of:=[.F6]/[.G6] -> 0.8 | N6: of:=[.E6]/[.G6] -> 0 | O6: of:=[.M6]+[.L6]+[.N6]+[.K6] -> 2.4 | P6: of:=[.L6]+[.M6] -> 1.6 | Q6: of:=[.C6]+[.E6]/2+[.F6]+[.J6] -> 12 | S6: Commerce Raider | T6: 1
A7: of:=[$military_assets.A7] -> Virginia Class SSN | B7: of:=[$military_assets.J7] -> Submarine | C7: of:=[$military_assets.E7] -> 3 | E7: of:=[$military_assets.F7] -> 0 | F7: of:=[$military_assets.G7] -> 4 | G7: of:=[$military_assets.H7] -> 4 | I7: of:=[$military_assets.I7] -> USN | J7: of:=[.T5]+[.T6]+[.T10] -> 3.5 | K7: of:=[.J7]/[.G7] -> 0.875 | L7: of:=[.C7]/[.G7] -> 0.75 | M7: of:=[.F7]/[.G7] -> 1 | N7: of:=[.E7]/[.G7] -> 0 | O7: of:=[.M7]+[.L7]+[.N7]+[.K7] -> 2.625 | P7: of:=[.L7]+[.M7] -> 1.75 | Q7: of:=[.C7]+[.E7]/2+[.F7]+[.J7] -> 10.5 | S7: Early Warn | T7: 3
A8: of:=[$military_assets.A8] -> Ohio Class SSGN | B8: of:=[$military_assets.J8] -> Submarine | C8: of:=[$military_assets.E8] -> 3 | E8: of:=[$military_assets.F8] -> 5 | F8: of:=[$military_assets.G8] -> 2 | G8: of:=[$military_assets.H8] -> 5 | I8: of:=[$military_assets.I8] -> USN | J8: of:=[.T5]+[.T6]+[.T12]+[.T10] -> 4 | K8: of:=[.J8]/[.G8] -> 0.8 | L8: of:=[.C8]/[.G8] -> 0.6 | M8: of:=[.F8]/[.G8] -> 0.4 | N8: of:=[.E8]/[.G8] -> 1 | O8: of:=[.M8]+[.L8]+[.N8]+[.K8] -> 2.8 | P8: of:=[.L8]+[.M8] -> 1 | Q8: of:=[.C8]+[.E8]/2+[.F8]+[.J8] -> 11.5 | S8: Help D +2 | T8: 3
A9: of:=[$military_assets.A9] -> Ticonderoga Class CG | B9: of:=[$military_assets.J9] -> Ship | C9: of:=[$military_assets.E9] -> 2 | E9: of:=[$military_assets.F9] -> 3 | F9: of:=[$military_assets.G9] -> 3 | G9: of:=[$military_assets.H9] -> 4 | I9: of:=[$military_assets.I9] -> USN | J9: of:=[.T8] -> 3 | K9: of:=[.J9]/[.G9] -> 0.75 | L9: of:=[.C9]/[.G9] -> 0.5 | M9: of:=[.F9]/[.G9] -> 0.75 | N9: of:=[.E9]/[.G9] -> 0.75 | O9: of:=[.M9]+[.L9]+[.N9]+[.K9] -> 2.75 | P9: of:=[.L9]+[.M9] -> 1.25 | Q9: of:=[.C9]+[.E9]/2+[.F9]+[.J9] -> 9.5 | S9: Help D +1 | T9: 1.5
A10: of:=[$military_assets.A10] -> Arleigh Burke Class DDG | B10: of:=[$military_assets.J10] -> Ship | C10: of:=[$military_assets.E10] -> 2 | E10: of:=[$military_assets.F10] -> 3 | F10: of:=[$military_assets.G10] -> 2 | G10: of:=[$military_assets.H10] -> 3 | I10: of:=[$military_assets.I10] -> USN | J10: of:=[.T8] -> 3 | K10: of:=[.J10]/[.G10] -> 1 | L10: of:=[.C10]/[.G10] -> 0.666666666666667 | M10: of:=[.F10]/[.G10] -> 0.666666666666667 | N10: of:=[.E10]/[.G10] -> 1 | O10: of:=[.M10]+[.L10]+[.N10]+[.K10] -> 3.33333333333333 | P10: of:=[.L10]+[.M10] -> 1.33333333333333 | Q10: of:=[.C10]+[.E10]/2+[.F10]+[.J10] -> 8.5 | S10: Hidden | T10: 0.5
A11: of:=[$military_assets.A11] -> Zumwalt Class DDG | B11: of:=[$military_assets.J11] -> Ship | C11: of:=[$military_assets.E11] -> 2 | E11: of:=[$military_assets.F11] -> 4 | F11: of:=[$military_assets.G11] -> 3 | G11: of:=[$military_assets.H11] -> 3 | I11: of:=[$military_assets.I11] -> USN | J11: 0 | K11: of:=[.J11]/[.G11] -> 0 | L11: of:=[.C11]/[.G11] -> 0.666666666666667 | M11: of:=[.F11]/[.G11] -> 1 | N11: of:=[.E11]/[.G11] -> 1.33333333333333 | O11: of:=[.M11]+[.L11]+[.N11]+[.K11] -> 3 | P11: of:=[.L11]+[.M11] -> 1.66666666666667 | Q11: of:=[.C11]+[.E11]/2+[.F11]+[.J11] -> 7 | S11: No attack | T11: -2
A12: of:=[$military_assets.A12] -> F/A-18E Superhornet | B12: of:=[$military_assets.J12] -> Squadron | C12: of:=[$military_assets.E12] -> 4 | E12: of:=[$military_assets.F12] -> 4 | F12: of:=[$military_assets.G12] -> 3 | G12: of:=[$military_assets.H12] -> 2 | I12: of:=[$military_assets.I12] -> USN | J12: of:=[.T10]+[.T15] -> -1.5 | K12: of:=[.J12]/[.G12] -> -0.75 | L12: of:=[.C12]/[.G12] -> 2 | M12: of:=[.F12]/[.G12] -> 1.5 | N12: of:=[.E12]/[.G12] -> 2 | O12: of:=[.M12]+[.L12]+[.N12]+[.K12] -> 4.75 | P12: of:=[.L12]+[.M12] -> 3.5 | Q12: of:=[.C12]+[.E12]/2+[.F12]+[.J12] -> 7.5 | S12: Other +.5 | T12: 0.5
A13: of:=[$military_assets.A13] -> F-35B Lightning II | B13: of:=[$military_assets.J13] -> Squadron | C13: of:=[$military_assets.E13] -> 4 | E13: of:=[$military_assets.F13] -> 3 | F13: of:=[$military_assets.G13] -> 2 | G13: of:=[$military_assets.H13] -> 3 | I13: of:=[$military_assets.I13] -> USN | J13: of:=[.T15]+[.T5]+[.T10] -> 0.5 | K13: of:=[.J13]/[.G13] -> 0.166666666666667 | L13: of:=[.C13]/[.G13] -> 1.33333333333333 | M13: of:=[.F13]/[.G13] -> 0.666666666666667 | N13: of:=[.E13]/[.G13] -> 1 | O13: of:=[.M13]+[.L13]+[.N13]+[.K13] -> 3.16666666666667 | P13: of:=[.L13]+[.M13] -> 2 | Q13: of:=[.C13]+[.E13]/2+[.F13]+[.J13] -> 8 | S13: Other +1 | T13: 2
A14: of:=[$military_assets.A14] -> F-35C  Lightning II | B14: of:=[$military_assets.J14] -> Squadron | C14: of:=[$military_assets.E14] -> 4 | E14: of:=[$military_assets.F14] -> 4 | F14: of:=[$military_assets.G14] -> 2 | G14: of:=[$military_assets.H14] -> 2 | I14: of:=[$military_assets.I14] -> USN | J14: of:=[.T5]+[.T10]+[.T15] -> 0.5 | K14: of:=[.J14]/[.G14] -> 0.25 | L14: of:=[.C14]/[.G14] -> 2 | M14: of:=[.F14]/[.G14] -> 1 | N14: of:=[.E14]/[.G14] -> 2 | O14: of:=[.M14]+[.L14]+[.N14]+[.K14] -> 5.25 | P14: of:=[.L14]+[.M14] -> 3 | Q14: of:=[.C14]+[.E14]/2+[.F14]+[.J14] -> 8.5
A15: of:=[$military_assets.A15] -> AV-8B Harrier II | B15: of:=[$military_assets.J15] -> Squadron | C15: of:=[$military_assets.E15] -> 3 | E15: of:=[$military_assets.F15] -> 3 | F15: of:=[$military_assets.G15] -> 2 | G15: of:=[$military_assets.H15] -> 1 | I15: of:=[$military_assets.I15] -> USN | J15: of:=[.T10]+[.T15] -> -1.5 | K15: of:=[.J15]/[.G15] -> -1.5 | L15: of:=[.C15]/[.G15] -> 3 | M15: of:=[.F15]/[.G15] -> 2 | N15: of:=[.E15]/[.G15] -> 3 | O15: of:=[.M15]+[.L15]+[.N15]+[.K15] -> 6.5 | P15: of:=[.L15]+[.M15] -> 5 | Q15: of:=[.C15]+[.E15]/2+[.F15]+[.J15] -> 5 | S15: Aircraft | T15: -2
A16: of:=[$military_assets.A16] -> Kuznetsov Class CV | B16: of:=[$military_assets.J16] -> Ship | C16: of:=[$military_assets.E16] -> 4 | E16: of:=[$military_assets.F16] -> 2 | F16: of:=[$military_assets.G16] -> 2 | G16: of:=[$military_assets.H16] -> 6 | I16: of:=[$military_assets.I16] -> RUS | J16: of:=[.T19]+[.T8] -> 6 | K16: of:=[.J16]/[.G16] -> 1 | L16: of:=[.C16]/[.G16] -> 0.666666666666667 | M16: of:=[.F16]/[.G16] -> 0.333333333333333 | N16: of:=[.E16]/[.G16] -> 0.333333333333333 | O16: of:=[.M16]+[.L16]+[.N16]+[.K16] -> 2.33333333333333 | P16: of:=[.L16]+[.M16] -> 1 | Q16: of:=[.C16]+[.E16]/2+[.F16]+[.J16] -> 13 | S16: VTOL only | T16: -1.5
A17: of:=[$military_assets.A17] -> Kirov Class CGN | B17: of:=[$military_assets.J17] -> Ship | C17: of:=[$military_assets.E17] -> 6 | E17: of:=[$military_assets.F17] -> 2 | F17: of:=[$military_assets.G17] -> 4 | G17: of:=[$military_assets.H17] -> 6 | I17: of:=[$military_assets.I17] -> RUS | J17: of:=[.T9] -> 1.5 | K17: of:=[.J17]/[.G17] -> 0.25 | L17: of:=[.C17]/[.G17] -> 1 | M17: of:=[.F17]/[.G17] -> 0.666666666666667 | N17: of:=[.E17]/[.G17] -> 0.333333333333333 | O17: of:=[.M17]+[.L17]+[.N17]+[.K17] -> 2.25 | P17: of:=[.L17]+[.M17] -> 1.66666666666667 | Q17: of:=[.C17]+[.E17]/2+[.F17]+[.J17] -> 12.5 | S17: Carrier 3 | T17: 4.5
A18: of:=[$military_assets.A18] -> Slava Class CG | B18: of:=[$military_assets.J18] -> Ship | C18: of:=[$military_assets.E18] -> 4 | E18: of:=[$military_assets.F18] -> 2 | F18: of:=[$military_assets.G18] -> 2 | G18: of:=[$military_assets.H18] -> 3 | I18: of:=[$military_assets.I18] -> RUS | J18: of:=[.T9] -> 1.5 | K18: of:=[.J18]/[.G18] -> 0.5 | L18: of:=[.C18]/[.G18] -> 1.33333333333333 | M18: of:=[.F18]/[.G18] -> 0.666666666666667 | N18: of:=[.E18]/[.G18] -> 0.666666666666667 | O18: of:=[.M18]+[.L18]+[.N18]+[.K18] -> 3.16666666666667 | P18: of:=[.L18]+[.M18] -> 2 | Q18: of:=[.C18]+[.E18]/2+[.F18]+[.J18] -> 8.5 | S18: Carrier 2 | T18: 4
A19: of:=[$military_assets.A19] -> Udaloy II Class DDG | B19: of:=[$military_assets.J19] -> Ship | C19: of:=[$military_assets.E19] -> 3 | E19: of:=[$military_assets.F19] -> 2 | F19: of:=[$military_assets.G19] -> 3 | G19: of:=[$military_assets.H19] -> 2 | I19: of:=[$military_assets.I19] -> RUS | J19: 0 | K19: of:=[.J19]/[.G19] -> 0 | L19: of:=[.C19]/[.G19] -> 1.5 | M19: of:=[.F19]/[.G19] -> 1.5 | N19: of:=[.E19]/[.G19] -> 1 | O19: of:=[.M19]+[.L19]+[.N19]+[.K19] -> 4 | P19: of:=[.L19]+[.M19] -> 3 | Q19: of:=[.C19]+[.E19]/2+[.F19]+[.J19] -> 7 | S19: Carrier 1 | T19: 3
A20: of:=[$military_assets.A20] -> Gorshkov Class FFG | B20: of:=[$military_assets.J20] -> Ship | C20: of:=[$military_assets.E20] -> 3 | E20: of:=[$military_assets.F20] -> 2 | F20: of:=[$military_assets.G20] -> 2 | G20: of:=[$military_assets.H20] -> 2 | I20: of:=[$military_assets.I20] -> RUS | J20: of:=[.T10] -> 0.5 | K20: of:=[.J20]/[.G20] -> 0.25 | L20: of:=[.C20]/[.G20] -> 1.5 | M20: of:=[.F20]/[.G20] -> 1 | N20: of:=[.E20]/[.G20] -> 1 | O20: of:=[.M20]+[.L20]+[.N20]+[.K20] -> 3.75 | P20: of:=[.L20]+[.M20] -> 2.5 | Q20: of:=[.C20]+[.E20]/2+[.F20]+[.J20] -> 6.5
A21: of:=[$military_assets.A21] -> Yasen Class SSGN | B21: of:=[$military_assets.J21] -> Submarine | C21: of:=[$military_assets.E21] -> 5 | E21: of:=[$military_assets.F21] -> 0 | F21: of:=[$military_assets.G21] -> 3 | G21: of:=[$military_assets.H21] -> 5 | I21: of:=[$military_assets.I21] -> RUS | J21: of:=[.T5]+[.T6]+[.T10] -> 3.5 | K21: of:=[.J21]/[.G21] -> 0.7 | L21: of:=[.C21]/[.G21] -> 1 | M21: of:=[.F21]/[.G21] -> 0.6 | N21: of:=[.E21]/[.G21] -> 0 | O21: of:=[.M21]+[.L21]+[.N21]+[.K21] -> 2.3 | P21: of:=[.L21]+[.M21] -> 1.6 | Q21: of:=[.C21]+[.E21]/2+[.F21]+[.J21] -> 11.5
A22: of:=[$military_assets.A22] -> Lada Class SSK | B22: of:=[$military_assets.J22] -> Submarine | C22: of:=[$military_assets.E22] -> 3 | E22: of:=[$military_assets.F22] -> 0 | F22: of:=[$military_assets.G22] -> 2 | G22: of:=[$military_assets.H22] -> 2 | I22: of:=[$military_assets.I22] -> RUS | J22: of:=[.T5]+[.T10]+[.T11] -> 0.5 | K22: of:=[.J22]/[.G22] -> 0.25 | L22: of:=[.C22]/[.G22] -> 1.5 | M22: of:=[.F22]/[.G22] -> 1 | N22: of:=[.E22]/[.G22] -> 0 | O22: of:=[.M22]+[.L22]+[.N22]+[.K22] -> 2.75 | P22: of:=[.L22]+[.M22] -> 2.5 | Q22: of:=[.C22]+[.E22]/2+[.F22]+[.J22] -> 5.5
A23: of:=[$military_assets.A23] -> Oscar II Class SSGN | B23: of:=[$military_assets.J23] -> Submarine | C23: of:=[$military_assets.E23] -> 4 | E23: of:=[$military_assets.F23] -> 0 | F23: of:=[$military_assets.G23] -> 1 | G23: of:=[$military_assets.H23] -> 3 | I23: of:=[$military_assets.I23] -> RUS | J23: of:=[.T5]+[.T6]+[.T12]+[.T10] -> 4 | K23: of:=[.J23]/[.G23] -> 1.33333333333333 | L23: of:=[.C23]/[.G23] -> 1.33333333333333 | M23: of:=[.F23]/[.G23] -> 0.333333333333333 | N23: of:=[.E23]/[.G23] -> 0 | O23: of:=[.M23]+[.L23]+[.N23]+[.K23] -> 3 | P23: of:=[.L23]+[.M23] -> 1.66666666666667 | Q23: of:=[.C23]+[.E23]/2+[.F23]+[.J23] -> 9
A24: of:=[$military_assets.A24] -> Mig-29K Fulcrum-D | B24: of:=[$military_assets.J24] -> Squadron | C24: of:=[$military_assets.E24] -> 4 | E24: of:=[$military_assets.F24] -> 3 | F24: of:=[$military_assets.G24] -> 3 | G24: of:=[$military_assets.H24] -> 1 | I24: of:=[$military_assets.I24] -> RUS | J24: of:=[.T10]+[.T15] -> -1.5 | K24: of:=[.J24]/[.G24] -> -1.5 | L24: of:=[.C24]/[.G24] -> 4 | M24: of:=[.F24]/[.G24] -> 3 | N24: of:=[.E24]/[.G24] -> 3 | O24: of:=[.M24]+[.L24]+[.N24]+[.K24] -> 8.5 | P24: of:=[.L24]+[.M24] -> 7 | Q24: of:=[.C24]+[.E24]/2+[.F24]+[.J24] -> 7
A25: of:=[$military_assets.A25] -> Su-33 Flanker-D | B25: of:=[$military_assets.J25] -> Squadron | C25: of:=[$military_assets.E25] -> 4 | E25: of:=[$military_assets.F25] -> 4 | F25: of:=[$military_assets.G25] -> 3 | G25: of:=[$military_assets.H25] -> 1 | I25: of:=[$military_assets.I25] -> RUS | J25: of:=[.T10]+[.T15] -> -1.5 | K25: of:=[.J25]/[.G25] -> -1.5 | L25: of:=[.C25]/[.G25] -> 4 | M25: of:=[.F25]/[.G25] -> 3 | N25: of:=[.E25]/[.G25] -> 4 | O25: of:=[.M25]+[.L25]+[.N25]+[.K25] -> 9.5 | P25: of:=[.L25]+[.M25] -> 7 | Q25: of:=[.C25]+[.E25]/2+[.F25]+[.J25] -> 7.5
A26: of:=[$military_assets.A26] -> Victor III Class SSN | B26: of:=[$military_assets.J26] -> Submarine | C26: of:=[$military_assets.E26] -> 2 | E26: of:=[$military_assets.F26] -> 0 | F26: of:=[$military_assets.G26] -> 1 | G26: of:=[$military_assets.H26] -> 1 | I26: of:=[$military_assets.I26] -> RUS | J26: of:=[.T5]+[.T10]+[.T6] -> 3.5 | K26: of:=[.J26]/[.G26] -> 3.5 | L26: of:=[.C26]/[.G26] -> 2 | M26: of:=[.F26]/[.G26] -> 1 | N26: of:=[.E26]/[.G26] -> 0 | O26: of:=[.M26]+[.L26]+[.N26]+[.K26] -> 6.5 | P26: of:=[.L26]+[.M26] -> 3 | Q26: of:=[.C26]+[.E26]/2+[.F26]+[.J26] -> 6.5
A27: of:=[$military_assets.A27] -> Akula Class SSN | B27: of:=[$military_assets.J27] -> Submarine | C27: of:=[$military_assets.E27] -> 3 | E27: of:=[$military_assets.F27] -> 0 | F27: of:=[$military_assets.G27] -> 3 | G27: of:=[$military_assets.H27] -> 3 | I27: of:=[$military_assets.I27] -> RUS | J27: of:=[.T5]+[.T6]+[.T10] -> 3.5 | K27: of:=[.J27]/[.G27] -> 1.16666666666667 | L27: of:=[.C27]/[.G27] -> 1 | M27: of:=[.F27]/[.G27] -> 1 | N27: of:=[.E27]/[.G27] -> 0 | O27: of:=[.M27]+[.L27]+[.N27]+[.K27] -> 3.16666666666667 | P27: of:=[.L27]+[.M27] -> 2 | Q27: of:=[.C27]+[.E27]/2+[.F27]+[.J27] -> 9.5
A28: of:=[$military_assets.A28] -> Sovremanny Class DDG | B28: of:=[$military_assets.J28] -> Ship | C28: of:=[$military_assets.E28] -> 2 | E28: of:=[$military_assets.F28] -> 0 | F28: of:=[$military_assets.G28] -> 2 | G28: of:=[$military_assets.H28] -> 1 | I28: of:=[$military_assets.I28] -> RUS | J28: 0 | K28: of:=[.J28]/[.G28] -> 0 | L28: of:=[.C28]/[.G28] -> 2 | M28: of:=[.F28]/[.G28] -> 2 | N28: of:=[.E28]/[.G28] -> 0 | O28: of:=[.M28]+[.L28]+[.N28]+[.K28] -> 4 | P28: of:=[.L28]+[.M28] -> 4 | Q28: of:=[.C28]+[.E28]/2+[.F28]+[.J28] -> 4
M31: Chart data | N31: Logistics | O31: Combined
N32: of:=[.G2] -> 6 | O32: of:=[.Q2] -> 12.5
N33: of:=[.G3] -> 7 | O33: of:=[.Q3] -> 13
N34: of:=[.G4] -> 3 | O34: of:=[.Q4] -> 5.5
N35: of:=[.G5] -> 5 | O35: of:=[.Q5] -> 6
N36: of:=[.G6] -> 5 | O36: of:=[.Q6] -> 12
N37: of:=[.G7] -> 4 | O37: of:=[.Q7] -> 10.5
N38: of:=[.G8] -> 5 | O38: of:=[.Q8] -> 11.5
N39: of:=[.G9] -> 4 | O39: of:=[.Q9] -> 9.5
N40: of:=[.G10] -> 3 | O40: of:=[.Q10] -> 8.5
N41: of:=[.G11] -> 3 | O41: of:=[.Q11] -> 7
N42: of:=[.G12] -> 2 | O42: of:=[.Q12] -> 7.5
N43: of:=[.G13] -> 3 | O43: of:=[.Q13] -> 8
N44: of:=[.G14] -> 2 | O44: of:=[.Q14] -> 8.5
N45: of:=[.G15] -> 1 | O45: of:=[.Q15] -> 5
N46: of:=[.G16] -> 6 | O46: of:=[.Q16] -> 13
N47: of:=[.G17] -> 6 | O47: of:=[.Q17] -> 12.5
N48: of:=[.G18] -> 3 | O48: of:=[.Q18] -> 8.5
N49: of:=[.G19] -> 2 | O49: of:=[.Q19] -> 7
N50: of:=[.G20] -> 2 | O50: of:=[.Q20] -> 6.5
N51: of:=[.G21] -> 5 | O51: of:=[.Q21] -> 11.5
N52: of:=[.G22] -> 2 | O52: of:=[.Q22] -> 5.5
N53: of:=[.G23] -> 3 | O53: of:=[.Q23] -> 9
N54: of:=[.G24] -> 1 | O54: of:=[.Q24] -> 7
N55: of:=[.G25] -> 1 | O55: of:=[.Q25] -> 7.5
N56: of:=[.G26] -> 1 | O56: of:=[.Q26] -> 6.5
N57: of:=[.G27] -> 3 | O57: of:=[.Q27] -> 9.5
N58: of:=[.G28] -> 1 | O58: of:=[.Q28] -> 4

Sheet: version
A1: 0.0.2

Sheet: effects
A1: UNUSED
A2: UNUSED
A3: CATOBAR: Compatible with CATOBAR, VTOL, and STOBAR squadrons.
A4: E-2C Hawkeye: All squadrons you control in a combat including this asset have +1 attack and defense.
A5: UNUSED
A6: VTOL: Compatible with all VTOL aircraft squadrons.
A7: UNUSED
A8: Surprise Attacker: This asset deals damage during the Surprise Damage Step.
A9: Special Purposes: Each time this military asset is flipped face up, your opponent must reveal one card from their hand at random.
A10: Strategic Strike Capability: At the end of your turn, if this asset is face-up and did not take part in a combat, your opponent must discard one card from their deck.
A11: AEGIS: +2 Help Defense.
A12: UNUSED
A13: UNUSED
A14: UNUSED
A15: UNUSED
A16: UNUSED
A17: UNUSED
A18: RAINFALL: During your first deployment phase each turn, select a face down asset controlled by your opponent. Your opponent must reveal this asset. It remains face down afterwards.
A19: Coastal Defender: This asset cannot take part in an attack.
A20: S-300: +1 Help Defense.
A21: UNUSED
A22: Hidden: Can be played face down.
A23: STOBAR: Compatible with STOBAR and VTOL squadrons.
A24: Commerce Raider: When sieging a player directly, this military asset's siege is equal to its attack.
A25: E-2D Hawkeye-I: All friendly air squadrons in combat with this asset have +1 attack and defense. Enemy air squadrons lose Ambush.
A26: VTOL
A27: STOBAR
A28: CATOBAR
A29: Carrier 1: Can station 1 aircraft squadron.
A30: Carrier 2: Can station 2 aircraft squadrons.
A31: Carrier 3: Can station 3 aircraft squadrons.
A32: Partisans: Provides -4 logistics capacity if controlled by a non-Russian player.
A33: Grants 2 logistics capacity to the USN player if controlled by their opponent.
A34: CAP: +2 Help Defense

Sheet: military_assets
A1: Title | B1: Unused0 | C1: Unused1 | D1: Unused2 | E1: Attack | F1: ShoreAttack | G1: Defense | H1: Logistics | I1: Rosters | J1: Type | K1: Description | L1: Image | M1: FlavorText | N1: Version
A2: Nimitz Class CVN | E2: 0 | F2: 0 | G2: 2 | H2: 6 | I2: USN | J2: Ship | K2: of:=[$effects.$A3]&CHAR(10)&[$effects.$A4]&CHAR(10)&[$effects.$A$31]&CHAR(10)&[$effects.$A$34] -> CATOBAR: Compatible with CATOBAR, VTOL, and  STOBAR squadrons.
E-2C Hawkeye: All squadrons you control in a combat including this asset have +1 attack and  defense.
Carrier 3: Can station 3 aircraft squadrons.
CAP: +2 Help Defense | L2: Images/nimitz.jpg | M2: A military airbase at sea, a Nimitz carrier is more than three times as long as a football field and has more than twice the displacement of the German super-battleship Bismarck. | N2: of:=[$version.$A$1] -> 0.0.2
A3: Gerald R Ford CVN | E3: 0 | F3: 0 | G3: 2 | H3: 7 | I3: USN | J3: Ship | K3: of:=[$effects.$A3]&CHAR(10)&[$effects.$A25]&CHAR(10)&[$effects.$A$31]&CHAR(10)&[$effects.$A$34] -> CATOBAR: Compatible with CATOBAR, VTOL, and  STOBAR squadrons.
E-2D Hawkeye-I: All friendly air squadrons in combat with this asset have +1 attack and  defense. Enemy air squadrons lose Ambush.
Carrier 3: Can station 3 aircraft squadrons.
CAP: +2 Help Defense | L3: Images/ford.jpg | N3: of:=[$version.$A$1] -> 0.0.2
A4: Wasp Class LHA | E4: 0 | F4: 4 | G4: 2 | H4: 3 | I4: USN | J4: Ship | K4: of:=[$effects.$A6]&CHAR(10)&[$effects.$A29] -> VTOL: Compatible with all VTOL aircraft squadrons.
Carrier 1: Can station 1 aircraft squadron. | L4: Images/wasp.jpg | M4: In addition to supporting VTOL aircraft, a Wasp amphibious assault ship is capable of delivering a Marine Expeditionary Unit complete with its armored vehicles to hostile shores via helicopters and landing craft. | N4: of:=[$version.$A$1] -> 0.0.2
A5: America Class LHA | E5: 0 | F5: 3 | G5: 2 | H5: 5 | I5: USN | J5: Ship | K5: of:=[$effects.$A6]&CHAR(10)&[$effects.$A$30] -> VTOL: Compatible with all VTOL aircraft squadrons.
Carrier 2: Can station 2 aircraft squadrons. | L5: Images/america.jpg | N5: of:=[$version.$A$1] -> 0.0.2
A6: Seawolf Class SSN | E6: 4 | F6: 0 | G6: 4 | H6: 5 | I6: USN | J6: Submarine | K6: of:=[$effects.$A8]&CHAR(10)&[$effects.$A9]&CHAR(10)&[$effects.$A22]&CHAR(10)&[$effects.$A24] -> Surprise Attacker: This asset deals damage during the Surprise Damage Step.
Special Purposes: Each time this military asset is flipped face up, your opponent must reveal one card from their hand at random.
Hidden: Can be played face down. 
Commerce Raider: When sieging a player directly, this military asset's siege is equal to its attack. | L6: Images/seawolf.jpg | M6: As the most expensive class of attack submarine ever built, the Seawolf is the apex predator of the US Navy's submarine fleet. | N6: of:=[$version.$A$1] -> 0.0.2
A7: Virginia Class SSN | E7: 3 | F7: 0 | G7: 4 | H7: 4 | I7: USN | J7: Submarine | K7: of:=[$effects.$A8]&CHAR(10)&[$effects.$A22]&CHAR(10)&[$effects.$A24] -> Surprise Attacker: This asset deals damage during the Surprise Damage Step.
Hidden: Can be played face down. 
Commerce Raider: When sieging a player directly, this military asset's siege is equal to its attack. | L7: Images/virginia.jpg | M7: The advanced Virginia will be the standard attack submarine of the US Navy until at least the middle of the 21st century. | N7: of:=[$version.$A$1] -> 0.0.2
A8: Ohio Class SSGN | E8: 3 | F8: 5 | G8: 2 | H8: 5 | I8: USN | J8: Submarine | K8: of:=[$effects.$A8]&CHAR(10)&[$effects.$A10]&CHAR(10)&[$effects.$A22] -> Surprise Attacker: This asset deals damage during the Surprise Damage Step.
Strategic Strike Capability: At the end of your turn, if this asset is face-up and did not take part in a combat, your opponent must discard one card from their deck.
Hidden: Can be played face down.  | L8: Images/ohio.jpg | M8: Although Ohio was originally intended to carry nuclear ballistic missiles, some Ohio's have been modified as SSGNs for surface warfare and land-attack missions. | N8: of:=[$version.$A$1] -> 0.0.2
A9: Ticonderoga Class CG | E9: 2 | F9: 3 | G9: 3 | H9: 4 | I9: USN | J9: Ship | K9: of:=[$effects.$A11] -> AEGIS: +2 Help Defense. | L9: Images/ticonderoga.jpg | M9: Despite a modest displacement by historical standards, the Ticonderoga is the largest surface combatant in the US Navy. | N9: of:=[$version.$A$1] -> 0.0.2
A10: Arleigh Burke Class DDG | E10: 2 | F10: 3 | G10: 2 | H10: 3 | I10: USN | J10: Ship | K10: of:=[$effects.$A11] -> AEGIS: +2 Help Defense. | L10: Images/arleighburke.jpg | M10: The multi-mission-capable Arleigh Burke is the most numerous ship in and workhorse of the US Navy. | N10: of:=[$version.$A$1] -> 0.0.2
A11: Zumwalt Class DDG | E11: 2 | F11: 4 | G11: 3 | H11: 3 | I11: USN | J11: Ship | K11: of:=[$effects.$A22] -> Hidden: Can be played face down.  | L11: Images/zumwalt.jpg | M11: With a cost of $1M per shot from its main howitzer, it is important for the crew of a Zumwalt to aim carefully. | N11: of:=[$version.$A$1] -> 0.0.2
A12: F/A-18E Superhornet | E12: 4 | F12: 4 | G12: 3 | H12: 2 | I12: USN | J12: Squadron | K12: of:=[$effects.$A28]&CHAR(10)&[$effects.$A$22] -> CATOBAR
Hidden: Can be played face down.  | L12: Images/f18.jpg | M12: The F/A-18 is one of the longest-tenured and most battle-proven multi-role carrier aircraft in the world. | N12: of:=[$version.$A$1] -> 0.0.2
A13: F-35B Lightning II | E13: 4 | F13: 3 | G13: 2 | H13: 3 | I13: USN | J13: Squadron | K13: of:=[$effects.$A26]&CHAR(10)&[$effects.$A22]&CHAR(10)&[$effects.$A$8] -> VTOL
Hidden: Can be played face down. 
Surprise Attacker: This asset deals damage during the Surprise Damage Step. | L13: Images/f35b.jpg | M13: The F-35B is a special variant of the F-35 capable of taking off and landing vertically. This allows it to be stationed on smaller carriers that have typically not been able to field cutting-edge aircraft. | N13: of:=[$version.$A$1] -> 0.0.2
A14: F-35C Lightning II | E14: 4 | F14: 4 | G14: 2 | H14: 2 | I14: USN | J14: Squadron | K14: of:=[$effects.$A28]&CHAR(10)&[$effects.$A22]&CHAR(10)&[$effects.$A$8] -> CATOBAR
Hidden: Can be played face down. 
Surprise Attacker: This asset deals damage during the Surprise Damage Step. | L14: Images/f35c.jpg | M14: The F-35 acquisition program cost of just under $450 billion USD would be enough to buy 450 billion $1 cheeseburgers - enough to kill all humans on earth. | N14: of:=[$version.$A$1] -> 0.0.2
A15: AV-8B Harrier II | E15: 3 | F15: 3 | G15: 2 | H15: 1 | I15: USN | J15: Squadron | K15: of:=[$effects.$A26]&CHAR(10)&[$effects.$A$22] -> VTOL
Hidden: Can be played face down.  | L15: Images/harrier.jpg | M15: A Pepsi ad campaign promised to award a Harrier to anyone who collected enough Pepsi points- a promise Pepsi did not keep. During its service history, the Harrier has proven it is more reliable than Pepsi Co. | N15: of:=[$version.$A$1] -> 0.0.2
A16: Kuznetsov Class CV | E16: 4 | F16: 2 | G16: 2 | H16: 6 | I16: RUS | J16: Ship | K16: of:=[$effects.$A23]&CHAR(10)&[$effects.$A$29]&CHAR(10)&[$effects.$A$34] -> STOBAR: Compatible with STOBAR and VTOL squadrons.
Carrier 1: Can station 1 aircraft squadron.
CAP: +2 Help Defense | L16: Images/kuznetsov.jpg | M16: Although sold to a company in Macau supposedly for use as a floating casino, Kuznetsov's sister ship has since unsurprisingly become the first aircraft carrier of the Chinese People's Liberation Army Navy. | N16: of:=[$version.$A$1] -> 0.0.2
A17: Kirov Class CGN | E17: 6 | F17: 2 | G17: 4 | H17: 6 | I17: RUS | J17: Ship | K17: of:=[$effects.$A20] -> S-300: +1 Help Defense. | L17: Images/kirov.jpg | M17: Since the decommisioning of the last retrofitted WWII-era battleship in 1991, the Kirov has been the largest surface combatant in the world. | N17: of:=[$version.$A$1] -> 0.0.2
A18: Slava Class CG | E18: 4 | F18: 2 | G18: 2 | H18: 3 | I18: RUS | J18: Ship | K18: of:=[$effects.$A20] -> S-300: +1 Help Defense. | L18: Images/slava.jpg | M18: Equipped with the same massive anti-ship missiles as the Kirov class, the Slava packs a similar punch in a considerably smaller form-factor. | N18: of:=[$version.$A$1] -> 0.0.2
A19: Udaloy II Class DDG | E19: 3 | F19: 2 | G19: 3 | H19: 2 | I19: RUS | J19: Ship | K19: of:=CHAR(10) -> 
 | L19: Images/udaloy.jpg | M19: Udaloy II: the ship so nice they designed it twice. | N19: of:=[$version.$A$1] -> 0.0.2
A20: Gorshkov Class FFG | E20: 3 | F20: 2 | G20: 2 | H20: 2 | I20: RUS | J20: Ship | K20: of:=[$effects.$A22] -> Hidden: Can be played face down.  | L20: Images/gorshkov.jpg | M20: The cutting-edge Gorshkov frigates stick out in the largely-outdated Russian surface warfare fleet. | N20: of:=[$version.$A$1] -> 0.0.2
A21: Yasen Class SSGN | E21: 5 | F21: 0 | G21: 3 | H21: 5 | I21: RUS | J21: Submarine | K21: of:=[$effects.$A22]&CHAR(10)&[$effects.$A8]&CHAR(10)&[$effects.$A24] -> Hidden: Can be played face down. 
Surprise Attacker: This asset deals damage during the Surprise Damage Step.
Commerce Raider: When sieging a player directly, this military asset's siege is equal to its attack. | L21: Images/yasen.jpg | M21: With more than twice the firepower of western submarines, the Yasen is Russia's best effort in no-expense-spared attack submarine development. | N21: of:=[$version.$A$1] -> 0.0.2
A22: Lada Class SSK | E22: 3 | F22: 0 | G22: 2 | H22: 2 | I22: RUS | J22: Submarine | K22: of:=[$effects.$A22]&CHAR(10)&[$effects.$A8]&CHAR(10)&[$effects.$A19] -> Hidden: Can be played face down. 
Surprise Attacker: This asset deals damage during the Surprise Damage Step.
Coastal Defender: This asset cannot  take part in an attack. | L22: Images/lada.jpg | M22: Although shorter-ranged than nuclear attack submarines, diesel-electric attack submarines are smaller, quieter and nearly as well armed. | N22: of:=[$version.$A$1] -> 0.0.2
A23: Oscar II Class SSGN | E23: 4 | F23: 0 | G23: 1 | H23: 3 | I23: RUS | J23: Submarine | K23: of:=[$effects.$A22]&CHAR(10)&[$effects.$A8]&CHAR(10)&[$effects.$A24] -> Hidden: Can be played face down. 
Surprise Attacker: This asset deals damage during the Surprise Damage Step.
Commerce Raider: When sieging a player directly, this military asset's siege is equal to its attack. | L23: Images/oscar2.jpg | M23: The massive but aging Oscar is a relic of Cold War Soviet strategy. That said, it's large guided missile batteries are still a formidable threat to US carriers. | N23: of:=[$version.$A$1] -> 0.0.2
A24: Mig-29K Fulcrum-D | E24: 4 | F24: 3 | G24: 3 | H24: 1 | I24: RUS | J24: Squadron | K24: of:=[$effects.$A27]&CHAR(10)&[$effects.$A$22] -> STOBAR
Hidden: Can be played face down.  | L24: Images/mig29k.jpg | M24: With an affordable $15M unit cost, the Mig-29K is proof that achieving air dominance doesn’t always require one to break the bank. | N24: of:=[$version.$A$1] -> 0.0.2
A25: Su-33 Flanker-D | E25: 4 | F25: 4 | G25: 3 | H25: 1 | I25: RUS | J25: Squadron | K25: of:=[$effects.$A27]&CHAR(10)&[$effects.$A$22] -> STOBAR
Hidden: Can be played face down.  | L25: Images/su33.jpg | M25: It's a plane, comrade. | N25: of:=[$version.$A$1] -> 0.0.2
A26: Victor III Class SSN | E26: 2 | F26: 0 | G26: 1 | H26: 1 | I26: RUS | J26: Submarine | K26: of:=[$effects.$A22]&CHAR(10)&[$effects.$A8]&CHAR(10)&[$effects.$A24] -> Hidden: Can be played face down. 
Surprise Attacker: This asset deals damage during the Surprise Damage Step.
Commerce Raider: When sieging a player directly, this military asset's siege is equal to its attack. | L26: Images/victor2.jpg | M26: Nothing fancy, but it ain't bad for government work. | N26: of:=[$version.$A$1] -> 0.0.2
A27: Akula Class SSN | E27: 3 | F27: 0 | G27: 3 | H27: 3 | I27: RUS | J27: Submarine | K27: of:=[$effects.$A22]&CHAR(10)&[$effects.$A8]&CHAR(10)&[$effects.$A24] -> Hidden: Can be played face down. 
Surprise Attacker: This asset deals damage during the Surprise Damage Step.
Commerce Raider: When sieging a player directly, this military asset's siege is equal to its attack. | L27: Images/akula.jpg | M27: In Russian, akula means shark | N27: of:=[$version.$A$1] -> 0.0.2
A28: Sovremanny Class DDG | E28: 2 | F28: 0 | G28: 2 | H28: 1 | I28: RUS | J28: Ship | K28: of:=CHAR(10) -> 
 | L28: Images/sovremenny.jpg | M28: Despite a name that means "modern" in Russian, they are the oldest class of destroyer in the Russian Navy. | N28: of:=[$version.$A$1] -> 0.0.2

Sheet: actions
A1: Title | B1: Type | C1: Roster | D1: Description | E1: Image | F1: FlavorText | G1: Version
F2: of:=CHAR(10) -> 

A3: Scuttlebutt | B3: Tactic | C3: USN | D3: Look at and reorder the top 4 cards of your deck. You may put any number on the bottom of your deck in any order. | E3: Images/scuttlebutt.jpeg | F3: of:=CHAR(10) -> 
 | G3: of:=[$version.$A$1] -> 0.0.2
A4: AF Is Short On Water | B4: Tactic | C4: USN | D4: Take one asset card from your hand and put it face-up into play under your control; it may attack or defend this turn. If it is a squadron, it may be played on a carrier or territory. This asset must otherwise be valid to play. | E4: Images/midway.jpg | F4: of:=CHAR(10) -> 
 | G4: of:=[$version.$A$1] -> 0.0.2
F5: of:=CHAR(10) -> 

A6: KH-11 Key Hole | B6: Tactic | C6: USN | D6: Flip all military assets your opponent controls face up. You opponent must also reveal their hand. | E6: Images/keyhole.jpg | F6: of:=CHAR(10) -> 
 | G6: of:=[$version.$A$1] -> 0.0.2
A7: Semper Fidelis | B7: Strategy | C7: USN | D7: Whenever an opponent buys-back a territory card you control, they must discard an additional card from their deck. | E7: Images/semperfi.jpg | F7: of:=CHAR(10) -> 
 | G7: of:=[$version.$A$1] -> 0.0.2
A8: Build 'Em Faster Than They Can Sink 'Em | B8: Strategy | C8: USN | D8: Whenever you lose a military asset of logistics 3 or greater, you may draw a card. | E8: Images/buildem.jpg | F8: of:=CHAR(10) -> 
 | G8: of:=[$version.$A$1] -> 0.0.2
A9: NATO Allies | B9: Tactic | C9: USN | D9: Search your deck for a squadron, reveal it, and place it on a territory you control. Then shuffle your deck. You must control a territory to play this card. | E9: Images/nato.jpg | F9: of:=CHAR(10) -> 
 | G9: of:=[$version.$A$1] -> 0.0.2
A10: Uncommon Valor Was A Common Virtue | B10: Tactic | C10: USN | D10: You may immediately discard one military asset from an attack you've declared in order to add twice that asset's attack statistic to your damage total during the Normal Damage Step. | E10: Images/valor.jpg | F10: of:=CHAR(10) -> 
 | G10: of:=[$version.$A$1] -> 0.0.2
A11: I Have Not Yet Begun To Fight | B11: Tactic | C11: USN | D11: Retrieve one card from your discard pile, reveal it, and put it on top of your deck. | E11: Images/fight.jpg | F11: of:=CHAR(10) -> 
 | G11: of:=[$version.$A$1] -> 0.0.2
F12: of:=CHAR(10) -> 

A13: The Long Winter | B13: Strategy | C13: RUS | D13: Both players must discard 2 cards from their deck at the end of each turn. | E13: Images/winter.jpg | F13: of:=CHAR(10) -> 
 | G13: of:=[$version.$A$1] -> 0.0.2
A14: State-Controlled Media | B14: Strategy | C14: RUS | D14: Whenever you destroy a ship of logistics cost 3 or greater, you may look at the top card of your deck and may choose to put it on the bottom of your deck. | E14: Images/statemedia.jpg | F14: of:=CHAR(10) -> 
 | G14: of:=[$version.$A$1] -> 0.0.2
A15: Disinformation Campaigns | B15: Tactic | C15: RUS | D15: Your opponent must discard 5 cards from their deck. | E15: Images/disinformation.jpg | F15: of:=CHAR(10) -> 
 | G15: of:=[$version.$A$1] -> 0.0.2
A17: The Russians Used a Pencil | B17: Strategy | C17: RUS | D17: Each military asset you control requires 1 less logistics, with a minimum of 1 per military asset. | E17: Images/sputnik.jpg | F17: of:=CHAR(10) -> 
 | G17: of:=[$version.$A$1] -> 0.0.2
A18: Scorched Earth | B18: Tactic | C18: RUS | D18: Destroy one territory belonging to your opponent that is under your control. | E18: Images/scorched.jpg | F18: of:=CHAR(10) -> 
 | G18: of:=[$version.$A$1] -> 0.0.2
F19: of:=CHAR(10) -> 

F20: of:=CHAR(10) -> 

A21: Counter-Espionage | B21: Tactic | C21: RUS | D21: Ignore the effects of a tactic card. | E21: Images/putingun.jpg | F21: of:=CHAR(10) -> 
 | G21: of:=[$version.$A$1] -> 0.0.2
A22: Strategic Flexibility | B22: Tactic | C22: RUS | D22: Search your deck for a strategy card, reveal that card and put it into your hand. Then shuffle your deck. | E22: Images/dolls.jpeg | F22: of:=CHAR(10) -> 
 | G22: of:=[$version.$A$1] -> 0.0.2
F23: of:=CHAR(10) -> 

F24: of:=CHAR(10) -> 

A25: That's the Spirit! | B25: Tactic | C25: USN | D25: Immediately destroy one face-up military asset whose total defense including Help Defense and stationed aircraft is 6 or less. | E25: Images/b2.jpg | F25: of:=CHAR(10) -> 
 | G25: of:=[$version.$A$1] -> 0.0.2
A26: Aerial Refueling | B26: Strategy | C26: USN | D26: Carriers you control do not need to take part in the damage order of an attack in order for their aircraft to take part in an attack. Carriers are still considered to be attacking, and can still only attack one target per turn. | E26: Images/refuel.jpg | F26: of:=CHAR(10) -> 
 | G26: of:=[$version.$A$1] -> 0.0.2
A27: Strategic Destabilization | B27: Strategy | C27: RUS | D27: Your opponents territories provide 1 less logistics. | E27: Images/electricgrid.jpg | F27: of:=CHAR(10) -> 
 | G27: of:=[$version.$A$1] -> 0.0.2
A28: Rapid Mobilization | B28: Tactic | C28: RUS | D28: Search your library for military asset cards whose combined logistics is equal to or less than 4, put those cards into your hand, then shuffle your library. | E28: Images/mobilization.jpg | F28: of:=CHAR(10) -> 
 | G28: of:=[$version.$A$1] -> 0.0.2

Sheet: territories
A1: Title | B1: LogisticsCapacity | C1: ShoreDefense | D1: Description | E1: Roster | F1: FlavorText | G1: Image | H1: Version
A2: US Naval Base | B2: 6 | C2: 2 | D2: of:=CHAR(10) -> 
 | E2: USN | F2: of:=CHAR(10) -> 
 | G2: Images/navalbase.jpg | H2: of:=[$version.$A$1] -> 0.0.2
A3: Pine Gap | B3: 4 | C3: 2 | D3: of:=[$effects.A18] -> RAINFALL: During your first deployment phase each turn, select a face down asset controlled by your opponent. Your opponent must reveal this asset. It remains face down afterwards. | E3: USN | F3: of:=CHAR(10) -> 
 | G3: Images/pinegap.jpg | H3: of:=[$version.$A$1] -> 0.0.2
A4: Joint Base Pearl Harbor | B4: 5 | C4: 4 | D4: of:=[$effects.$A$33] -> Grants 2 logistics capacity to the USN player if controlled by their opponent. | E4: USN | F4: "I believe that I interpret the will of the Congress and of the people when I assert that we will not only defend ourselves to the uttermost, but will make it very certain that this form of treachery shall never again endanger us." - FDR | G4: Images/pearlharbor.jpg | H4: of:=[$version.$A$1] -> 0.0.2
A5: Russian Naval Base | B5: 5 | C5: 4 | D5: of:=[$effects.$A$32] -> Partisans: Provides -4 logistics capacity if controlled by a non-Russian player. | E5: RUS | F5: of:=CHAR(10) -> 
 | G5: Images/russnavybase.jpg | H5: of:=[$version.$A$1] -> 0.0.2

Sheet: mil_ass_all
A1: Duplication | B1: Class | C1: Name | D1: of:=[$military_assets.A1] -> Title | E1: of:=[$military_assets.B1] -> Unused0 | F1: of:=[$military_assets.C1] -> Unused1 | G1: of:=[$military_assets.D1] -> Unused2 | H1: of:=[$military_assets.E1] -> Attack | I1: of:=[$military_assets.F1] -> ShoreAttack | J1: of:=[$military_assets.G1] -> Defense | K1: of:=[$military_assets.H1] -> Logistics | L1: of:=[$military_assets.I1] -> Rosters | M1: of:=[$military_assets.J1] -> Type | N1: of:=[$military_assets.K1] -> Description | O1: of:=[$military_assets.L1] -> Image | P1: of:=[$military_assets.M1] -> FlavorText | Q1: of:=[$military_assets.N1] -> Version | R1: of:=[$military_assets.O1] -> 0 | S1: of:=[$military_assets.P1] -> 0 | T1: of:=[$military_assets.Q1] -> 0 | U1: of:=[$military_assets.R1] -> 0 | V1: of:=[$military_assets.S1] -> 0
A2: 1 | B2: 2 | C2: USS Abraham Lincoln | D2: of:=INDEX([$military_assets.A$1:.A$1048576];[$mil_ass_all.$B2]) -> Nimitz Class CVN | E2: of:=INDEX([$military_assets.B$1:.B$1048576];[$mil_ass_all.$B2]) -> 0 | F2: of:=INDEX([$military_assets.C$1:.C$1048576];[$mil_ass_all.$B2]) -> 0 | G2: of:=INDEX([$military_assets.D$1:.D$1048576];[$mil_ass_all.$B2]) -> 0 | H2: of:=INDEX([$military_assets.E$1:.E$1048576];[$mil_ass_all.$B2]) -> 0 | I2: of:=INDEX([$military_assets.F$1:.F$1048576];[$mil_ass_all.$B2]) -> 0 | J2: of:=INDEX([$military_assets.G$1:.G$1048576];[$mil_ass_all.$B2]) -> 2 | K2: of:=INDEX([$military_assets.H$1:.H$1048576];[$mil_ass_all.$B2]) -> 6 | L2: of:=INDEX([$military_assets.I$1:.I$1048576];[$mil_ass_all.$B2]) -> USN | M2: of:=INDEX([$military_assets.J$1:.J$1048576];[$mil_ass_all.$B2]) -> Ship | N2: of:=INDEX([$military_assets.K$1:.K$1048576];[$mil_ass_all.$B2]) -> CATOBAR: Compatible with CATOBAR, VTOL, and  STOBAR squadrons.
E-2C Hawkeye: All squadrons you control in a combat including this asset have +1 attack and  defense.
Carrier 3: Can station 3 aircraft squadrons.
CAP: +2 Help Defense | O2: of:=INDEX([$military_assets.L$1:.L$1048576];[$mil_ass_all.$B2]) -> Images/nimitz.jpg | P2: of:=INDEX([$military_assets.M$1:.M$1048576];[$mil_ass_all.$B2]) -> A military airbase at sea, a Nimitz carrier is more than three times as long as a football field and has more than twice the displacement of the German super-battleship Bismarck. | Q2: of:=INDEX([$military_assets.N$1:.N$1048576];[$mil_ass_all.$B2]) -> 0.0.2
A3: 1 | B3: 2 | C3: USS Carl Vinson | D3: of:=INDEX([$military_assets.A$1:.A$1048576];[$mil_ass_all.$B3]) -> Nimitz Class CVN | E3: of:=INDEX([$military_assets.B$1:.B$1048576];[$mil_ass_all.$B3]) -> 0 | F3: of:=INDEX([$military_assets.C$1:.C$1048576];[$mil_ass_all.$B3]) -> 0 | G3: of:=INDEX([$military_assets.D$1:.D$1048576];[$mil_ass_all.$B3]) -> 0 | H3: of:=INDEX([$military_assets.E$1:.E$1048576];[$mil_ass_all.$B3]) -> 0 | I3: of:=INDEX([$military_assets.F$1:.F$1048576];[$mil_ass_all.$B3]) -> 0 | J3: of:=INDEX([$military_assets.G$1:.G$1048576];[$mil_ass_all.$B3]) -> 2 | K3: of:=INDEX([$military_assets.H$1:.H$1048576];[$mil_ass_all.$B3]) -> 6 | L3: of:=INDEX([$military_assets.I$1:.I$1048576];[$mil_ass_all.$B3]) -> USN | M3: of:=INDEX([$military_assets.J$1:.J$1048576];[$mil_ass_all.$B3]) -> Ship | N3: of:=INDEX([$military_assets.K$1:.K$1048576];[$mil_ass_all.$B3]) -> CATOBAR: Compatible with CATOBAR, VTOL, and  STOBAR squadrons.
E-2C Hawkeye: All squadrons you control in a combat including this asset have +1 attack and  defense.
Carrier 3: Can station 3 aircraft squadrons.
CAP: +2 Help Defense | O3: of:=INDEX([$military_assets.L$1:.L$1048576];[$mil_ass_all.$B3]) -> Images/nimitz.jpg | P3: of:=INDEX([$military_assets.M$1:.M$1048576];[$mil_ass_all.$B3]) -> A military airbase at sea, a Nimitz carrier is more than three times as long as a football field and has more than twice the displacement of the German super-battleship Bismarck. | Q3: of:=INDEX([$military_assets.N$1:.N$1048576];[$mil_ass_all.$B3]) -> 0.0.2
A4: 1 | B4: 2 | C4: USS George Washington | D4: of:=INDEX([$military_assets.A$1:.A$1048576];[$mil_ass_all.$B4]) -> Nimitz Class CVN | E4: of:=INDEX([$military_assets.B$1:.B$1048576];[$mil_ass_all.$B4]) -> 0 | F4: of:=INDEX([$military_assets.C$1:.C$1048576];[$mil_ass_all.$B4]) -> 0 | G4: of:=INDEX([$military_assets.D$1:.D$1048576];[$mil_ass_all.$B4]) -> 0 | H4: of:=INDEX([$military_assets.E$1:.E$1048576];[$mil_ass_all.$B4]) -> 0 | I4: of:=INDEX([$military_assets.F$1:.F$1048576];[$mil_ass_all.$B4]) -> 0 | J4: of:=INDEX([$military_assets.G$1:.G$1048576];[$mil_ass_all.$B4]) -> 2 | K4: of:=INDEX([$military_assets.H$1:.H$1048576];[$mil_ass_all.$B4]) -> 6 | L4: of:=INDEX([$military_assets.I$1:.I$1048576];[$mil_ass_all.$B4]) -> USN | M4: of:=INDEX([$military_assets.J$1:.J$1048576];[$mil_ass_all.$B4]) -> Ship | N4: of:=INDEX([$military_assets.K$1:.K$1048576];[$mil_ass_all.$B4]) -> CATOBAR: Compatible with CATOBAR, VTOL, and  STOBAR squadrons.
E-2C Hawkeye: All squadrons you control in a combat including this asset have +1 attack and  defense.
Carrier 3: Can station 3 aircraft squadrons.
CAP: +2 Help Defense | O4: of:=INDEX([$military_assets.L$1:.L$1048576];[$mil_ass_all.$B4]) -> Images/nimitz.jpg | P4: of:=INDEX([$military_assets.M$1:.M$1048576];[$mil_ass_all.$B4]) -> A military airbase at sea, a Nimitz carrier is more than three times as long as a football field and has more than twice the displacement of the German super-battleship Bismarck. | Q4: of:=INDEX([$military_assets.N$1:.N$1048576];[$mil_ass_all.$B4]) -> 0.0.2
A5: 1 | B5: 4 | C5: USS Bonhomme Richard | D5: of:=INDEX([$military_assets.A$1:.A$1048576];[$mil_ass_all.$B5]) -> Wasp Class LHA | E5: of:=INDEX([$military_assets.B$1:.B$1048576];[$mil_ass_all.$B5]) -> 0 | F5: of:=INDEX([$military_assets.C$1:.C$1048576];[$mil_ass_all.$B5]) -> 0 | G5: of:=INDEX([$military_assets.D$1:.D$1048576];[$mil_ass_all.$B5]) -> 0 | H5: of:=INDEX([$military_assets.E$1:.E$1048576];[$mil_ass_all.$B5]) -> 0 | I5: of:=INDEX([$military_assets.F$1:.F$1048576];[$mil_ass_all.$B5]) -> 4 | J5: of:=INDEX([$military_assets.G$1:.G$1048576];[$mil_ass_all.$B5]) -> 2 | K5: of:=INDEX([$military_assets.H$1:.H$1048576];[$mil_ass_all.$B5]) -> 3 | L5: of:=INDEX([$military_assets.I$1:.I$1048576];[$mil_ass_all.$B5]) -> USN | M5: of:=INDEX([$military_assets.J$1:.J$1048576];[$mil_ass_all.$B5]) -> Ship | N5: of:=INDEX([$military_assets.K$1:.K$1048576];[$mil_ass_all.$B5]) -> VTOL: Compatible with all VTOL aircraft squadrons.
Carrier 1: Can station 1 aircraft squadron. | O5: of:=INDEX([$military_assets.L$1:.L$1048576];[$mil_ass_all.$B5]) -> Images/wasp.jpg | P5: of:=INDEX([$military_assets.M$1:.M$1048576];[$mil_ass_all.$B5]) -> In addition to supporting VTOL aircraft, a Wasp amphibious assault ship is capable of delivering a Marine Expeditionary Unit complete with its armored vehicles to hostile shores via helicopters and landing craft. | Q5: of:=INDEX([$military_assets.N$1:.N$1048576];[$mil_ass_all.$B5]) -> 0.0.2
A6: 1 | B6: 4 | C6: USS Essex | D6: of:=INDEX([$military_assets.A$1:.A$1048576];[$mil_ass_all.$B6]) -> Wasp Class LHA | E6: of:=INDEX([$military_assets.B$1:.B$1048576];[$mil_ass_all.$B6]) -> 0 | F6: of:=INDEX([$military_assets.C$1:.C$1048576];[$mil_ass_all.$B6]) -> 0 | G6: of:=INDEX([$military_assets.D$1:.D$1048576];[$mil_ass_all.$B6]) -> 0 | H6: of:=INDEX([$military_assets.E$1:.E$1048576];[$mil_ass_all.$B6]) -> 0 | I6: of:=INDEX([$military_assets.F$1:.F$1048576];[$mil_ass_all.$B6]) -> 4 | J6: of:=INDEX([$military_assets.G$1:.G$1048576];[$mil_ass_all.$B6]) -> 2 | K6: of:=INDEX([$military_assets.H$1:.H$1048576];[$mil_ass_all.$B6]) -> 3 | L6: of:=INDEX([$military_assets.I$1:.I$1048576];[$mil_ass_all.$B6]) -> USN | M6: of:=INDEX([$military_assets.J$1:.J$1048576];[$mil_ass_all.$B6]) -> Ship | N6: of:=INDEX([$military_assets.K$1:.K$1048576];[$mil_ass_all.$B6]) -> VTOL: Compatible with all VTOL aircraft squadrons.
Carrier 1: Can station 1 aircraft squadron. | O6: of:=INDEX([$military_assets.L$1:.L$1048576];[$mil_ass_all.$B6]) -> Images/wasp.jpg | P6: of:=INDEX([$military_assets.M$1:.M$1048576];[$mil_ass_all.$B6]) -> In addition to supporting VTOL aircraft, a Wasp amphibious assault ship is capable of delivering a Marine Expeditionary Unit complete with its armored vehicles to hostile shores via helicopters and landing craft. | Q6: of:=INDEX([$military_assets.N$1:.N$1048576];[$mil_ass_all.$B6]) -> 0.0.2
A7: 1 | B7: 4 | C7: USS Bataan | D7: of:=INDEX([$military_assets.A$1:.A$1048576];[$mil_ass_all.$B7]) -> Wasp Class LHA | E7: of:=INDEX([$military_assets.B$1:.B$1048576];[$mil_ass_all.$B7]) -> 0 | F7: of:=INDEX([$military_assets.C$1:.C$1048576];[$mil_ass_all.$B7]) -> 0 | G7: of:=INDEX([$military_assets.D$1:.D$1048576];[$mil_ass_all.$B7]) -> 0 | H7: of:=INDEX([$military_assets.E$1:.E$1048576];[$mil_ass_all.$B7]) -> 0 | I7: of:=INDEX([$military_assets.F$1:.F$1048576];[$mil_ass_all.$B7]) -> 4 | J7: of:=INDEX([$military_assets.G$1:.G$1048576];[$mil_ass_all.$B7]) -> 2 | K7: of:=INDEX([$military_assets.H$1:.H$1048576];[$mil_ass_all.$B7]) -> 3 | L7: of:=INDEX([$military_assets.I$1:.I$1048576];[$mil_ass_all.$B7]) -> USN | M7: of:=INDEX([$military_assets.J$1:.J$1048576];[$mil_ass_all.$B7]) -> Ship | N7: of:=INDEX([$military_assets.K$1:.K$1048576];[$mil_ass_all.$B7]) -> VTOL: Compatible with all VTOL aircraft squadrons.
Carrier 1: Can station 1 aircraft squadron. | O7: of:=INDEX([$military_assets.L$1:.L$1048576];[$mil_ass_all.$B7]) -> Images/wasp.jpg | P7: of:=INDEX([$military_assets.M$1:.M$1048576];[$mil_ass_all.$B7]) -> In addition to supporting VTOL aircraft, a Wasp amphibious assault ship is capable of delivering a Marine Expeditionary Unit complete with its armored vehicles to hostile shores via helicopters and landing craft. | Q7: of:=INDEX([$military_assets.N$1:.N$1048576];[$mil_ass_all.$B7]) -> 0.0.2
A8: 1 | B8: 4 | C8: USS Boxer | D8: of:=INDEX([$military_assets.A$1:.A$1048576];[$mil_ass_all.$B8]) -> Wasp Class LHA | E8: of:=INDEX([$military_assets.B$1:.B$1048576];[$mil_ass_all.$B8]) -> 0 | F8: of:=INDEX([$military_assets.C$1:.C$1048576];[$mil_ass_all.$B8]) -> 0 | G8: of:=INDEX([$military_assets.D$1:.D$1048576];[$mil_ass_all.$B8]) -> 0 | H8: of:=INDEX([$military_assets.E$1:.E$1048576];[$mil_ass_all.$B8]) -> 0 | I8: of:=INDEX([$military_assets.F$1:.F$1048576];[$mil_ass_all.$B8]) -> 4 | J8: of:=INDEX([$military_assets.G$1:.G$1048576];[$mil_ass_all.$B8]) -> 2 | K8: of:=INDEX([$military_assets.H$1:.H$1048576];[$mil_ass_all.$B8]) -> 3 | L8: of:=INDEX([$military_assets.I$1:.I$1048576];[$mil_ass_all.$B8]) -> USN | M8: of:=INDEX([$military_assets.J$1:.J$1048576];[$mil_ass_all.$B8]) -> Ship | N8: of:=INDEX([$military_assets.K$1:.K$1048576];[$mil_ass_all.$B8]) -> VTOL: Compatible with all VTOL aircraft squadrons.
Carrier 1: Can station 1 aircraft squadron. | O8: of:=INDEX([$military_assets.L$1:.L$1048576];[$mil_ass_all.$B8]) -> Images/wasp.jpg | P8: of:=INDEX([$military_assets.M$1:.M$1048576];[$mil_ass_all.$B8]) -> In addition to supporting VTOL aircraft, a Wasp amphibious assault ship is capable of delivering a Marine Expeditionary Unit complete with its armored vehicles to hostile shores via helicopters and landing craft. | Q8: of:=INDEX([$military_assets.N$1:.N$1048576];[$mil_ass_all.$B8]) -> 0.0.2
A9: 1 | B9: 4 | C9: USS Iow Jima | D9: of:=INDEX([$military_assets.A$1:.A$1048576];[$mil_ass_all.$B9]) -> Wasp Class LHA | E9: of:=INDEX([$military_assets.B$1:.B$1048576];[$mil_ass_all.$B9]) -> 0 | F9: of:=INDEX([$military_assets.C$1:.C$1048576];[$mil_ass_all.$B9]) -> 0 | G9: of:=INDEX([$military_assets.D$1:.D$1048576];[$mil_ass_all.$B9]) -> 0 | H9: of:=INDEX([$military_assets.E$1:.E$1048576];[$mil_ass_all.$B9]) -> 0 | I9: of:=INDEX([$military_assets.F$1:.F$1048576];[$mil_ass_all.$B9]) -> 4 | J9: of:=INDEX([$military_assets.G$1:.G$1048576];[$mil_ass_all.$B9]) -> 2 | K9: of:=INDEX([$military_assets.H$1:.H$1048576];[$mil_ass_all.$B9]) -> 3 | L9: of:=INDEX([$military_assets.I$1:.I$1048576];[$mil_ass_all.$B9]) -> USN | M9: of:=INDEX([$military_assets.J$1:.J$1048576];[$mil_ass_all.$B9]) -> Ship | N9: of:=INDEX([$military_assets.K$1:.K$1048576];[$mil_ass_all.$B9]) -> VTOL: Compatible with all VTOL aircraft squadrons.
Carrier 1: Can station 1 aircraft squadron. | O9: of:=INDEX([$military_assets.L$1:.L$1048576];[$mil_ass_all.$B9]) -> Images/wasp.jpg | P9: of:=INDEX([$military_assets.M$1:.M$1048576];[$mil_ass_all.$B9]) -> In addition to supporting VTOL aircraft, a Wasp amphibious assault ship is capable of delivering a Marine Expeditionary Unit complete with its armored vehicles to hostile shores via helicopters and landing craft. | Q9: of:=INDEX([$military_assets.N$1:.N$1048576];[$mil_ass_all.$B9]) -> 0.0.2
A10: 1 | B10: 6 | C10: USS Seawolf | D10: of:=INDEX([$military_assets.A$1:.A$1048576];[$mil_ass_all.$B10]) -> Seawolf Class SSN | E10: of:=INDEX([$military_assets.B$1:.B$1048576];[$mil_ass_all.$B10]) -> 0 | F10: of:=INDEX([$military_assets.C$1:.C$1048576];[$mil_ass_all.$B10]) -> 0 | G10: of:=INDEX([$military_assets.D$1:.D$1048576];[$mil_ass_all.$B10]) -> 0 | H10: of:=INDEX([$military_assets.E$1:.E$1048576];[$mil_ass_all.$B10]) -> 4 | I10: of:=INDEX([$military_assets.F$1:.F$1048576];[$mil_ass_all.$B10]) -> 0 | J10: of:=INDEX([$military_assets.G$1:.G$1048576];[$mil_ass_all.$B10]) -> 4 | K10: of:=INDEX([$military_assets.H$1:.H$1048576];[$mil_ass_all.$B10]) -> 5 | L10: of:=INDEX([$military_assets.I$1:.I$1048576];[$mil_ass_all.$B10]) -> USN | M10: of:=INDEX([$military_assets.J$1:.J$1048576];[$mil_ass_all.$B10]) -> Submarine | N10: of:=INDEX([$military_assets.K$1:.K$1048576];[$mil_ass_all.$B10]) -> Surprise Attacker: This asset deals damage during the Surprise Damage Step.
Special Purposes: Each time this military asset is flipped face up, your opponent must reveal one card from their hand at random.
Hidden: Can be played face down. 
Commerce Raider: When sieging a player directly, this military asset's siege is equal to its attack. | O10: of:=INDEX([$military_assets.L$1:.L$1048576];[$mil_ass_all.$B10]) -> Images/seawolf.jpg | P10: of:=INDEX([$military_assets.M$1:.M$1048576];[$mil_ass_all.$B10]) -> As the most expensive class of attack submarine ever built, the Seawolf is the apex predator of the US Navy's submarine fleet. | Q10: of:=INDEX([$military_assets.N$1:.N$1048576];[$mil_ass_all.$B10]) -> 0.0.2
A11: 1 | B11: 7 | C11: USS California | D11: of:=INDEX([$military_assets.A$1:.A$1048576];[$mil_ass_all.$B11]) -> Virginia Class SSN | E11: of:=INDEX([$military_assets.B$1:.B$1048576];[$mil_ass_all.$B11]) -> 0 | F11: of:=INDEX([$military_assets.C$1:.C$1048576];[$mil_ass_all.$B11]) -> 0 | G11: of:=INDEX([$military_assets.D$1:.D$1048576];[$mil_ass_all.$B11]) -> 0 | H11: of:=INDEX([$military_assets.E$1:.E$1048576];[$mil_ass_all.$B11]) -> 3 | I11: of:=INDEX([$military_assets.F$1:.F$1048576];[$mil_ass_all.$B11]) -> 0 | J11: of:=INDEX([$military_assets.G$1:.G$1048576];[$mil_ass_all.$B11]) -> 4 | K11: of:=INDEX([$military_assets.H$1:.H$1048576];[$mil_ass_all.$B11]) -> 4 | L11: of:=INDEX([$military_assets.I$1:.I$1048576];[$mil_ass_all.$B11]) -> USN | M11: of:=INDEX([$military_assets.J$1:.J$1048576];[$mil_ass_all.$B11]) -> Submarine | N11: of:=INDEX([$military_assets.K$1:.K$1048576];[$mil_ass_all.$B11]) -> Surprise Attacker: This asset deals damage during the Surprise Damage Step.
Hidden: Can be played face down. 
Commerce Raider: When sieging a player directly, this military asset's siege is equal to its attack. | O11: of:=INDEX([$military_assets.L$1:.L$1048576];[$mil_ass_all.$B11]) -> Images/virginia.jpg | P11: of:=INDEX([$military_assets.M$1:.M$1048576];[$mil_ass_all.$B11]) -> The advanced Virginia will be the standard attack submarine of the US Navy until at least the middle of the 21st century. | Q11: of:=INDEX([$military_assets.N$1:.N$1048576];[$mil_ass_all.$B11]) -> 0.0.2
A12: 1 | B12: 7 | C12: USS Hawaii | D12: of:=INDEX([$military_assets.A$1:.A$1048576];[$mil_ass_all.$B12]) -> Virginia Class SSN | E12: of:=INDEX([$military_assets.B$1:.B$1048576];[$mil_ass_all.$B12]) -> 0 | F12: of:=INDEX([$military_assets.C$1:.C$1048576];[$mil_ass_all.$B12]) -> 0 | G12: of:=INDEX([$military_assets.D$1:.D$1048576];[$mil_ass_all.$B12]) -> 0 | H12: of:=INDEX([$military_assets.E$1:.E$1048576];[$mil_ass_all.$B12]) -> 3 | I12: of:=INDEX([$military_assets.F$1:.F$1048576];[$mil_ass_all.$B12]) -> 0 | J12: of:=INDEX([$military_assets.G$1:.G$1048576];[$mil_ass_all.$B12]) -> 4 | K12: of:=INDEX([$military_assets.H$1:.H$1048576];[$mil_ass_all.$B12]) -> 4 | L12: of:=INDEX([$military_assets.I$1:.I$1048576];[$mil_ass_all.$B12]) -> USN | M12: of:=INDEX([$military_assets.J$1:.J$1048576];[$mil_ass_all.$B12]) -> Submarine | N12: of:=INDEX([$military_assets.K$1:.K$1048576];[$mil_ass_all.$B12]) -> Surprise Attacker: This asset deals damage during the Surprise Damage Step.
Hidden: Can be played face down. 
Commerce Raider: When sieging a player directly, this military asset's siege is equal to its attack. | O12: of:=INDEX([$military_assets.L$1:.L$1048576];[$mil_ass_all.$B12]) -> Images/virginia.jpg | P12: of:=INDEX([$military_assets.M$1:.M$1048576];[$mil_ass_all.$B12]) -> The advanced Virginia will be the standard attack submarine of the US Navy until at least the middle of the 21st century. | Q12: of:=INDEX([$military_assets.N$1:.N$1048576];[$mil_ass_all.$B12]) -> 0.0.2
A13: 1 | B13: 7 | C13: USS Mississippi | D13: of:=INDEX([$military_assets.A$1:.A$1048576];[$mil_ass_all.$B13]) -> Virginia Class SSN | E13: of:=INDEX([$military_assets.B$1:.B$1048576];[$mil_ass_all.$B13]) -> 0 | F13: of:=INDEX([$military_assets.C$1:.C$1048576];[$mil_ass_all.$B13]) -> 0 | G13: of:=INDEX([$military_assets.D$1:.D$1048576];[$mil_ass_all.$B13]) -> 0 | H13: of:=INDEX([$military_assets.E$1:.E$1048576];[$mil_ass_all.$B13]) -> 3 | I13: of:=INDEX([$military_assets.F$1:.F$1048576];[$mil_ass_all.$B13]) -> 0 | J13: of:=INDEX([$military_assets.G$1:.G$1048576];[$mil_ass_all.$B13]) -> 4 | K13: of:=INDEX([$military_assets.H$1:.H$1048576];[$mil_ass_all.$B13]) -> 4 | L13: of:=INDEX([$military_assets.I$1:.I$1048576];[$mil_ass_all.$B13]) -> USN | M13: of:=INDEX([$military_assets.J$1:.J$1048576];[$mil_ass_all.$B13]) -> Submarine | N13: of:=INDEX([$military_assets.K$1:.K$1048576];[$mil_ass_all.$B13]) -> Surprise Attacker: This asset deals damage during the Surprise Damage Step.
Hidden: Can be played face down. 
Commerce Raider: When sieging a player directly, this military asset's siege is equal to its attack. | O13: of:=INDEX([$military_assets.L$1:.L$1048576];[$mil_ass_all.$B13]) -> Images/virginia.jpg | P13: of:=INDEX([$military_assets.M$1:.M$1048576];[$mil_ass_all.$B13]) -> The advanced Virginia will be the standard attack submarine of the US Navy until at least the middle of the 21st century. | Q13: of:=INDEX([$military_assets.N$1:.N$1048576];[$mil_ass_all.$B13]) -> 0.0.2
A14: 1 | B14: 8 | C14: USS Florida | D14: of:=INDEX([$military_assets.A$1:.A$1048576];[$mil_ass_all.$B14]) -> Ohio Class SSGN | E14: of:=INDEX([$military_assets.B$1:.B$1048576];[$mil_ass_all.$B14]) -> 0 | F14: of:=INDEX([$military_assets.C$1:.C$1048576];[$mil_ass_all.$B14]) -> 0 | G14: of:=INDEX([$military_assets.D$1:.D$1048576];[$mil_ass_all.$B14]) -> 0 | H14: of:=INDEX([$military_assets.E$1:.E$1048576];[$mil_ass_all.$B14]) -> 3 | I14: of:=INDEX([$military_assets.F$1:.F$1048576];[$mil_ass_all.$B14]) -> 5 | J14: of:=INDEX([$military_assets.G$1:.G$1048576];[$mil_ass_all.$B14]) -> 2 | K14: of:=INDEX([$military_assets.H$1:.H$1048576];[$mil_ass_all.$B14]) -> 5 | L14: of:=INDEX([$military_assets.I$1:.I$1048576];[$mil_ass_all.$B14]) -> USN | M14: of:=INDEX([$military_assets.J$1:.J$1048576];[$mil_ass_all.$B14]) -> Submarine | N14: of:=INDEX([$military_assets.K$1:.K$1048576];[$mil_ass_all.$B14]) -> Surprise Attacker: This asset deals damage during the Surprise Damage Step.
Strategic Strike Capability: At the end of your turn, if this asset is face-up and did not take part in a combat, your opponent must discard one card from their deck.
Hidden: Can be played face down.  | O14: of:=INDEX([$military_assets.L$1:.L$1048576];[$mil_ass_all.$B14]) -> Images/ohio.jpg | P14: of:=INDEX([$military_assets.M$1:.M$1048576];[$mil_ass_all.$B14]) -> Although Ohio was originally intended to carry nuclear ballistic missiles, some Ohio's have been modified as SSGNs for surface warfare and land-attack missions. | Q14: of:=INDEX([$military_assets.N$1:.N$1048576];[$mil_ass_all.$B14]) -> 0.0.2
A15: 1 | B15: 8 | C15: USS Ohio | D15: of:=INDEX([$military_assets.A$1:.A$1048576];[$mil_ass_all.$B15]) -> Ohio Class SSGN | E15: of:=INDEX([$military_assets.B$1:.B$1048576];[$mil_ass_all.$B15]) -> 0 | F15: of:=INDEX([$military_assets.C$1:.C$1048576];[$mil_ass_all.$B15]) -> 0 | G15: of:=INDEX([$military_assets.D$1:.D$1048576];[$mil_ass_all.$B15]) -> 0 | H15: of:=INDEX([$military_assets.E$1:.E$1048576];[$mil_ass_all.$B15]) -> 3 | I15: of:=INDEX([$military_assets.F$1:.F$1048576];[$mil_ass_all.$B15]) -> 5 | J15: of:=INDEX([$military_assets.G$1:.G$1048576];[$mil_ass_all.$B15]) -> 2 | K15: of:=INDEX([$military_assets.H$1:.H$1048576];[$mil_ass_all.$B15]) -> 5 | L15: of:=INDEX([$military_assets.I$1:.I$1048576];[$mil_ass_all.$B15]) -> USN | M15: of:=INDEX([$military_assets.J$1:.J$1048576];[$mil_ass_all.$B15]) -> Submarine | N15: of:=INDEX([$military_assets.K$1:.K$1048576];[$mil_ass_all.$B15]) -> Surprise Attacker: This asset deals damage during the Surprise Damage Step.
Strategic Strike Capability: At the end of your turn, if this asset is face-up and did not take part in a combat, your opponent must discard one card from their deck.
Hidden: Can be played face down.  | O15: of:=INDEX([$military_assets.L$1:.L$1048576];[$mil_ass_all.$B15]) -> Images/ohio.jpg | P15: of:=INDEX([$military_assets.M$1:.M$1048576];[$mil_ass_all.$B15]) -> Although Ohio was originally intended to carry nuclear ballistic missiles, some Ohio's have been modified as SSGNs for surface warfare and land-attack missions. | Q15: of:=INDEX([$military_assets.N$1:.N$1048576];[$mil_ass_all.$B15]) -> 0.0.2
A16: 1 | B16: 9 | C16: USS Bunker Hill | D16: of:=INDEX([$military_assets.A$1:.A$1048576];[$mil_ass_all.$B16]) -> Ticonderoga Class CG | E16: of:=INDEX([$military_assets.B$1:.B$1048576];[$mil_ass_all.$B16]) -> 0 | F16: of:=INDEX([$military_assets.C$1:.C$1048576];[$mil_ass_all.$B16]) -> 0 | G16: of:=INDEX([$military_assets.D$1:.D$1048576];[$mil_ass_all.$B16]) -> 0 | H16: of:=INDEX([$military_assets.E$1:.E$1048576];[$mil_ass_all.$B16]) -> 2 | I16: of:=INDEX([$military_assets.F$1:.F$1048576];[$mil_ass_all.$B16]) -> 3 | J16: of:=INDEX([$military_assets.G$1:.G$1048576];[$mil_ass_all.$B16]) -> 3 | K16: of:=INDEX([$military_assets.H$1:.H$1048576];[$mil_ass_all.$B16]) -> 4 | L16: of:=INDEX([$military_assets.I$1:.I$1048576];[$mil_ass_all.$B16]) -> USN | M16: of:=INDEX([$military_assets.J$1:.J$1048576];[$mil_ass_all.$B16]) -> Ship | N16: of:=INDEX([$military_assets.K$1:.K$1048576];[$mil_ass_all.$B16]) -> AEGIS: +2 Help Defense. | O16: of:=INDEX([$military_assets.L$1:.L$1048576];[$mil_ass_all.$B16]) -> Images/ticonderoga.jpg | P16: of:=INDEX([$military_assets.M$1:.M$1048576];[$mil_ass_all.$B16]) -> Despite a modest displacement by historical standards, the Ticonderoga is the largest surface combatant in the US Navy. | Q16: of:=INDEX([$military_assets.N$1:.N$1048576];[$mil_ass_all.$B16]) -> 0.0.2
A17: 1 | B17: 9 | C17: USS Philippine Sea | D17: of:=INDEX([$military_assets.A$1:.A$1048576];[$mil_ass_all.$B17]) -> Ticonderoga Class CG | E17: of:=INDEX([$military_assets.B$1:.B$1048576];[$mil_ass_all.$B17]) -> 0 | F17: of:=INDEX([$military_assets.C$1:.C$1048576];[$mil_ass_all.$B17]) -> 0 | G17: of:=INDEX([$military_assets.D$1:.D$1048576];[$mil_ass_all.$B17]) -> 0 | H17: of:=INDEX([$military_assets.E$1:.E$1048576];[$mil_ass_all.$B17]) -> 2 | I17: of:=INDEX([$military_assets.F$1:.F$1048576];[$mil_ass_all.$B17]) -> 3 | J17: of:=INDEX([$military_assets.G$1:.G$1048576];[$mil_ass_all.$B17]) -> 3 | K17: of:=INDEX([$military_assets.H$1:.H$1048576];[$mil_ass_all.$B17]) -> 4 | L17: of:=INDEX([$military_assets.I$1:.I$1048576];[$mil_ass_all.$B17]) -> USN | M17: of:=INDEX([$military_assets.J$1:.J$1048576];[$mil_ass_all.$B17]) -> Ship | N17: of:=INDEX([$military_assets.K$1:.K$1048576];[$mil_ass_all.$B17]) -> AEGIS: +2 Help Defense. | O17: of:=INDEX([$military_assets.L$1:.L$1048576];[$mil_ass_all.$B17]) -> Images/ticonderoga.jpg | P17: of:=INDEX([$military_assets.M$1:.M$1048576];[$mil_ass_all.$B17]) -> Despite a modest displacement by historical standards, the Ticonderoga is the largest surface combatant in the US Navy. | Q17: of:=INDEX([$military_assets.N$1:.N$1048576];[$mil_ass_all.$B17]) -> 0.0.2
A18: 1 | B18: 9 | C18: USS Gettysburg | D18: of:=INDEX([$military_assets.A$1:.A$1048576];[$mil_ass_all.$B18]) -> Ticonderoga Class CG | E18: of:=INDEX([$military_assets.B$1:.B$1048576];[$mil_ass_all.$B18]) -> 0 | F18: of:=INDEX([$military_assets.C$1:.C$1048576];[$mil_ass_all.$B18]) -> 0 | G18: of:=INDEX([$military_assets.D$1:.D$1048576];[$mil_ass_all.$B18]) -> 0 | H18: of:=INDEX([$military_assets.E$1:.E$1048576];[$mil_ass_all.$B18]) -> 2 | I18: of:=INDEX([$military_assets.F$1:.F$1048576];[$mil_ass_all.$B18]) -> 3 | J18: of:=INDEX([$military_assets.G$1:.G$1048576];[$mil_ass_all.$B18]) -> 3 | K18: of:=INDEX([$military_assets.H$1:.H$1048576];[$mil_ass_all.$B18]) -> 4 | L18: of:=INDEX([$military_assets.I$1:.I$1048576];[$mil_ass_all.$B18]) -> USN | M18: of:=INDEX([$military_assets.J$1:.J$1048576];[$mil_ass_all.$B18]) -> Ship | N18: of:=INDEX([$military_assets.K$1:.K$1048576];[$mil_ass_all.$B18]) -> AEGIS: +2 Help Defense. | O18: of:=INDEX([$military_assets.L$1:.L$1048576];[$mil_ass_all.$B18]) -> Images/ticonderoga.jpg | P18: of:=INDEX([$military_assets.M$1:.M$1048576];[$mil_ass_all.$B18]) -> Despite a modest displacement by historical standards, the Ticonderoga is the largest surface combatant in the US Navy. | Q18: of:=INDEX([$military_assets.N$1:.N$1048576];[$mil_ass_all.$B18]) -> 0.0.2
A19: 1 | B19: 10 | C19: USS Fitzgerald | D19: of:=INDEX([$military_assets.A$1:.A$1048576];[$mil_ass_all.$B19]) -> Arleigh Burke Class DDG | E19: of:=INDEX([$military_assets.B$1:.B$1048576];[$mil_ass_all.$B19]) -> 0 | F19: of:=INDEX([$military_assets.C$1:.C$1048576];[$mil_ass_all.$B19]) -> 0 | G19: of:=INDEX([$military_assets.D$1:.D$1048576];[$mil_ass_all.$B19]) -> 0 | H19: of:=INDEX([$military_assets.E$1:.E$1048576];[$mil_ass_all.$B19]) -> 2 | I19: of:=INDEX([$military_assets.F$1:.F$1048576];[$mil_ass_all.$B19]) -> 3 | J19: of:=INDEX([$military_assets.G$1:.G$1048576];[$mil_ass_all.$B19]) -> 2 | K19: of:=INDEX([$military_assets.H$1:.H$1048576];[$mil_ass_all.$B19]) -> 3 | L19: of:=INDEX([$military_assets.I$1:.I$1048576];[$mil_ass_all.$B19]) -> USN | M19: of:=INDEX([$military_assets.J$1:.J$1048576];[$mil_ass_all.$B19]) -> Ship | N19: of:=INDEX([$military_assets.K$1:.K$1048576];[$mil_ass_all.$B19]) -> AEGIS: +2 Help Defense. | O19: of:=INDEX([$military_assets.L$1:.L$1048576];[$mil_ass_all.$B19]) -> Images/arleighburke.jpg | P19: of:=INDEX([$military_assets.M$1:.M$1048576];[$mil_ass_all.$B19]) -> The multi-mission-capable Arleigh Burke is the most numerous ship in and workhorse of the US Navy. | Q19: of:=INDEX([$military_assets.N$1:.N$1048576];[$mil_ass_all.$B19]) -> 0.0.2
A20: 1 | B20: 10 | C20: USS Cole | D20: of:=INDEX([$military_assets.A$1:.A$1048576];[$mil_ass_all.$B20]) -> Arleigh Burke Class DDG | E20: of:=INDEX([$military_assets.B$1:.B$1048576];[$mil_ass_all.$B20]) -> 0 | F20: of:=INDEX([$military_assets.C$1:.C$1048576];[$mil_ass_all.$B20]) -> 0 | G20: of:=INDEX([$military_assets.D$1:.D$1048576];[$mil_ass_all.$B20]) -> 0 | H20: of:=INDEX([$military_assets.E$1:.E$1048576];[$mil_ass_all.$B20]) -> 2 | I20: of:=INDEX([$military_assets.F$1:.F$1048576];[$mil_ass_all.$B20]) -> 3 | J20: of:=INDEX([$military_assets.G$1:.G$1048576];[$mil_ass_all.$B20]) -> 2 | K20: of:=INDEX([$military_assets.H$1:.H$1048576];[$mil_ass_all.$B20]) -> 3 | L20: of:=INDEX([$military_assets.I$1:.I$1048576];[$mil_ass_all.$B20]) -> USN | M20: of:=INDEX([$military_assets.J$1:.J$1048576];[$mil_ass_all.$B20]) -> Ship | N20: of:=INDEX([$military_assets.K$1:.K$1048576];[$mil_ass_all.$B20]) -> AEGIS: +2 Help Defense. | O20: of:=INDEX([$military_assets.L$1:.L$1048576];[$mil_ass_all.$B20]) -> Images/arleighburke.jpg | P20: of:=INDEX([$military_assets.M$1:.M$1048576];[$mil_ass_all.$B20]) -> The multi-mission-capable Arleigh Burke is the most numerous ship in and workhorse of the US Navy. | Q20: of:=INDEX([$military_assets.N$1:.N$1048576];[$mil_ass_all.$B20]) -> 0.0.2
A21: 1 | B21: 10 | C21: USS Porter | D21: of:=INDEX([$military_assets.A$1:.A$1048576];[$mil_ass_all.$B21]) -> Arleigh Burke Class DDG | E21: of:=INDEX([$military_assets.B$1:.B$1048576];[$mil_ass_all.$B21]) -> 0 | F21: of:=INDEX([$military_assets.C$1:.C$1048576];[$mil_ass_all.$B21]) -> 0 | G21: of:=INDEX([$military_assets.D$1:.D$1048576];[$mil_ass_all.$B21]) -> 0 | H21: of:=INDEX([$military_assets.E$1:.E$1048576];[$mil_ass_all.$B21]) -> 2 | I21: of:=INDEX([$military_assets.F$1:.F$1048576];[$mil_ass_all.$B21]) -> 3 | J21: of:=INDEX([$military_assets.G$1:.G$1048576];[$mil_ass_all.$B21]) -> 2 | K21: of:=INDEX([$military_assets.H$1:.H$1048576];[$mil_ass_all.$B21]) -> 3 | L21: of:=INDEX([$military_assets.I$1:.I$1048576];[$mil_ass_all.$B21]) -> USN | M21: of:=INDEX([$military_assets.J$1:.J$1048576];[$mil_ass_all.$B21]) -> Ship | N21: of:=INDEX([$military_assets.K$1:.K$1048576];[$mil_ass_all.$B21]) -> AEGIS: +2 Help Defense. | O21: of:=INDEX([$military_assets.L$1:.L$1048576];[$mil_ass_all.$B21]) -> Images/arleighburke.jpg | P21: of:=INDEX([$military_assets.M$1:.M$1048576];[$mil_ass_all.$B21]) -> The multi-mission-capable Arleigh Burke is the most numerous ship in and workhorse of the US Navy. | Q21: of:=INDEX([$military_assets.N$1:.N$1048576];[$mil_ass_all.$B21]) -> 0.0.2
A22: 1 | B22: 10 | C22: USS Spruance | D22: of:=INDEX([$military_assets.A$1:.A$1048576];[$mil_ass_all.$B22]) -> Arleigh Burke Class DDG | E22: of:=INDEX([$military_assets.B$1:.B$1048576];[$mil_ass_all.$B22]) -> 0 | F22: of:=INDEX([$military_assets.C$1:.C$1048576];[$mil_ass_all.$B22]) -> 0 | G22: of:=INDEX([$military_assets.D$1:.D$1048576];[$mil_ass_all.$B22]) -> 0 | H22: of:=INDEX([$military_assets.E$1:.E$1048576];[$mil_ass_all.$B22]) -> 2 | I22: of:=INDEX([$military_assets.F$1:.F$1048576];[$mil_ass_all.$B22]) -> 3 | J22: of:=INDEX([$military_assets.G$1:.G$1048576];[$mil_ass_all.$B22]) -> 2 | K22: of:=INDEX([$military_assets.H$1:.H$1048576];[$mil_ass_all.$B22]) -> 3 | L22: of:=INDEX([$military_assets.I$1:.I$1048576];[$mil_ass_all.$B22]) -> USN | M22: of:=INDEX([$military_assets.J$1:.J$1048576];[$mil_ass_all.$B22]) -> Ship | N22: of:=INDEX([$military_assets.K$1:.K$1048576];[$mil_ass_all.$B22]) -> AEGIS: +2 Help Defense. | O22: of:=INDEX([$military_assets.L$1:.L$1048576];[$mil_ass_all.$B22]) -> Images/arleighburke.jpg | P22: of:=INDEX([$military_assets.M$1:.M$1048576];[$mil_ass_all.$B22]) -> The multi-mission-capable Arleigh Burke is the most numerous ship in and workhorse of the US Navy. | Q22: of:=INDEX([$military_assets.N$1:.N$1048576];[$mil_ass_all.$B22]) -> 0.0.2
A23: 1 | B23: 10 | C23: USS John Paul Jones | D23: of:=INDEX([$military_assets.A$1:.A$1048576];[$mil_ass_all.$B23]) -> Arleigh Burke Class DDG | E23: of:=INDEX([$military_assets.B$1:.B$1048576];[$mil_ass_all.$B23]) -> 0 | F23: of:=INDEX([$military_assets.C$1:.C$1048576];[$mil_ass_all.$B23]) -> 0 | G23: of:=INDEX([$military_assets.D$1:.D$1048576];[$mil_ass_all.$B23]) -> 0 | H23: of:=INDEX([$military_assets.E$1:.E$1048576];[$mil_ass_all.$B23]) -> 2 | I23: of:=INDEX([$military_assets.F$1:.F$1048576];[$mil_ass_all.$B23]) -> 3 | J23: of:=INDEX([$military_assets.G$1:.G$1048576];[$mil_ass_all.$B23]) -> 2 | K23: of:=INDEX([$military_assets.H$1:.H$1048576];[$mil_ass_all.$B23]) -> 3 | L23: of:=INDEX([$military_assets.I$1:.I$1048576];[$mil_ass_all.$B23]) -> USN | M23: of:=INDEX([$military_assets.J$1:.J$1048576];[$mil_ass_all.$B23]) -> Ship | N23: of:=INDEX([$military_assets.K$1:.K$1048576];[$mil_ass_all.$B23]) -> AEGIS: +2 Help Defense. | O23: of:=INDEX([$military_assets.L$1:.L$1048576];[$mil_ass_all.$B23]) -> Images/arleighburke.jpg | P23: of:=INDEX([$military_assets.M$1:.M$1048576];[$mil_ass_all.$B23]) -> The multi-mission-capable Arleigh Burke is the most numerous ship in and workhorse of the US Navy. | Q23: of:=INDEX([$military_assets.N$1:.N$1048576];[$mil_ass_all.$B23]) -> 0.0.2
A24: 1 | B24: 11 | C24: USS Zumwalt | D24: of:=INDEX([$military_assets.A$1:.A$1048576];[$mil_ass_all.$B24]) -> Zumwalt Class DDG | E24: of:=INDEX([$military_assets.B$1:.B$1048576];[$mil_ass_all.$B24]) -> 0 | F24: of:=INDEX([$military_assets.C$1:.C$1048576];[$mil_ass_all.$B24]) -> 0 | G24: of:=INDEX([$military_assets.D$1:.D$1048576];[$mil_ass_all.$B24]) -> 0 | H24: of:=INDEX([$military_assets.E$1:.E$1048576];[$mil_ass_all.$B24]) -> 2 | I24: of:=INDEX([$military_assets.F$1:.F$1048576];[$mil_ass_all.$B24]) -> 4 | J24: of:=INDEX([$military_assets.G$1:.G$1048576];[$mil_ass_all.$B24]) -> 3 | K24: of:=INDEX([$military_assets.H$1:.H$1048576];[$mil_ass_all.$B24]) -> 3 | L24: of:=INDEX([$military_assets.I$1:.I$1048576];[$mil_ass_all.$B24]) -> USN | M24: of:=INDEX([$military_assets.J$1:.J$1048576];[$mil_ass_all.$B24]) -> Ship | N24: of:=INDEX([$military_assets.K$1:.K$1048576];[$mil_ass_all.$B24]) -> Hidden: Can be played face down.  | O24: of:=INDEX([$military_assets.L$1:.L$1048576];[$mil_ass_all.$B24]) -> Images/zumwalt.jpg | P24: of:=INDEX([$military_assets.M$1:.M$1048576];[$mil_ass_all.$B24]) -> With a cost of $1M per shot from its main howitzer, it is important for the crew of a Zumwalt to aim carefully. | Q24: of:=INDEX([$military_assets.N$1:.N$1048576];[$mil_ass_all.$B24]) -> 0.0.2
A25: 1 | B25: 11 | C25: USS Michael Monsoor | D25: of:=INDEX([$military_assets.A$1:.A$1048576];[$mil_ass_all.$B25]) -> Zumwalt Class DDG | E25: of:=INDEX([$military_assets.B$1:.B$1048576];[$mil_ass_all.$B25]) -> 0 | F25: of:=INDEX([$military_assets.C$1:.C$1048576];[$mil_ass_all.$B25]) -> 0 | G25: of:=INDEX([$military_assets.D$1:.D$1048576];[$mil_ass_all.$B25]) -> 0 | H25: of:=INDEX([$military_assets.E$1:.E$1048576];[$mil_ass_all.$B25]) -> 2 | I25: of:=INDEX([$military_assets.F$1:.F$1048576];[$mil_ass_all.$B25]) -> 4 | J25: of:=INDEX([$military_assets.G$1:.G$1048576];[$mil_ass_all.$B25]) -> 3 | K25: of:=INDEX([$military_assets.H$1:.H$1048576];[$mil_ass_all.$B25]) -> 3 | L25: of:=INDEX([$military_assets.I$1:.I$1048576];[$mil_ass_all.$B25]) -> USN | M25: of:=INDEX([$military_assets.J$1:.J$1048576];[$mil_ass_all.$B25]) -> Ship | N25: of:=INDEX([$military_assets.K$1:.K$1048576];[$mil_ass_all.$B25]) -> Hidden: Can be played face down.  | O25: of:=INDEX([$military_assets.L$1:.L$1048576];[$mil_ass_all.$B25]) -> Images/zumwalt.jpg | P25: of:=INDEX([$military_assets.M$1:.M$1048576];[$mil_ass_all.$B25]) -> With a cost of $1M per shot from its main howitzer, it is important for the crew of a Zumwalt to aim carefully. | Q25: of:=INDEX([$military_assets.N$1:.N$1048576];[$mil_ass_all.$B25]) -> 0.0.2
A26: 1 | B26: 12 | C26: Tophatters | D26: of:=INDEX([$military_assets.A$1:.A$1048576];[$mil_ass_all.$B26]) -> F/A-18E Superhornet | E26: of:=INDEX([$military_assets.B$1:.B$1048576];[$mil_ass_all.$B26]) -> 0 | F26: of:=INDEX([$military_assets.C$1:.C$1048576];[$mil_ass_all.$B26]) -> 0 | G26: of:=INDEX([$military_assets.D$1:.D$1048576];[$mil_ass_all.$B26]) -> 0 | H26: of:=INDEX([$military_assets.E$1:.E$1048576];[$mil_ass_all.$B26]) -> 4 | I26: of:=INDEX([$military_assets.F$1:.F$1048576];[$mil_ass_all.$B26]) -> 4 | J26: of:=INDEX([$military_assets.G$1:.G$1048576];[$mil_ass_all.$B26]) -> 3 | K26: of:=INDEX([$military_assets.H$1:.H$1048576];[$mil_ass_all.$B26]) -> 2 | L26: of:=INDEX([$military_assets.I$1:.I$1048576];[$mil_ass_all.$B26]) -> USN | M26: of:=INDEX([$military_assets.J$1:.J$1048576];[$mil_ass_all.$B26]) -> Squadron | N26: of:=INDEX([$military_assets.K$1:.K$1048576];[$mil_ass_all.$B26]) -> CATOBAR
Hidden: Can be played face down.  | O26: of:=INDEX([$military_assets.L$1:.L$1048576];[$mil_ass_all.$B26]) -> Images/f18.jpg | P26: of:=INDEX([$military_assets.M$1:.M$1048576];[$mil_ass_all.$B26]) -> The F/A-18 is one of the longest-tenured and most battle-proven multi-role carrier aircraft in the world. | Q26: of:=INDEX([$military_assets.N$1:.N$1048576];[$mil_ass_all.$B26]) -> 0.0.2
A27: 1 | B27: 12 | C27: Sidewinders | D27: of:=INDEX([$military_assets.A$1:.A$1048576];[$mil_ass_all.$B27]) -> F/A-18E Superhornet | E27: of:=INDEX([$military_assets.B$1:.B$1048576];[$mil_ass_all.$B27]) -> 0 | F27: of:=INDEX([$military_assets.C$1:.C$1048576];[$mil_ass_all.$B27]) -> 0 | G27: of:=INDEX([$military_assets.D$1:.D$1048576];[$mil_ass_all.$B27]) -> 0 | H27: of:=INDEX([$military_assets.E$1:.E$1048576];[$mil_ass_all.$B27]) -> 4 | I27: of:=INDEX([$military_assets.F$1:.F$1048576];[$mil_ass_all.$B27]) -> 4 | J27: of:=INDEX([$military_assets.G$1:.G$1048576];[$mil_ass_all.$B27]) -> 3 | K27: of:=INDEX([$military_assets.H$1:.H$1048576];[$mil_ass_all.$B27]) -> 2 | L27: of:=INDEX([$military_assets.I$1:.I$1048576];[$mil_ass_all.$B27]) -> USN | M27: of:=INDEX([$military_assets.J$1:.J$1048576];[$mil_ass_all.$B27]) -> Squadron | N27: of:=INDEX([$military_assets.K$1:.K$1048576];[$mil_ass_all.$B27]) -> CATOBAR
Hidden: Can be played face down.  | O27: of:=INDEX([$military_assets.L$1:.L$1048576];[$mil_ass_all.$B27]) -> Images/f18.jpg | P27: of:=INDEX([$military_assets.M$1:.M$1048576];[$mil_ass_all.$B27]) -> The F/A-18 is one of the longest-tenured and most battle-proven multi-role carrier aircraft in the world. | Q27: of:=INDEX([$military_assets.N$1:.N$1048576];[$mil_ass_all.$B27]) -> 0.0.2
A28: 1 | B28: 12 | C28: Eagles | D28: of:=INDEX([$military_assets.A$1:.A$1048576];[$mil_ass_all.$B28]) -> F/A-18E Superhornet | E28: of:=INDEX([$military_assets.B$1:.B$1048576];[$mil_ass_all.$B28]) -> 0 | F28: of:=INDEX([$military_assets.C$1:.C$1048576];[$mil_ass_all.$B28]) -> 0 | G28: of:=INDEX([$military_assets.D$1:.D$1048576];[$mil_ass_all.$B28]) -> 0 | H28: of:=INDEX([$military_assets.E$1:.E$1048576];[$mil_ass_all.$B28]) -> 4 | I28: of:=INDEX([$military_assets.F$1:.F$1048576];[$mil_ass_all.$B28]) -> 4 | J28: of:=INDEX([$military_assets.G$1:.G$1048576];[$mil_ass_all.$B28]) -> 3 | K28: of:=INDEX([$military_assets.H$1:.H$1048576];[$mil_ass_all.$B28]) -> 2 | L28: of:=INDEX([$military_assets.I$1:.I$1048576];[$mil_ass_all.$B28]) -> USN | M28: of:=INDEX([$military_assets.J$1:.J$1048576];[$mil_ass_all.$B28]) -> Squadron | N28: of:=INDEX([$military_assets.K$1:.K$1048576];[$mil_ass_all.$B28]) -> CATOBAR
Hidden: Can be played face down.  | O28: of:=INDEX([$military_assets.L$1:.L$1048576];[$mil_ass_all.$B28]) -> Images/f18.jpg | P28: of:=INDEX([$military_assets.M$1:.M$1048576];[$mil_ass_all.$B28]) -> The F/A-18 is one of the longest-tenured and most battle-proven multi-role carrier aircraft in the world. | Q28: of:=INDEX([$military_assets.N$1:.N$1048576];[$mil_ass_all.$B28]) -> 0.0.2
A29: 1 | B29: 12 | C29: Warhawks | D29: of:=INDEX([$military_assets.A$1:.A$1048576];[$mil_ass_all.$B29]) -> F/A-18E Superhornet | E29: of:=INDEX([$military_assets.B$1:.B$1048576];[$mil_ass_all.$B29]) -> 0 | F29: of:=INDEX([$military_assets.C$1:.C$1048576];[$mil_ass_all.$B29]) -> 0 | G29: of:=INDEX([$military_assets.D$1:.D$1048576];[$mil_ass_all.$B29]) -> 0 | H29: of:=INDEX([$military_assets.E$1:.E$1048576];[$mil_ass_all.$B29]) -> 4 | I29: of:=INDEX([$military_assets.F$1:.F$1048576];[$mil_ass_all.$B29]) -> 4 | J29: of:=INDEX([$military_assets.G$1:.G$1048576];[$mil_ass_all.$B29]) -> 3 | K29: of:=INDEX([$military_assets.H$1:.H$1048576];[$mil_ass_all.$B29]) -> 2 | L29: of:=INDEX([$military_assets.I$1:.I$1048576];[$mil_ass_all.$B29]) -> USN | M29: of:=INDEX([$military_assets.J$1:.J$1048576];[$mil_ass_all.$B29]) -> Squadron | N29: of:=INDEX([$military_assets.K$1:.K$1048576];[$mil_ass_all.$B29]) -> CATOBAR
Hidden: Can be played face down.  | O29: of:=INDEX([$military_assets.L$1:.L$1048576];[$mil_ass_all.$B29]) -> Images/f18.jpg | P29: of:=INDEX([$military_assets.M$1:.M$1048576];[$mil_ass_all.$B29]) -> The F/A-18 is one of the longest-tenured and most battle-proven multi-role carrier aircraft in the world. | Q29: of:=INDEX([$military_assets.N$1:.N$1048576];[$mil_ass_all.$B29]) -> 0.0.2
A30: 1 | B30: 12 | C30: Vigilantes | D30: of:=INDEX([$military_assets.A$1:.A$1048576];[$mil_ass_all.$B30]) -> F/A-18E Superhornet | E30: of:=INDEX([$military_assets.B$1:.B$1048576];[$mil_ass_all.$B30]) -> 0 | F30: of:=INDEX([$military_assets.C$1:.C$1048576];[$mil_ass_all.$B30]) -> 0 | G30: of:=INDEX([$military_assets.D$1:.D$1048576];[$mil_ass_all.$B30]) -> 0 | H30: of:=INDEX([$military_assets.E$1:.E$1048576];[$mil_ass_all.$B30]) -> 4 | I30: of:=INDEX([$military_assets.F$1:.F$1048576];[$mil_ass_all.$B30]) -> 4 | J30: of:=INDEX([$military_assets.G$1:.G$1048576];[$mil_ass_all.$B30]) -> 3 | K30: of:=INDEX([$military_assets.H$1:.H$1048576];[$mil_ass_all.$B30]) -> 2 | L30: of:=INDEX([$military_assets.I$1:.I$1048576];[$mil_ass_all.$B30]) -> USN | M30: of:=INDEX([$military_assets.J$1:.J$1048576];[$mil_ass_all.$B30]) -> Squadron | N30: of:=INDEX([$military_assets.K$1:.K$1048576];[$mil_ass_all.$B30]) -> CATOBAR
Hidden: Can be played face down.  | O30: of:=INDEX([$military_assets.L$1:.L$1048576];[$mil_ass_all.$B30]) -> Images/f18.jpg | P30: of:=INDEX([$military_assets.M$1:.M$1048576];[$mil_ass_all.$B30]) -> The F/A-18 is one of the longest-tenured and most battle-proven multi-role carrier aircraft in the world. | Q30: of:=INDEX([$military_assets.N$1:.N$1048576];[$mil_ass_all.$B30]) -> 0.0.2
A31: 1 | B31: 13 | C31: Green Knights | D31: of:=INDEX([$military_assets.A$1:.A$1048576];[$mil_ass_all.$B31]) -> F-35B Lightning II | E31: of:=INDEX([$military_assets.B$1:.B$1048576];[$mil_ass_all.$B31]) -> 0 | F31: of:=INDEX([$military_assets.C$1:.C$1048576];[$mil_ass_all.$B31]) -> 0 | G31: of:=INDEX([$military_assets.D$1:.D$1048576];[$mil_ass_all.$B31]) -> 0 | H31: of:=INDEX([$military_assets.E$1:.E$1048576];[$mil_ass_all.$B31]) -> 4 | I31: of:=INDEX([$military_assets.F$1:.F$1048576];[$mil_ass_all.$B31]) -> 3 | J31: of:=INDEX([$military_assets.G$1:.G$1048576];[$mil_ass_all.$B31]) -> 2 | K31: of:=INDEX([$military_assets.H$1:.H$1048576];[$mil_ass_all.$B31]) -> 3 | L31: of:=INDEX([$military_assets.I$1:.I$1048576];[$mil_ass_all.$B31]) -> USN | M31: of:=INDEX([$military_assets.J$1:.J$1048576];[$mil_ass_all.$B31]) -> Squadron | N31: of:=INDEX([$military_assets.K$1:.K$1048576];[$mil_ass_all.$B31]) -> VTOL
Hidden: Can be played face down. 
Surprise Attacker: This asset deals damage during the Surprise Damage Step. | O31: of:=INDEX([$military_assets.L$1:.L$1048576];[$mil_ass_all.$B31]) -> Images/f35b.jpg | P31: of:=INDEX([$military_assets.M$1:.M$1048576];[$mil_ass_all.$B31]) -> The F-35B is a special variant of the F-35 capable of taking off and landing vertically. This allows it to be stationed on smaller carriers that have typically not been able to field cutting-edge aircraft. | Q31: of:=INDEX([$military_assets.N$1:.N$1048576];[$mil_ass_all.$B31]) -> 0.0.2
A32: 1 | B32: 13 | C32: Flying Leathernecks | D32: of:=INDEX([$military_assets.A$1:.A$1048576];[$mil_ass_all.$B32]) -> F-35B Lightning II | E32: of:=INDEX([$military_assets.B$1:.B$1048576];[$mil_ass_all.$B32]) -> 0 | F32: of:=INDEX([$military_assets.C$1:.C$1048576];[$mil_ass_all.$B32]) -> 0 | G32: of:=INDEX([$military_assets.D$1:.D$1048576];[$mil_ass_all.$B32]) -> 0 | H32: of:=INDEX([$military_assets.E$1:.E$1048576];[$mil_ass_all.$B32]) -> 4 | I32: of:=INDEX([$military_assets.F$1:.F$1048576];[$mil_ass_all.$B32]) -> 3 | J32: of:=INDEX([$military_assets.G$1:.G$1048576];[$mil_ass_all.$B32]) -> 2 | K32: of:=INDEX([$military_assets.H$1:.H$1048576];[$mil_ass_all.$B32]) -> 3 | L32: of:=INDEX([$military_assets.I$1:.I$1048576];[$mil_ass_all.$B32]) -> USN | M32: of:=INDEX([$military_assets.J$1:.J$1048576];[$mil_ass_all.$B32]) -> Squadron | N32: of:=INDEX([$military_assets.K$1:.K$1048576];[$mil_ass_all.$B32]) -> VTOL
Hidden: Can be played face down. 
Surprise Attacker: This asset deals damage during the Surprise Damage Step. | O32: of:=INDEX([$military_assets.L$1:.L$1048576];[$mil_ass_all.$B32]) -> Images/f35b.jpg | P32: of:=INDEX([$military_assets.M$1:.M$1048576];[$mil_ass_all.$B32]) -> The F-35B is a special variant of the F-35 capable of taking off and landing vertically. This allows it to be stationed on smaller carriers that have typically not been able to field cutting-edge aircraft. | Q32: of:=INDEX([$military_assets.N$1:.N$1048576];[$mil_ass_all.$B32]) -> 0.0.2
A33: 1 | B33: 13 | C33: Wake Island Avengers | D33: of:=INDEX([$military_assets.A$1:.A$1048576];[$mil_ass_all.$B33]) -> F-35B Lightning II | E33: of:=INDEX([$military_assets.B$1:.B$1048576];[$mil_ass_all.$B33]) -> 0 | F33: of:=INDEX([$military_assets.C$1:.C$1048576];[$mil_ass_all.$B33]) -> 0 | G33: of:=INDEX([$military_assets.D$1:.D$1048576];[$mil_ass_all.$B33]) -> 0 | H33: of:=INDEX([$military_assets.E$1:.E$1048576];[$mil_ass_all.$B33]) -> 4 | I33: of:=INDEX([$military_assets.F$1:.F$1048576];[$mil_ass_all.$B33]) -> 3 | J33: of:=INDEX([$military_assets.G$1:.G$1048576];[$mil_ass_all.$B33]) -> 2 | K33: of:=INDEX([$military_assets.H$1:.H$1048576];[$mil_ass_all.$B33]) -> 3 | L33: of:=INDEX([$military_assets.I$1:.I$1048576];[$mil_ass_all.$B33]) -> USN | M33: of:=INDEX([$military_assets.J$1:.J$1048576];[$mil_ass_all.$B33]) -> Squadron | N33: of:=INDEX([$military_assets.K$1:.K$1048576];[$mil_ass_all.$B33]) -> VTOL
Hidden: Can be played face down. 
Surprise Attacker: This asset deals damage during the Surprise Damage Step. | O33: of:=INDEX([$military_assets.L$1:.L$1048576];[$mil_ass_all.$B33]) -> Images/f35b.jpg | P33: of:=INDEX([$military_assets.M$1:.M$1048576];[$mil_ass_all.$B33]) -> The F-35B is a special variant of the F-35 capable of taking off and landing vertically. This allows it to be stationed on smaller carriers that have typically not been able to field cutting-edge aircraft. | Q33: of:=INDEX([$military_assets.N$1:.N$1048576];[$mil_ass_all.$B33]) -> 0.0.2
A34: 1 | B34: 14 | C34: Black Knights | D34: of:=INDEX([$military_assets.A$1:.A$1048576];[$mil_ass_all.$B34]) -> F-35C  Lightning II | E34: of:=INDEX([$military_assets.B$1:.B$1048576];[$mil_ass_all.$B34]) -> 0 | F34: of:=INDEX([$military_assets.C$1:.C$1048576];[$mil_ass_all.$B34]) -> 0 | G34: of:=INDEX([$military_assets.D$1:.D$1048576];[$mil_ass_all.$B34]) -> 0 | H34: of:=INDEX([$military_assets.E$1:.E$1048576];[$mil_ass_all.$B34]) -> 4 | I34: of:=INDEX([$military_assets.F$1:.F$1048576];[$mil_ass_all.$B34]) -> 4 | J34: of:=INDEX([$military_assets.G$1:.G$1048576];[$mil_ass_all.$B34]) -> 2 | K34: of:=INDEX([$military_assets.H$1:.H$1048576];[$mil_ass_all.$B34]) -> 2 | L34: of:=INDEX([$military_assets.I$1:.I$1048576];[$mil_ass_all.$B34]) -> USN | M34: of:=INDEX([$military_assets.J$1:.J$1048576];[$mil_ass_all.$B34]) -> Squadron | N34: of:=INDEX([$military_assets.K$1:.K$1048576];[$mil_ass_all.$B34]) -> CATOBAR
Hidden: Can be played face down. 
Surprise Attacker: This asset deals damage during the Surprise Damage Step. | O34: of:=INDEX([$military_assets.L$1:.L$1048576];[$mil_ass_all.$B34]) -> Images/f35c.jpg | P34: of:=INDEX([$military_assets.M$1:.M$1048576];[$mil_ass_all.$B34]) -> The F-35 acquisition program cost of just under $450 billion USD would be enough to buy 450 billion $1 cheeseburgers - enough to kill all humans on earth. | Q34: of:=INDEX([$military_assets.N$1:.N$1048576];[$mil_ass_all.$B34]) -> 0.0.2
A35: 1 | B35: 14 | C35: Rough Raiders | D35: of:=INDEX([$military_assets.A$1:.A$1048576];[$mil_ass_all.$B35]) -> F-35C  Lightning II | E35: of:=INDEX([$military_assets.B$1:.B$1048576];[$mil_ass_all.$B35]) -> 0 | F35: of:=INDEX([$military_assets.C$1:.C$1048576];[$mil_ass_all.$B35]) -> 0 | G35: of:=INDEX([$military_assets.D$1:.D$1048576];[$mil_ass_all.$B35]) -> 0 | H35: of:=INDEX([$military_assets.E$1:.E$1048576];[$mil_ass_all.$B35]) -> 4 | I35: of:=INDEX([$military_assets.F$1:.F$1048576];[$mil_ass_all.$B35]) -> 4 | J35: of:=INDEX([$military_assets.G$1:.G$1048576];[$mil_ass_all.$B35]) -> 2 | K35: of:=INDEX([$military_assets.H$1:.H$1048576];[$mil_ass_all.$B35]) -> 2 | L35: of:=INDEX([$military_assets.I$1:.I$1048576];[$mil_ass_all.$B35]) -> USN | M35: of:=INDEX([$military_assets.J$1:.J$1048576];[$mil_ass_all.$B35]) -> Squadron | N35: of:=INDEX([$military_assets.K$1:.K$1048576];[$mil_ass_all.$B35]) -> CATOBAR
Hidden: Can be played face down. 
Surprise Attacker: This asset deals damage during the Surprise Damage Step. | O35: of:=INDEX([$military_assets.L$1:.L$1048576];[$mil_ass_all.$B35]) -> Images/f35c.jpg | P35: of:=INDEX([$military_assets.M$1:.M$1048576];[$mil_ass_all.$B35]) -> The F-35 acquisition program cost of just under $450 billion USD would be enough to buy 450 billion $1 cheeseburgers - enough to kill all humans on earth. | Q35: of:=INDEX([$military_assets.N$1:.N$1048576];[$mil_ass_all.$B35]) -> 0.0.2
A36: 1 | B36: 14 | C36: Argonauts | D36: of:=INDEX([$military_assets.A$1:.A$1048576];[$mil_ass_all.$B36]) -> F-35C  Lightning II | E36: of:=INDEX([$military_assets.B$1:.B$1048576];[$mil_ass_all.$B36]) -> 0 | F36: of:=INDEX([$military_assets.C$1:.C$1048576];[$mil_ass_all.$B36]) -> 0 | G36: of:=INDEX([$military_assets.D$1:.D$1048576];[$mil_ass_all.$B36]) -> 0 | H36: of:=INDEX([$military_assets.E$1:.E$1048576];[$mil_ass_all.$B36]) -> 4 | I36: of:=INDEX([$military_assets.F$1:.F$1048576];[$mil_ass_all.$B36]) -> 4 | J36: of:=INDEX([$military_assets.G$1:.G$1048576];[$mil_ass_all.$B36]) -> 2 | K36: of:=INDEX([$military_assets.H$1:.H$1048576];[$mil_ass_all.$B36]) -> 2 | L36: of:=INDEX([$military_assets.I$1:.I$1048576];[$mil_ass_all.$B36]) -> USN | M36: of:=INDEX([$military_assets.J$1:.J$1048576];[$mil_ass_all.$B36]) -> Squadron | N36: of:=INDEX([$military_assets.K$1:.K$1048576];[$mil_ass_all.$B36]) -> CATOBAR
Hidden: Can be played face down. 
Surprise Attacker: This asset deals damage during the Surprise Damage Step. | O36: of:=INDEX([$military_assets.L$1:.L$1048576];[$mil_ass_all.$B36]) -> Images/f35c.jpg | P36: of:=INDEX([$military_assets.M$1:.M$1048576];[$mil_ass_all.$B36]) -> The F-35 acquisition program cost of just under $450 billion USD would be enough to buy 450 billion $1 cheeseburgers - enough to kill all humans on earth. | Q36: of:=INDEX([$military_assets.N$1:.N$1048576];[$mil_ass_all.$B36]) -> 0.0.2
A37: 1 | B37: 15 | C37: Black Sheep | D37: of:=INDEX([$military_assets.A$1:.A$1048576];[$mil_ass_all.$B37]) -> AV-8B Harrier II | E37: of:=INDEX([$military_assets.B$1:.B$1048576];[$mil_ass_all.$B37]) -> 0 | F37: of:=INDEX([$military_assets.C$1:.C$1048576];[$mil_ass_all.$B37]) -> 0 | G37: of:=INDEX([$military_assets.D$1:.D$1048576];[$mil_ass_all.$B37]) -> 0 | H37: of:=INDEX([$military_assets.E$1:.E$1048576];[$mil_ass_all.$B37]) -> 3 | I37: of:=INDEX([$military_assets.F$1:.F$1048576];[$mil_ass_all.$B37]) -> 3 | J37: of:=INDEX([$military_assets.G$1:.G$1048576];[$mil_ass_all.$B37]) -> 2 | K37: of:=INDEX([$military_assets.H$1:.H$1048576];[$mil_ass_all.$B37]) -> 1 | L37: of:=INDEX([$military_assets.I$1:.I$1048576];[$mil_ass_all.$B37]) -> USN | M37: of:=INDEX([$military_assets.J$1:.J$1048576];[$mil_ass_all.$B37]) -> Squadron | N37: of:=INDEX([$military_assets.K$1:.K$1048576];[$mil_ass_all.$B37]) -> VTOL
Hidden: Can be played face down.  | O37: of:=INDEX([$military_assets.L$1:.L$1048576];[$mil_ass_all.$B37]) -> Images/harrier.jpg | P37: of:=INDEX([$military_assets.M$1:.M$1048576];[$mil_ass_all.$B37]) -> A Pepsi ad campaign promised to award a Harrier to anyone who collected enough Pepsi points- a promise Pepsi did not keep. During its service history, the Harrier has proven it is more reliable than Pepsi Co. | Q37: of:=INDEX([$military_assets.N$1:.N$1048576];[$mil_ass_all.$B37]) -> 0.0.2
A38: 1 | B38: 15 | C38: Bulldogs | D38: of:=INDEX([$military_assets.A$1:.A$1048576];[$mil_ass_all.$B38]) -> AV-8B Harrier II | E38: of:=INDEX([$military_assets.B$1:.B$1048576];[$mil_ass_all.$B38]) -> 0 | F38: of:=INDEX([$military_assets.C$1:.C$1048576];[$mil_ass_all.$B38]) -> 0 | G38: of:=INDEX([$military_assets.D$1:.D$1048576];[$mil_ass_all.$B38]) -> 0 | H38: of:=INDEX([$military_assets.E$1:.E$1048576];[$mil_ass_all.$B38]) -> 3 | I38: of:=INDEX([$military_assets.F$1:.F$1048576];[$mil_ass_all.$B38]) -> 3 | J38: of:=INDEX([$military_assets.G$1:.G$1048576];[$mil_ass_all.$B38]) -> 2 | K38: of:=INDEX([$military_assets.H$1:.H$1048576];[$mil_ass_all.$B38]) -> 1 | L38: of:=INDEX([$military_assets.I$1:.I$1048576];[$mil_ass_all.$B38]) -> USN | M38: of:=INDEX([$military_assets.J$1:.J$1048576];[$mil_ass_all.$B38]) -> Squadron | N38: of:=INDEX([$military_assets.K$1:.K$1048576];[$mil_ass_all.$B38]) -> VTOL
Hidden: Can be played face down.  | O38: of:=INDEX([$military_assets.L$1:.L$1048576];[$mil_ass_all.$B38]) -> Images/harrier.jpg | P38: of:=INDEX([$military_assets.M$1:.M$1048576];[$mil_ass_all.$B38]) -> A Pepsi ad campaign promised to award a Harrier to anyone who collected enough Pepsi points- a promise Pepsi did not keep. During its service history, the Harrier has proven it is more reliable than Pepsi Co. | Q38: of:=INDEX([$military_assets.N$1:.N$1048576];[$mil_ass_all.$B38]) -> 0.0.2
A39: 1 | B39: 15 | C39: Ace of Spades | D39: of:=INDEX([$military_assets.A$1:.A$1048576];[$mil_ass_all.$B39]) -> AV-8B Harrier II | E39: of:=INDEX([$military_assets.B$1:.B$1048576];[$mil_ass_all.$B39]) -> 0 | F39: of:=INDEX([$military_assets.C$1:.C$1048576];[$mil_ass_all.$B39]) -> 0 | G39: of:=INDEX([$military_assets.D$1:.D$1048576];[$mil_ass_all.$B39]) -> 0 | H39: of:=INDEX([$military_assets.E$1:.E$1048576];[$mil_ass_all.$B39]) -> 3 | I39: of:=INDEX([$military_assets.F$1:.F$1048576];[$mil_ass_all.$B39]) -> 3 | J39: of:=INDEX([$military_assets.G$1:.G$1048576];[$mil_ass_all.$B39]) -> 2 | K39: of:=INDEX([$military_assets.H$1:.H$1048576];[$mil_ass_all.$B39]) -> 1 | L39: of:=INDEX([$military_assets.I$1:.I$1048576];[$mil_ass_all.$B39]) -> USN | M39: of:=INDEX([$military_assets.J$1:.J$1048576];[$mil_ass_all.$B39]) -> Squadron | N39: of:=INDEX([$military_assets.K$1:.K$1048576];[$mil_ass_all.$B39]) -> VTOL
Hidden: Can be played face down.  | O39: of:=INDEX([$military_assets.L$1:.L$1048576];[$mil_ass_all.$B39]) -> Images/harrier.jpg | P39: of:=INDEX([$military_assets.M$1:.M$1048576];[$mil_ass_all.$B39]) -> A Pepsi ad campaign promised to award a Harrier to anyone who collected enough Pepsi points- a promise Pepsi did not keep. During its service history, the Harrier has proven it is more reliable than Pepsi Co. | Q39: of:=INDEX([$military_assets.N$1:.N$1048576];[$mil_ass_all.$B39]) -> 0.0.2
A40: 1 | B40: 15 | C40: Tomcats | D40: of:=INDEX([$military_assets.A$1:.A$1048576];[$mil_ass_all.$B40]) -> AV-8B Harrier II | E40: of:=INDEX([$military_assets.B$1:.B$1048576];[$mil_ass_all.$B40]) -> 0 | F40: of:=INDEX([$military_assets.C$1:.C$1048576];[$mil_ass_all.$B40]) -> 0 | G40: of:=INDEX([$military_assets.D$1:.D$1048576];[$mil_ass_all.$B40]) -> 0 | H40: of:=INDEX([$military_assets.E$1:.E$1048576];[$mil_ass_all.$B40]) -> 3 | I40: of:=INDEX([$military_assets.F$1:.F$1048576];[$mil_ass_all.$B40]) -> 3 | J40: of:=INDEX([$military_assets.G$1:.G$1048576];[$mil_ass_all.$B40]) -> 2 | K40: of:=INDEX([$military_assets.H$1:.H$1048576];[$mil_ass_all.$B40]) -> 1 | L40: of:=INDEX([$military_assets.I$1:.I$1048576];[$mil_ass_all.$B40]) -> USN | M40: of:=INDEX([$military_assets.J$1:.J$1048576];[$mil_ass_all.$B40]) -> Squadron | N40: of:=INDEX([$military_assets.K$1:.K$1048576];[$mil_ass_all.$B40]) -> VTOL
Hidden: Can be played face down.  | O40: of:=INDEX([$military_assets.L$1:.L$1048576];[$mil_ass_all.$B40]) -> Images/harrier.jpg | P40: of:=INDEX([$military_assets.M$1:.M$1048576];[$mil_ass_all.$B40]) -> A Pepsi ad campaign promised to award a Harrier to anyone who collected enough Pepsi points- a promise Pepsi did not keep. During its service history, the Harrier has proven it is more reliable than Pepsi Co. | Q40: of:=INDEX([$military_assets.N$1:.N$1048576];[$mil_ass_all.$B40]) -> 0.0.2
A41: 1 | B41: 15 | C41: Tigers | D41: of:=INDEX([$military_assets.A$1:.A$1048576];[$mil_ass_all.$B41]) -> AV-8B Harrier II | E41: of:=INDEX([$military_assets.B$1:.B$1048576];[$mil_ass_all.$B41]) -> 0 | F41: of:=INDEX([$military_assets.C$1:.C$1048576];[$mil_ass_all.$B41]) -> 0 | G41: of:=INDEX([$military_assets.D$1:.D$1048576];[$mil_ass_all.$B41]) -> 0 | H41: of:=INDEX([$military_assets.E$1:.E$1048576];[$mil_ass_all.$B41]) -> 3 | I41: of:=INDEX([$military_assets.F$1:.F$1048576];[$mil_ass_all.$B41]) -> 3 | J41: of:=INDEX([$military_assets.G$1:.G$1048576];[$mil_ass_all.$B41]) -> 2 | K41: of:=INDEX([$military_assets.H$1:.H$1048576];[$mil_ass_all.$B41]) -> 1 | L41: of:=INDEX([$military_assets.I$1:.I$1048576];[$mil_ass_all.$B41]) -> USN | M41: of:=INDEX([$military_assets.J$1:.J$1048576];[$mil_ass_all.$B41]) -> Squadron | N41: of:=INDEX([$military_assets.K$1:.K$1048576];[$mil_ass_all.$B41]) -> VTOL
Hidden: Can be played face down.  | O41: of:=INDEX([$military_assets.L$1:.L$1048576];[$mil_ass_all.$B41]) -> Images/harrier.jpg | P41: of:=INDEX([$military_assets.M$1:.M$1048576];[$mil_ass_all.$B41]) -> A Pepsi ad campaign promised to award a Harrier to anyone who collected enough Pepsi points- a promise Pepsi did not keep. During its service history, the Harrier has proven it is more reliable than Pepsi Co. | Q41: of:=INDEX([$military_assets.N$1:.N$1048576];[$mil_ass_all.$B41]) -> 0.0.2
A42: 1 | B42: 16 | C42: Admiral Kuznetsov | D42: of:=INDEX([$military_assets.A$1:.A$1048576];[$mil_ass_all.$B42]) -> Kuznetsov Class CV | E42: of:=INDEX([$military_assets.B$1:.B$1048576];[$mil_ass_all.$B42]) -> 0 | F42: of:=INDEX([$military_assets.C$1:.C$1048576];[$mil_ass_all.$B42]) -> 0 | G42: of:=INDEX([$military_assets.D$1:.D$1048576];[$mil_ass_all.$B42]) -> 0 | H42: of:=INDEX([$military_assets.E$1:.E$1048576];[$mil_ass_all.$B42]) -> 4 | I42: of:=INDEX([$military_assets.F$1:.F$1048576];[$mil_ass_all.$B42]) -> 2 | J42: of:=INDEX([$military_assets.G$1:.G$1048576];[$mil_ass_all.$B42]) -> 2 | K42: of:=INDEX([$military_assets.H$1:.H$1048576];[$mil_ass_all.$B42]) -> 6 | L42: of:=INDEX([$military_assets.I$1:.I$1048576];[$mil_ass_all.$B42]) -> RUS | M42: of:=INDEX([$military_assets.J$1:.J$1048576];[$mil_ass_all.$B42]) -> Ship | N42: of:=INDEX([$military_assets.K$1:.K$1048576];[$mil_ass_all.$B42]) -> STOBAR: Compatible with STOBAR and VTOL squadrons.
Carrier 1: Can station 1 aircraft squadron.
CAP: +2 Help Defense | O42: of:=INDEX([$military_assets.L$1:.L$1048576];[$mil_ass_all.$B42]) -> Images/kuznetsov.jpg | P42: of:=INDEX([$military_assets.M$1:.M$1048576];[$mil_ass_all.$B42]) -> Although sold to a company in Macau supposedly for use as a floating casino, Kuznetsov's sister ship has since unsurprisingly become the first aircraft carrier of the Chinese People's Liberation Army Navy. | Q42: of:=INDEX([$military_assets.N$1:.N$1048576];[$mil_ass_all.$B42]) -> 0.0.2
A43: 1 | B43: 17 | C43: Pyotr Velikiy | D43: of:=INDEX([$military_assets.A$1:.A$1048576];[$mil_ass_all.$B43]) -> Kirov Class CGN | E43: of:=INDEX([$military_assets.B$1:.B$1048576];[$mil_ass_all.$B43]) -> 0 | F43: of:=INDEX([$military_assets.C$1:.C$1048576];[$mil_ass_all.$B43]) -> 0 | G43: of:=INDEX([$military_assets.D$1:.D$1048576];[$mil_ass_all.$B43]) -> 0 | H43: of:=INDEX([$military_assets.E$1:.E$1048576];[$mil_ass_all.$B43]) -> 6 | I43: of:=INDEX([$military_assets.F$1:.F$1048576];[$mil_ass_all.$B43]) -> 2 | J43: of:=INDEX([$military_assets.G$1:.G$1048576];[$mil_ass_all.$B43]) -> 4 | K43: of:=INDEX([$military_assets.H$1:.H$1048576];[$mil_ass_all.$B43]) -> 6 | L43: of:=INDEX([$military_assets.I$1:.I$1048576];[$mil_ass_all.$B43]) -> RUS | M43: of:=INDEX([$military_assets.J$1:.J$1048576];[$mil_ass_all.$B43]) -> Ship | N43: of:=INDEX([$military_assets.K$1:.K$1048576];[$mil_ass_all.$B43]) -> S-300: +1 Help Defense. | O43: of:=INDEX([$military_assets.L$1:.L$1048576];[$mil_ass_all.$B43]) -> Images/kirov.jpg | P43: of:=INDEX([$military_assets.M$1:.M$1048576];[$mil_ass_all.$B43]) -> Since the decommisioning of the last retrofitted WWII-era battleship in 1991, the Kirov has been the largest surface combatant in the world. | Q43: of:=INDEX([$military_assets.N$1:.N$1048576];[$mil_ass_all.$B43]) -> 0.0.2
A44: 1 | B44: 17 | C44: Admiral Nahkimov | D44: of:=INDEX([$military_assets.A$1:.A$1048576];[$mil_ass_all.$B44]) -> Kirov Class CGN | E44: of:=INDEX([$military_assets.B$1:.B$1048576];[$mil_ass_all.$B44]) -> 0 | F44: of:=INDEX([$military_assets.C$1:.C$1048576];[$mil_ass_all.$B44]) -> 0 | G44: of:=INDEX([$military_assets.D$1:.D$1048576];[$mil_ass_all.$B44]) -> 0 | H44: of:=INDEX([$military_assets.E$1:.E$1048576];[$mil_ass_all.$B44]) -> 6 | I44: of:=INDEX([$military_assets.F$1:.F$1048576];[$mil_ass_all.$B44]) -> 2 | J44: of:=INDEX([$military_assets.G$1:.G$1048576];[$mil_ass_all.$B44]) -> 4 | K44: of:=INDEX([$military_assets.H$1:.H$1048576];[$mil_ass_all.$B44]) -> 6 | L44: of:=INDEX([$military_assets.I$1:.I$1048576];[$mil_ass_all.$B44]) -> RUS | M44: of:=INDEX([$military_assets.J$1:.J$1048576];[$mil_ass_all.$B44]) -> Ship | N44: of:=INDEX([$military_assets.K$1:.K$1048576];[$mil_ass_all.$B44]) -> S-300: +1 Help Defense. | O44: of:=INDEX([$military_assets.L$1:.L$1048576];[$mil_ass_all.$B44]) -> Images/kirov.jpg | P44: of:=INDEX([$military_assets.M$1:.M$1048576];[$mil_ass_all.$B44]) -> Since the decommisioning of the last retrofitted WWII-era battleship in 1991, the Kirov has been the largest surface combatant in the world. | Q44: of:=INDEX([$military_assets.N$1:.N$1048576];[$mil_ass_all.$B44]) -> 0.0.2
A45: 1 | B45: 17 | C45: Admiral Ushakov | D45: of:=INDEX([$military_assets.A$1:.A$1048576];[$mil_ass_all.$B45]) -> Kirov Class CGN | E45: of:=INDEX([$military_assets.B$1:.B$1048576];[$mil_ass_all.$B45]) -> 0 | F45: of:=INDEX([$military_assets.C$1:.C$1048576];[$mil_ass_all.$B45]) -> 0 | G45: of:=INDEX([$military_assets.D$1:.D$1048576];[$mil_ass_all.$B45]) -> 0 | H45: of:=INDEX([$military_assets.E$1:.E$1048576];[$mil_ass_all.$B45]) -> 6 | I45: of:=INDEX([$military_assets.F$1:.F$1048576];[$mil_ass_all.$B45]) -> 2 | J45: of:=INDEX([$military_assets.G$1:.G$1048576];[$mil_ass_all.$B45]) -> 4 | K45: of:=INDEX([$military_assets.H$1:.H$1048576];[$mil_ass_all.$B45]) -> 6 | L45: of:=INDEX([$military_assets.I$1:.I$1048576];[$mil_ass_all.$B45]) -> RUS | M45: of:=INDEX([$military_assets.J$1:.J$1048576];[$mil_ass_all.$B45]) -> Ship | N45: of:=INDEX([$military_assets.K$1:.K$1048576];[$mil_ass_all.$B45]) -> S-300: +1 Help Defense. | O45: of:=INDEX([$military_assets.L$1:.L$1048576];[$mil_ass_all.$B45]) -> Images/kirov.jpg | P45: of:=INDEX([$military_assets.M$1:.M$1048576];[$mil_ass_all.$B45]) -> Since the decommisioning of the last retrofitted WWII-era battleship in 1991, the Kirov has been the largest surface combatant in the world. | Q45: of:=INDEX([$military_assets.N$1:.N$1048576];[$mil_ass_all.$B45]) -> 0.0.2
A46: 1 | B46: 18 | C46: Marshal Ustinov | D46: of:=INDEX([$military_assets.A$1:.A$1048576];[$mil_ass_all.$B46]) -> Slava Class CG | E46: of:=INDEX([$military_assets.B$1:.B$1048576];[$mil_ass_all.$B46]) -> 0 | F46: of:=INDEX([$military_assets.C$1:.C$1048576];[$mil_ass_all.$B46]) -> 0 | G46: of:=INDEX([$military_assets.D$1:.D$1048576];[$mil_ass_all.$B46]) -> 0 | H46: of:=INDEX([$military_assets.E$1:.E$1048576];[$mil_ass_all.$B46]) -> 4 | I46: of:=INDEX([$military_assets.F$1:.F$1048576];[$mil_ass_all.$B46]) -> 2 | J46: of:=INDEX([$military_assets.G$1:.G$1048576];[$mil_ass_all.$B46]) -> 2 | K46: of:=INDEX([$military_assets.H$1:.H$1048576];[$mil_ass_all.$B46]) -> 3 | L46: of:=INDEX([$military_assets.I$1:.I$1048576];[$mil_ass_all.$B46]) -> RUS | M46: of:=INDEX([$military_assets.J$1:.J$1048576];[$mil_ass_all.$B46]) -> Ship | N46: of:=INDEX([$military_assets.K$1:.K$1048576];[$mil_ass_all.$B46]) -> S-300: +1 Help Defense. | O46: of:=INDEX([$military_assets.L$1:.L$1048576];[$mil_ass_all.$B46]) -> Images/slava.jpg | P46: of:=INDEX([$military_assets.M$1:.M$1048576];[$mil_ass_all.$B46]) -> Equipped with the same massive anti-ship missiles as the Kirov class, the Slava packs a similar punch in a considerably smaller form-factor. | Q46: of:=INDEX([$military_assets.N$1:.N$1048576];[$mil_ass_all.$B46]) -> 0.0.2
A47: 1 | B47: 18 | C47: Moskva | D47: of:=INDEX([$military_assets.A$1:.A$1048576];[$mil_ass_all.$B47]) -> Slava Class CG | E47: of:=INDEX([$military_assets.B$1:.B$1048576];[$mil_ass_all.$B47]) -> 0 | F47: of:=INDEX([$military_assets.C$1:.C$1048576];[$mil_ass_all.$B47]) -> 0 | G47: of:=INDEX([$military_assets.D$1:.D$1048576];[$mil_ass_all.$B47]) -> 0 | H47: of:=INDEX([$military_assets.E$1:.E$1048576];[$mil_ass_all.$B47]) -> 4 | I47: of:=INDEX([$military_assets.F$1:.F$1048576];[$mil_ass_all.$B47]) -> 2 | J47: of:=INDEX([$military_assets.G$1:.G$1048576];[$mil_ass_all.$B47]) -> 2 | K47: of:=INDEX([$military_assets.H$1:.H$1048576];[$mil_ass_all.$B47]) -> 3 | L47: of:=INDEX([$military_assets.I$1:.I$1048576];[$mil_ass_all.$B47]) -> RUS | M47: of:=INDEX([$military_assets.J$1:.J$1048576];[$mil_ass_all.$B47]) -> Ship | N47: of:=INDEX([$military_assets.K$1:.K$1048576];[$mil_ass_all.$B47]) -> S-300: +1 Help Defense. | O47: of:=INDEX([$military_assets.L$1:.L$1048576];[$mil_ass_all.$B47]) -> Images/slava.jpg | P47: of:=INDEX([$military_assets.M$1:.M$1048576];[$mil_ass_all.$B47]) -> Equipped with the same massive anti-ship missiles as the Kirov class, the Slava packs a similar punch in a considerably smaller form-factor. | Q47: of:=INDEX([$military_assets.N$1:.N$1048576];[$mil_ass_all.$B47]) -> 0.0.2
A48: 1 | B48: 18 | C48: Varyag | D48: of:=INDEX([$military_assets.A$1:.A$1048576];[$mil_ass_all.$B48]) -> Slava Class CG | E48: of:=INDEX([$military_assets.B$1:.B$1048576];[$mil_ass_all.$B48]) -> 0 | F48: of:=INDEX([$military_assets.C$1:.C$1048576];[$mil_ass_all.$B48]) -> 0 | G48: of:=INDEX([$military_assets.D$1:.D$1048576];[$mil_ass_all.$B48]) -> 0 | H48: of:=INDEX([$military_assets.E$1:.E$1048576];[$mil_ass_all.$B48]) -> 4 | I48: of:=INDEX([$military_assets.F$1:.F$1048576];[$mil_ass_all.$B48]) -> 2 | J48: of:=INDEX([$military_assets.G$1:.G$1048576];[$mil_ass_all.$B48]) -> 2 | K48: of:=INDEX([$military_assets.H$1:.H$1048576];[$mil_ass_all.$B48]) -> 3 | L48: of:=INDEX([$military_assets.I$1:.I$1048576];[$mil_ass_all.$B48]) -> RUS | M48: of:=INDEX([$military_assets.J$1:.J$1048576];[$mil_ass_all.$B48]) -> Ship | N48: of:=INDEX([$military_assets.K$1:.K$1048576];[$mil_ass_all.$B48]) -> S-300: +1 Help Defense. | O48: of:=INDEX([$military_assets.L$1:.L$1048576];[$mil_ass_all.$B48]) -> Images/slava.jpg | P48: of:=INDEX([$military_assets.M$1:.M$1048576];[$mil_ass_all.$B48]) -> Equipped with the same massive anti-ship missiles as the Kirov class, the Slava packs a similar punch in a considerably smaller form-factor. | Q48: of:=INDEX([$military_assets.N$1:.N$1048576];[$mil_ass_all.$B48]) -> 0.0.2
A49: 1 | B49: 18 | C49: Sevastopol | D49: of:=INDEX([$military_assets.A$1:.A$1048576];[$mil_ass_all.$B49]) -> Slava Class CG | E49: of:=INDEX([$military_assets.B$1:.B$1048576];[$mil_ass_all.$B49]) -> 0 | F49: of:=INDEX([$military_assets.C$1:.C$1048576];[$mil_ass_all.$B49]) -> 0 | G49: of:=INDEX([$military_assets.D$1:.D$1048576];[$mil_ass_all.$B49]) -> 0 | H49: of:=INDEX([$military_assets.E$1:.E$1048576];[$mil_ass_all.$B49]) -> 4 | I49: of:=INDEX([$military_assets.F$1:.F$1048576];[$mil_ass_all.$B49]) -> 2 | J49: of:=INDEX([$military_assets.G$1:.G$1048576];[$mil_ass_all.$B49]) -> 2 | K49: of:=INDEX([$military_assets.H$1:.H$1048576];[$mil_ass_all.$B49]) -> 3 | L49: of:=INDEX([$military_assets.I$1:.I$1048576];[$mil_ass_all.$B49]) -> RUS | M49: of:=INDEX([$military_assets.J$1:.J$1048576];[$mil_ass_all.$B49]) -> Ship | N49: of:=INDEX([$military_assets.K$1:.K$1048576];[$mil_ass_all.$B49]) -> S-300: +1 Help Defense. | O49: of:=INDEX([$military_assets.L$1:.L$1048576];[$mil_ass_all.$B49]) -> Images/slava.jpg | P49: of:=INDEX([$military_assets.M$1:.M$1048576];[$mil_ass_all.$B49]) -> Equipped with the same massive anti-ship missiles as the Kirov class, the Slava packs a similar punch in a considerably smaller form-factor. | Q49: of:=INDEX([$military_assets.N$1:.N$1048576];[$mil_ass_all.$B49]) -> 0.0.2
A50: 1 | B50: 19 | C50: Admiral Chabenenko | D50: of:=INDEX([$military_assets.A$1:.A$1048576];[$mil_ass_all.$B50]) -> Udaloy II Class DDG | E50: of:=INDEX([$military_assets.B$1:.B$1048576];[$mil_ass_all.$B50]) -> 0 | F50: of:=INDEX([$military_assets.C$1:.C$1048576];[$mil_ass_all.$B50]) -> 0 | G50: of:=INDEX([$military_assets.D$1:.D$1048576];[$mil_ass_all.$B50]) -> 0 | H50: of:=INDEX([$military_assets.E$1:.E$1048576];[$mil_ass_all.$B50]) -> 3 | I50: of:=INDEX([$military_assets.F$1:.F$1048576];[$mil_ass_all.$B50]) -> 2 | J50: of:=INDEX([$military_assets.G$1:.G$1048576];[$mil_ass_all.$B50]) -> 3 | K50: of:=INDEX([$military_assets.H$1:.H$1048576];[$mil_ass_all.$B50]) -> 2 | L50: of:=INDEX([$military_assets.I$1:.I$1048576];[$mil_ass_all.$B50]) -> RUS | M50: of:=INDEX([$military_assets.J$1:.J$1048576];[$mil_ass_all.$B50]) -> Ship | N50: of:=INDEX([$military_assets.K$1:.K$1048576];[$mil_ass_all.$B50]) -> 
 | O50: of:=INDEX([$military_assets.L$1:.L$1048576];[$mil_ass_all.$B50]) -> Images/udaloy.jpg | P50: of:=INDEX([$military_assets.M$1:.M$1048576];[$mil_ass_all.$B50]) -> Udaloy II: the ship so nice they designed it twice. | Q50: of:=INDEX([$military_assets.N$1:.N$1048576];[$mil_ass_all.$B50]) -> 0.0.2
A51: 1 | B51: 19 | C51: Admiral Panteleyev | D51: of:=INDEX([$military_assets.A$1:.A$1048576];[$mil_ass_all.$B51]) -> Udaloy II Class DDG | E51: of:=INDEX([$military_assets.B$1:.B$1048576];[$mil_ass_all.$B51]) -> 0 | F51: of:=INDEX([$military_assets.C$1:.C$1048576];[$mil_ass_all.$B51]) -> 0 | G51: of:=INDEX([$military_assets.D$1:.D$1048576];[$mil_ass_all.$B51]) -> 0 | H51: of:=INDEX([$military_assets.E$1:.E$1048576];[$mil_ass_all.$B51]) -> 3 | I51: of:=INDEX([$military_assets.F$1:.F$1048576];[$mil_ass_all.$B51]) -> 2 | J51: of:=INDEX([$military_assets.G$1:.G$1048576];[$mil_ass_all.$B51]) -> 3 | K51: of:=INDEX([$military_assets.H$1:.H$1048576];[$mil_ass_all.$B51]) -> 2 | L51: of:=INDEX([$military_assets.I$1:.I$1048576];[$mil_ass_all.$B51]) -> RUS | M51: of:=INDEX([$military_assets.J$1:.J$1048576];[$mil_ass_all.$B51]) -> Ship | N51: of:=INDEX([$military_assets.K$1:.K$1048576];[$mil_ass_all.$B51]) -> 
 | O51: of:=INDEX([$military_assets.L$1:.L$1048576];[$mil_ass_all.$B51]) -> Images/udaloy.jpg | P51: of:=INDEX([$military_assets.M$1:.M$1048576];[$mil_ass_all.$B51]) -> Udaloy II: the ship so nice they designed it twice. | Q51: of:=INDEX([$military_assets.N$1:.N$1048576];[$mil_ass_all.$B51]) -> 0.0.2
A52: 1 | B52: 19 | C52: Admiral Levchenko | D52: of:=INDEX([$military_assets.A$1:.A$1048576];[$mil_ass_all.$B52]) -> Udaloy II Class DDG | E52: of:=INDEX([$military_assets.B$1:.B$1048576];[$mil_ass_all.$B52]) -> 0 | F52: of:=INDEX([$military_assets.C$1:.C$1048576];[$mil_ass_all.$B52]) -> 0 | G52: of:=INDEX([$military_assets.D$1:.D$1048576];[$mil_ass_all.$B52]) -> 0 | H52: of:=INDEX([$military_assets.E$1:.E$1048576];[$mil_ass_all.$B52]) -> 3 | I52: of:=INDEX([$military_assets.F$1:.F$1048576];[$mil_ass_all.$B52]) -> 2 | J52: of:=INDEX([$military_assets.G$1:.G$1048576];[$mil_ass_all.$B52]) -> 3 | K52: of:=INDEX([$military_assets.H$1:.H$1048576];[$mil_ass_all.$B52]) -> 2 | L52: of:=INDEX([$military_assets.I$1:.I$1048576];[$mil_ass_all.$B52]) -> RUS | M52: of:=INDEX([$military_assets.J$1:.J$1048576];[$mil_ass_all.$B52]) -> Ship | N52: of:=INDEX([$military_assets.K$1:.K$1048576];[$mil_ass_all.$B52]) -> 
 | O52: of:=INDEX([$military_assets.L$1:.L$1048576];[$mil_ass_all.$B52]) -> Images/udaloy.jpg | P52: of:=INDEX([$military_assets.M$1:.M$1048576];[$mil_ass_all.$B52]) -> Udaloy II: the ship so nice they designed it twice. | Q52: of:=INDEX([$military_assets.N$1:.N$1048576];[$mil_ass_all.$B52]) -> 0.0.2
A53: 1 | B53: 19 | C53: Admiral Vinogradov | D53: of:=INDEX([$military_assets.A$1:.A$1048576];[$mil_ass_all.$B53]) -> Udaloy II Class DDG | E53: of:=INDEX([$military_assets.B$1:.B$1048576];[$mil_ass_all.$B53]) -> 0 | F53: of:=INDEX([$military_assets.C$1:.C$1048576];[$mil_ass_all.$B53]) -> 0 | G53: of:=INDEX([$military_assets.D$1:.D$1048576];[$mil_ass_all.$B53]) -> 0 | H53: of:=INDEX([$military_assets.E$1:.E$1048576];[$mil_ass_all.$B53]) -> 3 | I53: of:=INDEX([$military_assets.F$1:.F$1048576];[$mil_ass_all.$B53]) -> 2 | J53: of:=INDEX([$military_assets.G$1:.G$1048576];[$mil_ass_all.$B53]) -> 3 | K53: of:=INDEX([$military_assets.H$1:.H$1048576];[$mil_ass_all.$B53]) -> 2 | L53: of:=INDEX([$military_assets.I$1:.I$1048576];[$mil_ass_all.$B53]) -> RUS | M53: of:=INDEX([$military_assets.J$1:.J$1048576];[$mil_ass_all.$B53]) -> Ship | N53: of:=INDEX([$military_assets.K$1:.K$1048576];[$mil_ass_all.$B53]) -> 
 | O53: of:=INDEX([$military_assets.L$1:.L$1048576];[$mil_ass_all.$B53]) -> Images/udaloy.jpg | P53: of:=INDEX([$military_assets.M$1:.M$1048576];[$mil_ass_all.$B53]) -> Udaloy II: the ship so nice they designed it twice. | Q53: of:=INDEX([$military_assets.N$1:.N$1048576];[$mil_ass_all.$B53]) -> 0.0.2
A54: 1 | B54: 19 | C54: Severomorsk | D54: of:=INDEX([$military_assets.A$1:.A$1048576];[$mil_ass_all.$B54]) -> Udaloy II Class DDG | E54: of:=INDEX([$military_assets.B$1:.B$1048576];[$mil_ass_all.$B54]) -> 0 | F54: of:=INDEX([$military_assets.C$1:.C$1048576];[$mil_ass_all.$B54]) -> 0 | G54: of:=INDEX([$military_assets.D$1:.D$1048576];[$mil_ass_all.$B54]) -> 0 | H54: of:=INDEX([$military_assets.E$1:.E$1048576];[$mil_ass_all.$B54]) -> 3 | I54: of:=INDEX([$military_assets.F$1:.F$1048576];[$mil_ass_all.$B54]) -> 2 | J54: of:=INDEX([$military_assets.G$1:.G$1048576];[$mil_ass_all.$B54]) -> 3 | K54: of:=INDEX([$military_assets.H$1:.H$1048576];[$mil_ass_all.$B54]) -> 2 | L54: of:=INDEX([$military_assets.I$1:.I$1048576];[$mil_ass_all.$B54]) -> RUS | M54: of:=INDEX([$military_assets.J$1:.J$1048576];[$mil_ass_all.$B54]) -> Ship | N54: of:=INDEX([$military_assets.K$1:.K$1048576];[$mil_ass_all.$B54]) -> 
 | O54: of:=INDEX([$military_assets.L$1:.L$1048576];[$mil_ass_all.$B54]) -> Images/udaloy.jpg | P54: of:=INDEX([$military_assets.M$1:.M$1048576];[$mil_ass_all.$B54]) -> Udaloy II: the ship so nice they designed it twice. | Q54: of:=INDEX([$military_assets.N$1:.N$1048576];[$mil_ass_all.$B54]) -> 0.0.2
A55: 1 | B55: 19 | C55: Admiral Shaposhnikov | D55: of:=INDEX([$military_assets.A$1:.A$1048576];[$mil_ass_all.$B55]) -> Udaloy II Class DDG | E55: of:=INDEX([$military_assets.B$1:.B$1048576];[$mil_ass_all.$B55]) -> 0 | F55: of:=INDEX([$military_assets.C$1:.C$1048576];[$mil_ass_all.$B55]) -> 0 | G55: of:=INDEX([$military_assets.D$1:.D$1048576];[$mil_ass_all.$B55]) -> 0 | H55: of:=INDEX([$military_assets.E$1:.E$1048576];[$mil_ass_all.$B55]) -> 3 | I55: of:=INDEX([$military_assets.F$1:.F$1048576];[$mil_ass_all.$B55]) -> 2 | J55: of:=INDEX([$military_assets.G$1:.G$1048576];[$mil_ass_all.$B55]) -> 3 | K55: of:=INDEX([$military_assets.H$1:.H$1048576];[$mil_ass_all.$B55]) -> 2 | L55: of:=INDEX([$military_assets.I$1:.I$1048576];[$mil_ass_all.$B55]) -> RUS | M55: of:=INDEX([$military_assets.J$1:.J$1048576];[$mil_ass_all.$B55]) -> Ship | N55: of:=INDEX([$military_assets.K$1:.K$1048576];[$mil_ass_all.$B55]) -> 
 | O55: of:=INDEX([$military_assets.L$1:.L$1048576];[$mil_ass_all.$B55]) -> Images/udaloy.jpg | P55: of:=INDEX([$military_assets.M$1:.M$1048576];[$mil_ass_all.$B55]) -> Udaloy II: the ship so nice they designed it twice. | Q55: of:=INDEX([$military_assets.N$1:.N$1048576];[$mil_ass_all.$B55]) -> 0.0.2
A56: 1 | B56: 28 | C56: Bystryy | D56: of:=INDEX([$military_assets.A$1:.A$1048576];[$mil_ass_all.$B56]) -> Sovremanny Class DDG | E56: of:=INDEX([$military_assets.B$1:.B$1048576];[$mil_ass_all.$B56]) -> 0 | F56: of:=INDEX([$military_assets.C$1:.C$1048576];[$mil_ass_all.$B56]) -> 0 | G56: of:=INDEX([$military_assets.D$1:.D$1048576];[$mil_ass_all.$B56]) -> 0 | H56: of:=INDEX([$military_assets.E$1:.E$1048576];[$mil_ass_all.$B56]) -> 2 | I56: of:=INDEX([$military_assets.F$1:.F$1048576];[$mil_ass_all.$B56]) -> 0 | J56: of:=INDEX([$military_assets.G$1:.G$1048576];[$mil_ass_all.$B56]) -> 2 | K56: of:=INDEX([$military_assets.H$1:.H$1048576];[$mil_ass_all.$B56]) -> 1 | L56: of:=INDEX([$military_assets.I$1:.I$1048576];[$mil_ass_all.$B56]) -> RUS | M56: of:=INDEX([$military_assets.J$1:.J$1048576];[$mil_ass_all.$B56]) -> Ship | N56: of:=INDEX([$military_assets.K$1:.K$1048576];[$mil_ass_all.$B56]) -> 
 | O56: of:=INDEX([$military_assets.L$1:.L$1048576];[$mil_ass_all.$B56]) -> Images/sovremenny.jpg | P56: of:=INDEX([$military_assets.M$1:.M$1048576];[$mil_ass_all.$B56]) -> Despite a name that means "modern" in Russian, they are the oldest class of destroyer in the Russian Navy. | Q56: of:=INDEX([$military_assets.N$1:.N$1048576];[$mil_ass_all.$B56]) -> 0.0.2
A57: 1 | B57: 28 | C57: Nastoychivyy | D57: of:=INDEX([$military_assets.A$1:.A$1048576];[$mil_ass_all.$B57]) -> Sovremanny Class DDG | E57: of:=INDEX([$military_assets.B$1:.B$1048576];[$mil_ass_all.$B57]) -> 0 | F57: of:=INDEX([$military_assets.C$1:.C$1048576];[$mil_ass_all.$B57]) -> 0 | G57: of:=INDEX([$military_assets.D$1:.D$1048576];[$mil_ass_all.$B57]) -> 0 | H57: of:=INDEX([$military_assets.E$1:.E$1048576];[$mil_ass_all.$B57]) -> 2 | I57: of:=INDEX([$military_assets.F$1:.F$1048576];[$mil_ass_all.$B57]) -> 0 | J57: of:=INDEX([$military_assets.G$1:.G$1048576];[$mil_ass_all.$B57]) -> 2 | K57: of:=INDEX([$military_assets.H$1:.H$1048576];[$mil_ass_all.$B57]) -> 1 | L57: of:=INDEX([$military_assets.I$1:.I$1048576];[$mil_ass_all.$B57]) -> RUS | M57: of:=INDEX([$military_assets.J$1:.J$1048576];[$mil_ass_all.$B57]) -> Ship | N57: of:=INDEX([$military_assets.K$1:.K$1048576];[$mil_ass_all.$B57]) -> 
 | O57: of:=INDEX([$military_assets.L$1:.L$1048576];[$mil_ass_all.$B57]) -> Images/sovremenny.jpg | P57: of:=INDEX([$military_assets.M$1:.M$1048576];[$mil_ass_all.$B57]) -> Despite a name that means "modern" in Russian, they are the oldest class of destroyer in the Russian Navy. | Q57: of:=INDEX([$military_assets.N$1:.N$1048576];[$mil_ass_all.$B57]) -> 0.0.2
A58: 1 | B58: 28 | C58: Admiral Ushakov | D58: of:=INDEX([$military_assets.A$1:.A$1048576];[$mil_ass_all.$B58]) -> Sovremanny Class DDG | E58: of:=INDEX([$military_assets.B$1:.B$1048576];[$mil_ass_all.$B58]) -> 0 | F58: of:=INDEX([$military_assets.C$1:.C$1048576];[$mil_ass_all.$B58]) -> 0 | G58: of:=INDEX([$military_assets.D$1:.D$1048576];[$mil_ass_all.$B58]) -> 0 | H58: of:=INDEX([$military_assets.E$1:.E$1048576];[$mil_ass_all.$B58]) -> 2 | I58: of:=INDEX([$military_assets.F$1:.F$1048576];[$mil_ass_all.$B58]) -> 0 | J58: of:=INDEX([$military_assets.G$1:.G$1048576];[$mil_ass_all.$B58]) -> 2 | K58: of:=INDEX([$military_assets.H$1:.H$1048576];[$mil_ass_all.$B58]) -> 1 | L58: of:=INDEX([$military_assets.I$1:.I$1048576];[$mil_ass_all.$B58]) -> RUS | M58: of:=INDEX([$military_assets.J$1:.J$1048576];[$mil_ass_all.$B58]) -> Ship | N58: of:=INDEX([$military_assets.K$1:.K$1048576];[$mil_ass_all.$B58]) -> 
 | O58: of:=INDEX([$military_assets.L$1:.L$1048576];[$mil_ass_all.$B58]) -> Images/sovremenny.jpg | P58: of:=INDEX([$military_assets.M$1:.M$1048576];[$mil_ass_all.$B58]) -> Despite a name that means "modern" in Russian, they are the oldest class of destroyer in the Russian Navy. | Q58: of:=INDEX([$military_assets.N$1:.N$1048576];[$mil_ass_all.$B58]) -> 0.0.2
A59: 1 | B59: 28 | C59: Burnyy | D59: of:=INDEX([$military_assets.A$1:.A$1048576];[$mil_ass_all.$B59]) -> Sovremanny Class DDG | E59: of:=INDEX([$military_assets.B$1:.B$1048576];[$mil_ass_all.$B59]) -> 0 | F59: of:=INDEX([$military_assets.C$1:.C$1048576];[$mil_ass_all.$B59]) -> 0 | G59: of:=INDEX([$military_assets.D$1:.D$1048576];[$mil_ass_all.$B59]) -> 0 | H59: of:=INDEX([$military_assets.E$1:.E$1048576];[$mil_ass_all.$B59]) -> 2 | I59: of:=INDEX([$military_assets.F$1:.F$1048576];[$mil_ass_all.$B59]) -> 0 | J59: of:=INDEX([$military_assets.G$1:.G$1048576];[$mil_ass_all.$B59]) -> 2 | K59: of:=INDEX([$military_assets.H$1:.H$1048576];[$mil_ass_all.$B59]) -> 1 | L59: of:=INDEX([$military_assets.I$1:.I$1048576];[$mil_ass_all.$B59]) -> RUS | M59: of:=INDEX([$military_assets.J$1:.J$1048576];[$mil_ass_all.$B59]) -> Ship | N59: of:=INDEX([$military_assets.K$1:.K$1048576];[$mil_ass_all.$B59]) -> 
 | O59: of:=INDEX([$military_assets.L$1:.L$1048576];[$mil_ass_all.$B59]) -> Images/sovremenny.jpg | P59: of:=INDEX([$military_assets.M$1:.M$1048576];[$mil_ass_all.$B59]) -> Despite a name that means "modern" in Russian, they are the oldest class of destroyer in the Russian Navy. | Q59: of:=INDEX([$military_assets.N$1:.N$1048576];[$mil_ass_all.$B59]) -> 0.0.2
A60: 1 | B60: 20 | C60: Admiral Kasatanov | D60: of:=INDEX([$military_assets.A$1:.A$1048576];[$mil_ass_all.$B60]) -> Gorshkov Class FFG | E60: of:=INDEX([$military_assets.B$1:.B$1048576];[$mil_ass_all.$B60]) -> 0 | F60: of:=INDEX([$military_assets.C$1:.C$1048576];[$mil_ass_all.$B60]) -> 0 | G60: of:=INDEX([$military_assets.D$1:.D$1048576];[$mil_ass_all.$B60]) -> 0 | H60: of:=INDEX([$military_assets.E$1:.E$1048576];[$mil_ass_all.$B60]) -> 3 | I60: of:=INDEX([$military_assets.F$1:.F$1048576];[$mil_ass_all.$B60]) -> 2 | J60: of:=INDEX([$military_assets.G$1:.G$1048576];[$mil_ass_all.$B60]) -> 2 | K60: of:=INDEX([$military_assets.H$1:.H$1048576];[$mil_ass_all.$B60]) -> 2 | L60: of:=INDEX([$military_assets.I$1:.I$1048576];[$mil_ass_all.$B60]) -> RUS | M60: of:=INDEX([$military_assets.J$1:.J$1048576];[$mil_ass_all.$B60]) -> Ship | N60: of:=INDEX([$military_assets.K$1:.K$1048576];[$mil_ass_all.$B60]) -> Hidden: Can be played face down.  | O60: of:=INDEX([$military_assets.L$1:.L$1048576];[$mil_ass_all.$B60]) -> Images/gorshkov.jpg | P60: of:=INDEX([$military_assets.M$1:.M$1048576];[$mil_ass_all.$B60]) -> The cutting-edge Gorshkov frigates stick out in the largely-outdated Russian surface warfare fleet. | Q60: of:=INDEX([$military_assets.N$1:.N$1048576];[$mil_ass_all.$B60]) -> 0.0.2
A61: 1 | B61: 20 | C61: Admiral Gorshkov | D61: of:=INDEX([$military_assets.A$1:.A$1048576];[$mil_ass_all.$B61]) -> Gorshkov Class FFG | E61: of:=INDEX([$military_assets.B$1:.B$1048576];[$mil_ass_all.$B61]) -> 0 | F61: of:=INDEX([$military_assets.C$1:.C$1048576];[$mil_ass_all.$B61]) -> 0 | G61: of:=INDEX([$military_assets.D$1:.D$1048576];[$mil_ass_all.$B61]) -> 0 | H61: of:=INDEX([$military_assets.E$1:.E$1048576];[$mil_ass_all.$B61]) -> 3 | I61: of:=INDEX([$military_assets.F$1:.F$1048576];[$mil_ass_all.$B61]) -> 2 | J61: of:=INDEX([$military_assets.G$1:.G$1048576];[$mil_ass_all.$B61]) -> 2 | K61: of:=INDEX([$military_assets.H$1:.H$1048576];[$mil_ass_all.$B61]) -> 2 | L61: of:=INDEX([$military_assets.I$1:.I$1048576];[$mil_ass_all.$B61]) -> RUS | M61: of:=INDEX([$military_assets.J$1:.J$1048576];[$mil_ass_all.$B61]) -> Ship | N61: of:=INDEX([$military_assets.K$1:.K$1048576];[$mil_ass_all.$B61]) -> Hidden: Can be played face down.  | O61: of:=INDEX([$military_assets.L$1:.L$1048576];[$mil_ass_all.$B61]) -> Images/gorshkov.jpg | P61: of:=INDEX([$military_assets.M$1:.M$1048576];[$mil_ass_all.$B61]) -> The cutting-edge Gorshkov frigates stick out in the largely-outdated Russian surface warfare fleet. | Q61: of:=INDEX([$military_assets.N$1:.N$1048576];[$mil_ass_all.$B61]) -> 0.0.2
A62: 1 | B62: 21 | C62: Novosibirsk | D62: of:=INDEX([$military_assets.A$1:.A$1048576];[$mil_ass_all.$B62]) -> Yasen Class SSGN | E62: of:=INDEX([$military_assets.B$1:.B$1048576];[$mil_ass_all.$B62]) -> 0 | F62: of:=INDEX([$military_assets.C$1:.C$1048576];[$mil_ass_all.$B62]) -> 0 | G62: of:=INDEX([$military_assets.D$1:.D$1048576];[$mil_ass_all.$B62]) -> 0 | H62: of:=INDEX([$military_assets.E$1:.E$1048576];[$mil_ass_all.$B62]) -> 5 | I62: of:=INDEX([$military_assets.F$1:.F$1048576];[$mil_ass_all.$B62]) -> 0 | J62: of:=INDEX([$military_assets.G$1:.G$1048576];[$mil_ass_all.$B62]) -> 3 | K62: of:=INDEX([$military_assets.H$1:.H$1048576];[$mil_ass_all.$B62]) -> 5 | L62: of:=INDEX([$military_assets.I$1:.I$1048576];[$mil_ass_all.$B62]) -> RUS | M62: of:=INDEX([$military_assets.J$1:.J$1048576];[$mil_ass_all.$B62]) -> Submarine | N62: of:=INDEX([$military_assets.K$1:.K$1048576];[$mil_ass_all.$B62]) -> Hidden: Can be played face down. 
Surprise Attacker: This asset deals damage during the Surprise Damage Step.
Commerce Raider: When sieging a player directly, this military asset's siege is equal to its attack. | O62: of:=INDEX([$military_assets.L$1:.L$1048576];[$mil_ass_all.$B62]) -> Images/yasen.jpg | P62: of:=INDEX([$military_assets.M$1:.M$1048576];[$mil_ass_all.$B62]) -> With more than twice the firepower of western submarines, the Yasen is Russia's best effort in no-expense-spared attack submarine development. | Q62: of:=INDEX([$military_assets.N$1:.N$1048576];[$mil_ass_all.$B62]) -> 0.0.2
A63: 1 | B63: 21 | C63: Severodvinsk | D63: of:=INDEX([$military_assets.A$1:.A$1048576];[$mil_ass_all.$B63]) -> Yasen Class SSGN | E63: of:=INDEX([$military_assets.B$1:.B$1048576];[$mil_ass_all.$B63]) -> 0 | F63: of:=INDEX([$military_assets.C$1:.C$1048576];[$mil_ass_all.$B63]) -> 0 | G63: of:=INDEX([$military_assets.D$1:.D$1048576];[$mil_ass_all.$B63]) -> 0 | H63: of:=INDEX([$military_assets.E$1:.E$1048576];[$mil_ass_all.$B63]) -> 5 | I63: of:=INDEX([$military_assets.F$1:.F$1048576];[$mil_ass_all.$B63]) -> 0 | J63: of:=INDEX([$military_assets.G$1:.G$1048576];[$mil_ass_all.$B63]) -> 3 | K63: of:=INDEX([$military_assets.H$1:.H$1048576];[$mil_ass_all.$B63]) -> 5 | L63: of:=INDEX([$military_assets.I$1:.I$1048576];[$mil_ass_all.$B63]) -> RUS | M63: of:=INDEX([$military_assets.J$1:.J$1048576];[$mil_ass_all.$B63]) -> Submarine | N63: of:=INDEX([$military_assets.K$1:.K$1048576];[$mil_ass_all.$B63]) -> Hidden: Can be played face down. 
Surprise Attacker: This asset deals damage during the Surprise Damage Step.
Commerce Raider: When sieging a player directly, this military asset's siege is equal to its attack. | O63: of:=INDEX([$military_assets.L$1:.L$1048576];[$mil_ass_all.$B63]) -> Images/yasen.jpg | P63: of:=INDEX([$military_assets.M$1:.M$1048576];[$mil_ass_all.$B63]) -> With more than twice the firepower of western submarines, the Yasen is Russia's best effort in no-expense-spared attack submarine development. | Q63: of:=INDEX([$military_assets.N$1:.N$1048576];[$mil_ass_all.$B63]) -> 0.0.2
A64: 1 | B64: 21 | C64: Kazan | D64: of:=INDEX([$military_assets.A$1:.A$1048576];[$mil_ass_all.$B64]) -> Yasen Class SSGN | E64: of:=INDEX([$military_assets.B$1:.B$1048576];[$mil_ass_all.$B64]) -> 0 | F64: of:=INDEX([$military_assets.C$1:.C$1048576];[$mil_ass_all.$B64]) -> 0 | G64: of:=INDEX([$military_assets.D$1:.D$1048576];[$mil_ass_all.$B64]) -> 0 | H64: of:=INDEX([$military_assets.E$1:.E$1048576];[$mil_ass_all.$B64]) -> 5 | I64: of:=INDEX([$military_assets.F$1:.F$1048576];[$mil_ass_all.$B64]) -> 0 | J64: of:=INDEX([$military_assets.G$1:.G$1048576];[$mil_ass_all.$B64]) -> 3 | K64: of:=INDEX([$military_assets.H$1:.H$1048576];[$mil_ass_all.$B64]) -> 5 | L64: of:=INDEX([$military_assets.I$1:.I$1048576];[$mil_ass_all.$B64]) -> RUS | M64: of:=INDEX([$military_assets.J$1:.J$1048576];[$mil_ass_all.$B64]) -> Submarine | N64: of:=INDEX([$military_assets.K$1:.K$1048576];[$mil_ass_all.$B64]) -> Hidden: Can be played face down. 
Surprise Attacker: This asset deals damage during the Surprise Damage Step.
Commerce Raider: When sieging a player directly, this military asset's siege is equal to its attack. | O64: of:=INDEX([$military_assets.L$1:.L$1048576];[$mil_ass_all.$B64]) -> Images/yasen.jpg | P64: of:=INDEX([$military_assets.M$1:.M$1048576];[$mil_ass_all.$B64]) -> With more than twice the firepower of western submarines, the Yasen is Russia's best effort in no-expense-spared attack submarine development. | Q64: of:=INDEX([$military_assets.N$1:.N$1048576];[$mil_ass_all.$B64]) -> 0.0.2
A65: 1 | B65: 23 | C65: Tver | D65: of:=INDEX([$military_assets.A$1:.A$1048576];[$mil_ass_all.$B65]) -> Oscar II Class SSGN | E65: of:=INDEX([$military_assets.B$1:.B$1048576];[$mil_ass_all.$B65]) -> 0 | F65: of:=INDEX([$military_assets.C$1:.C$1048576];[$mil_ass_all.$B65]) -> 0 | G65: of:=INDEX([$military_assets.D$1:.D$1048576];[$mil_ass_all.$B65]) -> 0 | H65: of:=INDEX([$military_assets.E$1:.E$1048576];[$mil_ass_all.$B65]) -> 4 | I65: of:=INDEX([$military_assets.F$1:.F$1048576];[$mil_ass_all.$B65]) -> 0 | J65: of:=INDEX([$military_assets.G$1:.G$1048576];[$mil_ass_all.$B65]) -> 1 | K65: of:=INDEX([$military_assets.H$1:.H$1048576];[$mil_ass_all.$B65]) -> 3 | L65: of:=INDEX([$military_assets.I$1:.I$1048576];[$mil_ass_all.$B65]) -> RUS | M65: of:=INDEX([$military_assets.J$1:.J$1048576];[$mil_ass_all.$B65]) -> Submarine | N65: of:=INDEX([$military_assets.K$1:.K$1048576];[$mil_ass_all.$B65]) -> Hidden: Can be played face down. 
Surprise Attacker: This asset deals damage during the Surprise Damage Step.
Commerce Raider: When sieging a player directly, this military asset's siege is equal to its attack. | O65: of:=INDEX([$military_assets.L$1:.L$1048576];[$mil_ass_all.$B65]) -> Images/oscar2.jpg | P65: of:=INDEX([$military_assets.M$1:.M$1048576];[$mil_ass_all.$B65]) -> The massive but aging Oscar is a relic of Cold War Soviet strategy. That said, it's large guided missile batteries are still a formidable threat to US carriers. | Q65: of:=INDEX([$military_assets.N$1:.N$1048576];[$mil_ass_all.$B65]) -> 0.0.2
A66: 1 | B66: 23 | C66: Chelyabinsk | D66: of:=INDEX([$military_assets.A$1:.A$1048576];[$mil_ass_all.$B66]) -> Oscar II Class SSGN | E66: of:=INDEX([$military_assets.B$1:.B$1048576];[$mil_ass_all.$B66]) -> 0 | F66: of:=INDEX([$military_assets.C$1:.C$1048576];[$mil_ass_all.$B66]) -> 0 | G66: of:=INDEX([$military_assets.D$1:.D$1048576];[$mil_ass_all.$B66]) -> 0 | H66: of:=INDEX([$military_assets.E$1:.E$1048576];[$mil_ass_all.$B66]) -> 4 | I66: of:=INDEX([$military_assets.F$1:.F$1048576];[$mil_ass_all.$B66]) -> 0 | J66: of:=INDEX([$military_assets.G$1:.G$1048576];[$mil_ass_all.$B66]) -> 1 | K66: of:=INDEX([$military_assets.H$1:.H$1048576];[$mil_ass_all.$B66]) -> 3 | L66: of:=INDEX([$military_assets.I$1:.I$1048576];[$mil_ass_all.$B66]) -> RUS | M66: of:=INDEX([$military_assets.J$1:.J$1048576];[$mil_ass_all.$B66]) -> Submarine | N66: of:=INDEX([$military_assets.K$1:.K$1048576];[$mil_ass_all.$B66]) -> Hidden: Can be played face down. 
Surprise Attacker: This asset deals damage during the Surprise Damage Step.
Commerce Raider: When sieging a player directly, this military asset's siege is equal to its attack. | O66: of:=INDEX([$military_assets.L$1:.L$1048576];[$mil_ass_all.$B66]) -> Images/oscar2.jpg | P66: of:=INDEX([$military_assets.M$1:.M$1048576];[$mil_ass_all.$B66]) -> The massive but aging Oscar is a relic of Cold War Soviet strategy. That said, it's large guided missile batteries are still a formidable threat to US carriers. | Q66: of:=INDEX([$military_assets.N$1:.N$1048576];[$mil_ass_all.$B66]) -> 0.0.2
A67: 1 | B67: 23 | C67: Omsk | D67: of:=INDEX([$military_assets.A$1:.A$1048576];[$mil_ass_all.$B67]) -> Oscar II Class SSGN | E67: of:=INDEX([$military_assets.B$1:.B$1048576];[$mil_ass_all.$B67]) -> 0 | F67: of:=INDEX([$military_assets.C$1:.C$1048576];[$mil_ass_all.$B67]) -> 0 | G67: of:=INDEX([$military_assets.D$1:.D$1048576];[$mil_ass_all.$B67]) -> 0 | H67: of:=INDEX([$military_assets.E$1:.E$1048576];[$mil_ass_all.$B67]) -> 4 | I67: of:=INDEX([$military_assets.F$1:.F$1048576];[$mil_ass_all.$B67]) -> 0 | J67: of:=INDEX([$military_assets.G$1:.G$1048576];[$mil_ass_all.$B67]) -> 1 | K67: of:=INDEX([$military_assets.H$1:.H$1048576];[$mil_ass_all.$B67]) -> 3 | L67: of:=INDEX([$military_assets.I$1:.I$1048576];[$mil_ass_all.$B67]) -> RUS | M67: of:=INDEX([$military_assets.J$1:.J$1048576];[$mil_ass_all.$B67]) -> Submarine | N67: of:=INDEX([$military_assets.K$1:.K$1048576];[$mil_ass_all.$B67]) -> Hidden: Can be played face down. 
Surprise Attacker: This asset deals damage during the Surprise Damage Step.
Commerce Raider: When sieging a player directly, this military asset's siege is equal to its attack. | O67: of:=INDEX([$military_assets.L$1:.L$1048576];[$mil_ass_all.$B67]) -> Images/oscar2.jpg | P67: of:=INDEX([$military_assets.M$1:.M$1048576];[$mil_ass_all.$B67]) -> The massive but aging Oscar is a relic of Cold War Soviet strategy. That said, it's large guided missile batteries are still a formidable threat to US carriers. | Q67: of:=INDEX([$military_assets.N$1:.N$1048576];[$mil_ass_all.$B67]) -> 0.0.2
A68: 1 | B68: 23 | C68: Tomsk | D68: of:=INDEX([$military_assets.A$1:.A$1048576];[$mil_ass_all.$B68]) -> Oscar II Class SSGN | E68: of:=INDEX([$military_assets.B$1:.B$1048576];[$mil_ass_all.$B68]) -> 0 | F68: of:=INDEX([$military_assets.C$1:.C$1048576];[$mil_ass_all.$B68]) -> 0 | G68: of:=INDEX([$military_assets.D$1:.D$1048576];[$mil_ass_all.$B68]) -> 0 | H68: of:=INDEX([$military_assets.E$1:.E$1048576];[$mil_ass_all.$B68]) -> 4 | I68: of:=INDEX([$military_assets.F$1:.F$1048576];[$mil_ass_all.$B68]) -> 0 | J68: of:=INDEX([$military_assets.G$1:.G$1048576];[$mil_ass_all.$B68]) -> 1 | K68: of:=INDEX([$military_assets.H$1:.H$1048576];[$mil_ass_all.$B68]) -> 3 | L68: of:=INDEX([$military_assets.I$1:.I$1048576];[$mil_ass_all.$B68]) -> RUS | M68: of:=INDEX([$military_assets.J$1:.J$1048576];[$mil_ass_all.$B68]) -> Submarine | N68: of:=INDEX([$military_assets.K$1:.K$1048576];[$mil_ass_all.$B68]) -> Hidden: Can be played face down. 
Surprise Attacker: This asset deals damage during the Surprise Damage Step.
Commerce Raider: When sieging a player directly, this military asset's siege is equal to its attack. | O68: of:=INDEX([$military_assets.L$1:.L$1048576];[$mil_ass_all.$B68]) -> Images/oscar2.jpg | P68: of:=INDEX([$military_assets.M$1:.M$1048576];[$mil_ass_all.$B68]) -> The massive but aging Oscar is a relic of Cold War Soviet strategy. That said, it's large guided missile batteries are still a formidable threat to US carriers. | Q68: of:=INDEX([$military_assets.N$1:.N$1048576];[$mil_ass_all.$B68]) -> 0.0.2
A69: 1 | B69: 27 | C69: Leopard | D69: of:=INDEX([$military_assets.A$1:.A$1048576];[$mil_ass_all.$B69]) -> Akula Class SSN | E69: of:=INDEX([$military_assets.B$1:.B$1048576];[$mil_ass_all.$B69]) -> 0 | F69: of:=INDEX([$military_assets.C$1:.C$1048576];[$mil_ass_all.$B69]) -> 0 | G69: of:=INDEX([$military_assets.D$1:.D$1048576];[$mil_ass_all.$B69]) -> 0 | H69: of:=INDEX([$military_assets.E$1:.E$1048576];[$mil_ass_all.$B69]) -> 3 | I69: of:=INDEX([$military_assets.F$1:.F$1048576];[$mil_ass_all.$B69]) -> 0 | J69: of:=INDEX([$military_assets.G$1:.G$1048576];[$mil_ass_all.$B69]) -> 3 | K69: of:=INDEX([$military_assets.H$1:.H$1048576];[$mil_ass_all.$B69]) -> 3 | L69: of:=INDEX([$military_assets.I$1:.I$1048576];[$mil_ass_all.$B69]) -> RUS | M69: of:=INDEX([$military_assets.J$1:.J$1048576];[$mil_ass_all.$B69]) -> Submarine | N69: of:=INDEX([$military_assets.K$1:.K$1048576];[$mil_ass_all.$B69]) -> Hidden: Can be played face down. 
Surprise Attacker: This asset deals damage during the Surprise Damage Step.
Commerce Raider: When sieging a player directly, this military asset's siege is equal to its attack. | O69: of:=INDEX([$military_assets.L$1:.L$1048576];[$mil_ass_all.$B69]) -> Images/akula.jpg | P69: of:=INDEX([$military_assets.M$1:.M$1048576];[$mil_ass_all.$B69]) -> In Russian, akula means shark | Q69: of:=INDEX([$military_assets.N$1:.N$1048576];[$mil_ass_all.$B69]) -> 0.0.2
A70: 1 | B70: 27 | C70: Tigr | D70: of:=INDEX([$military_assets.A$1:.A$1048576];[$mil_ass_all.$B70]) -> Akula Class SSN | E70: of:=INDEX([$military_assets.B$1:.B$1048576];[$mil_ass_all.$B70]) -> 0 | F70: of:=INDEX([$military_assets.C$1:.C$1048576];[$mil_ass_all.$B70]) -> 0 | G70: of:=INDEX([$military_assets.D$1:.D$1048576];[$mil_ass_all.$B70]) -> 0 | H70: of:=INDEX([$military_assets.E$1:.E$1048576];[$mil_ass_all.$B70]) -> 3 | I70: of:=INDEX([$military_assets.F$1:.F$1048576];[$mil_ass_all.$B70]) -> 0 | J70: of:=INDEX([$military_assets.G$1:.G$1048576];[$mil_ass_all.$B70]) -> 3 | K70: of:=INDEX([$military_assets.H$1:.H$1048576];[$mil_ass_all.$B70]) -> 3 | L70: of:=INDEX([$military_assets.I$1:.I$1048576];[$mil_ass_all.$B70]) -> RUS | M70: of:=INDEX([$military_assets.J$1:.J$1048576];[$mil_ass_all.$B70]) -> Submarine | N70: of:=INDEX([$military_assets.K$1:.K$1048576];[$mil_ass_all.$B70]) -> Hidden: Can be played face down. 
Surprise Attacker: This asset deals damage during the Surprise Damage Step.
Commerce Raider: When sieging a player directly, this military asset's siege is equal to its attack. | O70: of:=INDEX([$military_assets.L$1:.L$1048576];[$mil_ass_all.$B70]) -> Images/akula.jpg | P70: of:=INDEX([$military_assets.M$1:.M$1048576];[$mil_ass_all.$B70]) -> In Russian, akula means shark | Q70: of:=INDEX([$military_assets.N$1:.N$1048576];[$mil_ass_all.$B70]) -> 0.0.2
A71: 1 | B71: 27 | C71: Volk | D71: of:=INDEX([$military_assets.A$1:.A$1048576];[$mil_ass_all.$B71]) -> Akula Class SSN | E71: of:=INDEX([$military_assets.B$1:.B$1048576];[$mil_ass_all.$B71]) -> 0 | F71: of:=INDEX([$military_assets.C$1:.C$1048576];[$mil_ass_all.$B71]) -> 0 | G71: of:=INDEX([$military_assets.D$1:.D$1048576];[$mil_ass_all.$B71]) -> 0 | H71: of:=INDEX([$military_assets.E$1:.E$1048576];[$mil_ass_all.$B71]) -> 3 | I71: of:=INDEX([$military_assets.F$1:.F$1048576];[$mil_ass_all.$B71]) -> 0 | J71: of:=INDEX([$military_assets.G$1:.G$1048576];[$mil_ass_all.$B71]) -> 3 | K71: of:=INDEX([$military_assets.H$1:.H$1048576];[$mil_ass_all.$B71]) -> 3 | L71: of:=INDEX([$military_assets.I$1:.I$1048576];[$mil_ass_all.$B71]) -> RUS | M71: of:=INDEX([$military_assets.J$1:.J$1048576];[$mil_ass_all.$B71]) -> Submarine | N71: of:=INDEX([$military_assets.K$1:.K$1048576];[$mil_ass_all.$B71]) -> Hidden: Can be played face down. 
Surprise Attacker: This asset deals damage during the Surprise Damage Step.
Commerce Raider: When sieging a player directly, this military asset's siege is equal to its attack. | O71: of:=INDEX([$military_assets.L$1:.L$1048576];[$mil_ass_all.$B71]) -> Images/akula.jpg | P71: of:=INDEX([$military_assets.M$1:.M$1048576];[$mil_ass_all.$B71]) -> In Russian, akula means shark | Q71: of:=INDEX([$military_assets.N$1:.N$1048576];[$mil_ass_all.$B71]) -> 0.0.2
A72: 1 | B72: 27 | C72: Bratsk | D72: of:=INDEX([$military_assets.A$1:.A$1048576];[$mil_ass_all.$B72]) -> Akula Class SSN | E72: of:=INDEX([$military_assets.B$1:.B$1048576];[$mil_ass_all.$B72]) -> 0 | F72: of:=INDEX([$military_assets.C$1:.C$1048576];[$mil_ass_all.$B72]) -> 0 | G72: of:=INDEX([$military_assets.D$1:.D$1048576];[$mil_ass_all.$B72]) -> 0 | H72: of:=INDEX([$military_assets.E$1:.E$1048576];[$mil_ass_all.$B72]) -> 3 | I72: of:=INDEX([$military_assets.F$1:.F$1048576];[$mil_ass_all.$B72]) -> 0 | J72: of:=INDEX([$military_assets.G$1:.G$1048576];[$mil_ass_all.$B72]) -> 3 | K72: of:=INDEX([$military_assets.H$1:.H$1048576];[$mil_ass_all.$B72]) -> 3 | L72: of:=INDEX([$military_assets.I$1:.I$1048576];[$mil_ass_all.$B72]) -> RUS | M72: of:=INDEX([$military_assets.J$1:.J$1048576];[$mil_ass_all.$B72]) -> Submarine | N72: of:=INDEX([$military_assets.K$1:.K$1048576];[$mil_ass_all.$B72]) -> Hidden: Can be played face down. 
Surprise Attacker: This asset deals damage during the Surprise Damage Step.
Commerce Raider: When sieging a player directly, this military asset's siege is equal to its attack. | O72: of:=INDEX([$military_assets.L$1:.L$1048576];[$mil_ass_all.$B72]) -> Images/akula.jpg | P72: of:=INDEX([$military_assets.M$1:.M$1048576];[$mil_ass_all.$B72]) -> In Russian, akula means shark | Q72: of:=INDEX([$military_assets.N$1:.N$1048576];[$mil_ass_all.$B72]) -> 0.0.2
A73: 1 | B73: 27 | C73: Samara | D73: of:=INDEX([$military_assets.A$1:.A$1048576];[$mil_ass_all.$B73]) -> Akula Class SSN | E73: of:=INDEX([$military_assets.B$1:.B$1048576];[$mil_ass_all.$B73]) -> 0 | F73: of:=INDEX([$military_assets.C$1:.C$1048576];[$mil_ass_all.$B73]) -> 0 | G73: of:=INDEX([$military_assets.D$1:.D$1048576];[$mil_ass_all.$B73]) -> 0 | H73: of:=INDEX([$military_assets.E$1:.E$1048576];[$mil_ass_all.$B73]) -> 3 | I73: of:=INDEX([$military_assets.F$1:.F$1048576];[$mil_ass_all.$B73]) -> 0 | J73: of:=INDEX([$military_assets.G$1:.G$1048576];[$mil_ass_all.$B73]) -> 3 | K73: of:=INDEX([$military_assets.H$1:.H$1048576];[$mil_ass_all.$B73]) -> 3 | L73: of:=INDEX([$military_assets.I$1:.I$1048576];[$mil_ass_all.$B73]) -> RUS | M73: of:=INDEX([$military_assets.J$1:.J$1048576];[$mil_ass_all.$B73]) -> Submarine | N73: of:=INDEX([$military_assets.K$1:.K$1048576];[$mil_ass_all.$B73]) -> Hidden: Can be played face down. 
Surprise Attacker: This asset deals damage during the Surprise Damage Step.
Commerce Raider: When sieging a player directly, this military asset's siege is equal to its attack. | O73: of:=INDEX([$military_assets.L$1:.L$1048576];[$mil_ass_all.$B73]) -> Images/akula.jpg | P73: of:=INDEX([$military_assets.M$1:.M$1048576];[$mil_ass_all.$B73]) -> In Russian, akula means shark | Q73: of:=INDEX([$military_assets.N$1:.N$1048576];[$mil_ass_all.$B73]) -> 0.0.2
A74: 1 | B74: 27 | C74: Kuzbass | D74: of:=INDEX([$military_assets.A$1:.A$1048576];[$mil_ass_all.$B74]) -> Akula Class SSN | E74: of:=INDEX([$military_assets.B$1:.B$1048576];[$mil_ass_all.$B74]) -> 0 | F74: of:=INDEX([$military_assets.C$1:.C$1048576];[$mil_ass_all.$B74]) -> 0 | G74: of:=INDEX([$military_assets.D$1:.D$1048576];[$mil_ass_all.$B74]) -> 0 | H74: of:=INDEX([$military_assets.E$1:.E$1048576];[$mil_ass_all.$B74]) -> 3 | I74: of:=INDEX([$military_assets.F$1:.F$1048576];[$mil_ass_all.$B74]) -> 0 | J74: of:=INDEX([$military_assets.G$1:.G$1048576];[$mil_ass_all.$B74]) -> 3 | K74: of:=INDEX([$military_assets.H$1:.H$1048576];[$mil_ass_all.$B74]) -> 3 | L74: of:=INDEX([$military_assets.I$1:.I$1048576];[$mil_ass_all.$B74]) -> RUS | M74: of:=INDEX([$military_assets.J$1:.J$1048576];[$mil_ass_all.$B74]) -> Submarine | N74: of:=INDEX([$military_assets.K$1:.K$1048576];[$mil_ass_all.$B74]) -> Hidden: Can be played face down. 
Surprise Attacker: This asset deals damage during the Surprise Damage Step.
Commerce Raider: When sieging a player directly, this military asset's siege is equal to its attack. | O74: of:=INDEX([$military_assets.L$1:.L$1048576];[$mil_ass_all.$B74]) -> Images/akula.jpg | P74: of:=INDEX([$military_assets.M$1:.M$1048576];[$mil_ass_all.$B74]) -> In Russian, akula means shark | Q74: of:=INDEX([$military_assets.N$1:.N$1048576];[$mil_ass_all.$B74]) -> 0.0.2
A75: 1 | B75: 26 | C75: Danlil Moskovskiy | D75: of:=INDEX([$military_assets.A$1:.A$1048576];[$mil_ass_all.$B75]) -> Victor III Class SSN | E75: of:=INDEX([$military_assets.B$1:.B$1048576];[$mil_ass_all.$B75]) -> 0 | F75: of:=INDEX([$military_assets.C$1:.C$1048576];[$mil_ass_all.$B75]) -> 0 | G75: of:=INDEX([$military_assets.D$1:.D$1048576];[$mil_ass_all.$B75]) -> 0 | H75: of:=INDEX([$military_assets.E$1:.E$1048576];[$mil_ass_all.$B75]) -> 2 | I75: of:=INDEX([$military_assets.F$1:.F$1048576];[$mil_ass_all.$B75]) -> 0 | J75: of:=INDEX([$military_assets.G$1:.G$1048576];[$mil_ass_all.$B75]) -> 1 | K75: of:=INDEX([$military_assets.H$1:.H$1048576];[$mil_ass_all.$B75]) -> 1 | L75: of:=INDEX([$military_assets.I$1:.I$1048576];[$mil_ass_all.$B75]) -> RUS | M75: of:=INDEX([$military_assets.J$1:.J$1048576];[$mil_ass_all.$B75]) -> Submarine | N75: of:=INDEX([$military_assets.K$1:.K$1048576];[$mil_ass_all.$B75]) -> Hidden: Can be played face down. 
Surprise Attacker: This asset deals damage during the Surprise Damage Step.
Commerce Raider: When sieging a player directly, this military asset's siege is equal to its attack. | O75: of:=INDEX([$military_assets.L$1:.L$1048576];[$mil_ass_all.$B75]) -> Images/victor2.jpg | P75: of:=INDEX([$military_assets.M$1:.M$1048576];[$mil_ass_all.$B75]) -> Nothing fancy, but it ain't bad for government work. | Q75: of:=INDEX([$military_assets.N$1:.N$1048576];[$mil_ass_all.$B75]) -> 0.0.2
A76: 1 | B76: 26 | C76: Tambov | D76: of:=INDEX([$military_assets.A$1:.A$1048576];[$mil_ass_all.$B76]) -> Victor III Class SSN | E76: of:=INDEX([$military_assets.B$1:.B$1048576];[$mil_ass_all.$B76]) -> 0 | F76: of:=INDEX([$military_assets.C$1:.C$1048576];[$mil_ass_all.$B76]) -> 0 | G76: of:=INDEX([$military_assets.D$1:.D$1048576];[$mil_ass_all.$B76]) -> 0 | H76: of:=INDEX([$military_assets.E$1:.E$1048576];[$mil_ass_all.$B76]) -> 2 | I76: of:=INDEX([$military_assets.F$1:.F$1048576];[$mil_ass_all.$B76]) -> 0 | J76: of:=INDEX([$military_assets.G$1:.G$1048576];[$mil_ass_all.$B76]) -> 1 | K76: of:=INDEX([$military_assets.H$1:.H$1048576];[$mil_ass_all.$B76]) -> 1 | L76: of:=INDEX([$military_assets.I$1:.I$1048576];[$mil_ass_all.$B76]) -> RUS | M76: of:=INDEX([$military_assets.J$1:.J$1048576];[$mil_ass_all.$B76]) -> Submarine | N76: of:=INDEX([$military_assets.K$1:.K$1048576];[$mil_ass_all.$B76]) -> Hidden: Can be played face down. 
Surprise Attacker: This asset deals damage during the Surprise Damage Step.
Commerce Raider: When sieging a player directly, this military asset's siege is equal to its attack. | O76: of:=INDEX([$military_assets.L$1:.L$1048576];[$mil_ass_all.$B76]) -> Images/victor2.jpg | P76: of:=INDEX([$military_assets.M$1:.M$1048576];[$mil_ass_all.$B76]) -> Nothing fancy, but it ain't bad for government work. | Q76: of:=INDEX([$military_assets.N$1:.N$1048576];[$mil_ass_all.$B76]) -> 0.0.2
A77: 1 | B77: 26 | C77: Obninsk | D77: of:=INDEX([$military_assets.A$1:.A$1048576];[$mil_ass_all.$B77]) -> Victor III Class SSN | E77: of:=INDEX([$military_assets.B$1:.B$1048576];[$mil_ass_all.$B77]) -> 0 | F77: of:=INDEX([$military_assets.C$1:.C$1048576];[$mil_ass_all.$B77]) -> 0 | G77: of:=INDEX([$military_assets.D$1:.D$1048576];[$mil_ass_all.$B77]) -> 0 | H77: of:=INDEX([$military_assets.E$1:.E$1048576];[$mil_ass_all.$B77]) -> 2 | I77: of:=INDEX([$military_assets.F$1:.F$1048576];[$mil_ass_all.$B77]) -> 0 | J77: of:=INDEX([$military_assets.G$1:.G$1048576];[$mil_ass_all.$B77]) -> 1 | K77: of:=INDEX([$military_assets.H$1:.H$1048576];[$mil_ass_all.$B77]) -> 1 | L77: of:=INDEX([$military_assets.I$1:.I$1048576];[$mil_ass_all.$B77]) -> RUS | M77: of:=INDEX([$military_assets.J$1:.J$1048576];[$mil_ass_all.$B77]) -> Submarine | N77: of:=INDEX([$military_assets.K$1:.K$1048576];[$mil_ass_all.$B77]) -> Hidden: Can be played face down. 
Surprise Attacker: This asset deals damage during the Surprise Damage Step.
Commerce Raider: When sieging a player directly, this military asset's siege is equal to its attack. | O77: of:=INDEX([$military_assets.L$1:.L$1048576];[$mil_ass_all.$B77]) -> Images/victor2.jpg | P77: of:=INDEX([$military_assets.M$1:.M$1048576];[$mil_ass_all.$B77]) -> Nothing fancy, but it ain't bad for government work. | Q77: of:=INDEX([$military_assets.N$1:.N$1048576];[$mil_ass_all.$B77]) -> 0.0.2
A78: 1 | B78: 26 | C78: Nizny Novgorod | D78: of:=INDEX([$military_assets.A$1:.A$1048576];[$mil_ass_all.$B78]) -> Victor III Class SSN | E78: of:=INDEX([$military_assets.B$1:.B$1048576];[$mil_ass_all.$B78]) -> 0 | F78: of:=INDEX([$military_assets.C$1:.C$1048576];[$mil_ass_all.$B78]) -> 0 | G78: of:=INDEX([$military_assets.D$1:.D$1048576];[$mil_ass_all.$B78]) -> 0 | H78: of:=INDEX([$military_assets.E$1:.E$1048576];[$mil_ass_all.$B78]) -> 2 | I78: of:=INDEX([$military_assets.F$1:.F$1048576];[$mil_ass_all.$B78]) -> 0 | J78: of:=INDEX([$military_assets.G$1:.G$1048576];[$mil_ass_all.$B78]) -> 1 | K78: of:=INDEX([$military_assets.H$1:.H$1048576];[$mil_ass_all.$B78]) -> 1 | L78: of:=INDEX([$military_assets.I$1:.I$1048576];[$mil_ass_all.$B78]) -> RUS | M78: of:=INDEX([$military_assets.J$1:.J$1048576];[$mil_ass_all.$B78]) -> Submarine | N78: of:=INDEX([$military_assets.K$1:.K$1048576];[$mil_ass_all.$B78]) -> Hidden: Can be played face down. 
Surprise Attacker: This asset deals damage during the Surprise Damage Step.
Commerce Raider: When sieging a player directly, this military asset's siege is equal to its attack. | O78: of:=INDEX([$military_assets.L$1:.L$1048576];[$mil_ass_all.$B78]) -> Images/victor2.jpg | P78: of:=INDEX([$military_assets.M$1:.M$1048576];[$mil_ass_all.$B78]) -> Nothing fancy, but it ain't bad for government work. | Q78: of:=INDEX([$military_assets.N$1:.N$1048576];[$mil_ass_all.$B78]) -> 0.0.2
A79: 1 | B79: 22 | C79: Sankt Peterburg | D79: of:=INDEX([$military_assets.A$1:.A$1048576];[$mil_ass_all.$B79]) -> Lada Class SSK | E79: of:=INDEX([$military_assets.B$1:.B$1048576];[$mil_ass_all.$B79]) -> 0 | F79: of:=INDEX([$military_assets.C$1:.C$1048576];[$mil_ass_all.$B79]) -> 0 | G79: of:=INDEX([$military_assets.D$1:.D$1048576];[$mil_ass_all.$B79]) -> 0 | H79: of:=INDEX([$military_assets.E$1:.E$1048576];[$mil_ass_all.$B79]) -> 3 | I79: of:=INDEX([$military_assets.F$1:.F$1048576];[$mil_ass_all.$B79]) -> 0 | J79: of:=INDEX([$military_assets.G$1:.G$1048576];[$mil_ass_all.$B79]) -> 2 | K79: of:=INDEX([$military_assets.H$1:.H$1048576];[$mil_ass_all.$B79]) -> 2 | L79: of:=INDEX([$military_assets.I$1:.I$1048576];[$mil_ass_all.$B79]) -> RUS | M79: of:=INDEX([$military_assets.J$1:.J$1048576];[$mil_ass_all.$B79]) -> Submarine | N79: of:=INDEX([$military_assets.K$1:.K$1048576];[$mil_ass_all.$B79]) -> Hidden: Can be played face down. 
Surprise Attacker: This asset deals damage during the Surprise Damage Step.
Coastal Defender: This asset cannot  take part in an attack. | O79: of:=INDEX([$military_assets.L$1:.L$1048576];[$mil_ass_all.$B79]) -> Images/lada.jpg | P79: of:=INDEX([$military_assets.M$1:.M$1048576];[$mil_ass_all.$B79]) -> Although shorter-ranged than nuclear attack submarines, diesel-electric attack submarines are smaller, quieter and nearly as well armed. | Q79: of:=INDEX([$military_assets.N$1:.N$1048576];[$mil_ass_all.$B79]) -> 0.0.2
A80: 1 | B80: 22 | C80: Kronshtadt | D80: of:=INDEX([$military_assets.A$1:.A$1048576];[$mil_ass_all.$B80]) -> Lada Class SSK | E80: of:=INDEX([$military_assets.B$1:.B$1048576];[$mil_ass_all.$B80]) -> 0 | F80: of:=INDEX([$military_assets.C$1:.C$1048576];[$mil_ass_all.$B80]) -> 0 | G80: of:=INDEX([$military_assets.D$1:.D$1048576];[$mil_ass_all.$B80]) -> 0 | H80: of:=INDEX([$military_assets.E$1:.E$1048576];[$mil_ass_all.$B80]) -> 3 | I80: of:=INDEX([$military_assets.F$1:.F$1048576];[$mil_ass_all.$B80]) -> 0 | J80: of:=INDEX([$military_assets.G$1:.G$1048576];[$mil_ass_all.$B80]) -> 2 | K80: of:=INDEX([$military_assets.H$1:.H$1048576];[$mil_ass_all.$B80]) -> 2 | L80: of:=INDEX([$military_assets.I$1:.I$1048576];[$mil_ass_all.$B80]) -> RUS | M80: of:=INDEX([$military_assets.J$1:.J$1048576];[$mil_ass_all.$B80]) -> Submarine | N80: of:=INDEX([$military_assets.K$1:.K$1048576];[$mil_ass_all.$B80]) -> Hidden: Can be played face down. 
Surprise Attacker: This asset deals damage during the Surprise Damage Step.
Coastal Defender: This asset cannot  take part in an attack. | O80: of:=INDEX([$military_assets.L$1:.L$1048576];[$mil_ass_all.$B80]) -> Images/lada.jpg | P80: of:=INDEX([$military_assets.M$1:.M$1048576];[$mil_ass_all.$B80]) -> Although shorter-ranged than nuclear attack submarines, diesel-electric attack submarines are smaller, quieter and nearly as well armed. | Q80: of:=INDEX([$military_assets.N$1:.N$1048576];[$mil_ass_all.$B80]) -> 0.0.2
A81: 1 | B81: 24 | C81: 100th Regiment | D81: of:=INDEX([$military_assets.A$1:.A$1048576];[$mil_ass_all.$B81]) -> Mig-29K Fulcrum-D | E81: of:=INDEX([$military_assets.B$1:.B$1048576];[$mil_ass_all.$B81]) -> 0 | F81: of:=INDEX([$military_assets.C$1:.C$1048576];[$mil_ass_all.$B81]) -> 0 | G81: of:=INDEX([$military_assets.D$1:.D$1048576];[$mil_ass_all.$B81]) -> 0 | H81: of:=INDEX([$military_assets.E$1:.E$1048576];[$mil_ass_all.$B81]) -> 4 | I81: of:=INDEX([$military_assets.F$1:.F$1048576];[$mil_ass_all.$B81]) -> 3 | J81: of:=INDEX([$military_assets.G$1:.G$1048576];[$mil_ass_all.$B81]) -> 3 | K81: of:=INDEX([$military_assets.H$1:.H$1048576];[$mil_ass_all.$B81]) -> 1 | L81: of:=INDEX([$military_assets.I$1:.I$1048576];[$mil_ass_all.$B81]) -> RUS | M81: of:=INDEX([$military_assets.J$1:.J$1048576];[$mil_ass_all.$B81]) -> Squadron | N81: of:=INDEX([$military_assets.K$1:.K$1048576];[$mil_ass_all.$B81]) -> STOBAR
Hidden: Can be played face down.  | O81: of:=INDEX([$military_assets.L$1:.L$1048576];[$mil_ass_all.$B81]) -> Images/mig29k.jpg | P81: of:=INDEX([$military_assets.M$1:.M$1048576];[$mil_ass_all.$B81]) -> With an affordable  $15M unit cost, the Mig-29K is proof that achieving air dominance doesn’t always require one to break the bank. | Q81: of:=INDEX([$military_assets.N$1:.N$1048576];[$mil_ass_all.$B81]) -> 0.0.2
A82: 1 | B82: 24 | C82: 101st Regiment | D82: of:=INDEX([$military_assets.A$1:.A$1048576];[$mil_ass_all.$B82]) -> Mig-29K Fulcrum-D | E82: of:=INDEX([$military_assets.B$1:.B$1048576];[$mil_ass_all.$B82]) -> 0 | F82: of:=INDEX([$military_assets.C$1:.C$1048576];[$mil_ass_all.$B82]) -> 0 | G82: of:=INDEX([$military_assets.D$1:.D$1048576];[$mil_ass_all.$B82]) -> 0 | H82: of:=INDEX([$military_assets.E$1:.E$1048576];[$mil_ass_all.$B82]) -> 4 | I82: of:=INDEX([$military_assets.F$1:.F$1048576];[$mil_ass_all.$B82]) -> 3 | J82: of:=INDEX([$military_assets.G$1:.G$1048576];[$mil_ass_all.$B82]) -> 3 | K82: of:=INDEX([$military_assets.H$1:.H$1048576];[$mil_ass_all.$B82]) -> 1 | L82: of:=INDEX([$military_assets.I$1:.I$1048576];[$mil_ass_all.$B82]) -> RUS | M82: of:=INDEX([$military_assets.J$1:.J$1048576];[$mil_ass_all.$B82]) -> Squadron | N82: of:=INDEX([$military_assets.K$1:.K$1048576];[$mil_ass_all.$B82]) -> STOBAR
Hidden: Can be played face down.  | O82: of:=INDEX([$military_assets.L$1:.L$1048576];[$mil_ass_all.$B82]) -> Images/mig29k.jpg | P82: of:=INDEX([$military_assets.M$1:.M$1048576];[$mil_ass_all.$B82]) -> With an affordable  $15M unit cost, the Mig-29K is proof that achieving air dominance doesn’t always require one to break the bank. | Q82: of:=INDEX([$military_assets.N$1:.N$1048576];[$mil_ass_all.$B82]) -> 0.0.2
A83: 1 | B83: 24 | C83: 102nd Regiment | D83: of:=INDEX([$military_assets.A$1:.A$1048576];[$mil_ass_all.$B83]) -> Mig-29K Fulcrum-D | E83: of:=INDEX([$military_assets.B$1:.B$1048576];[$mil_ass_all.$B83]) -> 0 | F83: of:=INDEX([$military_assets.C$1:.C$1048576];[$mil_ass_all.$B83]) -> 0 | G83: of:=INDEX([$military_assets.D$1:.D$1048576];[$mil_ass_all.$B83]) -> 0 | H83: of:=INDEX([$military_assets.E$1:.E$1048576];[$mil_ass_all.$B83]) -> 4 | I83: of:=INDEX([$military_assets.F$1:.F$1048576];[$mil_ass_all.$B83]) -> 3 | J83: of:=INDEX([$military_assets.G$1:.G$1048576];[$mil_ass_all.$B83]) -> 3 | K83: of:=INDEX([$military_assets.H$1:.H$1048576];[$mil_ass_all.$B83]) -> 1 | L83: of:=INDEX([$military_assets.I$1:.I$1048576];[$mil_ass_all.$B83]) -> RUS | M83: of:=INDEX([$military_assets.J$1:.J$1048576];[$mil_ass_all.$B83]) -> Squadron | N83: of:=INDEX([$military_assets.K$1:.K$1048576];[$mil_ass_all.$B83]) -> STOBAR
Hidden: Can be played face down.  | O83: of:=INDEX([$military_assets.L$1:.L$1048576];[$mil_ass_all.$B83]) -> Images/mig29k.jpg | P83: of:=INDEX([$military_assets.M$1:.M$1048576];[$mil_ass_all.$B83]) -> With an affordable  $15M unit cost, the Mig-29K is proof that achieving air dominance doesn’t always require one to break the bank. | Q83: of:=INDEX([$military_assets.N$1:.N$1048576];[$mil_ass_all.$B83]) -> 0.0.2

Sheet: mil_ass_us_start
A1: Duplication | B1: Class | C1: Name | D1: of:=[$military_assets.A1] -> Title | E1: of:=[$military_assets.B1] -> Unused0 | F1: of:=[$military_assets.C1] -> Unused1 | G1: of:=[$military_assets.D1] -> Unused2 | H1: of:=[$military_assets.E1] -> Attack | I1: of:=[$military_assets.F1] -> ShoreAttack | J1: of:=[$military_assets.G1] -> Defense | K1: of:=[$military_assets.H1] -> Logistics | L1: of:=[$military_assets.I1] -> Rosters | M1: of:=[$military_assets.J1] -> Type | N1: of:=[$military_assets.K1] -> Description | O1: of:=[$military_assets.L1] -> Image | P1: of:=[$military_assets.M1] -> FlavorText | Q1: of:=[$military_assets.N1] -> Version
A2: 1 | B2: 2 | C2: USS Abraham Lincoln | D2: of:=INDEX([$military_assets.A$1:.A$1048576];[$mil_ass_us_start.$B2]) -> Nimitz Class CVN | E2: of:=INDEX([$military_assets.B$1:.B$1048576];[$mil_ass_us_start.$B2]) -> 0 | F2: of:=INDEX([$military_assets.C$1:.C$1048576];[$mil_ass_us_start.$B2]) -> 0 | G2: of:=INDEX([$military_assets.D$1:.D$1048576];[$mil_ass_us_start.$B2]) -> 0 | H2: of:=INDEX([$military_assets.E$1:.E$1048576];[$mil_ass_us_start.$B2]) -> 0 | I2: of:=INDEX([$military_assets.F$1:.F$1048576];[$mil_ass_us_start.$B2]) -> 0 | J2: of:=INDEX([$military_assets.G$1:.G$1048576];[$mil_ass_us_start.$B2]) -> 2 | K2: of:=INDEX([$military_assets.H$1:.H$1048576];[$mil_ass_us_start.$B2]) -> 6 | L2: of:=INDEX([$military_assets.I$1:.I$1048576];[$mil_ass_us_start.$B2]) -> USN | M2: of:=INDEX([$military_assets.J$1:.J$1048576];[$mil_ass_us_start.$B2]) -> Ship | N2: of:=INDEX([$military_assets.K$1:.K$1048576];[$mil_ass_us_start.$B2]) -> CATOBAR: Compatible with CATOBAR, VTOL, and  STOBAR squadrons.
E-2C Hawkeye: All squadrons you control in a combat including this asset have +1 attack and  defense.
Carrier 3: Can station 3 aircraft squadrons.
CAP: +2 Help Defense | O2: of:=INDEX([$military_assets.L$1:.L$1048576];[$mil_ass_us_start.$B2]) -> Images/nimitz.jpg | P2: of:=INDEX([$military_assets.M$1:.M$1048576];[$mil_ass_us_start.$B2]) -> A military airbase at sea, a Nimitz carrier is more than three times as long as a football field and has more than twice the displacement of the German super-battleship Bismarck. | Q2: of:=INDEX([$military_assets.N$1:.N$1048576];[$mil_ass_us_start.$B2]) -> 0.0.2
A3: 1 | B3: 2 | C3: USS Carl Vinson | D3: of:=INDEX([$military_assets.A$1:.A$1048576];[$mil_ass_us_start.$B3]) -> Nimitz Class CVN | E3: of:=INDEX([$military_assets.B$1:.B$1048576];[$mil_ass_us_start.$B3]) -> 0 | F3: of:=INDEX([$military_assets.C$1:.C$1048576];[$mil_ass_us_start.$B3]) -> 0 | G3: of:=INDEX([$military_assets.D$1:.D$1048576];[$mil_ass_us_start.$B3]) -> 0 | H3: of:=INDEX([$military_assets.E$1:.E$1048576];[$mil_ass_us_start.$B3]) -> 0 | I3: of:=INDEX([$military_assets.F$1:.F$1048576];[$mil_ass_us_start.$B3]) -> 0 | J3: of:=INDEX([$military_assets.G$1:.G$1048576];[$mil_ass_us_start.$B3]) -> 2 | K3: of:=INDEX([$military_assets.H$1:.H$1048576];[$mil_ass_us_start.$B3]) -> 6 | L3: of:=INDEX([$military_assets.I$1:.I$1048576];[$mil_ass_us_start.$B3]) -> USN | M3: of:=INDEX([$military_assets.J$1:.J$1048576];[$mil_ass_us_start.$B3]) -> Ship | N3: of:=INDEX([$military_assets.K$1:.K$1048576];[$mil_ass_us_start.$B3]) -> CATOBAR: Compatible with CATOBAR, VTOL, and  STOBAR squadrons.
E-2C Hawkeye: All squadrons you control in a combat including this asset have +1 attack and  defense.
Carrier 3: Can station 3 aircraft squadrons.
CAP: +2 Help Defense | O3: of:=INDEX([$military_assets.L$1:.L$1048576];[$mil_ass_us_start.$B3]) -> Images/nimitz.jpg | P3: of:=INDEX([$military_assets.M$1:.M$1048576];[$mil_ass_us_start.$B3]) -> A military airbase at sea, a Nimitz carrier is more than three times as long as a football field and has more than twice the displacement of the German super-battleship Bismarck. | Q3: of:=INDEX([$military_assets.N$1:.N$1048576];[$mil_ass_us_start.$B3]) -> 0.0.2
A4: 1 | B4: 2 | C4: USS George Washington | D4: of:=INDEX([$military_assets.A$1:.A$1048576];[$mil_ass_us_start.$B4]) -> Nimitz Class CVN | E4: of:=INDEX([$military_assets.B$1:.B$1048576];[$mil_ass_us_start.$B4]) -> 0 | F4: of:=INDEX([$military_assets.C$1:.C$1048576];[$mil_ass_us_start.$B4]) -> 0 | G4: of:=INDEX([$military_assets.D$1:.D$1048576];[$mil_ass_us_start.$B4]) -> 0 | H4: of:=INDEX([$military_assets.E$1:.E$1048576];[$mil_ass_us_start.$B4]) -> 0 | I4: of:=INDEX([$military_assets.F$1:.F$1048576];[$mil_ass_us_start.$B4]) -> 0 | J4: of:=INDEX([$military_assets.G$1:.G$1048576];[$mil_ass_us_start.$B4]) -> 2 | K4: of:=INDEX([$military_assets.H$1:.H$1048576];[$mil_ass_us_start.$B4]) -> 6 | L4: of:=INDEX([$military_assets.I$1:.I$1048576];[$mil_ass_us_start.$B4]) -> USN | M4: of:=INDEX([$military_assets.J$1:.J$1048576];[$mil_ass_us_start.$B4]) -> Ship | N4: of:=INDEX([$military_assets.K$1:.K$1048576];[$mil_ass_us_start.$B4]) -> CATOBAR: Compatible with CATOBAR, VTOL, and  STOBAR squadrons.
E-2C Hawkeye: All squadrons you control in a combat including this asset have +1 attack and  defense.
Carrier 3: Can station 3 aircraft squadrons.
CAP: +2 Help Defense | O4: of:=INDEX([$military_assets.L$1:.L$1048576];[$mil_ass_us_start.$B4]) -> Images/nimitz.jpg | P4: of:=INDEX([$military_assets.M$1:.M$1048576];[$mil_ass_us_start.$B4]) -> A military airbase at sea, a Nimitz carrier is more than three times as long as a football field and has more than twice the displacement of the German super-battleship Bismarck. | Q4: of:=INDEX([$military_assets.N$1:.N$1048576];[$mil_ass_us_start.$B4]) -> 0.0.2
A5: 0 | B5: 4 | C5: USS Bonhomme Richard | D5: of:=INDEX([$military_assets.A$1:.A$1048576];[$mil_ass_us_start.$B5]) -> Wasp Class LHA | E5: of:=INDEX([$military_assets.B$1:.B$1048576];[$mil_ass_us_start.$B5]) -> 0 | F5: of:=INDEX([$military_assets.C$1:.C$1048576];[$mil_ass_us_start.$B5]) -> 0 | G5: of:=INDEX([$military_assets.D$1:.D$1048576];[$mil_ass_us_start.$B5]) -> 0 | H5: of:=INDEX([$military_assets.E$1:.E$1048576];[$mil_ass_us_start.$B5]) -> 0 | I5: of:=INDEX([$military_assets.F$1:.F$1048576];[$mil_ass_us_start.$B5]) -> 4 | J5: of:=INDEX([$military_assets.G$1:.G$1048576];[$mil_ass_us_start.$B5]) -> 2 | K5: of:=INDEX([$military_assets.H$1:.H$1048576];[$mil_ass_us_start.$B5]) -> 3 | L5: of:=INDEX([$military_assets.I$1:.I$1048576];[$mil_ass_us_start.$B5]) -> USN | M5: of:=INDEX([$military_assets.J$1:.J$1048576];[$mil_ass_us_start.$B5]) -> Ship | N5: of:=INDEX([$military_assets.K$1:.K$1048576];[$mil_ass_us_start.$B5]) -> VTOL: Compatible with all VTOL aircraft squadrons.
Carrier 1: Can station 1 aircraft squadron. | O5: of:=INDEX([$military_assets.L$1:.L$1048576];[$mil_ass_us_start.$B5]) -> Images/wasp.jpg | P5: of:=INDEX([$military_assets.M$1:.M$1048576];[$mil_ass_us_start.$B5]) -> In addition to supporting VTOL aircraft, a Wasp amphibious assault ship is capable of delivering a Marine Expeditionary Unit complete with its armored vehicles to hostile shores via helicopters and landing craft. | Q5: of:=INDEX([$military_assets.N$1:.N$1048576];[$mil_ass_us_start.$B5]) -> 0.0.2
A6: 0 | B6: 4 | C6: USS Essex | D6: of:=INDEX([$military_assets.A$1:.A$1048576];[$mil_ass_us_start.$B6]) -> Wasp Class LHA | E6: of:=INDEX([$military_assets.B$1:.B$1048576];[$mil_ass_us_start.$B6]) -> 0 | F6: of:=INDEX([$military_assets.C$1:.C$1048576];[$mil_ass_us_start.$B6]) -> 0 | G6: of:=INDEX([$military_assets.D$1:.D$1048576];[$mil_ass_us_start.$B6]) -> 0 | H6: of:=INDEX([$military_assets.E$1:.E$1048576];[$mil_ass_us_start.$B6]) -> 0 | I6: of:=INDEX([$military_assets.F$1:.F$1048576];[$mil_ass_us_start.$B6]) -> 4 | J6: of:=INDEX([$military_assets.G$1:.G$1048576];[$mil_ass_us_start.$B6]) -> 2 | K6: of:=INDEX([$military_assets.H$1:.H$1048576];[$mil_ass_us_start.$B6]) -> 3 | L6: of:=INDEX([$military_assets.I$1:.I$1048576];[$mil_ass_us_start.$B6]) -> USN | M6: of:=INDEX([$military_assets.J$1:.J$1048576];[$mil_ass_us_start.$B6]) -> Ship | N6: of:=INDEX([$military_assets.K$1:.K$1048576];[$mil_ass_us_start.$B6]) -> VTOL: Compatible with all VTOL aircraft squadrons.
Carrier 1: Can station 1 aircraft squadron. | O6: of:=INDEX([$military_assets.L$1:.L$1048576];[$mil_ass_us_start.$B6]) -> Images/wasp.jpg | P6: of:=INDEX([$military_assets.M$1:.M$1048576];[$mil_ass_us_start.$B6]) -> In addition to supporting VTOL aircraft, a Wasp amphibious assault ship is capable of delivering a Marine Expeditionary Unit complete with its armored vehicles to hostile shores via helicopters and landing craft. | Q6: of:=INDEX([$military_assets.N$1:.N$1048576];[$mil_ass_us_start.$B6]) -> 0.0.2
A7: 0 | B7: 4 | C7: USS Bataan | D7: of:=INDEX([$military_assets.A$1:.A$1048576];[$mil_ass_us_start.$B7]) -> Wasp Class LHA | E7: of:=INDEX([$military_assets.B$1:.B$1048576];[$mil_ass_us_start.$B7]) -> 0 | F7: of:=INDEX([$military_assets.C$1:.C$1048576];[$mil_ass_us_start.$B7]) -> 0 | G7: of:=INDEX([$military_assets.D$1:.D$1048576];[$mil_ass_us_start.$B7]) -> 0 | H7: of:=INDEX([$military_assets.E$1:.E$1048576];[$mil_ass_us_start.$B7]) -> 0 | I7: of:=INDEX([$military_assets.F$1:.F$1048576];[$mil_ass_us_start.$B7]) -> 4 | J7: of:=INDEX([$military_assets.G$1:.G$1048576];[$mil_ass_us_start.$B7]) -> 2 | K7: of:=INDEX([$military_assets.H$1:.H$1048576];[$mil_ass_us_start.$B7]) -> 3 | L7: of:=INDEX([$military_assets.I$1:.I$1048576];[$mil_ass_us_start.$B7]) -> USN | M7: of:=INDEX([$military_assets.J$1:.J$1048576];[$mil_ass_us_start.$B7]) -> Ship | N7: of:=INDEX([$military_assets.K$1:.K$1048576];[$mil_ass_us_start.$B7]) -> VTOL: Compatible with all VTOL aircraft squadrons.
Carrier 1: Can station 1 aircraft squadron. | O7: of:=INDEX([$military_assets.L$1:.L$1048576];[$mil_ass_us_start.$B7]) -> Images/wasp.jpg | P7: of:=INDEX([$military_assets.M$1:.M$1048576];[$mil_ass_us_start.$B7]) -> In addition to supporting VTOL aircraft, a Wasp amphibious assault ship is capable of delivering a Marine Expeditionary Unit complete with its armored vehicles to hostile shores via helicopters and landing craft. | Q7: of:=INDEX([$military_assets.N$1:.N$1048576];[$mil_ass_us_start.$B7]) -> 0.0.2
A8: 0 | B8: 4 | C8: USS Boxer | D8: of:=INDEX([$military_assets.A$1:.A$1048576];[$mil_ass_us_start.$B8]) -> Wasp Class LHA | E8: of:=INDEX([$military_assets.B$1:.B$1048576];[$mil_ass_us_start.$B8]) -> 0 | F8: of:=INDEX([$military_assets.C$1:.C$1048576];[$mil_ass_us_start.$B8]) -> 0 | G8: of:=INDEX([$military_assets.D$1:.D$1048576];[$mil_ass_us_start.$B8]) -> 0 | H8: of:=INDEX([$military_assets.E$1:.E$1048576];[$mil_ass_us_start.$B8]) -> 0 | I8: of:=INDEX([$military_assets.F$1:.F$1048576];[$mil_ass_us_start.$B8]) -> 4 | J8: of:=INDEX([$military_assets.G$1:.G$1048576];[$mil_ass_us_start.$B8]) -> 2 | K8: of:=INDEX([$military_assets.H$1:.H$1048576];[$mil_ass_us_start.$B8]) -> 3 | L8: of:=INDEX([$military_assets.I$1:.I$1048576];[$mil_ass_us_start.$B8]) -> USN | M8: of:=INDEX([$military_assets.J$1:.J$1048576];[$mil_ass_us_start.$B8]) -> Ship | N8: of:=INDEX([$military_assets.K$1:.K$1048576];[$mil_ass_us_start.$B8]) -> VTOL: Compatible with all VTOL aircraft squadrons.
Carrier 1: Can station 1 aircraft squadron. | O8: of:=INDEX([$military_assets.L$1:.L$1048576];[$mil_ass_us_start.$B8]) -> Images/wasp.jpg | P8: of:=INDEX([$military_assets.M$1:.M$1048576];[$mil_ass_us_start.$B8]) -> In addition to supporting VTOL aircraft, a Wasp amphibious assault ship is capable of delivering a Marine Expeditionary Unit complete with its armored vehicles to hostile shores via helicopters and landing craft. | Q8: of:=INDEX([$military_assets.N$1:.N$1048576];[$mil_ass_us_start.$B8]) -> 0.0.2
A9: 0 | B9: 4 | C9: USS Iow Jima | D9: of:=INDEX([$military_assets.A$1:.A$1048576];[$mil_ass_us_start.$B9]) -> Wasp Class LHA | E9: of:=INDEX([$military_assets.B$1:.B$1048576];[$mil_ass_us_start.$B9]) -> 0 | F9: of:=INDEX([$military_assets.C$1:.C$1048576];[$mil_ass_us_start.$B9]) -> 0 | G9: of:=INDEX([$military_assets.D$1:.D$1048576];[$mil_ass_us_start.$B9]) -> 0 | H9: of:=INDEX([$military_assets.E$1:.E$1048576];[$mil_ass_us_start.$B9]) -> 0 | I9: of:=INDEX([$military_assets.F$1:.F$1048576];[$mil_ass_us_start.$B9]) -> 4 | J9: of:=INDEX([$military_assets.G$1:.G$1048576];[$mil_ass_us_start.$B9]) -> 2 | K9: of:=INDEX([$military_assets.H$1:.H$1048576];[$mil_ass_us_start.$B9]) -> 3 | L9: of:=INDEX([$military_assets.I$1:.I$1048576];[$mil_ass_us_start.$B9]) -> USN | M9: of:=INDEX([$military_assets.J$1:.J$1048576];[$mil_ass_us_start.$B9]) -> Ship | N9: of:=INDEX([$military_assets.K$1:.K$1048576];[$mil_ass_us_start.$B9]) -> VTOL: Compatible with all VTOL aircraft squadrons.
Carrier 1: Can station 1 aircraft squadron. | O9: of:=INDEX([$military_assets.L$1:.L$1048576];[$mil_ass_us_start.$B9]) -> Images/wasp.jpg | P9: of:=INDEX([$military_assets.M$1:.M$1048576];[$mil_ass_us_start.$B9]) -> In addition to supporting VTOL aircraft, a Wasp amphibious assault ship is capable of delivering a Marine Expeditionary Unit complete with its armored vehicles to hostile shores via helicopters and landing craft. | Q9: of:=INDEX([$military_assets.N$1:.N$1048576];[$mil_ass_us_start.$B9]) -> 0.0.2
A10: 1 | B10: 6 | C10: USS Seawolf | D10: of:=INDEX([$military_assets.A$1:.A$1048576];[$mil_ass_us_start.$B10]) -> Seawolf Class SSN | E10: of:=INDEX([$military_assets.B$1:.B$1048576];[$mil_ass_us_start.$B10]) -> 0 | F10: of:=INDEX([$military_assets.C$1:.C$1048576];[$mil_ass_us_start.$B10]) -> 0 | G10: of:=INDEX([$military_assets.D$1:.D$1048576];[$mil_ass_us_start.$B10]) -> 0 | H10: of:=INDEX([$military_assets.E$1:.E$1048576];[$mil_ass_us_start.$B10]) -> 4 | I10: of:=INDEX([$military_assets.F$1:.F$1048576];[$mil_ass_us_start.$B10]) -> 0 | J10: of:=INDEX([$military_assets.G$1:.G$1048576];[$mil_ass_us_start.$B10]) -> 4 | K10: of:=INDEX([$military_assets.H$1:.H$1048576];[$mil_ass_us_start.$B10]) -> 5 | L10: of:=INDEX([$military_assets.I$1:.I$1048576];[$mil_ass_us_start.$B10]) -> USN | M10: of:=INDEX([$military_assets.J$1:.J$1048576];[$mil_ass_us_start.$B10]) -> Submarine | N10: of:=INDEX([$military_assets.K$1:.K$1048576];[$mil_ass_us_start.$B10]) -> Surprise Attacker: This asset deals damage during the Surprise Damage Step.
Special Purposes: Each time this military asset is flipped face up, your opponent must reveal one card from their hand at random.
Hidden: Can be played face down. 
Commerce Raider: When sieging a player directly, this military asset's siege is equal to its attack. | O10: of:=INDEX([$military_assets.L$1:.L$1048576];[$mil_ass_us_start.$B10]) -> Images/seawolf.jpg | P10: of:=INDEX([$military_assets.M$1:.M$1048576];[$mil_ass_us_start.$B10]) -> As the most expensive class of attack submarine ever built, the Seawolf is the apex predator of the US Navy's submarine fleet. | Q10: of:=INDEX([$military_assets.N$1:.N$1048576];[$mil_ass_us_start.$B10]) -> 0.0.2
A11: 1 | B11: 7 | C11: USS California | D11: of:=INDEX([$military_assets.A$1:.A$1048576];[$mil_ass_us_start.$B11]) -> Virginia Class SSN | E11: of:=INDEX([$military_assets.B$1:.B$1048576];[$mil_ass_us_start.$B11]) -> 0 | F11: of:=INDEX([$military_assets.C$1:.C$1048576];[$mil_ass_us_start.$B11]) -> 0 | G11: of:=INDEX([$military_assets.D$1:.D$1048576];[$mil_ass_us_start.$B11]) -> 0 | H11: of:=INDEX([$military_assets.E$1:.E$1048576];[$mil_ass_us_start.$B11]) -> 3 | I11: of:=INDEX([$military_assets.F$1:.F$1048576];[$mil_ass_us_start.$B11]) -> 0 | J11: of:=INDEX([$military_assets.G$1:.G$1048576];[$mil_ass_us_start.$B11]) -> 4 | K11: of:=INDEX([$military_assets.H$1:.H$1048576];[$mil_ass_us_start.$B11]) -> 4 | L11: of:=INDEX([$military_assets.I$1:.I$1048576];[$mil_ass_us_start.$B11]) -> USN | M11: of:=INDEX([$military_assets.J$1:.J$1048576];[$mil_ass_us_start.$B11]) -> Submarine | N11: of:=INDEX([$military_assets.K$1:.K$1048576];[$mil_ass_us_start.$B11]) -> Surprise Attacker: This asset deals damage during the Surprise Damage Step.
Hidden: Can be played face down. 
Commerce Raider: When sieging a player directly, this military asset's siege is equal to its attack. | O11: of:=INDEX([$military_assets.L$1:.L$1048576];[$mil_ass_us_start.$B11]) -> Images/virginia.jpg | P11: of:=INDEX([$military_assets.M$1:.M$1048576];[$mil_ass_us_start.$B11]) -> The advanced Virginia will be the standard attack submarine of the US Navy until at least the middle of the 21st century. | Q11: of:=INDEX([$military_assets.N$1:.N$1048576];[$mil_ass_us_start.$B11]) -> 0.0.2
A12: 1 | B12: 7 | C12: USS Hawaii | D12: of:=INDEX([$military_assets.A$1:.A$1048576];[$mil_ass_us_start.$B12]) -> Virginia Class SSN | E12: of:=INDEX([$military_assets.B$1:.B$1048576];[$mil_ass_us_start.$B12]) -> 0 | F12: of:=INDEX([$military_assets.C$1:.C$1048576];[$mil_ass_us_start.$B12]) -> 0 | G12: of:=INDEX([$military_assets.D$1:.D$1048576];[$mil_ass_us_start.$B12]) -> 0 | H12: of:=INDEX([$military_assets.E$1:.E$1048576];[$mil_ass_us_start.$B12]) -> 3 | I12: of:=INDEX([$military_assets.F$1:.F$1048576];[$mil_ass_us_start.$B12]) -> 0 | J12: of:=INDEX([$military_assets.G$1:.G$1048576];[$mil_ass_us_start.$B12]) -> 4 | K12: of:=INDEX([$military_assets.H$1:.H$1048576];[$mil_ass_us_start.$B12]) -> 4 | L12: of:=INDEX([$military_assets.I$1:.I$1048576];[$mil_ass_us_start.$B12]) -> USN | M12: of:=INDEX([$military_assets.J$1:.J$1048576];[$mil_ass_us_start.$B12]) -> Submarine | N12: of:=INDEX([$military_assets.K$1:.K$1048576];[$mil_ass_us_start.$B12]) -> Surprise Attacker: This asset deals damage during the Surprise Damage Step.
Hidden: Can be played face down. 
Commerce Raider: When sieging a player directly, this military asset's siege is equal to its attack. | O12: of:=INDEX([$military_assets.L$1:.L$1048576];[$mil_ass_us_start.$B12]) -> Images/virginia.jpg | P12: of:=INDEX([$military_assets.M$1:.M$1048576];[$mil_ass_us_start.$B12]) -> The advanced Virginia will be the standard attack submarine of the US Navy until at least the middle of the 21st century. | Q12: of:=INDEX([$military_assets.N$1:.N$1048576];[$mil_ass_us_start.$B12]) -> 0.0.2
A13: 1 | B13: 7 | C13: USS Mississippi | D13: of:=INDEX([$military_assets.A$1:.A$1048576];[$mil_ass_us_start.$B13]) -> Virginia Class SSN | E13: of:=INDEX([$military_assets.B$1:.B$1048576];[$mil_ass_us_start.$B13]) -> 0 | F13: of:=INDEX([$military_assets.C$1:.C$1048576];[$mil_ass_us_start.$B13]) -> 0 | G13: of:=INDEX([$military_assets.D$1:.D$1048576];[$mil_ass_us_start.$B13]) -> 0 | H13: of:=INDEX([$military_assets.E$1:.E$1048576];[$mil_ass_us_start.$B13]) -> 3 | I13: of:=INDEX([$military_assets.F$1:.F$1048576];[$mil_ass_us_start.$B13]) -> 0 | J13: of:=INDEX([$military_assets.G$1:.G$1048576];[$mil_ass_us_start.$B13]) -> 4 | K13: of:=INDEX([$military_assets.H$1:.H$1048576];[$mil_ass_us_start.$B13]) -> 4 | L13: of:=INDEX([$military_assets.I$1:.I$1048576];[$mil_ass_us_start.$B13]) -> USN | M13: of:=INDEX([$military_assets.J$1:.J$1048576];[$mil_ass_us_start.$B13]) -> Submarine | N13: of:=INDEX([$military_assets.K$1:.K$1048576];[$mil_ass_us_start.$B13]) -> Surprise Attacker: This asset deals damage during the Surprise Damage Step.
Hidden: Can be played face down. 
Commerce Raider: When sieging a player directly, this military asset's siege is equal to its attack. | O13: of:=INDEX([$military_assets.L$1:.L$1048576];[$mil_ass_us_start.$B13]) -> Images/virginia.jpg | P13: of:=INDEX([$military_assets.M$1:.M$1048576];[$mil_ass_us_start.$B13]) -> The advanced Virginia will be the standard attack submarine of the US Navy until at least the middle of the 21st century. | Q13: of:=INDEX([$military_assets.N$1:.N$1048576];[$mil_ass_us_start.$B13]) -> 0.0.2
A14: 0 | B14: 8 | C14: USS Florida | D14: of:=INDEX([$military_assets.A$1:.A$1048576];[$mil_ass_us_start.$B14]) -> Ohio Class SSGN | E14: of:=INDEX([$military_assets.B$1:.B$1048576];[$mil_ass_us_start.$B14]) -> 0 | F14: of:=INDEX([$military_assets.C$1:.C$1048576];[$mil_ass_us_start.$B14]) -> 0 | G14: of:=INDEX([$military_assets.D$1:.D$1048576];[$mil_ass_us_start.$B14]) -> 0 | H14: of:=INDEX([$military_assets.E$1:.E$1048576];[$mil_ass_us_start.$B14]) -> 3 | I14: of:=INDEX([$military_assets.F$1:.F$1048576];[$mil_ass_us_start.$B14]) -> 5 | J14: of:=INDEX([$military_assets.G$1:.G$1048576];[$mil_ass_us_start.$B14]) -> 2 | K14: of:=INDEX([$military_assets.H$1:.H$1048576];[$mil_ass_us_start.$B14]) -> 5 | L14: of:=INDEX([$military_assets.I$1:.I$1048576];[$mil_ass_us_start.$B14]) -> USN | M14: of:=INDEX([$military_assets.J$1:.J$1048576];[$mil_ass_us_start.$B14]) -> Submarine | N14: of:=INDEX([$military_assets.K$1:.K$1048576];[$mil_ass_us_start.$B14]) -> Surprise Attacker: This asset deals damage during the Surprise Damage Step.
Strategic Strike Capability: At the end of your turn, if this asset is face-up and did not take part in a combat, your opponent must discard one card from their deck.
Hidden: Can be played face down.  | O14: of:=INDEX([$military_assets.L$1:.L$1048576];[$mil_ass_us_start.$B14]) -> Images/ohio.jpg | P14: of:=INDEX([$military_assets.M$1:.M$1048576];[$mil_ass_us_start.$B14]) -> Although Ohio was originally intended to carry nuclear ballistic missiles, some Ohio's have been modified as SSGNs for surface warfare and land-attack missions. | Q14: of:=INDEX([$military_assets.N$1:.N$1048576];[$mil_ass_us_start.$B14]) -> 0.0.2
A15: 0 | B15: 8 | C15: USS Ohio | D15: of:=INDEX([$military_assets.A$1:.A$1048576];[$mil_ass_us_start.$B15]) -> Ohio Class SSGN | E15: of:=INDEX([$military_assets.B$1:.B$1048576];[$mil_ass_us_start.$B15]) -> 0 | F15: of:=INDEX([$military_assets.C$1:.C$1048576];[$mil_ass_us_start.$B15]) -> 0 | G15: of:=INDEX([$military_assets.D$1:.D$1048576];[$mil_ass_us_start.$B15]) -> 0 | H15: of:=INDEX([$military_assets.E$1:.E$1048576];[$mil_ass_us_start.$B15]) -> 3 | I15: of:=INDEX([$military_assets.F$1:.F$1048576];[$mil_ass_us_start.$B15]) -> 5 | J15: of:=INDEX([$military_assets.G$1:.G$1048576];[$mil_ass_us_start.$B15]) -> 2 | K15: of:=INDEX([$military_assets.H$1:.H$1048576];[$mil_ass_us_start.$B15]) -> 5 | L15: of:=INDEX([$military_assets.I$1:.I$1048576];[$mil_ass_us_start.$B15]) -> USN | M15: of:=INDEX([$military_assets.J$1:.J$1048576];[$mil_ass_us_start.$B15]) -> Submarine | N15: of:=INDEX([$military_assets.K$1:.K$1048576];[$mil_ass_us_start.$B15]) -> Surprise Attacker: This asset deals damage during the Surprise Damage Step.
Strategic Strike Capability: At the end of your turn, if this asset is face-up and did not take part in a combat, your opponent must discard one card from their deck.
Hidden: Can be played face down.  | O15: of:=INDEX([$military_assets.L$1:.L$1048576];[$mil_ass_us_start.$B15]) -> Images/ohio.jpg | P15: of:=INDEX([$military_assets.M$1:.M$1048576];[$mil_ass_us_start.$B15]) -> Although Ohio was originally intended to carry nuclear ballistic missiles, some Ohio's have been modified as SSGNs for surface warfare and land-attack missions. | Q15: of:=INDEX([$military_assets.N$1:.N$1048576];[$mil_ass_us_start.$B15]) -> 0.0.2
A16: 0 | B16: 9 | C16: USS Bunker Hill | D16: of:=INDEX([$military_assets.A$1:.A$1048576];[$mil_ass_us_start.$B16]) -> Ticonderoga Class CG | E16: of:=INDEX([$military_assets.B$1:.B$1048576];[$mil_ass_us_start.$B16]) -> 0 | F16: of:=INDEX([$military_assets.C$1:.C$1048576];[$mil_ass_us_start.$B16]) -> 0 | G16: of:=INDEX([$military_assets.D$1:.D$1048576];[$mil_ass_us_start.$B16]) -> 0 | H16: of:=INDEX([$military_assets.E$1:.E$1048576];[$mil_ass_us_start.$B16]) -> 2 | I16: of:=INDEX([$military_assets.F$1:.F$1048576];[$mil_ass_us_start.$B16]) -> 3 | J16: of:=INDEX([$military_assets.G$1:.G$1048576];[$mil_ass_us_start.$B16]) -> 3 | K16: of:=INDEX([$military_assets.H$1:.H$1048576];[$mil_ass_us_start.$B16]) -> 4 | L16: of:=INDEX([$military_assets.I$1:.I$1048576];[$mil_ass_us_start.$B16]) -> USN | M16: of:=INDEX([$military_assets.J$1:.J$1048576];[$mil_ass_us_start.$B16]) -> Ship | N16: of:=INDEX([$military_assets.K$1:.K$1048576];[$mil_ass_us_start.$B16]) -> AEGIS: +2 Help Defense. | O16: of:=INDEX([$military_assets.L$1:.L$1048576];[$mil_ass_us_start.$B16]) -> Images/ticonderoga.jpg | P16: of:=INDEX([$military_assets.M$1:.M$1048576];[$mil_ass_us_start.$B16]) -> Despite a modest displacement by historical standards, the Ticonderoga is the largest surface combatant in the US Navy. | Q16: of:=INDEX([$military_assets.N$1:.N$1048576];[$mil_ass_us_start.$B16]) -> 0.0.2
A17: 1 | B17: 9 | C17: USS Philippine Sea | D17: of:=INDEX([$military_assets.A$1:.A$1048576];[$mil_ass_us_start.$B17]) -> Ticonderoga Class CG | E17: of:=INDEX([$military_assets.B$1:.B$1048576];[$mil_ass_us_start.$B17]) -> 0 | F17: of:=INDEX([$military_assets.C$1:.C$1048576];[$mil_ass_us_start.$B17]) -> 0 | G17: of:=INDEX([$military_assets.D$1:.D$1048576];[$mil_ass_us_start.$B17]) -> 0 | H17: of:=INDEX([$military_assets.E$1:.E$1048576];[$mil_ass_us_start.$B17]) -> 2 | I17: of:=INDEX([$military_assets.F$1:.F$1048576];[$mil_ass_us_start.$B17]) -> 3 | J17: of:=INDEX([$military_assets.G$1:.G$1048576];[$mil_ass_us_start.$B17]) -> 3 | K17: of:=INDEX([$military_assets.H$1:.H$1048576];[$mil_ass_us_start.$B17]) -> 4 | L17: of:=INDEX([$military_assets.I$1:.I$1048576];[$mil_ass_us_start.$B17]) -> USN | M17: of:=INDEX([$military_assets.J$1:.J$1048576];[$mil_ass_us_start.$B17]) -> Ship | N17: of:=INDEX([$military_assets.K$1:.K$1048576];[$mil_ass_us_start.$B17]) -> AEGIS: +2 Help Defense. | O17: of:=INDEX([$military_assets.L$1:.L$1048576];[$mil_ass_us_start.$B17]) -> Images/ticonderoga.jpg | P17: of:=INDEX([$military_assets.M$1:.M$1048576];[$mil_ass_us_start.$B17]) -> Despite a modest displacement by historical standards, the Ticonderoga is the largest surface combatant in the US Navy. | Q17: of:=INDEX([$military_assets.N$1:.N$1048576];[$mil_ass_us_start.$B17]) -> 0.0.2
A18: 1 | B18: 9 | C18: USS Gettysburg | D18: of:=INDEX([$military_assets.A$1:.A$1048576];[$mil_ass_us_start.$B18]) -> Ticonderoga Class CG | E18: of:=INDEX([$military_assets.B$1:.B$1048576];[$mil_ass_us_start.$B18]) -> 0 | F18: of:=INDEX([$military_assets.C$1:.C$1048576];[$mil_ass_us_start.$B18]) -> 0 | G18: of:=INDEX([$military_assets.D$1:.D$1048576];[$mil_ass_us_start.$B18]) -> 0 | H18: of:=INDEX([$military_assets.E$1:.E$1048576];[$mil_ass_us_start.$B18]) -> 2 | I18: of:=INDEX([$military_assets.F$1:.F$1048576];[$mil_ass_us_start.$B18]) -> 3 | J18: of:=INDEX([$military_assets.G$1:.G$1048576];[$mil_ass_us_start.$B18]) -> 3 | K18: of:=INDEX([$military_assets.H$1:.H$1048576];[$mil_ass_us_start.$B18]) -> 4 | L18: of:=INDEX([$military_assets.I$1:.I$1048576];[$mil_ass_us_start.$B18]) -> USN | M18: of:=INDEX([$military_assets.J$1:.J$1048576];[$mil_ass_us_start.$B18]) -> Ship | N18: of:=INDEX([$military_assets.K$1:.K$1048576];[$mil_ass_us_start.$B18]) -> AEGIS: +2 Help Defense. | O18: of:=INDEX([$military_assets.L$1:.L$1048576];[$mil_ass_us_start.$B18]) -> Images/ticonderoga.jpg | P18: of:=INDEX([$military_assets.M$1:.M$1048576];[$mil_ass_us_start.$B18]) -> Despite a modest displacement by historical standards, the Ticonderoga is the largest surface combatant in the US Navy. | Q18: of:=INDEX([$military_assets.N$1:.N$1048576];[$mil_ass_us_start.$B18]) -> 0.0.2
A19: 0 | B19: 10 | C19: USS Fitzgerald | D19: of:=INDEX([$military_assets.A$1:.A$1048576];[$mil_ass_us_start.$B19]) -> Arleigh Burke Class DDG | E19: of:=INDEX([$military_assets.B$1:.B$1048576];[$mil_ass_us_start.$B19]) -> 0 | F19: of:=INDEX([$military_assets.C$1:.C$1048576];[$mil_ass_us_start.$B19]) -> 0 | G19: of:=INDEX([$military_assets.D$1:.D$1048576];[$mil_ass_us_start.$B19]) -> 0 | H19: of:=INDEX([$military_assets.E$1:.E$1048576];[$mil_ass_us_start.$B19]) -> 2 | I19: of:=INDEX([$military_assets.F$1:.F$1048576];[$mil_ass_us_start.$B19]) -> 3 | J19: of:=INDEX([$military_assets.G$1:.G$1048576];[$mil_ass_us_start.$B19]) -> 2 | K19: of:=INDEX([$military_assets.H$1:.H$1048576];[$mil_ass_us_start.$B19]) -> 3 | L19: of:=INDEX([$military_assets.I$1:.I$1048576];[$mil_ass_us_start.$B19]) -> USN | M19: of:=INDEX([$military_assets.J$1:.J$1048576];[$mil_ass_us_start.$B19]) -> Ship | N19: of:=INDEX([$military_assets.K$1:.K$1048576];[$mil_ass_us_start.$B19]) -> AEGIS: +2 Help Defense. | O19: of:=INDEX([$military_assets.L$1:.L$1048576];[$mil_ass_us_start.$B19]) -> Images/arleighburke.jpg | P19: of:=INDEX([$military_assets.M$1:.M$1048576];[$mil_ass_us_start.$B19]) -> The multi-mission-capable Arleigh Burke is the most numerous ship in and workhorse of the US Navy. | Q19: of:=INDEX([$military_assets.N$1:.N$1048576];[$mil_ass_us_start.$B19]) -> 0.0.2
A20: 1 | B20: 10 | C20: USS Cole | D20: of:=INDEX([$military_assets.A$1:.A$1048576];[$mil_ass_us_start.$B20]) -> Arleigh Burke Class DDG | E20: of:=INDEX([$military_assets.B$1:.B$1048576];[$mil_ass_us_start.$B20]) -> 0 | F20: of:=INDEX([$military_assets.C$1:.C$1048576];[$mil_ass_us_start.$B20]) -> 0 | G20: of:=INDEX([$military_assets.D$1:.D$1048576];[$mil_ass_us_start.$B20]) -> 0 | H20: of:=INDEX([$military_assets.E$1:.E$1048576];[$mil_ass_us_start.$B20]) -> 2 | I20: of:=INDEX([$military_assets.F$1:.F$1048576];[$mil_ass_us_start.$B20]) -> 3 | J20: of:=INDEX([$military_assets.G$1:.G$1048576];[$mil_ass_us_start.$B20]) -> 2 | K20: of:=INDEX([$military_assets.H$1:.H$1048576];[$mil_ass_us_start.$B20]) -> 3 | L20: of:=INDEX([$military_assets.I$1:.I$1048576];[$mil_ass_us_start.$B20]) -> USN | M20: of:=INDEX([$military_assets.J$1:.J$1048576];[$mil_ass_us_start.$B20]) -> Ship | N20: of:=INDEX([$military_assets.K$1:.K$1048576];[$mil_ass_us_start.$B20]) -> AEGIS: +2 Help Defense. | O20: of:=INDEX([$military_assets.L$1:.L$1048576];[$mil_ass_us_start.$B20]) -> Images/arleighburke.jpg | P20: of:=INDEX([$military_assets.M$1:.M$1048576];[$mil_ass_us_start.$B20]) -> The multi-mission-capable Arleigh Burke is the most numerous ship in and workhorse of the US Navy. | Q20: of:=INDEX([$military_assets.N$1:.N$1048576];[$mil_ass_us_start.$B20]) -> 0.0.2
A21: 1 | B21: 10 | C21: USS Porter | D21: of:=INDEX([$military_assets.A$1:.A$1048576];[$mil_ass_us_start.$B21]) -> Arleigh Burke Class DDG | E21: of:=INDEX([$military_assets.B$1:.B$1048576];[$mil_ass_us_start.$B21]) -> 0 | F21: of:=INDEX([$military_assets.C$1:.C$1048576];[$mil_ass_us_start.$B21]) -> 0 | G21: of:=INDEX([$military_assets.D$1:.D$1048576];[$mil_ass_us_start.$B21]) -> 0 | H21: of:=INDEX([$military_assets.E$1:.E$1048576];[$mil_ass_us_start.$B21]) -> 2 | I21: of:=INDEX([$military_assets.F$1:.F$1048576];[$mil_ass_us_start.$B21]) -> 3 | J21: of:=INDEX([$military_assets.G$1:.G$1048576];[$mil_ass_us_start.$B21]) -> 2 | K21: of:=INDEX([$military_assets.H$1:.H$1048576];[$mil_ass_us_start.$B21]) -> 3 | L21: of:=INDEX([$military_assets.I$1:.I$1048576];[$mil_ass_us_start.$B21]) -> USN | M21: of:=INDEX([$military_assets.J$1:.J$1048576];[$mil_ass_us_start.$B21]) -> Ship | N21: of:=INDEX([$military_assets.K$1:.K$1048576];[$mil_ass_us_start.$B21]) -> AEGIS: +2 Help Defense. | O21: of:=INDEX([$military_assets.L$1:.L$1048576];[$mil_ass_us_start.$B21]) -> Images/arleighburke.jpg | P21: of:=INDEX([$military_assets.M$1:.M$1048576];[$mil_ass_us_start.$B21]) -> The multi-mission-capable Arleigh Burke is the most numerous ship in and workhorse of the US Navy. | Q21: of:=INDEX([$military_assets.N$1:.N$1048576];[$mil_ass_us_start.$B21]) -> 0.0.2
A22: 1 | B22: 10 | C22: USS Spruance | D22: of:=INDEX([$military_assets.A$1:.A$1048576];[$mil_ass_us_start.$B22]) -> Arleigh Burke Class DDG | E22: of:=INDEX([$military_assets.B$1:.B$1048576];[$mil_ass_us_start.$B22]) -> 0 | F22: of:=INDEX([$military_assets.C$1:.C$1048576];[$mil_ass_us_start.$B22]) -> 0 | G22: of:=INDEX([$military_assets.D$1:.D$1048576];[$mil_ass_us_start.$B22]) -> 0 | H22: of:=INDEX([$military_assets.E$1:.E$1048576];[$mil_ass_us_start.$B22]) -> 2 | I22: of:=INDEX([$military_assets.F$1:.F$1048576];[$mil_ass_us_start.$B22]) -> 3 | J22: of:=INDEX([$military_assets.G$1:.G$1048576];[$mil_ass_us_start.$B22]) -> 2 | K22: of:=INDEX([$military_assets.H$1:.H$1048576];[$mil_ass_us_start.$B22]) -> 3 | L22: of:=INDEX([$military_assets.I$1:.I$1048576];[$mil_ass_us_start.$B22]) -> USN | M22: of:=INDEX([$military_assets.J$1:.J$1048576];[$mil_ass_us_start.$B22]) -> Ship | N22: of:=INDEX([$military_assets.K$1:.K$1048576];[$mil_ass_us_start.$B22]) -> AEGIS: +2 Help Defense. | O22: of:=INDEX([$military_assets.L$1:.L$1048576];[$mil_ass_us_start.$B22]) -> Images/arleighburke.jpg | P22: of:=INDEX([$military_assets.M$1:.M$1048576];[$mil_ass_us_start.$B22]) -> The multi-mission-capable Arleigh Burke is the most numerous ship in and workhorse of the US Navy. | Q22: of:=INDEX([$military_assets.N$1:.N$1048576];[$mil_ass_us_start.$B22]) -> 0.0.2
A23: 1 | B23: 10 | C23: USS John Paul Jones | D23: of:=INDEX([$military_assets.A$1:.A$1048576];[$mil_ass_us_start.$B23]) -> Arleigh Burke Class DDG | E23: of:=INDEX([$military_assets.B$1:.B$1048576];[$mil_ass_us_start.$B23]) -> 0 | F23: of:=INDEX([$military_assets.C$1:.C$1048576];[$mil_ass_us_start.$B23]) -> 0 | G23: of:=INDEX([$military_assets.D$1:.D$1048576];[$mil_ass_us_start.$B23]) -> 0 | H23: of:=INDEX([$military_assets.E$1:.E$1048576];[$mil_ass_us_start.$B23]) -> 2 | I23: of:=INDEX([$military_assets.F$1:.F$1048576];[$mil_ass_us_start.$B23]) -> 3 | J23: of:=INDEX([$military_assets.G$1:.G$1048576];[$mil_ass_us_start.$B23]) -> 2 | K23: of:=INDEX([$military_assets.H$1:.H$1048576];[$mil_ass_us_start.$B23]) -> 3 | L23: of:=INDEX([$military_assets.I$1:.I$1048576];[$mil_ass_us_start.$B23]) -> USN | M23: of:=INDEX([$military_assets.J$1:.J$1048576];[$mil_ass_us_start.$B23]) -> Ship | N23: of:=INDEX([$military_assets.K$1:.K$1048576];[$mil_ass_us_start.$B23]) -> AEGIS: +2 Help Defense. | O23: of:=INDEX([$military_assets.L$1:.L$1048576];[$mil_ass_us_start.$B23]) -> Images/arleighburke.jpg | P23: of:=INDEX([$military_assets.M$1:.M$1048576];[$mil_ass_us_start.$B23]) -> The multi-mission-capable Arleigh Burke is the most numerous ship in and workhorse of the US Navy. | Q23: of:=INDEX([$military_assets.N$1:.N$1048576];[$mil_ass_us_start.$B23]) -> 0.0.2
A24: 0 | B24: 11 | C24: USS Zumwalt | D24: of:=INDEX([$military_assets.A$1:.A$1048576];[$mil_ass_us_start.$B24]) -> Zumwalt Class DDG | E24: of:=INDEX([$military_assets.B$1:.B$1048576];[$mil_ass_us_start.$B24]) -> 0 | F24: of:=INDEX([$military_assets.C$1:.C$1048576];[$mil_ass_us_start.$B24]) -> 0 | G24: of:=INDEX([$military_assets.D$1:.D$1048576];[$mil_ass_us_start.$B24]) -> 0 | H24: of:=INDEX([$military_assets.E$1:.E$1048576];[$mil_ass_us_start.$B24]) -> 2 | I24: of:=INDEX([$military_assets.F$1:.F$1048576];[$mil_ass_us_start.$B24]) -> 4 | J24: of:=INDEX([$military_assets.G$1:.G$1048576];[$mil_ass_us_start.$B24]) -> 3 | K24: of:=INDEX([$military_assets.H$1:.H$1048576];[$mil_ass_us_start.$B24]) -> 3 | L24: of:=INDEX([$military_assets.I$1:.I$1048576];[$mil_ass_us_start.$B24]) -> USN | M24: of:=INDEX([$military_assets.J$1:.J$1048576];[$mil_ass_us_start.$B24]) -> Ship | N24: of:=INDEX([$military_assets.K$1:.K$1048576];[$mil_ass_us_start.$B24]) -> Hidden: Can be played face down.  | O24: of:=INDEX([$military_assets.L$1:.L$1048576];[$mil_ass_us_start.$B24]) -> Images/zumwalt.jpg | P24: of:=INDEX([$military_assets.M$1:.M$1048576];[$mil_ass_us_start.$B24]) -> With a cost of $1M per shot from its main howitzer, it is important for the crew of a Zumwalt to aim carefully. | Q24: of:=INDEX([$military_assets.N$1:.N$1048576];[$mil_ass_us_start.$B24]) -> 0.0.2
A25: 0 | B25: 11 | C25: USS Michael Monsoor | D25: of:=INDEX([$military_assets.A$1:.A$1048576];[$mil_ass_us_start.$B25]) -> Zumwalt Class DDG | E25: of:=INDEX([$military_assets.B$1:.B$1048576];[$mil_ass_us_start.$B25]) -> 0 | F25: of:=INDEX([$military_assets.C$1:.C$1048576];[$mil_ass_us_start.$B25]) -> 0 | G25: of:=INDEX([$military_assets.D$1:.D$1048576];[$mil_ass_us_start.$B25]) -> 0 | H25: of:=INDEX([$military_assets.E$1:.E$1048576];[$mil_ass_us_start.$B25]) -> 2 | I25: of:=INDEX([$military_assets.F$1:.F$1048576];[$mil_ass_us_start.$B25]) -> 4 | J25: of:=INDEX([$military_assets.G$1:.G$1048576];[$mil_ass_us_start.$B25]) -> 3 | K25: of:=INDEX([$military_assets.H$1:.H$1048576];[$mil_ass_us_start.$B25]) -> 3 | L25: of:=INDEX([$military_assets.I$1:.I$1048576];[$mil_ass_us_start.$B25]) -> USN | M25: of:=INDEX([$military_assets.J$1:.J$1048576];[$mil_ass_us_start.$B25]) -> Ship | N25: of:=INDEX([$military_assets.K$1:.K$1048576];[$mil_ass_us_start.$B25]) -> Hidden: Can be played face down.  | O25: of:=INDEX([$military_assets.L$1:.L$1048576];[$mil_ass_us_start.$B25]) -> Images/zumwalt.jpg | P25: of:=INDEX([$military_assets.M$1:.M$1048576];[$mil_ass_us_start.$B25]) -> With a cost of $1M per shot from its main howitzer, it is important for the crew of a Zumwalt to aim carefully. | Q25: of:=INDEX([$military_assets.N$1:.N$1048576];[$mil_ass_us_start.$B25]) -> 0.0.2
A26: 0 | B26: 12 | C26: Tophatters | D26: of:=INDEX([$military_assets.A$1:.A$1048576];[$mil_ass_us_start.$B26]) -> F/A-18E Superhornet | E26: of:=INDEX([$military_assets.B$1:.B$1048576];[$mil_ass_us_start.$B26]) -> 0 | F26: of:=INDEX([$military_assets.C$1:.C$1048576];[$mil_ass_us_start.$B26]) -> 0 | G26: of:=INDEX([$military_assets.D$1:.D$1048576];[$mil_ass_us_start.$B26]) -> 0 | H26: of:=INDEX([$military_assets.E$1:.E$1048576];[$mil_ass_us_start.$B26]) -> 4 | I26: of:=INDEX([$military_assets.F$1:.F$1048576];[$mil_ass_us_start.$B26]) -> 4 | J26: of:=INDEX([$military_assets.G$1:.G$1048576];[$mil_ass_us_start.$B26]) -> 3 | K26: of:=INDEX([$military_assets.H$1:.H$1048576];[$mil_ass_us_start.$B26]) -> 2 | L26: of:=INDEX([$military_assets.I$1:.I$1048576];[$mil_ass_us_start.$B26]) -> USN | M26: of:=INDEX([$military_assets.J$1:.J$1048576];[$mil_ass_us_start.$B26]) -> Squadron | N26: of:=INDEX([$military_assets.K$1:.K$1048576];[$mil_ass_us_start.$B26]) -> CATOBAR
Hidden: Can be played face down.  | O26: of:=INDEX([$military_assets.L$1:.L$1048576];[$mil_ass_us_start.$B26]) -> Images/f18.jpg | P26: of:=INDEX([$military_assets.M$1:.M$1048576];[$mil_ass_us_start.$B26]) -> The F/A-18 is one of the longest-tenured and most battle-proven multi-role carrier aircraft in the world. | Q26: of:=INDEX([$military_assets.N$1:.N$1048576];[$mil_ass_us_start.$B26]) -> 0.0.2
A27: 0 | B27: 12 | C27: Sidewinders | D27: of:=INDEX([$military_assets.A$1:.A$1048576];[$mil_ass_us_start.$B27]) -> F/A-18E Superhornet | E27: of:=INDEX([$military_assets.B$1:.B$1048576];[$mil_ass_us_start.$B27]) -> 0 | F27: of:=INDEX([$military_assets.C$1:.C$1048576];[$mil_ass_us_start.$B27]) -> 0 | G27: of:=INDEX([$military_assets.D$1:.D$1048576];[$mil_ass_us_start.$B27]) -> 0 | H27: of:=INDEX([$military_assets.E$1:.E$1048576];[$mil_ass_us_start.$B27]) -> 4 | I27: of:=INDEX([$military_assets.F$1:.F$1048576];[$mil_ass_us_start.$B27]) -> 4 | J27: of:=INDEX([$military_assets.G$1:.G$1048576];[$mil_ass_us_start.$B27]) -> 3 | K27: of:=INDEX([$military_assets.H$1:.H$1048576];[$mil_ass_us_start.$B27]) -> 2 | L27: of:=INDEX([$military_assets.I$1:.I$1048576];[$mil_ass_us_start.$B27]) -> USN | M27: of:=INDEX([$military_assets.J$1:.J$1048576];[$mil_ass_us_start.$B27]) -> Squadron | N27: of:=INDEX([$military_assets.K$1:.K$1048576];[$mil_ass_us_start.$B27]) -> CATOBAR
Hidden: Can be played face down.  | O27: of:=INDEX([$military_assets.L$1:.L$1048576];[$mil_ass_us_start.$B27]) -> Images/f18.jpg | P27: of:=INDEX([$military_assets.M$1:.M$1048576];[$mil_ass_us_start.$B27]) -> The F/A-18 is one of the longest-tenured and most battle-proven multi-role carrier aircraft in the world. | Q27: of:=INDEX([$military_assets.N$1:.N$1048576];[$mil_ass_us_start.$B27]) -> 0.0.2
A28: 1 | B28: 12 | C28: Eagles | D28: of:=INDEX([$military_assets.A$1:.A$1048576];[$mil_ass_us_start.$B28]) -> F/A-18E Superhornet | E28: of:=INDEX([$military_assets.B$1:.B$1048576];[$mil_ass_us_start.$B28]) -> 0 | F28: of:=INDEX([$military_assets.C$1:.C$1048576];[$mil_ass_us_start.$B28]) -> 0 | G28: of:=INDEX([$military_assets.D$1:.D$1048576];[$mil_ass_us_start.$B28]) -> 0 | H28: of:=INDEX([$military_assets.E$1:.E$1048576];[$mil_ass_us_start.$B28]) -> 4 | I28: of:=INDEX([$military_assets.F$1:.F$1048576];[$mil_ass_us_start.$B28]) -> 4 | J28: of:=INDEX([$military_assets.G$1:.G$1048576];[$mil_ass_us_start.$B28]) -> 3 | K28: of:=INDEX([$military_assets.H$1:.H$1048576];[$mil_ass_us_start.$B28]) -> 2 | L28: of:=INDEX([$military_assets.I$1:.I$1048576];[$mil_ass_us_start.$B28]) -> USN | M28: of:=INDEX([$military_assets.J$1:.J$1048576];[$mil_ass_us_start.$B28]) -> Squadron | N28: of:=INDEX([$military_assets.K$1:.K$1048576];[$mil_ass_us_start.$B28]) -> CATOBAR
Hidden: Can be played face down.  | O28: of:=INDEX([$military_assets.L$1:.L$1048576];[$mil_ass_us_start.$B28]) -> Images/f18.jpg | P28: of:=INDEX([$military_assets.M$1:.M$1048576];[$mil_ass_us_start.$B28]) -> The F/A-18 is one of the longest-tenured and most battle-proven multi-role carrier aircraft in the world. | Q28: of:=INDEX([$military_assets.N$1:.N$1048576];[$mil_ass_us_start.$B28]) -> 0.0.2
A29: 1 | B29: 12 | C29: Warhawks | D29: of:=INDEX([$military_assets.A$1:.A$1048576];[$mil_ass_us_start.$B29]) -> F/A-18E Superhornet | E29: of:=INDEX([$military_assets.B$1:.B$1048576];[$mil_ass_us_start.$B29]) -> 0 | F29: of:=INDEX([$military_assets.C$1:.C$1048576];[$mil_ass_us_start.$B29]) -> 0 | G29: of:=INDEX([$military_assets.D$1:.D$1048576];[$mil_ass_us_start.$B29]) -> 0 | H29: of:=INDEX([$military_assets.E$1:.E$1048576];[$mil_ass_us_start.$B29]) -> 4 | I29: of:=INDEX([$military_assets.F$1:.F$1048576];[$mil_ass_us_start.$B29]) -> 4 | J29: of:=INDEX([$military_assets.G$1:.G$1048576];[$mil_ass_us_start.$B29]) -> 3 | K29: of:=INDEX([$military_assets.H$1:.H$1048576];[$mil_ass_us_start.$B29]) -> 2 | L29: of:=INDEX([$military_assets.I$1:.I$1048576];[$mil_ass_us_start.$B29]) -> USN | M29: of:=INDEX([$military_assets.J$1:.J$1048576];[$mil_ass_us_start.$B29]) -> Squadron | N29: of:=INDEX([$military_assets.K$1:.K$1048576];[$mil_ass_us_start.$B29]) -> CATOBAR
Hidden: Can be played face down.  | O29: of:=INDEX([$military_assets.L$1:.L$1048576];[$mil_ass_us_start.$B29]) -> Images/f18.jpg | P29: of:=INDEX([$military_assets.M$1:.M$1048576];[$mil_ass_us_start.$B29]) -> The F/A-18 is one of the longest-tenured and most battle-proven multi-role carrier aircraft in the world. | Q29: of:=INDEX([$military_assets.N$1:.N$1048576];[$mil_ass_us_start.$B29]) -> 0.0.2
A30: 1 | B30: 12 | C30: Vigilantes | D30: of:=INDEX([$military_assets.A$1:.A$1048576];[$mil_ass_us_start.$B30]) -> F/A-18E Superhornet | E30: of:=INDEX([$military_assets.B$1:.B$1048576];[$mil_ass_us_start.$B30]) -> 0 | F30: of:=INDEX([$military_assets.C$1:.C$1048576];[$mil_ass_us_start.$B30]) -> 0 | G30: of:=INDEX([$military_assets.D$1:.D$1048576];[$mil_ass_us_start.$B30]) -> 0 | H30: of:=INDEX([$military_assets.E$1:.E$1048576];[$mil_ass_us_start.$B30]) -> 4 | I30: of:=INDEX([$military_assets.F$1:.F$1048576];[$mil_ass_us_start.$B30]) -> 4 | J30: of:=INDEX([$military_assets.G$1:.G$1048576];[$mil_ass_us_start.$B30]) -> 3 | K30: of:=INDEX([$military_assets.H$1:.H$1048576];[$mil_ass_us_start.$B30]) -> 2 | L30: of:=INDEX([$military_assets.I$1:.I$1048576];[$mil_ass_us_start.$B30]) -> USN | M30: of:=INDEX([$military_assets.J$1:.J$1048576];[$mil_ass_us_start.$B30]) -> Squadron | N30: of:=INDEX([$military_assets.K$1:.K$1048576];[$mil_ass_us_start.$B30]) -> CATOBAR
Hidden: Can be played face down.  | O30: of:=INDEX([$military_assets.L$1:.L$1048576];[$mil_ass_us_start.$B30]) -> Images/f18.jpg | P30: of:=INDEX([$military_assets.M$1:.M$1048576];[$mil_ass_us_start.$B30]) -> The F/A-18 is one of the longest-tenured and most battle-proven multi-role carrier aircraft in the world. | Q30: of:=INDEX([$military_assets.N$1:.N$1048576];[$mil_ass_us_start.$B30]) -> 0.0.2
A31: 0 | B31: 13 | C31: Green Knights | D31: of:=INDEX([$military_assets.A$1:.A$1048576];[$mil_ass_us_start.$B31]) -> F-35B Lightning II | E31: of:=INDEX([$military_assets.B$1:.B$1048576];[$mil_ass_us_start.$B31]) -> 0 | F31: of:=INDEX([$military_assets.C$1:.C$1048576];[$mil_ass_us_start.$B31]) -> 0 | G31: of:=INDEX([$military_assets.D$1:.D$1048576];[$mil_ass_us_start.$B31]) -> 0 | H31: of:=INDEX([$military_assets.E$1:.E$1048576];[$mil_ass_us_start.$B31]) -> 4 | I31: of:=INDEX([$military_assets.F$1:.F$1048576];[$mil_ass_us_start.$B31]) -> 3 | J31: of:=INDEX([$military_assets.G$1:.G$1048576];[$mil_ass_us_start.$B31]) -> 2 | K31: of:=INDEX([$military_assets.H$1:.H$1048576];[$mil_ass_us_start.$B31]) -> 3 | L31: of:=INDEX([$military_assets.I$1:.I$1048576];[$mil_ass_us_start.$B31]) -> USN | M31: of:=INDEX([$military_assets.J$1:.J$1048576];[$mil_ass_us_start.$B31]) -> Squadron | N31: of:=INDEX([$military_assets.K$1:.K$1048576];[$mil_ass_us_start.$B31]) -> VTOL
Hidden: Can be played face down. 
Surprise Attacker: This asset deals damage during the Surprise Damage Step. | O31: of:=INDEX([$military_assets.L$1:.L$1048576];[$mil_ass_us_start.$B31]) -> Images/f35b.jpg | P31: of:=INDEX([$military_assets.M$1:.M$1048576];[$mil_ass_us_start.$B31]) -> The F-35B is a special variant of the F-35 capable of taking off and landing vertically. This allows it to be stationed on smaller carriers that have typically not been able to field cutting-edge aircraft. | Q31: of:=INDEX([$military_assets.N$1:.N$1048576];[$mil_ass_us_start.$B31]) -> 0.0.2
A32: 0 | B32: 13 | C32: Flying Leathernecks | D32: of:=INDEX([$military_assets.A$1:.A$1048576];[$mil_ass_us_start.$B32]) -> F-35B Lightning II | E32: of:=INDEX([$military_assets.B$1:.B$1048576];[$mil_ass_us_start.$B32]) -> 0 | F32: of:=INDEX([$military_assets.C$1:.C$1048576];[$mil_ass_us_start.$B32]) -> 0 | G32: of:=INDEX([$military_assets.D$1:.D$1048576];[$mil_ass_us_start.$B32]) -> 0 | H32: of:=INDEX([$military_assets.E$1:.E$1048576];[$mil_ass_us_start.$B32]) -> 4 | I32: of:=INDEX([$military_assets.F$1:.F$1048576];[$mil_ass_us_start.$B32]) -> 3 | J32: of:=INDEX([$military_assets.G$1:.G$1048576];[$mil_ass_us_start.$B32]) -> 2 | K32: of:=INDEX([$military_assets.H$1:.H$1048576];[$mil_ass_us_start.$B32]) -> 3 | L32: of:=INDEX([$military_assets.I$1:.I$1048576];[$mil_ass_us_start.$B32]) -> USN | M32: of:=INDEX([$military_assets.J$1:.J$1048576];[$mil_ass_us_start.$B32]) -> Squadron | N32: of:=INDEX([$military_assets.K$1:.K$1048576];[$mil_ass_us_start.$B32]) -> VTOL
Hidden: Can be played face down. 
Surprise Attacker: This asset deals damage during the Surprise Damage Step. | O32: of:=INDEX([$military_assets.L$1:.L$1048576];[$mil_ass_us_start.$B32]) -> Images/f35b.jpg | P32: of:=INDEX([$military_assets.M$1:.M$1048576];[$mil_ass_us_start.$B32]) -> The F-35B is a special variant of the F-35 capable of taking off and landing vertically. This allows it to be stationed on smaller carriers that have typically not been able to field cutting-edge aircraft. | Q32: of:=INDEX([$military_assets.N$1:.N$1048576];[$mil_ass_us_start.$B32]) -> 0.0.2
A33: 0 | B33: 13 | C33: Wake Island Avengers | D33: of:=INDEX([$military_assets.A$1:.A$1048576];[$mil_ass_us_start.$B33]) -> F-35B Lightning II | E33: of:=INDEX([$military_assets.B$1:.B$1048576];[$mil_ass_us_start.$B33]) -> 0 | F33: of:=INDEX([$military_assets.C$1:.C$1048576];[$mil_ass_us_start.$B33]) -> 0 | G33: of:=INDEX([$military_assets.D$1:.D$1048576];[$mil_ass_us_start.$B33]) -> 0 | H33: of:=INDEX([$military_assets.E$1:.E$1048576];[$mil_ass_us_start.$B33]) -> 4 | I33: of:=INDEX([$military_assets.F$1:.F$1048576];[$mil_ass_us_start.$B33]) -> 3 | J33: of:=INDEX([$military_assets.G$1:.G$1048576];[$mil_ass_us_start.$B33]) -> 2 | K33: of:=INDEX([$military_assets.H$1:.H$1048576];[$mil_ass_us_start.$B33]) -> 3 | L33: of:=INDEX([$military_assets.I$1:.I$1048576];[$mil_ass_us_start.$B33]) -> USN | M33: of:=INDEX([$military_assets.J$1:.J$1048576];[$mil_ass_us_start.$B33]) -> Squadron | N33: of:=INDEX([$military_assets.K$1:.K$1048576];[$mil_ass_us_start.$B33]) -> VTOL
Hidden: Can be played face down. 
Surprise Attacker: This asset deals damage during the Surprise Damage Step. | O33: of:=INDEX([$military_assets.L$1:.L$1048576];[$mil_ass_us_start.$B33]) -> Images/f35b.jpg | P33: of:=INDEX([$military_assets.M$1:.M$1048576];[$mil_ass_us_start.$B33]) -> The F-35B is a special variant of the F-35 capable of taking off and landing vertically. This allows it to be stationed on smaller carriers that have typically not been able to field cutting-edge aircraft. | Q33: of:=INDEX([$military_assets.N$1:.N$1048576];[$mil_ass_us_start.$B33]) -> 0.0.2
A34: 1 | B34: 14 | C34: Black Knights | D34: of:=INDEX([$military_assets.A$1:.A$1048576];[$mil_ass_us_start.$B34]) -> F-35C  Lightning II | E34: of:=INDEX([$military_assets.B$1:.B$1048576];[$mil_ass_us_start.$B34]) -> 0 | F34: of:=INDEX([$military_assets.C$1:.C$1048576];[$mil_ass_us_start.$B34]) -> 0 | G34: of:=INDEX([$military_assets.D$1:.D$1048576];[$mil_ass_us_start.$B34]) -> 0 | H34: of:=INDEX([$military_assets.E$1:.E$1048576];[$mil_ass_us_start.$B34]) -> 4 | I34: of:=INDEX([$military_assets.F$1:.F$1048576];[$mil_ass_us_start.$B34]) -> 4 | J34: of:=INDEX([$military_assets.G$1:.G$1048576];[$mil_ass_us_start.$B34]) -> 2 | K34: of:=INDEX([$military_assets.H$1:.H$1048576];[$mil_ass_us_start.$B34]) -> 2 | L34: of:=INDEX([$military_assets.I$1:.I$1048576];[$mil_ass_us_start.$B34]) -> USN | M34: of:=INDEX([$military_assets.J$1:.J$1048576];[$mil_ass_us_start.$B34]) -> Squadron | N34: of:=INDEX([$military_assets.K$1:.K$1048576];[$mil_ass_us_start.$B34]) -> CATOBAR
Hidden: Can be played face down. 
Surprise Attacker: This asset deals damage during the Surprise Damage Step. | O34: of:=INDEX([$military_assets.L$1:.L$1048576];[$mil_ass_us_start.$B34]) -> Images/f35c.jpg | P34: of:=INDEX([$military_assets.M$1:.M$1048576];[$mil_ass_us_start.$B34]) -> The F-35 acquisition program cost of just under $450 billion USD would be enough to buy 450 billion $1 cheeseburgers - enough to kill all humans on earth. | Q34: of:=INDEX([$military_assets.N$1:.N$1048576];[$mil_ass_us_start.$B34]) -> 0.0.2
A35: 1 | B35: 14 | C35: Rough Raiders | D35: of:=INDEX([$military_assets.A$1:.A$1048576];[$mil_ass_us_start.$B35]) -> F-35C  Lightning II | E35: of:=INDEX([$military_assets.B$1:.B$1048576];[$mil_ass_us_start.$B35]) -> 0 | F35: of:=INDEX([$military_assets.C$1:.C$1048576];[$mil_ass_us_start.$B35]) -> 0 | G35: of:=INDEX([$military_assets.D$1:.D$1048576];[$mil_ass_us_start.$B35]) -> 0 | H35: of:=INDEX([$military_assets.E$1:.E$1048576];[$mil_ass_us_start.$B35]) -> 4 | I35: of:=INDEX([$military_assets.F$1:.F$1048576];[$mil_ass_us_start.$B35]) -> 4 | J35: of:=INDEX([$military_assets.G$1:.G$1048576];[$mil_ass_us_start.$B35]) -> 2 | K35: of:=INDEX([$military_assets.H$1:.H$1048576];[$mil_ass_us_start.$B35]) -> 2 | L35: of:=INDEX([$military_assets.I$1:.I$1048576];[$mil_ass_us_start.$B35]) -> USN | M35: of:=INDEX([$military_assets.J$1:.J$1048576];[$mil_ass_us_start.$B35]) -> Squadron | N35: of:=INDEX([$military_assets.K$1:.K$1048576];[$mil_ass_us_start.$B35]) -> CATOBAR
Hidden: Can be played face down. 
Surprise Attacker: This asset deals damage during the Surprise Damage Step. | O35: of:=INDEX([$military_assets.L$1:.L$1048576];[$mil_ass_us_start.$B35]) -> Images/f35c.jpg | P35: of:=INDEX([$military_assets.M$1:.M$1048576];[$mil_ass_us_start.$B35]) -> The F-35 acquisition program cost of just under $450 billion USD would be enough to buy 450 billion $1 cheeseburgers - enough to kill all humans on earth. | Q35: of:=INDEX([$military_assets.N$1:.N$1048576];[$mil_ass_us_start.$B35]) -> 0.0.2
A36: 1 | B36: 14 | C36: Argonauts | D36: of:=INDEX([$military_assets.A$1:.A$1048576];[$mil_ass_us_start.$B36]) -> F-35C  Lightning II | E36: of:=INDEX([$military_assets.B$1:.B$1048576];[$mil_ass_us_start.$B36]) -> 0 | F36: of:=INDEX([$military_assets.C$1:.C$1048576];[$mil_ass_us_start.$B36]) -> 0 | G36: of:=INDEX([$military_assets.D$1:.D$1048576];[$mil_ass_us_start.$B36]) -> 0 | H36: of:=INDEX([$military_assets.E$1:.E$1048576];[$mil_ass_us_start.$B36]) -> 4 | I36: of:=INDEX([$military_assets.F$1:.F$1048576];[$mil_ass_us_start.$B36]) -> 4 | J36: of:=INDEX([$military_assets.G$1:.G$1048576];[$mil_ass_us_start.$B36]) -> 2 | K36: of:=INDEX([$military_assets.H$1:.H$1048576];[$mil_ass_us_start.$B36]) -> 2 | L36: of:=INDEX([$military_assets.I$1:.I$1048576];[$mil_ass_us_start.$B36]) -> USN | M36: of:=INDEX([$military_assets.J$1:.J$1048576];[$mil_ass_us_start.$B36]) -> Squadron | N36: of:=INDEX([$military_assets.K$1:.K$1048576];[$mil_ass_us_start.$B36]) -> CATOBAR
Hidden: Can be played face down. 
Surprise Attacker: This asset deals damage during the Surprise Damage Step. | O36: of:=INDEX([$military_assets.L$1:.L$1048576];[$mil_ass_us_start.$B36]) -> Images/f35c.jpg | P36: of:=INDEX([$military_assets.M$1:.M$1048576];[$mil_ass_us_start.$B36]) -> The F-35 acquisition program cost of just under $450 billion USD would be enough to buy 450 billion $1 cheeseburgers - enough to kill all humans on earth. | Q36: of:=INDEX([$military_assets.N$1:.N$1048576];[$mil_ass_us_start.$B36]) -> 0.0.2
A37: 0 | B37: 15 | C37: Black Sheep | D37: of:=INDEX([$military_assets.A$1:.A$1048576];[$mil_ass_us_start.$B37]) -> AV-8B Harrier II | E37: of:=INDEX([$military_assets.B$1:.B$1048576];[$mil_ass_us_start.$B37]) -> 0 | F37: of:=INDEX([$military_assets.C$1:.C$1048576];[$mil_ass_us_start.$B37]) -> 0 | G37: of:=INDEX([$military_assets.D$1:.D$1048576];[$mil_ass_us_start.$B37]) -> 0 | H37: of:=INDEX([$military_assets.E$1:.E$1048576];[$mil_ass_us_start.$B37]) -> 3 | I37: of:=INDEX([$military_assets.F$1:.F$1048576];[$mil_ass_us_start.$B37]) -> 3 | J37: of:=INDEX([$military_assets.G$1:.G$1048576];[$mil_ass_us_start.$B37]) -> 2 | K37: of:=INDEX([$military_assets.H$1:.H$1048576];[$mil_ass_us_start.$B37]) -> 1 | L37: of:=INDEX([$military_assets.I$1:.I$1048576];[$mil_ass_us_start.$B37]) -> USN | M37: of:=INDEX([$military_assets.J$1:.J$1048576];[$mil_ass_us_start.$B37]) -> Squadron | N37: of:=INDEX([$military_assets.K$1:.K$1048576];[$mil_ass_us_start.$B37]) -> VTOL
Hidden: Can be played face down.  | O37: of:=INDEX([$military_assets.L$1:.L$1048576];[$mil_ass_us_start.$B37]) -> Images/harrier.jpg | P37: of:=INDEX([$military_assets.M$1:.M$1048576];[$mil_ass_us_start.$B37]) -> A Pepsi ad campaign promised to award a Harrier to anyone who collected enough Pepsi points- a promise Pepsi did not keep. During its service history, the Harrier has proven it is more reliable than Pepsi Co. | Q37: of:=INDEX([$military_assets.N$1:.N$1048576];[$mil_ass_us_start.$B37]) -> 0.0.2
A38: 0 | B38: 15 | C38: Bulldogs | D38: of:=INDEX([$military_assets.A$1:.A$1048576];[$mil_ass_us_start.$B38]) -> AV-8B Harrier II | E38: of:=INDEX([$military_assets.B$1:.B$1048576];[$mil_ass_us_start.$B38]) -> 0 | F38: of:=INDEX([$military_assets.C$1:.C$1048576];[$mil_ass_us_start.$B38]) -> 0 | G38: of:=INDEX([$military_assets.D$1:.D$1048576];[$mil_ass_us_start.$B38]) -> 0 | H38: of:=INDEX([$military_assets.E$1:.E$1048576];[$mil_ass_us_start.$B38]) -> 3 | I38: of:=INDEX([$military_assets.F$1:.F$1048576];[$mil_ass_us_start.$B38]) -> 3 | J38: of:=INDEX([$military_assets.G$1:.G$1048576];[$mil_ass_us_start.$B38]) -> 2 | K38: of:=INDEX([$military_assets.H$1:.H$1048576];[$mil_ass_us_start.$B38]) -> 1 | L38: of:=INDEX([$military_assets.I$1:.I$1048576];[$mil_ass_us_start.$B38]) -> USN | M38: of:=INDEX([$military_assets.J$1:.J$1048576];[$mil_ass_us_start.$B38]) -> Squadron | N38: of:=INDEX([$military_assets.K$1:.K$1048576];[$mil_ass_us_start.$B38]) -> VTOL
Hidden: Can be played face down.  | O38: of:=INDEX([$military_assets.L$1:.L$1048576];[$mil_ass_us_start.$B38]) -> Images/harrier.jpg | P38: of:=INDEX([$military_assets.M$1:.M$1048576];[$mil_ass_us_start.$B38]) -> A Pepsi ad campaign promised to award a Harrier to anyone who collected enough Pepsi points- a promise Pepsi did not keep. During its service history, the Harrier has proven it is more reliable than Pepsi Co. | Q38: of:=INDEX([$military_assets.N$1:.N$1048576];[$mil_ass_us_start.$B38]) -> 0.0.2
A39: 0 | B39: 15 | C39: Ace of Spades | D39: of:=INDEX([$military_assets.A$1:.A$1048576];[$mil_ass_us_start.$B39]) -> AV-8B Harrier II | E39: of:=INDEX([$military_assets.B$1:.B$1048576];[$mil_ass_us_start.$B39]) -> 0 | F39: of:=INDEX([$military_assets.C$1:.C$1048576];[$mil_ass_us_start.$B39]) -> 0 | G39: of:=INDEX([$military_assets.D$1:.D$1048576];[$mil_ass_us_start.$B39]) -> 0 | H39: of:=INDEX([$military_assets.E$1:.E$1048576];[$mil_ass_us_start.$B39]) -> 3 | I39: of:=INDEX([$military_assets.F$1:.F$1048576];[$mil_ass_us_start.$B39]) -> 3 | J39: of:=INDEX([$military_assets.G$1:.G$1048576];[$mil_ass_us_start.$B39]) -> 2 | K39: of:=INDEX([$military_assets.H$1:.H$1048576];[$mil_ass_us_start.$B39]) -> 1 | L39: of:=INDEX([$military_assets.I$1:.I$1048576];[$mil_ass_us_start.$B39]) -> USN | M39: of:=INDEX([$military_assets.J$1:.J$1048576];[$mil_ass_us_start.$B39]) -> Squadron | N39: of:=INDEX([$military_assets.K$1:.K$1048576];[$mil_ass_us_start.$B39]) -> VTOL
Hidden: Can be played face down.  | O39: of:=INDEX([$military_assets.L$1:.L$1048576];[$mil_ass_us_start.$B39]) -> Images/harrier.jpg | P39: of:=INDEX([$military_assets.M$1:.M$1048576];[$mil_ass_us_start.$B39]) -> A Pepsi ad campaign promised to award a Harrier to anyone who collected enough Pepsi points- a promise Pepsi did not keep. During its service history, the Harrier has proven it is more reliable than Pepsi Co. | Q39: of:=INDEX([$military_assets.N$1:.N$1048576];[$mil_ass_us_start.$B39]) -> 0.0.2
A40: 0 | B40: 15 | C40: Tomcats | D40: of:=INDEX([$military_assets.A$1:.A$1048576];[$mil_ass_us_start.$B40]) -> AV-8B Harrier II | E40: of:=INDEX([$military_assets.B$1:.B$1048576];[$mil_ass_us_start.$B40]) -> 0 | F40: of:=INDEX([$military_assets.C$1:.C$1048576];[$mil_ass_us_start.$B40]) -> 0 | G40: of:=INDEX([$military_assets.D$1:.D$1048576];[$mil_ass_us_start.$B40]) -> 0 | H40: of:=INDEX([$military_assets.E$1:.E$1048576];[$mil_ass_us_start.$B40]) -> 3 | I40: of:=INDEX([$military_assets.F$1:.F$1048576];[$mil_ass_us_start.$B40]) -> 3 | J40: of:=INDEX([$military_assets.G$1:.G$1048576];[$mil_ass_us_start.$B40]) -> 2 | K40: of:=INDEX([$military_assets.H$1:.H$1048576];[$mil_ass_us_start.$B40]) -> 1 | L40: of:=INDEX([$military_assets.I$1:.I$1048576];[$mil_ass_us_start.$B40]) -> USN | M40: of:=INDEX([$military_assets.J$1:.J$1048576];[$mil_ass_us_start.$B40]) -> Squadron | N40: of:=INDEX([$military_assets.K$1:.K$1048576];[$mil_ass_us_start.$B40]) -> VTOL
Hidden: Can be played face down.  | O40: of:=INDEX([$military_assets.L$1:.L$1048576];[$mil_ass_us_start.$B40]) -> Images/harrier.jpg | P40: of:=INDEX([$military_assets.M$1:.M$1048576];[$mil_ass_us_start.$B40]) -> A Pepsi ad campaign promised to award a Harrier to anyone who collected enough Pepsi points- a promise Pepsi did not keep. During its service history, the Harrier has proven it is more reliable than Pepsi Co. | Q40: of:=INDEX([$military_assets.N$1:.N$1048576];[$mil_ass_us_start.$B40]) -> 0.0.2
A41: 0 | B41: 15 | C41: Tigers | D41: of:=INDEX([$military_assets.A$1:.A$1048576];[$mil_ass_us_start.$B41]) -> AV-8B Harrier II | E41: of:=INDEX([$military_assets.B$1:.B$1048576];[$mil_ass_us_start.$B41]) -> 0 | F41: of:=INDEX([$military_assets.C$1:.C$1048576];[$mil_ass_us_start.$B41]) -> 0 | G41: of:=INDEX([$military_assets.D$1:.D$1048576];[$mil_ass_us_start.$B41]) -> 0 | H41: of:=INDEX([$military_assets.E$1:.E$1048576];[$mil_ass_us_start.$B41]) -> 3 | I41: of:=INDEX([$military_assets.F$1:.F$1048576];[$mil_ass_us_start.$B41]) -> 3 | J41: of:=INDEX([$military_assets.G$1:.G$1048576];[$mil_ass_us_start.$B41]) -> 2 | K41: of:=INDEX([$military_assets.H$1:.H$1048576];[$mil_ass_us_start.$B41]) -> 1 | L41: of:=INDEX([$military_assets.I$1:.I$1048576];[$mil_ass_us_start.$B41]) -> USN | M41: of:=INDEX([$military_assets.J$1:.J$1048576];[$mil_ass_us_start.$B41]) -> Squadron | N41: of:=INDEX([$military_assets.K$1:.K$1048576];[$mil_ass_us_start.$B41]) -> VTOL
Hidden: Can be played face down.  | O41: of:=INDEX([$military_assets.L$1:.L$1048576];[$mil_ass_us_start.$B41]) -> Images/harrier.jpg | P41: of:=INDEX([$military_assets.M$1:.M$1048576];[$mil_ass_us_start.$B41]) -> A Pepsi ad campaign promised to award a Harrier to anyone who collected enough Pepsi points- a promise Pepsi did not keep. During its service history, the Harrier has proven it is more reliable than Pepsi Co. | Q41: of:=INDEX([$military_assets.N$1:.N$1048576];[$mil_ass_us_start.$B41]) -> 0.0.2

Sheet: mil_ass_ru_start
A1: Duplication | B1: Class | C1: Name | D1: of:=[$military_assets.A1] -> Title | E1: of:=[$military_assets.B1] -> Unused0 | F1: of:=[$military_assets.C1] -> Unused1 | G1: of:=[$military_assets.D1] -> Unused2 | H1: of:=[$military_assets.E1] -> Attack | I1: of:=[$military_assets.F1] -> ShoreAttack | J1: of:=[$military_assets.G1] -> Defense | K1: of:=[$military_assets.H1] -> Logistics | L1: of:=[$military_assets.I1] -> Rosters | M1: of:=[$military_assets.J1] -> Type | N1: of:=[$military_assets.K1] -> Description | O1: of:=[$military_assets.L1] -> Image | P1: of:=[$military_assets.M1] -> FlavorText | Q1: of:=[$military_assets.N1] -> Version
A2: 0 | B2: 16 | C2: Admiral Kuznetsov | D2: of:=INDEX([$military_assets.A$1:.A$1048576];[$mil_ass_ru_start.$B2]) -> Kuznetsov Class CV | E2: of:=INDEX([$military_assets.B$1:.B$1048576];[$mil_ass_ru_start.$B2]) -> 0 | F2: of:=INDEX([$military_assets.C$1:.C$1048576];[$mil_ass_ru_start.$B2]) -> 0 | G2: of:=INDEX([$military_assets.D$1:.D$1048576];[$mil_ass_ru_start.$B2]) -> 0 | H2: of:=INDEX([$military_assets.E$1:.E$1048576];[$mil_ass_ru_start.$B2]) -> 4 | I2: of:=INDEX([$military_assets.F$1:.F$1048576];[$mil_ass_ru_start.$B2]) -> 2 | J2: of:=INDEX([$military_assets.G$1:.G$1048576];[$mil_ass_ru_start.$B2]) -> 2 | K2: of:=INDEX([$military_assets.H$1:.H$1048576];[$mil_ass_ru_start.$B2]) -> 6 | L2: of:=INDEX([$military_assets.I$1:.I$1048576];[$mil_ass_ru_start.$B2]) -> RUS | M2: of:=INDEX([$military_assets.J$1:.J$1048576];[$mil_ass_ru_start.$B2]) -> Ship | N2: of:=INDEX([$military_assets.K$1:.K$1048576];[$mil_ass_ru_start.$B2]) -> STOBAR: Compatible with STOBAR and VTOL squadrons.
Carrier 1: Can station 1 aircraft squadron.
CAP: +2 Help Defense | O2: of:=INDEX([$military_assets.L$1:.L$1048576];[$mil_ass_ru_start.$B2]) -> Images/kuznetsov.jpg | P2: of:=INDEX([$military_assets.M$1:.M$1048576];[$mil_ass_ru_start.$B2]) -> Although sold to a company in Macau supposedly for use as a floating casino, Kuznetsov's sister ship has since unsurprisingly become the first aircraft carrier of the Chinese People's Liberation Army Navy. | Q2: of:=INDEX([$military_assets.N$1:.N$1048576];[$mil_ass_ru_start.$B2]) -> 0.0.2
A3: 1 | B3: 17 | C3: Pyotr Velikiy | D3: of:=INDEX([$military_assets.A$1:.A$1048576];[$mil_ass_ru_start.$B3]) -> Kirov Class CGN | E3: of:=INDEX([$military_assets.B$1:.B$1048576];[$mil_ass_ru_start.$B3]) -> 0 | F3: of:=INDEX([$military_assets.C$1:.C$1048576];[$mil_ass_ru_start.$B3]) -> 0 | G3: of:=INDEX([$military_assets.D$1:.D$1048576];[$mil_ass_ru_start.$B3]) -> 0 | H3: of:=INDEX([$military_assets.E$1:.E$1048576];[$mil_ass_ru_start.$B3]) -> 6 | I3: of:=INDEX([$military_assets.F$1:.F$1048576];[$mil_ass_ru_start.$B3]) -> 2 | J3: of:=INDEX([$military_assets.G$1:.G$1048576];[$mil_ass_ru_start.$B3]) -> 4 | K3: of:=INDEX([$military_assets.H$1:.H$1048576];[$mil_ass_ru_start.$B3]) -> 6 | L3: of:=INDEX([$military_assets.I$1:.I$1048576];[$mil_ass_ru_start.$B3]) -> RUS | M3: of:=INDEX([$military_assets.J$1:.J$1048576];[$mil_ass_ru_start.$B3]) -> Ship | N3: of:=INDEX([$military_assets.K$1:.K$1048576];[$mil_ass_ru_start.$B3]) -> S-300: +1 Help Defense. | O3: of:=INDEX([$military_assets.L$1:.L$1048576];[$mil_ass_ru_start.$B3]) -> Images/kirov.jpg | P3: of:=INDEX([$military_assets.M$1:.M$1048576];[$mil_ass_ru_start.$B3]) -> Since the decommisioning of the last retrofitted WWII-era battleship in 1991, the Kirov has been the largest surface combatant in the world. | Q3: of:=INDEX([$military_assets.N$1:.N$1048576];[$mil_ass_ru_start.$B3]) -> 0.0.2
A4: 1 | B4: 17 | C4: Admiral Nahkimov | D4: of:=INDEX([$military_assets.A$1:.A$1048576];[$mil_ass_ru_start.$B4]) -> Kirov Class CGN | E4: of:=INDEX([$military_assets.B$1:.B$1048576];[$mil_ass_ru_start.$B4]) -> 0 | F4: of:=INDEX([$military_assets.C$1:.C$1048576];[$mil_ass_ru_start.$B4]) -> 0 | G4: of:=INDEX([$military_assets.D$1:.D$1048576];[$mil_ass_ru_start.$B4]) -> 0 | H4: of:=INDEX([$military_assets.E$1:.E$1048576];[$mil_ass_ru_start.$B4]) -> 6 | I4: of:=INDEX([$military_assets.F$1:.F$1048576];[$mil_ass_ru_start.$B4]) -> 2 | J4: of:=INDEX([$military_assets.G$1:.G$1048576];[$mil_ass_ru_start.$B4]) -> 4 | K4: of:=INDEX([$military_assets.H$1:.H$1048576];[$mil_ass_ru_start.$B4]) -> 6 | L4: of:=INDEX([$military_assets.I$1:.I$1048576];[$mil_ass_ru_start.$B4]) -> RUS | M4: of:=INDEX([$military_assets.J$1:.J$1048576];[$mil_ass_ru_start.$B4]) -> Ship | N4: of:=INDEX([$military_assets.K$1:.K$1048576];[$mil_ass_ru_start.$B4]) -> S-300: +1 Help Defense. | O4: of:=INDEX([$military_assets.L$1:.L$1048576];[$mil_ass_ru_start.$B4]) -> Images/kirov.jpg | P4: of:=INDEX([$military_assets.M$1:.M$1048576];[$mil_ass_ru_start.$B4]) -> Since the decommisioning of the last retrofitted WWII-era battleship in 1991, the Kirov has been the largest surface combatant in the world. | Q4: of:=INDEX([$military_assets.N$1:.N$1048576];[$mil_ass_ru_start.$B4]) -> 0.0.2
A5: 0 | B5: 17 | C5: Admiral Ushakov | D5: of:=INDEX([$military_assets.A$1:.A$1048576];[$mil_ass_ru_start.$B5]) -> Kirov Class CGN | E5: of:=INDEX([$military_assets.B$1:.B$1048576];[$mil_ass_ru_start.$B5]) -> 0 | F5: of:=INDEX([$military_assets.C$1:.C$1048576];[$mil_ass_ru_start.$B5]) -> 0 | G5: of:=INDEX([$military_assets.D$1:.D$1048576];[$mil_ass_ru_start.$B5]) -> 0 | H5: of:=INDEX([$military_assets.E$1:.E$1048576];[$mil_ass_ru_start.$B5]) -> 6 | I5: of:=INDEX([$military_assets.F$1:.F$1048576];[$mil_ass_ru_start.$B5]) -> 2 | J5: of:=INDEX([$military_assets.G$1:.G$1048576];[$mil_ass_ru_start.$B5]) -> 4 | K5: of:=INDEX([$military_assets.H$1:.H$1048576];[$mil_ass_ru_start.$B5]) -> 6 | L5: of:=INDEX([$military_assets.I$1:.I$1048576];[$mil_ass_ru_start.$B5]) -> RUS | M5: of:=INDEX([$military_assets.J$1:.J$1048576];[$mil_ass_ru_start.$B5]) -> Ship | N5: of:=INDEX([$military_assets.K$1:.K$1048576];[$mil_ass_ru_start.$B5]) -> S-300: +1 Help Defense. | O5: of:=INDEX([$military_assets.L$1:.L$1048576];[$mil_ass_ru_start.$B5]) -> Images/kirov.jpg | P5: of:=INDEX([$military_assets.M$1:.M$1048576];[$mil_ass_ru_start.$B5]) -> Since the decommisioning of the last retrofitted WWII-era battleship in 1991, the Kirov has been the largest surface combatant in the world. | Q5: of:=INDEX([$military_assets.N$1:.N$1048576];[$mil_ass_ru_start.$B5]) -> 0.0.2
A6: 1 | B6: 18 | C6: Marshal Ustinov | D6: of:=INDEX([$military_assets.A$1:.A$1048576];[$mil_ass_ru_start.$B6]) -> Slava Class CG | E6: of:=INDEX([$military_assets.B$1:.B$1048576];[$mil_ass_ru_start.$B6]) -> 0 | F6: of:=INDEX([$military_assets.C$1:.C$1048576];[$mil_ass_ru_start.$B6]) -> 0 | G6: of:=INDEX([$military_assets.D$1:.D$1048576];[$mil_ass_ru_start.$B6]) -> 0 | H6: of:=INDEX([$military_assets.E$1:.E$1048576];[$mil_ass_ru_start.$B6]) -> 4 | I6: of:=INDEX([$military_assets.F$1:.F$1048576];[$mil_ass_ru_start.$B6]) -> 2 | J6: of:=INDEX([$military_assets.G$1:.G$1048576];[$mil_ass_ru_start.$B6]) -> 2 | K6: of:=INDEX([$military_assets.H$1:.H$1048576];[$mil_ass_ru_start.$B6]) -> 3 | L6: of:=INDEX([$military_assets.I$1:.I$1048576];[$mil_ass_ru_start.$B6]) -> RUS | M6: of:=INDEX([$military_assets.J$1:.J$1048576];[$mil_ass_ru_start.$B6]) -> Ship | N6: of:=INDEX([$military_assets.K$1:.K$1048576];[$mil_ass_ru_start.$B6]) -> S-300: +1 Help Defense. | O6: of:=INDEX([$military_assets.L$1:.L$1048576];[$mil_ass_ru_start.$B6]) -> Images/slava.jpg | P6: of:=INDEX([$military_assets.M$1:.M$1048576];[$mil_ass_ru_start.$B6]) -> Equipped with the same massive anti-ship missiles as the Kirov class, the Slava packs a similar punch in a considerably smaller form-factor. | Q6: of:=INDEX([$military_assets.N$1:.N$1048576];[$mil_ass_ru_start.$B6]) -> 0.0.2
A7: 1 | B7: 18 | C7: Moskva | D7: of:=INDEX([$military_assets.A$1:.A$1048576];[$mil_ass_ru_start.$B7]) -> Slava Class CG | E7: of:=INDEX([$military_assets.B$1:.B$1048576];[$mil_ass_ru_start.$B7]) -> 0 | F7: of:=INDEX([$military_assets.C$1:.C$1048576];[$mil_ass_ru_start.$B7]) -> 0 | G7: of:=INDEX([$military_assets.D$1:.D$1048576];[$mil_ass_ru_start.$B7]) -> 0 | H7: of:=INDEX([$military_assets.E$1:.E$1048576];[$mil_ass_ru_start.$B7]) -> 4 | I7: of:=INDEX([$military_assets.F$1:.F$1048576];[$mil_ass_ru_start.$B7]) -> 2 | J7: of:=INDEX([$military_assets.G$1:.G$1048576];[$mil_ass_ru_start.$B7]) -> 2 | K7: of:=INDEX([$military_assets.H$1:.H$1048576];[$mil_ass_ru_start.$B7]) -> 3 | L7: of:=INDEX([$military_assets.I$1:.I$1048576];[$mil_ass_ru_start.$B7]) -> RUS | M7: of:=INDEX([$military_assets.J$1:.J$1048576];[$mil_ass_ru_start.$B7]) -> Ship | N7: of:=INDEX([$military_assets.K$1:.K$1048576];[$mil_ass_ru_start.$B7]) -> S-300: +1 Help Defense. | O7: of:=INDEX([$military_assets.L$1:.L$1048576];[$mil_ass_ru_start.$B7]) -> Images/slava.jpg | P7: of:=INDEX([$military_assets.M$1:.M$1048576];[$mil_ass_ru_start.$B7]) -> Equipped with the same massive anti-ship missiles as the Kirov class, the Slava packs a similar punch in a considerably smaller form-factor. | Q7: of:=INDEX([$military_assets.N$1:.N$1048576];[$mil_ass_ru_start.$B7]) -> 0.0.2
A8: 1 | B8: 18 | C8: Varyag | D8: of:=INDEX([$military_assets.A$1:.A$1048576];[$mil_ass_ru_start.$B8]) -> Slava Class CG | E8: of:=INDEX([$military_assets.B$1:.B$1048576];[$mil_ass_ru_start.$B8]) -> 0 | F8: of:=INDEX([$military_assets.C$1:.C$1048576];[$mil_ass_ru_start.$B8]) -> 0 | G8: of:=INDEX([$military_assets.D$1:.D$1048576];[$mil_ass_ru_start.$B8]) -> 0 | H8: of:=INDEX([$military_assets.E$1:.E$1048576];[$mil_ass_ru_start.$B8]) -> 4 | I8: of:=INDEX([$military_assets.F$1:.F$1048576];[$mil_ass_ru_start.$B8]) -> 2 | J8: of:=INDEX([$military_assets.G$1:.G$1048576];[$mil_ass_ru_start.$B8]) -> 2 | K8: of:=INDEX([$military_assets.H$1:.H$1048576];[$mil_ass_ru_start.$B8]) -> 3 | L8: of:=INDEX([$military_assets.I$1:.I$1048576];[$mil_ass_ru_start.$B8]) -> RUS | M8: of:=INDEX([$military_assets.J$1:.J$1048576];[$mil_ass_ru_start.$B8]) -> Ship | N8: of:=INDEX([$military_assets.K$1:.K$1048576];[$mil_ass_ru_start.$B8]) -> S-300: +1 Help Defense. | O8: of:=INDEX([$military_assets.L$1:.L$1048576];[$mil_ass_ru_start.$B8]) -> Images/slava.jpg | P8: of:=INDEX([$military_assets.M$1:.M$1048576];[$mil_ass_ru_start.$B8]) -> Equipped with the same massive anti-ship missiles as the Kirov class, the Slava packs a similar punch in a considerably smaller form-factor. | Q8: of:=INDEX([$military_assets.N$1:.N$1048576];[$mil_ass_ru_start.$B8]) -> 0.0.2
A9: 0 | B9: 18 | C9: Sevastopol | D9: of:=INDEX([$military_assets.A$1:.A$1048576];[$mil_ass_ru_start.$B9]) -> Slava Class CG | E9: of:=INDEX([$military_assets.B$1:.B$1048576];[$mil_ass_ru_start.$B9]) -> 0 | F9: of:=INDEX([$military_assets.C$1:.C$1048576];[$mil_ass_ru_start.$B9]) -> 0 | G9: of:=INDEX([$military_assets.D$1:.D$1048576];[$mil_ass_ru_start.$B9]) -> 0 | H9: of:=INDEX([$military_assets.E$1:.E$1048576];[$mil_ass_ru_start.$B9]) -> 4 | I9: of:=INDEX([$military_assets.F$1:.F$1048576];[$mil_ass_ru_start.$B9]) -> 2 | J9: of:=INDEX([$military_assets.G$1:.G$1048576];[$mil_ass_ru_start.$B9]) -> 2 | K9: of:=INDEX([$military_assets.H$1:.H$1048576];[$mil_ass_ru_start.$B9]) -> 3 | L9: of:=INDEX([$military_assets.I$1:.I$1048576];[$mil_ass_ru_start.$B9]) -> RUS | M9: of:=INDEX([$military_assets.J$1:.J$1048576];[$mil_ass_ru_start.$B9]) -> Ship | N9: of:=INDEX([$military_assets.K$1:.K$1048576];[$mil_ass_ru_start.$B9]) -> S-300: +1 Help Defense. | O9: of:=INDEX([$military_assets.L$1:.L$1048576];[$mil_ass_ru_start.$B9]) -> Images/slava.jpg | P9: of:=INDEX([$military_assets.M$1:.M$1048576];[$mil_ass_ru_start.$B9]) -> Equipped with the same massive anti-ship missiles as the Kirov class, the Slava packs a similar punch in a considerably smaller form-factor. | Q9: of:=INDEX([$military_assets.N$1:.N$1048576];[$mil_ass_ru_start.$B9]) -> 0.0.2
A10: 1 | B10: 19 | C10: Admiral Chabenenko | D10: of:=INDEX([$military_assets.A$1:.A$1048576];[$mil_ass_ru_start.$B10]) -> Udaloy II Class DDG | E10: of:=INDEX([$military_assets.B$1:.B$1048576];[$mil_ass_ru_start.$B10]) -> 0 | F10: of:=INDEX([$military_assets.C$1:.C$1048576];[$mil_ass_ru_start.$B10]) -> 0 | G10: of:=INDEX([$military_assets.D$1:.D$1048576];[$mil_ass_ru_start.$B10]) -> 0 | H10: of:=INDEX([$military_assets.E$1:.E$1048576];[$mil_ass_ru_start.$B10]) -> 3 | I10: of:=INDEX([$military_assets.F$1:.F$1048576];[$mil_ass_ru_start.$B10]) -> 2 | J10: of:=INDEX([$military_assets.G$1:.G$1048576];[$mil_ass_ru_start.$B10]) -> 3 | K10: of:=INDEX([$military_assets.H$1:.H$1048576];[$mil_ass_ru_start.$B10]) -> 2 | L10: of:=INDEX([$military_assets.I$1:.I$1048576];[$mil_ass_ru_start.$B10]) -> RUS | M10: of:=INDEX([$military_assets.J$1:.J$1048576];[$mil_ass_ru_start.$B10]) -> Ship | N10: of:=INDEX([$military_assets.K$1:.K$1048576];[$mil_ass_ru_start.$B10]) -> 
 | O10: of:=INDEX([$military_assets.L$1:.L$1048576];[$mil_ass_ru_start.$B10]) -> Images/udaloy.jpg | P10: of:=INDEX([$military_assets.M$1:.M$1048576];[$mil_ass_ru_start.$B10]) -> Udaloy II: the ship so nice they designed it twice. | Q10: of:=INDEX([$military_assets.N$1:.N$1048576];[$mil_ass_ru_start.$B10]) -> 0.0.2
A11: 1 | B11: 19 | C11: Admiral Panteleyev | D11: of:=INDEX([$military_assets.A$1:.A$1048576];[$mil_ass_ru_start.$B11]) -> Udaloy II Class DDG | E11: of:=INDEX([$military_assets.B$1:.B$1048576];[$mil_ass_ru_start.$B11]) -> 0 | F11: of:=INDEX([$military_assets.C$1:.C$1048576];[$mil_ass_ru_start.$B11]) -> 0 | G11: of:=INDEX([$military_assets.D$1:.D$1048576];[$mil_ass_ru_start.$B11]) -> 0 | H11: of:=INDEX([$military_assets.E$1:.E$1048576];[$mil_ass_ru_start.$B11]) -> 3 | I11: of:=INDEX([$military_assets.F$1:.F$1048576];[$mil_ass_ru_start.$B11]) -> 2 | J11: of:=INDEX([$military_assets.G$1:.G$1048576];[$mil_ass_ru_start.$B11]) -> 3 | K11: of:=INDEX([$military_assets.H$1:.H$1048576];[$mil_ass_ru_start.$B11]) -> 2 | L11: of:=INDEX([$military_assets.I$1:.I$1048576];[$mil_ass_ru_start.$B11]) -> RUS | M11: of:=INDEX([$military_assets.J$1:.J$1048576];[$mil_ass_ru_start.$B11]) -> Ship | N11: of:=INDEX([$military_assets.K$1:.K$1048576];[$mil_ass_ru_start.$B11]) -> 
 | O11: of:=INDEX([$military_assets.L$1:.L$1048576];[$mil_ass_ru_start.$B11]) -> Images/udaloy.jpg | P11: of:=INDEX([$military_assets.M$1:.M$1048576];[$mil_ass_ru_start.$B11]) -> Udaloy II: the ship so nice they designed it twice. | Q11: of:=INDEX([$military_assets.N$1:.N$1048576];[$mil_ass_ru_start.$B11]) -> 0.0.2
A12: 1 | B12: 19 | C12: Admiral Levchenko | D12: of:=INDEX([$military_assets.A$1:.A$1048576];[$mil_ass_ru_start.$B12]) -> Udaloy II Class DDG | E12: of:=INDEX([$military_assets.B$1:.B$1048576];[$mil_ass_ru_start.$B12]) -> 0 | F12: of:=INDEX([$military_assets.C$1:.C$1048576];[$mil_ass_ru_start.$B12]) -> 0 | G12: of:=INDEX([$military_assets.D$1:.D$1048576];[$mil_ass_ru_start.$B12]) -> 0 | H12: of:=INDEX([$military_assets.E$1:.E$1048576];[$mil_ass_ru_start.$B12]) -> 3 | I12: of:=INDEX([$military_assets.F$1:.F$1048576];[$mil_ass_ru_start.$B12]) -> 2 | J12: of:=INDEX([$military_assets.G$1:.G$1048576];[$mil_ass_ru_start.$B12]) -> 3 | K12: of:=INDEX([$military_assets.H$1:.H$1048576];[$mil_ass_ru_start.$B12]) -> 2 | L12: of:=INDEX([$military_assets.I$1:.I$1048576];[$mil_ass_ru_start.$B12]) -> RUS | M12: of:=INDEX([$military_assets.J$1:.J$1048576];[$mil_ass_ru_start.$B12]) -> Ship | N12: of:=INDEX([$military_assets.K$1:.K$1048576];[$mil_ass_ru_start.$B12]) -> 
 | O12: of:=INDEX([$military_assets.L$1:.L$1048576];[$mil_ass_ru_start.$B12]) -> Images/udaloy.jpg | P12: of:=INDEX([$military_assets.M$1:.M$1048576];[$mil_ass_ru_start.$B12]) -> Udaloy II: the ship so nice they designed it twice. | Q12: of:=INDEX([$military_assets.N$1:.N$1048576];[$mil_ass_ru_start.$B12]) -> 0.0.2
A13: 0 | B13: 19 | C13: Admiral Vinogradov | D13: of:=INDEX([$military_assets.A$1:.A$1048576];[$mil_ass_ru_start.$B13]) -> Udaloy II Class DDG | E13: of:=INDEX([$military_assets.B$1:.B$1048576];[$mil_ass_ru_start.$B13]) -> 0 | F13: of:=INDEX([$military_assets.C$1:.C$1048576];[$mil_ass_ru_start.$B13]) -> 0 | G13: of:=INDEX([$military_assets.D$1:.D$1048576];[$mil_ass_ru_start.$B13]) -> 0 | H13: of:=INDEX([$military_assets.E$1:.E$1048576];[$mil_ass_ru_start.$B13]) -> 3 | I13: of:=INDEX([$military_assets.F$1:.F$1048576];[$mil_ass_ru_start.$B13]) -> 2 | J13: of:=INDEX([$military_assets.G$1:.G$1048576];[$mil_ass_ru_start.$B13]) -> 3 | K13: of:=INDEX([$military_assets.H$1:.H$1048576];[$mil_ass_ru_start.$B13]) -> 2 | L13: of:=INDEX([$military_assets.I$1:.I$1048576];[$mil_ass_ru_start.$B13]) -> RUS | M13: of:=INDEX([$military_assets.J$1:.J$1048576];[$mil_ass_ru_start.$B13]) -> Ship | N13: of:=INDEX([$military_assets.K$1:.K$1048576];[$mil_ass_ru_start.$B13]) -> 
 | O13: of:=INDEX([$military_assets.L$1:.L$1048576];[$mil_ass_ru_start.$B13]) -> Images/udaloy.jpg | P13: of:=INDEX([$military_assets.M$1:.M$1048576];[$mil_ass_ru_start.$B13]) -> Udaloy II: the ship so nice they designed it twice. | Q13: of:=INDEX([$military_assets.N$1:.N$1048576];[$mil_ass_ru_start.$B13]) -> 0.0.2
A14: 0 | B14: 19 | C14: Severomorsk | D14: of:=INDEX([$military_assets.A$1:.A$1048576];[$mil_ass_ru_start.$B14]) -> Udaloy II Class DDG | E14: of:=INDEX([$military_assets.B$1:.B$1048576];[$mil_ass_ru_start.$B14]) -> 0 | F14: of:=INDEX([$military_assets.C$1:.C$1048576];[$mil_ass_ru_start.$B14]) -> 0 | G14: of:=INDEX([$military_assets.D$1:.D$1048576];[$mil_ass_ru_start.$B14]) -> 0 | H14: of:=INDEX([$military_assets.E$1:.E$1048576];[$mil_ass_ru_start.$B14]) -> 3 | I14: of:=INDEX([$military_assets.F$1:.F$1048576];[$mil_ass_ru_start.$B14]) -> 2 | J14: of:=INDEX([$military_assets.G$1:.G$1048576];[$mil_ass_ru_start.$B14]) -> 3 | K14: of:=INDEX([$military_assets.H$1:.H$1048576];[$mil_ass_ru_start.$B14]) -> 2 | L14: of:=INDEX([$military_assets.I$1:.I$1048576];[$mil_ass_ru_start.$B14]) -> RUS | M14: of:=INDEX([$military_assets.J$1:.J$1048576];[$mil_ass_ru_start.$B14]) -> Ship | N14: of:=INDEX([$military_assets.K$1:.K$1048576];[$mil_ass_ru_start.$B14]) -> 
 | O14: of:=INDEX([$military_assets.L$1:.L$1048576];[$mil_ass_ru_start.$B14]) -> Images/udaloy.jpg | P14: of:=INDEX([$military_assets.M$1:.M$1048576];[$mil_ass_ru_start.$B14]) -> Udaloy II: the ship so nice they designed it twice. | Q14: of:=INDEX([$military_assets.N$1:.N$1048576];[$mil_ass_ru_start.$B14]) -> 0.0.2
A15: 0 | B15: 19 | C15: Admiral Shaposhnikov | D15: of:=INDEX([$military_assets.A$1:.A$1048576];[$mil_ass_ru_start.$B15]) -> Udaloy II Class DDG | E15: of:=INDEX([$military_assets.B$1:.B$1048576];[$mil_ass_ru_start.$B15]) -> 0 | F15: of:=INDEX([$military_assets.C$1:.C$1048576];[$mil_ass_ru_start.$B15]) -> 0 | G15: of:=INDEX([$military_assets.D$1:.D$1048576];[$mil_ass_ru_start.$B15]) -> 0 | H15: of:=INDEX([$military_assets.E$1:.E$1048576];[$mil_ass_ru_start.$B15]) -> 3 | I15: of:=INDEX([$military_assets.F$1:.F$1048576];[$mil_ass_ru_start.$B15]) -> 2 | J15: of:=INDEX([$military_assets.G$1:.G$1048576];[$mil_ass_ru_start.$B15]) -> 3 | K15: of:=INDEX([$military_assets.H$1:.H$1048576];[$mil_ass_ru_start.$B15]) -> 2 | L15: of:=INDEX([$military_assets.I$1:.I$1048576];[$mil_ass_ru_start.$B15]) -> RUS | M15: of:=INDEX([$military_assets.J$1:.J$1048576];[$mil_ass_ru_start.$B15]) -> Ship | N15: of:=INDEX([$military_assets.K$1:.K$1048576];[$mil_ass_ru_start.$B15]) -> 
 | O15: of:=INDEX([$military_assets.L$1:.L$1048576];[$mil_ass_ru_start.$B15]) -> Images/udaloy.jpg | P15: of:=INDEX([$military_assets.M$1:.M$1048576];[$mil_ass_ru_start.$B15]) -> Udaloy II: the ship so nice they designed it twice. | Q15: of:=INDEX([$military_assets.N$1:.N$1048576];[$mil_ass_ru_start.$B15]) -> 0.0.2
A16: 1 | B16: 28 | C16: Bystryy | D16: of:=INDEX([$military_assets.A$1:.A$1048576];[$mil_ass_ru_start.$B16]) -> Sovremanny Class DDG | E16: of:=INDEX([$military_assets.B$1:.B$1048576];[$mil_ass_ru_start.$B16]) -> 0 | F16: of:=INDEX([$military_assets.C$1:.C$1048576];[$mil_ass_ru_start.$B16]) -> 0 | G16: of:=INDEX([$military_assets.D$1:.D$1048576];[$mil_ass_ru_start.$B16]) -> 0 | H16: of:=INDEX([$military_assets.E$1:.E$1048576];[$mil_ass_ru_start.$B16]) -> 2 | I16: of:=INDEX([$military_assets.F$1:.F$1048576];[$mil_ass_ru_start.$B16]) -> 0 | J16: of:=INDEX([$military_assets.G$1:.G$1048576];[$mil_ass_ru_start.$B16]) -> 2 | K16: of:=INDEX([$military_assets.H$1:.H$1048576];[$mil_ass_ru_start.$B16]) -> 1 | L16: of:=INDEX([$military_assets.I$1:.I$1048576];[$mil_ass_ru_start.$B16]) -> RUS | M16: of:=INDEX([$military_assets.J$1:.J$1048576];[$mil_ass_ru_start.$B16]) -> Ship | N16: of:=INDEX([$military_assets.K$1:.K$1048576];[$mil_ass_ru_start.$B16]) -> 
 | O16: of:=INDEX([$military_assets.L$1:.L$1048576];[$mil_ass_ru_start.$B16]) -> Images/sovremenny.jpg | P16: of:=INDEX([$military_assets.M$1:.M$1048576];[$mil_ass_ru_start.$B16]) -> Despite a name that means "modern" in Russian, they are the oldest class of destroyer in the Russian Navy. | Q16: of:=INDEX([$military_assets.N$1:.N$1048576];[$mil_ass_ru_start.$B16]) -> 0.0.2
A17: 0 | B17: 28 | C17: Nastoychivyy | D17: of:=INDEX([$military_assets.A$1:.A$1048576];[$mil_ass_ru_start.$B17]) -> Sovremanny Class DDG | E17: of:=INDEX([$military_assets.B$1:.B$1048576];[$mil_ass_ru_start.$B17]) -> 0 | F17: of:=INDEX([$military_assets.C$1:.C$1048576];[$mil_ass_ru_start.$B17]) -> 0 | G17: of:=INDEX([$military_assets.D$1:.D$1048576];[$mil_ass_ru_start.$B17]) -> 0 | H17: of:=INDEX([$military_assets.E$1:.E$1048576];[$mil_ass_ru_start.$B17]) -> 2 | I17: of:=INDEX([$military_assets.F$1:.F$1048576];[$mil_ass_ru_start.$B17]) -> 0 | J17: of:=INDEX([$military_assets.G$1:.G$1048576];[$mil_ass_ru_start.$B17]) -> 2 | K17: of:=INDEX([$military_assets.H$1:.H$1048576];[$mil_ass_ru_start.$B17]) -> 1 | L17: of:=INDEX([$military_assets.I$1:.I$1048576];[$mil_ass_ru_start.$B17]) -> RUS | M17: of:=INDEX([$military_assets.J$1:.J$1048576];[$mil_ass_ru_start.$B17]) -> Ship | N17: of:=INDEX([$military_assets.K$1:.K$1048576];[$mil_ass_ru_start.$B17]) -> 
 | O17: of:=INDEX([$military_assets.L$1:.L$1048576];[$mil_ass_ru_start.$B17]) -> Images/sovremenny.jpg | P17: of:=INDEX([$military_assets.M$1:.M$1048576];[$mil_ass_ru_start.$B17]) -> Despite a name that means "modern" in Russian, they are the oldest class of destroyer in the Russian Navy. | Q17: of:=INDEX([$military_assets.N$1:.N$1048576];[$mil_ass_ru_start.$B17]) -> 0.0.2
A18: 0 | B18: 28 | C18: Admiral Ushakov | D18: of:=INDEX([$military_assets.A$1:.A$1048576];[$mil_ass_ru_start.$B18]) -> Sovremanny Class DDG | E18: of:=INDEX([$military_assets.B$1:.B$1048576];[$mil_ass_ru_start.$B18]) -> 0 | F18: of:=INDEX([$military_assets.C$1:.C$1048576];[$mil_ass_ru_start.$B18]) -> 0 | G18: of:=INDEX([$military_assets.D$1:.D$1048576];[$mil_ass_ru_start.$B18]) -> 0 | H18: of:=INDEX([$military_assets.E$1:.E$1048576];[$mil_ass_ru_start.$B18]) -> 2 | I18: of:=INDEX([$military_assets.F$1:.F$1048576];[$mil_ass_ru_start.$B18]) -> 0 | J18: of:=INDEX([$military_assets.G$1:.G$1048576];[$mil_ass_ru_start.$B18]) -> 2 | K18: of:=INDEX([$military_assets.H$1:.H$1048576];[$mil_ass_ru_start.$B18]) -> 1 | L18: of:=INDEX([$military_assets.I$1:.I$1048576];[$mil_ass_ru_start.$B18]) -> RUS | M18: of:=INDEX([$military_assets.J$1:.J$1048576];[$mil_ass_ru_start.$B18]) -> Ship | N18: of:=INDEX([$military_assets.K$1:.K$1048576];[$mil_ass_ru_start.$B18]) -> 
 | O18: of:=INDEX([$military_assets.L$1:.L$1048576];[$mil_ass_ru_start.$B18]) -> Images/sovremenny.jpg | P18: of:=INDEX([$military_assets.M$1:.M$1048576];[$mil_ass_ru_start.$B18]) -> Despite a name that means "modern" in Russian, they are the oldest class of destroyer in the Russian Navy. | Q18: of:=INDEX([$military_assets.N$1:.N$1048576];[$mil_ass_ru_start.$B18]) -> 0.0.2
A19: 0 | B19: 28 | C19: Burnyy | D19: of:=INDEX([$military_assets.A$1:.A$1048576];[$mil_ass_ru_start.$B19]) -> Sovremanny Class DDG | E19: of:=INDEX([$military_assets.B$1:.B$1048576];[$mil_ass_ru_start.$B19]) -> 0 | F19: of:=INDEX([$military_assets.C$1:.C$1048576];[$mil_ass_ru_start.$B19]) -> 0 | G19: of:=INDEX([$military_assets.D$1:.D$1048576];[$mil_ass_ru_start.$B19]) -> 0 | H19: of:=INDEX([$military_assets.E$1:.E$1048576];[$mil_ass_ru_start.$B19]) -> 2 | I19: of:=INDEX([$military_assets.F$1:.F$1048576];[$mil_ass_ru_start.$B19]) -> 0 | J19: of:=INDEX([$military_assets.G$1:.G$1048576];[$mil_ass_ru_start.$B19]) -> 2 | K19: of:=INDEX([$military_assets.H$1:.H$1048576];[$mil_ass_ru_start.$B19]) -> 1 | L19: of:=INDEX([$military_assets.I$1:.I$1048576];[$mil_ass_ru_start.$B19]) -> RUS | M19: of:=INDEX([$military_assets.J$1:.J$1048576];[$mil_ass_ru_start.$B19]) -> Ship | N19: of:=INDEX([$military_assets.K$1:.K$1048576];[$mil_ass_ru_start.$B19]) -> 
 | O19: of:=INDEX([$military_assets.L$1:.L$1048576];[$mil_ass_ru_start.$B19]) -> Images/sovremenny.jpg | P19: of:=INDEX([$military_assets.M$1:.M$1048576];[$mil_ass_ru_start.$B19]) -> Despite a name that means "modern" in Russian, they are the oldest class of destroyer in the Russian Navy. | Q19: of:=INDEX([$military_assets.N$1:.N$1048576];[$mil_ass_ru_start.$B19]) -> 0.0.2
A20: 0 | B20: 20 | C20: Admiral Kasatanov | D20: of:=INDEX([$military_assets.A$1:.A$1048576];[$mil_ass_ru_start.$B20]) -> Gorshkov Class FFG | E20: of:=INDEX([$military_assets.B$1:.B$1048576];[$mil_ass_ru_start.$B20]) -> 0 | F20: of:=INDEX([$military_assets.C$1:.C$1048576];[$mil_ass_ru_start.$B20]) -> 0 | G20: of:=INDEX([$military_assets.D$1:.D$1048576];[$mil_ass_ru_start.$B20]) -> 0 | H20: of:=INDEX([$military_assets.E$1:.E$1048576];[$mil_ass_ru_start.$B20]) -> 3 | I20: of:=INDEX([$military_assets.F$1:.F$1048576];[$mil_ass_ru_start.$B20]) -> 2 | J20: of:=INDEX([$military_assets.G$1:.G$1048576];[$mil_ass_ru_start.$B20]) -> 2 | K20: of:=INDEX([$military_assets.H$1:.H$1048576];[$mil_ass_ru_start.$B20]) -> 2 | L20: of:=INDEX([$military_assets.I$1:.I$1048576];[$mil_ass_ru_start.$B20]) -> RUS | M20: of:=INDEX([$military_assets.J$1:.J$1048576];[$mil_ass_ru_start.$B20]) -> Ship | N20: of:=INDEX([$military_assets.K$1:.K$1048576];[$mil_ass_ru_start.$B20]) -> Hidden: Can be played face down.  | O20: of:=INDEX([$military_assets.L$1:.L$1048576];[$mil_ass_ru_start.$B20]) -> Images/gorshkov.jpg | P20: of:=INDEX([$military_assets.M$1:.M$1048576];[$mil_ass_ru_start.$B20]) -> The cutting-edge Gorshkov frigates stick out in the largely-outdated Russian surface warfare fleet. | Q20: of:=INDEX([$military_assets.N$1:.N$1048576];[$mil_ass_ru_start.$B20]) -> 0.0.2
A21: 0 | B21: 20 | C21: Admiral Gorshkov | D21: of:=INDEX([$military_assets.A$1:.A$1048576];[$mil_ass_ru_start.$B21]) -> Gorshkov Class FFG | E21: of:=INDEX([$military_assets.B$1:.B$1048576];[$mil_ass_ru_start.$B21]) -> 0 | F21: of:=INDEX([$military_assets.C$1:.C$1048576];[$mil_ass_ru_start.$B21]) -> 0 | G21: of:=INDEX([$military_assets.D$1:.D$1048576];[$mil_ass_ru_start.$B21]) -> 0 | H21: of:=INDEX([$military_assets.E$1:.E$1048576];[$mil_ass_ru_start.$B21]) -> 3 | I21: of:=INDEX([$military_assets.F$1:.F$1048576];[$mil_ass_ru_start.$B21]) -> 2 | J21: of:=INDEX([$military_assets.G$1:.G$1048576];[$mil_ass_ru_start.$B21]) -> 2 | K21: of:=INDEX([$military_assets.H$1:.H$1048576];[$mil_ass_ru_start.$B21]) -> 2 | L21: of:=INDEX([$military_assets.I$1:.I$1048576];[$mil_ass_ru_start.$B21]) -> RUS | M21: of:=INDEX([$military_assets.J$1:.J$1048576];[$mil_ass_ru_start.$B21]) -> Ship | N21: of:=INDEX([$military_assets.K$1:.K$1048576];[$mil_ass_ru_start.$B21]) -> Hidden: Can be played face down.  | O21: of:=INDEX([$military_assets.L$1:.L$1048576];[$mil_ass_ru_start.$B21]) -> Images/gorshkov.jpg | P21: of:=INDEX([$military_assets.M$1:.M$1048576];[$mil_ass_ru_start.$B21]) -> The cutting-edge Gorshkov frigates stick out in the largely-outdated Russian surface warfare fleet. | Q21: of:=INDEX([$military_assets.N$1:.N$1048576];[$mil_ass_ru_start.$B21]) -> 0.0.2
A22: 1 | B22: 21 | C22: Novosibirsk | D22: of:=INDEX([$military_assets.A$1:.A$1048576];[$mil_ass_ru_start.$B22]) -> Yasen Class SSGN | E22: of:=INDEX([$military_assets.B$1:.B$1048576];[$mil_ass_ru_start.$B22]) -> 0 | F22: of:=INDEX([$military_assets.C$1:.C$1048576];[$mil_ass_ru_start.$B22]) -> 0 | G22: of:=INDEX([$military_assets.D$1:.D$1048576];[$mil_ass_ru_start.$B22]) -> 0 | H22: of:=INDEX([$military_assets.E$1:.E$1048576];[$mil_ass_ru_start.$B22]) -> 5 | I22: of:=INDEX([$military_assets.F$1:.F$1048576];[$mil_ass_ru_start.$B22]) -> 0 | J22: of:=INDEX([$military_assets.G$1:.G$1048576];[$mil_ass_ru_start.$B22]) -> 3 | K22: of:=INDEX([$military_assets.H$1:.H$1048576];[$mil_ass_ru_start.$B22]) -> 5 | L22: of:=INDEX([$military_assets.I$1:.I$1048576];[$mil_ass_ru_start.$B22]) -> RUS | M22: of:=INDEX([$military_assets.J$1:.J$1048576];[$mil_ass_ru_start.$B22]) -> Submarine | N22: of:=INDEX([$military_assets.K$1:.K$1048576];[$mil_ass_ru_start.$B22]) -> Hidden: Can be played face down. 
Surprise Attacker: This asset deals damage during the Surprise Damage Step.
Commerce Raider: When sieging a player directly, this military asset's siege is equal to its attack. | O22: of:=INDEX([$military_assets.L$1:.L$1048576];[$mil_ass_ru_start.$B22]) -> Images/yasen.jpg | P22: of:=INDEX([$military_assets.M$1:.M$1048576];[$mil_ass_ru_start.$B22]) -> With more than twice the firepower of western submarines, the Yasen is Russia's best effort in no-expense-spared attack submarine development. | Q22: of:=INDEX([$military_assets.N$1:.N$1048576];[$mil_ass_ru_start.$B22]) -> 0.0.2
A23: 1 | B23: 21 | C23: Severodvinsk | D23: of:=INDEX([$military_assets.A$1:.A$1048576];[$mil_ass_ru_start.$B23]) -> Yasen Class SSGN | E23: of:=INDEX([$military_assets.B$1:.B$1048576];[$mil_ass_ru_start.$B23]) -> 0 | F23: of:=INDEX([$military_assets.C$1:.C$1048576];[$mil_ass_ru_start.$B23]) -> 0 | G23: of:=INDEX([$military_assets.D$1:.D$1048576];[$mil_ass_ru_start.$B23]) -> 0 | H23: of:=INDEX([$military_assets.E$1:.E$1048576];[$mil_ass_ru_start.$B23]) -> 5 | I23: of:=INDEX([$military_assets.F$1:.F$1048576];[$mil_ass_ru_start.$B23]) -> 0 | J23: of:=INDEX([$military_assets.G$1:.G$1048576];[$mil_ass_ru_start.$B23]) -> 3 | K23: of:=INDEX([$military_assets.H$1:.H$1048576];[$mil_ass_ru_start.$B23]) -> 5 | L23: of:=INDEX([$military_assets.I$1:.I$1048576];[$mil_ass_ru_start.$B23]) -> RUS | M23: of:=INDEX([$military_assets.J$1:.J$1048576];[$mil_ass_ru_start.$B23]) -> Submarine | N23: of:=INDEX([$military_assets.K$1:.K$1048576];[$mil_ass_ru_start.$B23]) -> Hidden: Can be played face down. 
Surprise Attacker: This asset deals damage during the Surprise Damage Step.
Commerce Raider: When sieging a player directly, this military asset's siege is equal to its attack. | O23: of:=INDEX([$military_assets.L$1:.L$1048576];[$mil_ass_ru_start.$B23]) -> Images/yasen.jpg | P23: of:=INDEX([$military_assets.M$1:.M$1048576];[$mil_ass_ru_start.$B23]) -> With more than twice the firepower of western submarines, the Yasen is Russia's best effort in no-expense-spared attack submarine development. | Q23: of:=INDEX([$military_assets.N$1:.N$1048576];[$mil_ass_ru_start.$B23]) -> 0.0.2
A24: 0 | B24: 21 | C24: Kazan | D24: of:=INDEX([$military_assets.A$1:.A$1048576];[$mil_ass_ru_start.$B24]) -> Yasen Class SSGN | E24: of:=INDEX([$military_assets.B$1:.B$1048576];[$mil_ass_ru_start.$B24]) -> 0 | F24: of:=INDEX([$military_assets.C$1:.C$1048576];[$mil_ass_ru_start.$B24]) -> 0 | G24: of:=INDEX([$military_assets.D$1:.D$1048576];[$mil_ass_ru_start.$B24]) -> 0 | H24: of:=INDEX([$military_assets.E$1:.E$1048576];[$mil_ass_ru_start.$B24]) -> 5 | I24: of:=INDEX([$military_assets.F$1:.F$1048576];[$mil_ass_ru_start.$B24]) -> 0 | J24: of:=INDEX([$military_assets.G$1:.G$1048576];[$mil_ass_ru_start.$B24]) -> 3 | K24: of:=INDEX([$military_assets.H$1:.H$1048576];[$mil_ass_ru_start.$B24]) -> 5 | L24: of:=INDEX([$military_assets.I$1:.I$1048576];[$mil_ass_ru_start.$B24]) -> RUS | M24: of:=INDEX([$military_assets.J$1:.J$1048576];[$mil_ass_ru_start.$B24]) -> Submarine | N24: of:=INDEX([$military_assets.K$1:.K$1048576];[$mil_ass_ru_start.$B24]) -> Hidden: Can be played face down. 
Surprise Attacker: This asset deals damage during the Surprise Damage Step.
Commerce Raider: When sieging a player directly, this military asset's siege is equal to its attack. | O24: of:=INDEX([$military_assets.L$1:.L$1048576];[$mil_ass_ru_start.$B24]) -> Images/yasen.jpg | P24: of:=INDEX([$military_assets.M$1:.M$1048576];[$mil_ass_ru_start.$B24]) -> With more than twice the firepower of western submarines, the Yasen is Russia's best effort in no-expense-spared attack submarine development. | Q24: of:=INDEX([$military_assets.N$1:.N$1048576];[$mil_ass_ru_start.$B24]) -> 0.0.2
A25: 1 | B25: 23 | C25: Tver | D25: of:=INDEX([$military_assets.A$1:.A$1048576];[$mil_ass_ru_start.$B25]) -> Oscar II Class SSGN | E25: of:=INDEX([$military_assets.B$1:.B$1048576];[$mil_ass_ru_start.$B25]) -> 0 | F25: of:=INDEX([$military_assets.C$1:.C$1048576];[$mil_ass_ru_start.$B25]) -> 0 | G25: of:=INDEX([$military_assets.D$1:.D$1048576];[$mil_ass_ru_start.$B25]) -> 0 | H25: of:=INDEX([$military_assets.E$1:.E$1048576];[$mil_ass_ru_start.$B25]) -> 4 | I25: of:=INDEX([$military_assets.F$1:.F$1048576];[$mil_ass_ru_start.$B25]) -> 0 | J25: of:=INDEX([$military_assets.G$1:.G$1048576];[$mil_ass_ru_start.$B25]) -> 1 | K25: of:=INDEX([$military_assets.H$1:.H$1048576];[$mil_ass_ru_start.$B25]) -> 3 | L25: of:=INDEX([$military_assets.I$1:.I$1048576];[$mil_ass_ru_start.$B25]) -> RUS | M25: of:=INDEX([$military_assets.J$1:.J$1048576];[$mil_ass_ru_start.$B25]) -> Submarine | N25: of:=INDEX([$military_assets.K$1:.K$1048576];[$mil_ass_ru_start.$B25]) -> Hidden: Can be played face down. 
Surprise Attacker: This asset deals damage during the Surprise Damage Step.
Commerce Raider: When sieging a player directly, this military asset's siege is equal to its attack. | O25: of:=INDEX([$military_assets.L$1:.L$1048576];[$mil_ass_ru_start.$B25]) -> Images/oscar2.jpg | P25: of:=INDEX([$military_assets.M$1:.M$1048576];[$mil_ass_ru_start.$B25]) -> The massive but aging Oscar is a relic of Cold War Soviet strategy. That said, it's large guided missile batteries are still a formidable threat to US carriers. | Q25: of:=INDEX([$military_assets.N$1:.N$1048576];[$mil_ass_ru_start.$B25]) -> 0.0.2
A26: 1 | B26: 23 | C26: Chelyabinsk | D26: of:=INDEX([$military_assets.A$1:.A$1048576];[$mil_ass_ru_start.$B26]) -> Oscar II Class SSGN | E26: of:=INDEX([$military_assets.B$1:.B$1048576];[$mil_ass_ru_start.$B26]) -> 0 | F26: of:=INDEX([$military_assets.C$1:.C$1048576];[$mil_ass_ru_start.$B26]) -> 0 | G26: of:=INDEX([$military_assets.D$1:.D$1048576];[$mil_ass_ru_start.$B26]) -> 0 | H26: of:=INDEX([$military_assets.E$1:.E$1048576];[$mil_ass_ru_start.$B26]) -> 4 | I26: of:=INDEX([$military_assets.F$1:.F$1048576];[$mil_ass_ru_start.$B26]) -> 0 | J26: of:=INDEX([$military_assets.G$1:.G$1048576];[$mil_ass_ru_start.$B26]) -> 1 | K26: of:=INDEX([$military_assets.H$1:.H$1048576];[$mil_ass_ru_start.$B26]) -> 3 | L26: of:=INDEX([$military_assets.I$1:.I$1048576];[$mil_ass_ru_start.$B26]) -> RUS | M26: of:=INDEX([$military_assets.J$1:.J$1048576];[$mil_ass_ru_start.$B26]) -> Submarine | N26: of:=INDEX([$military_assets.K$1:.K$1048576];[$mil_ass_ru_start.$B26]) -> Hidden: Can be played face down. 
Surprise Attacker: This asset deals damage during the Surprise Damage Step.
Commerce Raider: When sieging a player directly, this military asset's siege is equal to its attack. | O26: of:=INDEX([$military_assets.L$1:.L$1048576];[$mil_ass_ru_start.$B26]) -> Images/oscar2.jpg | P26: of:=INDEX([$military_assets.M$1:.M$1048576];[$mil_ass_ru_start.$B26]) -> The massive but aging Oscar is a relic of Cold War Soviet strategy. That said, it's large guided missile batteries are still a formidable threat to US carriers. | Q26: of:=INDEX([$military_assets.N$1:.N$1048576];[$mil_ass_ru_start.$B26]) -> 0.0.2
A27: 1 | B27: 23 | C27: Omsk | D27: of:=INDEX([$military_assets.A$1:.A$1048576];[$mil_ass_ru_start.$B27]) -> Oscar II Class SSGN | E27: of:=INDEX([$military_assets.B$1:.B$1048576];[$mil_ass_ru_start.$B27]) -> 0 | F27: of:=INDEX([$military_assets.C$1:.C$1048576];[$mil_ass_ru_start.$B27]) -> 0 | G27: of:=INDEX([$military_assets.D$1:.D$1048576];[$mil_ass_ru_start.$B27]) -> 0 | H27: of:=INDEX([$military_assets.E$1:.E$1048576];[$mil_ass_ru_start.$B27]) -> 4 | I27: of:=INDEX([$military_assets.F$1:.F$1048576];[$mil_ass_ru_start.$B27]) -> 0 | J27: of:=INDEX([$military_assets.G$1:.G$1048576];[$mil_ass_ru_start.$B27]) -> 1 | K27: of:=INDEX([$military_assets.H$1:.H$1048576];[$mil_ass_ru_start.$B27]) -> 3 | L27: of:=INDEX([$military_assets.I$1:.I$1048576];[$mil_ass_ru_start.$B27]) -> RUS | M27: of:=INDEX([$military_assets.J$1:.J$1048576];[$mil_ass_ru_start.$B27]) -> Submarine | N27: of:=INDEX([$military_assets.K$1:.K$1048576];[$mil_ass_ru_start.$B27]) -> Hidden: Can be played face down. 
Surprise Attacker: This asset deals damage during the Surprise Damage Step.
Commerce Raider: When sieging a player directly, this military asset's siege is equal to its attack. | O27: of:=INDEX([$military_assets.L$1:.L$1048576];[$mil_ass_ru_start.$B27]) -> Images/oscar2.jpg | P27: of:=INDEX([$military_assets.M$1:.M$1048576];[$mil_ass_ru_start.$B27]) -> The massive but aging Oscar is a relic of Cold War Soviet strategy. That said, it's large guided missile batteries are still a formidable threat to US carriers. | Q27: of:=INDEX([$military_assets.N$1:.N$1048576];[$mil_ass_ru_start.$B27]) -> 0.0.2
A28: 1 | B28: 23 | C28: Tomsk | D28: of:=INDEX([$military_assets.A$1:.A$1048576];[$mil_ass_ru_start.$B28]) -> Oscar II Class SSGN | E28: of:=INDEX([$military_assets.B$1:.B$1048576];[$mil_ass_ru_start.$B28]) -> 0 | F28: of:=INDEX([$military_assets.C$1:.C$1048576];[$mil_ass_ru_start.$B28]) -> 0 | G28: of:=INDEX([$military_assets.D$1:.D$1048576];[$mil_ass_ru_start.$B28]) -> 0 | H28: of:=INDEX([$military_assets.E$1:.E$1048576];[$mil_ass_ru_start.$B28]) -> 4 | I28: of:=INDEX([$military_assets.F$1:.F$1048576];[$mil_ass_ru_start.$B28]) -> 0 | J28: of:=INDEX([$military_assets.G$1:.G$1048576];[$mil_ass_ru_start.$B28]) -> 1 | K28: of:=INDEX([$military_assets.H$1:.H$1048576];[$mil_ass_ru_start.$B28]) -> 3 | L28: of:=INDEX([$military_assets.I$1:.I$1048576];[$mil_ass_ru_start.$B28]) -> RUS | M28: of:=INDEX([$military_assets.J$1:.J$1048576];[$mil_ass_ru_start.$B28]) -> Submarine | N28: of:=INDEX([$military_assets.K$1:.K$1048576];[$mil_ass_ru_start.$B28]) -> Hidden: Can be played face down. 
Surprise Attacker: This asset deals damage during the Surprise Damage Step.
Commerce Raider: When sieging a player directly, this military asset's siege is equal to its attack. | O28: of:=INDEX([$military_assets.L$1:.L$1048576];[$mil_ass_ru_start.$B28]) -> Images/oscar2.jpg | P28: of:=INDEX([$military_assets.M$1:.M$1048576];[$mil_ass_ru_start.$B28]) -> The massive but aging Oscar is a relic of Cold War Soviet strategy. That said, it's large guided missile batteries are still a formidable threat to US carriers. | Q28: of:=INDEX([$military_assets.N$1:.N$1048576];[$mil_ass_ru_start.$B28]) -> 0.0.2
A29: 0 | B29: 27 | C29: Leopard | D29: of:=INDEX([$military_assets.A$1:.A$1048576];[$mil_ass_ru_start.$B29]) -> Akula Class SSN | E29: of:=INDEX([$military_assets.B$1:.B$1048576];[$mil_ass_ru_start.$B29]) -> 0 | F29: of:=INDEX([$military_assets.C$1:.C$1048576];[$mil_ass_ru_start.$B29]) -> 0 | G29: of:=INDEX([$military_assets.D$1:.D$1048576];[$mil_ass_ru_start.$B29]) -> 0 | H29: of:=INDEX([$military_assets.E$1:.E$1048576];[$mil_ass_ru_start.$B29]) -> 3 | I29: of:=INDEX([$military_assets.F$1:.F$1048576];[$mil_ass_ru_start.$B29]) -> 0 | J29: of:=INDEX([$military_assets.G$1:.G$1048576];[$mil_ass_ru_start.$B29]) -> 3 | K29: of:=INDEX([$military_assets.H$1:.H$1048576];[$mil_ass_ru_start.$B29]) -> 3 | L29: of:=INDEX([$military_assets.I$1:.I$1048576];[$mil_ass_ru_start.$B29]) -> RUS | M29: of:=INDEX([$military_assets.J$1:.J$1048576];[$mil_ass_ru_start.$B29]) -> Submarine | N29: of:=INDEX([$military_assets.K$1:.K$1048576];[$mil_ass_ru_start.$B29]) -> Hidden: Can be played face down. 
Surprise Attacker: This asset deals damage during the Surprise Damage Step.
Commerce Raider: When sieging a player directly, this military asset's siege is equal to its attack. | O29: of:=INDEX([$military_assets.L$1:.L$1048576];[$mil_ass_ru_start.$B29]) -> Images/akula.jpg | P29: of:=INDEX([$military_assets.M$1:.M$1048576];[$mil_ass_ru_start.$B29]) -> In Russian, akula means shark | Q29: of:=INDEX([$military_assets.N$1:.N$1048576];[$mil_ass_ru_start.$B29]) -> 0.0.2
A30: 0 | B30: 27 | C30: Tigr | D30: of:=INDEX([$military_assets.A$1:.A$1048576];[$mil_ass_ru_start.$B30]) -> Akula Class SSN | E30: of:=INDEX([$military_assets.B$1:.B$1048576];[$mil_ass_ru_start.$B30]) -> 0 | F30: of:=INDEX([$military_assets.C$1:.C$1048576];[$mil_ass_ru_start.$B30]) -> 0 | G30: of:=INDEX([$military_assets.D$1:.D$1048576];[$mil_ass_ru_start.$B30]) -> 0 | H30: of:=INDEX([$military_assets.E$1:.E$1048576];[$mil_ass_ru_start.$B30]) -> 3 | I30: of:=INDEX([$military_assets.F$1:.F$1048576];[$mil_ass_ru_start.$B30]) -> 0 | J30: of:=INDEX([$military_assets.G$1:.G$1048576];[$mil_ass_ru_start.$B30]) -> 3 | K30: of:=INDEX([$military_assets.H$1:.H$1048576];[$mil_ass_ru_start.$B30]) -> 3 | L30: of:=INDEX([$military_assets.I$1:.I$1048576];[$mil_ass_ru_start.$B30]) -> RUS | M30: of:=INDEX([$military_assets.J$1:.J$1048576];[$mil_ass_ru_start.$B30]) -> Submarine | N30: of:=INDEX([$military_assets.K$1:.K$1048576];[$mil_ass_ru_start.$B30]) -> Hidden: Can be played face down. 
Surprise Attacker: This asset deals damage during the Surprise Damage Step.
Commerce Raider: When sieging a player directly, this military asset's siege is equal to its attack. | O30: of:=INDEX([$military_assets.L$1:.L$1048576];[$mil_ass_ru_start.$B30]) -> Images/akula.jpg | P30: of:=INDEX([$military_assets.M$1:.M$1048576];[$mil_ass_ru_start.$B30]) -> In Russian, akula means shark | Q30: of:=INDEX([$military_assets.N$1:.N$1048576];[$mil_ass_ru_start.$B30]) -> 0.0.2
A31: 1 | B31: 27 | C31: Volk | D31: of:=INDEX([$military_assets.A$1:.A$1048576];[$mil_ass_ru_start.$B31]) -> Akula Class SSN | E31: of:=INDEX([$military_assets.B$1:.B$1048576];[$mil_ass_ru_start.$B31]) -> 0 | F31: of:=INDEX([$military_assets.C$1:.C$1048576];[$mil_ass_ru_start.$B31]) -> 0 | G31: of:=INDEX([$military_assets.D$1:.D$1048576];[$mil_ass_ru_start.$B31]) -> 0 | H31: of:=INDEX([$military_assets.E$1:.E$1048576];[$mil_ass_ru_start.$B31]) -> 3 | I31: of:=INDEX([$military_assets.F$1:.F$1048576];[$mil_ass_ru_start.$B31]) -> 0 | J31: of:=INDEX([$military_assets.G$1:.G$1048576];[$mil_ass_ru_start.$B31]) -> 3 | K31: of:=INDEX([$military_assets.H$1:.H$1048576];[$mil_ass_ru_start.$B31]) -> 3 | L31: of:=INDEX([$military_assets.I$1:.I$1048576];[$mil_ass_ru_start.$B31]) -> RUS | M31: of:=INDEX([$military_assets.J$1:.J$1048576];[$mil_ass_ru_start.$B31]) -> Submarine | N31: of:=INDEX([$military_assets.K$1:.K$1048576];[$mil_ass_ru_start.$B31]) -> Hidden: Can be played face down. 
Surprise Attacker: This asset deals damage during the Surprise Damage Step.
Commerce Raider: When sieging a player directly, this military asset's siege is equal to its attack. | O31: of:=INDEX([$military_assets.L$1:.L$1048576];[$mil_ass_ru_start.$B31]) -> Images/akula.jpg | P31: of:=INDEX([$military_assets.M$1:.M$1048576];[$mil_ass_ru_start.$B31]) -> In Russian, akula means shark | Q31: of:=INDEX([$military_assets.N$1:.N$1048576];[$mil_ass_ru_start.$B31]) -> 0.0.2
A32: 1 | B32: 27 | C32: Bratsk | D32: of:=INDEX([$military_assets.A$1:.A$1048576];[$mil_ass_ru_start.$B32]) -> Akula Class SSN | E32: of:=INDEX([$military_assets.B$1:.B$1048576];[$mil_ass_ru_start.$B32]) -> 0 | F32: of:=INDEX([$military_assets.C$1:.C$1048576];[$mil_ass_ru_start.$B32]) -> 0 | G32: of:=INDEX([$military_assets.D$1:.D$1048576];[$mil_ass_ru_start.$B32]) -> 0 | H32: of:=INDEX([$military_assets.E$1:.E$1048576];[$mil_ass_ru_start.$B32]) -> 3 | I32: of:=INDEX([$military_assets.F$1:.F$1048576];[$mil_ass_ru_start.$B32]) -> 0 | J32: of:=INDEX([$military_assets.G$1:.G$1048576];[$mil_ass_ru_start.$B32]) -> 3 | K32: of:=INDEX([$military_assets.H$1:.H$1048576];[$mil_ass_ru_start.$B32]) -> 3 | L32: of:=INDEX([$military_assets.I$1:.I$1048576];[$mil_ass_ru_start.$B32]) -> RUS | M32: of:=INDEX([$military_assets.J$1:.J$1048576];[$mil_ass_ru_start.$B32]) -> Submarine | N32: of:=INDEX([$military_assets.K$1:.K$1048576];[$mil_ass_ru_start.$B32]) -> Hidden: Can be played face down. 
Surprise Attacker: This asset deals damage during the Surprise Damage Step.
Commerce Raider: When sieging a player directly, this military asset's siege is equal to its attack. | O32: of:=INDEX([$military_assets.L$1:.L$1048576];[$mil_ass_ru_start.$B32]) -> Images/akula.jpg | P32: of:=INDEX([$military_assets.M$1:.M$1048576];[$mil_ass_ru_start.$B32]) -> In Russian, akula means shark | Q32: of:=INDEX([$military_assets.N$1:.N$1048576];[$mil_ass_ru_start.$B32]) -> 0.0.2
A33: 1 | B33: 27 | C33: Samara | D33: of:=INDEX([$military_assets.A$1:.A$1048576];[$mil_ass_ru_start.$B33]) -> Akula Class SSN | E33: of:=INDEX([$military_assets.B$1:.B$1048576];[$mil_ass_ru_start.$B33]) -> 0 | F33: of:=INDEX([$military_assets.C$1:.C$1048576];[$mil_ass_ru_start.$B33]) -> 0 | G33: of:=INDEX([$military_assets.D$1:.D$1048576];[$mil_ass_ru_start.$B33]) -> 0 | H33: of:=INDEX([$military_assets.E$1:.E$1048576];[$mil_ass_ru_start.$B33]) -> 3 | I33: of:=INDEX([$military_assets.F$1:.F$1048576];[$mil_ass_ru_start.$B33]) -> 0 | J33: of:=INDEX([$military_assets.G$1:.G$1048576];[$mil_ass_ru_start.$B33]) -> 3 | K33: of:=INDEX([$military_assets.H$1:.H$1048576];[$mil_ass_ru_start.$B33]) -> 3 | L33: of:=INDEX([$military_assets.I$1:.I$1048576];[$mil_ass_ru_start.$B33]) -> RUS | M33: of:=INDEX([$military_assets.J$1:.J$1048576];[$mil_ass_ru_start.$B33]) -> Submarine | N33: of:=INDEX([$military_assets.K$1:.K$1048576];[$mil_ass_ru_start.$B33]) -> Hidden: Can be played face down. 
Surprise Attacker: This asset deals damage during the Surprise Damage Step.
Commerce Raider: When sieging a player directly, this military asset's siege is equal to its attack. | O33: of:=INDEX([$military_assets.L$1:.L$1048576];[$mil_ass_ru_start.$B33]) -> Images/akula.jpg | P33: of:=INDEX([$military_assets.M$1:.M$1048576];[$mil_ass_ru_start.$B33]) -> In Russian, akula means shark | Q33: of:=INDEX([$military_assets.N$1:.N$1048576];[$mil_ass_ru_start.$B33]) -> 0.0.2
A34: 1 | B34: 27 | C34: Kuzbass | D34: of:=INDEX([$military_assets.A$1:.A$1048576];[$mil_ass_ru_start.$B34]) -> Akula Class SSN | E34: of:=INDEX([$military_assets.B$1:.B$1048576];[$mil_ass_ru_start.$B34]) -> 0 | F34: of:=INDEX([$military_assets.C$1:.C$1048576];[$mil_ass_ru_start.$B34]) -> 0 | G34: of:=INDEX([$military_assets.D$1:.D$1048576];[$mil_ass_ru_start.$B34]) -> 0 | H34: of:=INDEX([$military_assets.E$1:.E$1048576];[$mil_ass_ru_start.$B34]) -> 3 | I34: of:=INDEX([$military_assets.F$1:.F$1048576];[$mil_ass_ru_start.$B34]) -> 0 | J34: of:=INDEX([$military_assets.G$1:.G$1048576];[$mil_ass_ru_start.$B34]) -> 3 | K34: of:=INDEX([$military_assets.H$1:.H$1048576];[$mil_ass_ru_start.$B34]) -> 3 | L34: of:=INDEX([$military_assets.I$1:.I$1048576];[$mil_ass_ru_start.$B34]) -> RUS | M34: of:=INDEX([$military_assets.J$1:.J$1048576];[$mil_ass_ru_start.$B34]) -> Submarine | N34: of:=INDEX([$military_assets.K$1:.K$1048576];[$mil_ass_ru_start.$B34]) -> Hidden: Can be played face down. 
Surprise Attacker: This asset deals damage during the Surprise Damage Step.
Commerce Raider: When sieging a player directly, this military asset's siege is equal to its attack. | O34: of:=INDEX([$military_assets.L$1:.L$1048576];[$mil_ass_ru_start.$B34]) -> Images/akula.jpg | P34: of:=INDEX([$military_assets.M$1:.M$1048576];[$mil_ass_ru_start.$B34]) -> In Russian, akula means shark | Q34: of:=INDEX([$military_assets.N$1:.N$1048576];[$mil_ass_ru_start.$B34]) -> 0.0.2
A35: 0 | B35: 26 | C35: Danlil Moskovskiy | D35: of:=INDEX([$military_assets.A$1:.A$1048576];[$mil_ass_ru_start.$B35]) -> Victor III Class SSN | E35: of:=INDEX([$military_assets.B$1:.B$1048576];[$mil_ass_ru_start.$B35]) -> 0 | F35: of:=INDEX([$military_assets.C$1:.C$1048576];[$mil_ass_ru_start.$B35]) -> 0 | G35: of:=INDEX([$military_assets.D$1:.D$1048576];[$mil_ass_ru_start.$B35]) -> 0 | H35: of:=INDEX([$military_assets.E$1:.E$1048576];[$mil_ass_ru_start.$B35]) -> 2 | I35: of:=INDEX([$military_assets.F$1:.F$1048576];[$mil_ass_ru_start.$B35]) -> 0 | J35: of:=INDEX([$military_assets.G$1:.G$1048576];[$mil_ass_ru_start.$B35]) -> 1 | K35: of:=INDEX([$military_assets.H$1:.H$1048576];[$mil_ass_ru_start.$B35]) -> 1 | L35: of:=INDEX([$military_assets.I$1:.I$1048576];[$mil_ass_ru_start.$B35]) -> RUS | M35: of:=INDEX([$military_assets.J$1:.J$1048576];[$mil_ass_ru_start.$B35]) -> Submarine | N35: of:=INDEX([$military_assets.K$1:.K$1048576];[$mil_ass_ru_start.$B35]) -> Hidden: Can be played face down. 
Surprise Attacker: This asset deals damage during the Surprise Damage Step.
Commerce Raider: When sieging a player directly, this military asset's siege is equal to its attack. | O35: of:=INDEX([$military_assets.L$1:.L$1048576];[$mil_ass_ru_start.$B35]) -> Images/victor2.jpg | P35: of:=INDEX([$military_assets.M$1:.M$1048576];[$mil_ass_ru_start.$B35]) -> Nothing fancy, but it ain't bad for government work. | Q35: of:=INDEX([$military_assets.N$1:.N$1048576];[$mil_ass_ru_start.$B35]) -> 0.0.2
A36: 0 | B36: 26 | C36: Tambov | D36: of:=INDEX([$military_assets.A$1:.A$1048576];[$mil_ass_ru_start.$B36]) -> Victor III Class SSN | E36: of:=INDEX([$military_assets.B$1:.B$1048576];[$mil_ass_ru_start.$B36]) -> 0 | F36: of:=INDEX([$military_assets.C$1:.C$1048576];[$mil_ass_ru_start.$B36]) -> 0 | G36: of:=INDEX([$military_assets.D$1:.D$1048576];[$mil_ass_ru_start.$B36]) -> 0 | H36: of:=INDEX([$military_assets.E$1:.E$1048576];[$mil_ass_ru_start.$B36]) -> 2 | I36: of:=INDEX([$military_assets.F$1:.F$1048576];[$mil_ass_ru_start.$B36]) -> 0 | J36: of:=INDEX([$military_assets.G$1:.G$1048576];[$mil_ass_ru_start.$B36]) -> 1 | K36: of:=INDEX([$military_assets.H$1:.H$1048576];[$mil_ass_ru_start.$B36]) -> 1 | L36: of:=INDEX([$military_assets.I$1:.I$1048576];[$mil_ass_ru_start.$B36]) -> RUS | M36: of:=INDEX([$military_assets.J$1:.J$1048576];[$mil_ass_ru_start.$B36]) -> Submarine | N36: of:=INDEX([$military_assets.K$1:.K$1048576];[$mil_ass_ru_start.$B36]) -> Hidden: Can be played face down. 
Surprise Attacker: This asset deals damage during the Surprise Damage Step.
Commerce Raider: When sieging a player directly, this military asset's siege is equal to its attack. | O36: of:=INDEX([$military_assets.L$1:.L$1048576];[$mil_ass_ru_start.$B36]) -> Images/victor2.jpg | P36: of:=INDEX([$military_assets.M$1:.M$1048576];[$mil_ass_ru_start.$B36]) -> Nothing fancy, but it ain't bad for government work. | Q36: of:=INDEX([$military_assets.N$1:.N$1048576];[$mil_ass_ru_start.$B36]) -> 0.0.2
A37: 1 | B37: 26 | C37: Obninsk | D37: of:=INDEX([$military_assets.A$1:.A$1048576];[$mil_ass_ru_start.$B37]) -> Victor III Class SSN | E37: of:=INDEX([$military_assets.B$1:.B$1048576];[$mil_ass_ru_start.$B37]) -> 0 | F37: of:=INDEX([$military_assets.C$1:.C$1048576];[$mil_ass_ru_start.$B37]) -> 0 | G37: of:=INDEX([$military_assets.D$1:.D$1048576];[$mil_ass_ru_start.$B37]) -> 0 | H37: of:=INDEX([$military_assets.E$1:.E$1048576];[$mil_ass_ru_start.$B37]) -> 2 | I37: of:=INDEX([$military_assets.F$1:.F$1048576];[$mil_ass_ru_start.$B37]) -> 0 | J37: of:=INDEX([$military_assets.G$1:.G$1048576];[$mil_ass_ru_start.$B37]) -> 1 | K37: of:=INDEX([$military_assets.H$1:.H$1048576];[$mil_ass_ru_start.$B37]) -> 1 | L37: of:=INDEX([$military_assets.I$1:.I$1048576];[$mil_ass_ru_start.$B37]) -> RUS | M37: of:=INDEX([$military_assets.J$1:.J$1048576];[$mil_ass_ru_start.$B37]) -> Submarine | N37: of:=INDEX([$military_assets.K$1:.K$1048576];[$mil_ass_ru_start.$B37]) -> Hidden: Can be played face down. 
Surprise Attacker: This asset deals damage during the Surprise Damage Step.
Commerce Raider: When sieging a player directly, this military asset's siege is equal to its attack. | O37: of:=INDEX([$military_assets.L$1:.L$1048576];[$mil_ass_ru_start.$B37]) -> Images/victor2.jpg | P37: of:=INDEX([$military_assets.M$1:.M$1048576];[$mil_ass_ru_start.$B37]) -> Nothing fancy, but it ain't bad for government work. | Q37: of:=INDEX([$military_assets.N$1:.N$1048576];[$mil_ass_ru_start.$B37]) -> 0.0.2
A38: 1 | B38: 26 | C38: Nizny Novgorod | D38: of:=INDEX([$military_assets.A$1:.A$1048576];[$mil_ass_ru_start.$B38]) -> Victor III Class SSN | E38: of:=INDEX([$military_assets.B$1:.B$1048576];[$mil_ass_ru_start.$B38]) -> 0 | F38: of:=INDEX([$military_assets.C$1:.C$1048576];[$mil_ass_ru_start.$B38]) -> 0 | G38: of:=INDEX([$military_assets.D$1:.D$1048576];[$mil_ass_ru_start.$B38]) -> 0 | H38: of:=INDEX([$military_assets.E$1:.E$1048576];[$mil_ass_ru_start.$B38]) -> 2 | I38: of:=INDEX([$military_assets.F$1:.F$1048576];[$mil_ass_ru_start.$B38]) -> 0 | J38: of:=INDEX([$military_assets.G$1:.G$1048576];[$mil_ass_ru_start.$B38]) -> 1 | K38: of:=INDEX([$military_assets.H$1:.H$1048576];[$mil_ass_ru_start.$B38]) -> 1 | L38: of:=INDEX([$military_assets.I$1:.I$1048576];[$mil_ass_ru_start.$B38]) -> RUS | M38: of:=INDEX([$military_assets.J$1:.J$1048576];[$mil_ass_ru_start.$B38]) -> Submarine | N38: of:=INDEX([$military_assets.K$1:.K$1048576];[$mil_ass_ru_start.$B38]) -> Hidden: Can be played face down. 
Surprise Attacker: This asset deals damage during the Surprise Damage Step.
Commerce Raider: When sieging a player directly, this military asset's siege is equal to its attack. | O38: of:=INDEX([$military_assets.L$1:.L$1048576];[$mil_ass_ru_start.$B38]) -> Images/victor2.jpg | P38: of:=INDEX([$military_assets.M$1:.M$1048576];[$mil_ass_ru_start.$B38]) -> Nothing fancy, but it ain't bad for government work. | Q38: of:=INDEX([$military_assets.N$1:.N$1048576];[$mil_ass_ru_start.$B38]) -> 0.0.2
A39: 0 | B39: 22 | C39: Sankt Peterburg | D39: of:=INDEX([$military_assets.A$1:.A$1048576];[$mil_ass_ru_start.$B39]) -> Lada Class SSK | E39: of:=INDEX([$military_assets.B$1:.B$1048576];[$mil_ass_ru_start.$B39]) -> 0 | F39: of:=INDEX([$military_assets.C$1:.C$1048576];[$mil_ass_ru_start.$B39]) -> 0 | G39: of:=INDEX([$military_assets.D$1:.D$1048576];[$mil_ass_ru_start.$B39]) -> 0 | H39: of:=INDEX([$military_assets.E$1:.E$1048576];[$mil_ass_ru_start.$B39]) -> 3 | I39: of:=INDEX([$military_assets.F$1:.F$1048576];[$mil_ass_ru_start.$B39]) -> 0 | J39: of:=INDEX([$military_assets.G$1:.G$1048576];[$mil_ass_ru_start.$B39]) -> 2 | K39: of:=INDEX([$military_assets.H$1:.H$1048576];[$mil_ass_ru_start.$B39]) -> 2 | L39: of:=INDEX([$military_assets.I$1:.I$1048576];[$mil_ass_ru_start.$B39]) -> RUS | M39: of:=INDEX([$military_assets.J$1:.J$1048576];[$mil_ass_ru_start.$B39]) -> Submarine | N39: of:=INDEX([$military_assets.K$1:.K$1048576];[$mil_ass_ru_start.$B39]) -> Hidden: Can be played face down. 
Surprise Attacker: This asset deals damage during the Surprise Damage Step.
Coastal Defender: This asset cannot  take part in an attack. | O39: of:=INDEX([$military_assets.L$1:.L$1048576];[$mil_ass_ru_start.$B39]) -> Images/lada.jpg | P39: of:=INDEX([$military_assets.M$1:.M$1048576];[$mil_ass_ru_start.$B39]) -> Although shorter-ranged than nuclear attack submarines, diesel-electric attack submarines are smaller, quieter and nearly as well armed. | Q39: of:=INDEX([$military_assets.N$1:.N$1048576];[$mil_ass_ru_start.$B39]) -> 0.0.2
A40: 0 | B40: 22 | C40: Kronshtadt | D40: of:=INDEX([$military_assets.A$1:.A$1048576];[$mil_ass_ru_start.$B40]) -> Lada Class SSK | E40: of:=INDEX([$military_assets.B$1:.B$1048576];[$mil_ass_ru_start.$B40]) -> 0 | F40: of:=INDEX([$military_assets.C$1:.C$1048576];[$mil_ass_ru_start.$B40]) -> 0 | G40: of:=INDEX([$military_assets.D$1:.D$1048576];[$mil_ass_ru_start.$B40]) -> 0 | H40: of:=INDEX([$military_assets.E$1:.E$1048576];[$mil_ass_ru_start.$B40]) -> 3 | I40: of:=INDEX([$military_assets.F$1:.F$1048576];[$mil_ass_ru_start.$B40]) -> 0 | J40: of:=INDEX([$military_assets.G$1:.G$1048576];[$mil_ass_ru_start.$B40]) -> 2 | K40: of:=INDEX([$military_assets.H$1:.H$1048576];[$mil_ass_ru_start.$B40]) -> 2 | L40: of:=INDEX([$military_assets.I$1:.I$1048576];[$mil_ass_ru_start.$B40]) -> RUS | M40: of:=INDEX([$military_assets.J$1:.J$1048576];[$mil_ass_ru_start.$B40]) -> Submarine | N40: of:=INDEX([$military_assets.K$1:.K$1048576];[$mil_ass_ru_start.$B40]) -> Hidden: Can be played face down. 
Surprise Attacker: This asset deals damage during the Surprise Damage Step.
Coastal Defender: This asset cannot  take part in an attack. | O40: of:=INDEX([$military_assets.L$1:.L$1048576];[$mil_ass_ru_start.$B40]) -> Images/lada.jpg | P40: of:=INDEX([$military_assets.M$1:.M$1048576];[$mil_ass_ru_start.$B40]) -> Although shorter-ranged than nuclear attack submarines, diesel-electric attack submarines are smaller, quieter and nearly as well armed. | Q40: of:=INDEX([$military_assets.N$1:.N$1048576];[$mil_ass_ru_start.$B40]) -> 0.0.2
A41: 0 | B41: 24 | C41: 100th Regiment | D41: of:=INDEX([$military_assets.A$1:.A$1048576];[$mil_ass_ru_start.$B41]) -> Mig-29K Fulcrum-D | E41: of:=INDEX([$military_assets.B$1:.B$1048576];[$mil_ass_ru_start.$B41]) -> 0 | F41: of:=INDEX([$military_assets.C$1:.C$1048576];[$mil_ass_ru_start.$B41]) -> 0 | G41: of:=INDEX([$military_assets.D$1:.D$1048576];[$mil_ass_ru_start.$B41]) -> 0 | H41: of:=INDEX([$military_assets.E$1:.E$1048576];[$mil_ass_ru_start.$B41]) -> 4 | I41: of:=INDEX([$military_assets.F$1:.F$1048576];[$mil_ass_ru_start.$B41]) -> 3 | J41: of:=INDEX([$military_assets.G$1:.G$1048576];[$mil_ass_ru_start.$B41]) -> 3 | K41: of:=INDEX([$military_assets.H$1:.H$1048576];[$mil_ass_ru_start.$B41]) -> 1 | L41: of:=INDEX([$military_assets.I$1:.I$1048576];[$mil_ass_ru_start.$B41]) -> RUS | M41: of:=INDEX([$military_assets.J$1:.J$1048576];[$mil_ass_ru_start.$B41]) -> Squadron | N41: of:=INDEX([$military_assets.K$1:.K$1048576];[$mil_ass_ru_start.$B41]) -> STOBAR
Hidden: Can be played face down.  | O41: of:=INDEX([$military_assets.L$1:.L$1048576];[$mil_ass_ru_start.$B41]) -> Images/mig29k.jpg | P41: of:=INDEX([$military_assets.M$1:.M$1048576];[$mil_ass_ru_start.$B41]) -> With an affordable  $15M unit cost, the Mig-29K is proof that achieving air dominance doesn’t always require one to break the bank. | Q41: of:=INDEX([$military_assets.N$1:.N$1048576];[$mil_ass_ru_start.$B41]) -> 0.0.2
A42: 0 | B42: 24 | C42: 101st Regiment | D42: of:=INDEX([$military_assets.A$1:.A$1048576];[$mil_ass_ru_start.$B42]) -> Mig-29K Fulcrum-D | E42: of:=INDEX([$military_assets.B$1:.B$1048576];[$mil_ass_ru_start.$B42]) -> 0 | F42: of:=INDEX([$military_assets.C$1:.C$1048576];[$mil_ass_ru_start.$B42]) -> 0 | G42: of:=INDEX([$military_assets.D$1:.D$1048576];[$mil_ass_ru_start.$B42]) -> 0 | H42: of:=INDEX([$military_assets.E$1:.E$1048576];[$mil_ass_ru_start.$B42]) -> 4 | I42: of:=INDEX([$military_assets.F$1:.F$1048576];[$mil_ass_ru_start.$B42]) -> 3 | J42: of:=INDEX([$military_assets.G$1:.G$1048576];[$mil_ass_ru_start.$B42]) -> 3 | K42: of:=INDEX([$military_assets.H$1:.H$1048576];[$mil_ass_ru_start.$B42]) -> 1 | L42: of:=INDEX([$military_assets.I$1:.I$1048576];[$mil_ass_ru_start.$B42]) -> RUS | M42: of:=INDEX([$military_assets.J$1:.J$1048576];[$mil_ass_ru_start.$B42]) -> Squadron | N42: of:=INDEX([$military_assets.K$1:.K$1048576];[$mil_ass_ru_start.$B42]) -> STOBAR
Hidden: Can be played face down.  | O42: of:=INDEX([$military_assets.L$1:.L$1048576];[$mil_ass_ru_start.$B42]) -> Images/mig29k.jpg | P42: of:=INDEX([$military_assets.M$1:.M$1048576];[$mil_ass_ru_start.$B42]) -> With an affordable  $15M unit cost, the Mig-29K is proof that achieving air dominance doesn’t always require one to break the bank. | Q42: of:=INDEX([$military_assets.N$1:.N$1048576];[$mil_ass_ru_start.$B42]) -> 0.0.2
A43: 0 | B43: 24 | C43: 102nd Regiment | D43: of:=INDEX([$military_assets.A$1:.A$1048576];[$mil_ass_ru_start.$B43]) -> Mig-29K Fulcrum-D | E43: of:=INDEX([$military_assets.B$1:.B$1048576];[$mil_ass_ru_start.$B43]) -> 0 | F43: of:=INDEX([$military_assets.C$1:.C$1048576];[$mil_ass_ru_start.$B43]) -> 0 | G43: of:=INDEX([$military_assets.D$1:.D$1048576];[$mil_ass_ru_start.$B43]) -> 0 | H43: of:=INDEX([$military_assets.E$1:.E$1048576];[$mil_ass_ru_start.$B43]) -> 4 | I43: of:=INDEX([$military_assets.F$1:.F$1048576];[$mil_ass_ru_start.$B43]) -> 3 | J43: of:=INDEX([$military_assets.G$1:.G$1048576];[$mil_ass_ru_start.$B43]) -> 3 | K43: of:=INDEX([$military_assets.H$1:.H$1048576];[$mil_ass_ru_start.$B43]) -> 1 | L43: of:=INDEX([$military_assets.I$1:.I$1048576];[$mil_ass_ru_start.$B43]) -> RUS | M43: of:=INDEX([$military_assets.J$1:.J$1048576];[$mil_ass_ru_start.$B43]) -> Squadron | N43: of:=INDEX([$military_assets.K$1:.K$1048576];[$mil_ass_ru_start.$B43]) -> STOBAR
Hidden: Can be played face down.  | O43: of:=INDEX([$military_assets.L$1:.L$1048576];[$mil_ass_ru_start.$B43]) -> Images/mig29k.jpg | P43: of:=INDEX([$military_assets.M$1:.M$1048576];[$mil_ass_ru_start.$B43]) -> With an affordable  $15M unit cost, the Mig-29K is proof that achieving air dominance doesn’t always require one to break the bank. | Q43: of:=INDEX([$military_assets.N$1:.N$1048576];[$mil_ass_ru_start.$B43]) -> 0.0.2

Sheet: actions_all
A1: Duplication | B1: Class | C1: Name | D1: of:=[$actions.A1] -> Title | E1: of:=[$actions.B1] -> Type | F1: of:=[$actions.C1] -> Roster | G1: of:=[$actions.D1] -> Description | H1: of:=[$actions.E1] -> Image | I1: of:=[$actions.F1] -> FlavorText | J1: of:=[$actions.G1] -> Version
A2: 1 | B2: 3 | C2: Tactic A | D2: of:=INDEX([$actions.A$1:.A$1048576];[$actions_all.$B2]) -> Scuttlebutt | E2: of:=INDEX([$actions.B$1:.B$1048576];[$actions_all.$B2]) -> Tactic | F2: of:=INDEX([$actions.C$1:.C$1048576];[$actions_all.$B2]) -> USN | G2: of:=INDEX([$actions.D$1:.D$1048576];[$actions_all.$B2]) -> Look at and reorder the top 4 cards of your deck. You may put any number on the bottom of your deck in any order. | H2: of:=INDEX([$actions.E$1:.E$1048576];[$actions_all.$B2]) -> Images/scuttlebutt.jpeg | I2: of:=INDEX([$actions.F$1:.F$1048576];[$actions_all.$B2]) -> 
 | J2: of:=INDEX([$actions.G$1:.G$1048576];[$actions_all.$B2]) -> 0.0.2
A3: 1 | B3: 3 | C3: Tactic B | D3: of:=INDEX([$actions.A$1:.A$1048576];[$actions_all.$B3]) -> Scuttlebutt | E3: of:=INDEX([$actions.B$1:.B$1048576];[$actions_all.$B3]) -> Tactic | F3: of:=INDEX([$actions.C$1:.C$1048576];[$actions_all.$B3]) -> USN | G3: of:=INDEX([$actions.D$1:.D$1048576];[$actions_all.$B3]) -> Look at and reorder the top 4 cards of your deck. You may put any number on the bottom of your deck in any order. | H3: of:=INDEX([$actions.E$1:.E$1048576];[$actions_all.$B3]) -> Images/scuttlebutt.jpeg | I3: of:=INDEX([$actions.F$1:.F$1048576];[$actions_all.$B3]) -> 
 | J3: of:=INDEX([$actions.G$1:.G$1048576];[$actions_all.$B3]) -> 0.0.2
A4: 1 | B4: 4 | C4: Tactic A | D4: of:=INDEX([$actions.A$1:.A$1048576];[$actions_all.$B4]) -> AF Is Short On Water | E4: of:=INDEX([$actions.B$1:.B$1048576];[$actions_all.$B4]) -> Tactic | F4: of:=INDEX([$actions.C$1:.C$1048576];[$actions_all.$B4]) -> USN | G4: of:=INDEX([$actions.D$1:.D$1048576];[$actions_all.$B4]) -> Take one asset card from your hand and put it face-up into play under your control; it may attack or defend this turn. If it is a squadron, it may be played on a carrier or territory. This asset must otherwise be valid to play. | H4: of:=INDEX([$actions.E$1:.E$1048576];[$actions_all.$B4]) -> Images/midway.jpg | I4: of:=INDEX([$actions.F$1:.F$1048576];[$actions_all.$B4]) -> 
 | J4: of:=INDEX([$actions.G$1:.G$1048576];[$actions_all.$B4]) -> 0.0.2
A5: 1 | B5: 4 | C5: Tactic B | D5: of:=INDEX([$actions.A$1:.A$1048576];[$actions_all.$B5]) -> AF Is Short On Water | E5: of:=INDEX([$actions.B$1:.B$1048576];[$actions_all.$B5]) -> Tactic | F5: of:=INDEX([$actions.C$1:.C$1048576];[$actions_all.$B5]) -> USN | G5: of:=INDEX([$actions.D$1:.D$1048576];[$actions_all.$B5]) -> Take one asset card from your hand and put it face-up into play under your control; it may attack or defend this turn. If it is a squadron, it may be played on a carrier or territory. This asset must otherwise be valid to play. | H5: of:=INDEX([$actions.E$1:.E$1048576];[$actions_all.$B5]) -> Images/midway.jpg | I5: of:=INDEX([$actions.F$1:.F$1048576];[$actions_all.$B5]) -> 
 | J5: of:=INDEX([$actions.G$1:.G$1048576];[$actions_all.$B5]) -> 0.0.2
A6: 1 | B6: 6 | C6: Tactic A | D6: of:=INDEX([$actions.A$1:.A$1048576];[$actions_all.$B6]) -> KH-11 Key Hole | E6: of:=INDEX([$actions.B$1:.B$1048576];[$actions_all.$B6]) -> Tactic | F6: of:=INDEX([$actions.C$1:.C$1048576];[$actions_all.$B6]) -> USN | G6: of:=INDEX([$actions.D$1:.D$1048576];[$actions_all.$B6]) -> Flip all military assets your opponent controls face up. You opponent must also reveal their hand. | H6: of:=INDEX([$actions.E$1:.E$1048576];[$actions_all.$B6]) -> Images/keyhole.jpg | I6: of:=INDEX([$actions.F$1:.F$1048576];[$actions_all.$B6]) -> 
 | J6: of:=INDEX([$actions.G$1:.G$1048576];[$actions_all.$B6]) -> 0.0.2
A7: 1 | B7: 6 | C7: Tactic B | D7: of:=INDEX([$actions.A$1:.A$1048576];[$actions_all.$B7]) -> KH-11 Key Hole | E7: of:=INDEX([$actions.B$1:.B$1048576];[$actions_all.$B7]) -> Tactic | F7: of:=INDEX([$actions.C$1:.C$1048576];[$actions_all.$B7]) -> USN | G7: of:=INDEX([$actions.D$1:.D$1048576];[$actions_all.$B7]) -> Flip all military assets your opponent controls face up. You opponent must also reveal their hand. | H7: of:=INDEX([$actions.E$1:.E$1048576];[$actions_all.$B7]) -> Images/keyhole.jpg | I7: of:=INDEX([$actions.F$1:.F$1048576];[$actions_all.$B7]) -> 
 | J7: of:=INDEX([$actions.G$1:.G$1048576];[$actions_all.$B7]) -> 0.0.2
A8: 1 | B8: 9 | C8: Tactic A | D8: of:=INDEX([$actions.A$1:.A$1048576];[$actions_all.$B8]) -> NATO Allies | E8: of:=INDEX([$actions.B$1:.B$1048576];[$actions_all.$B8]) -> Tactic | F8: of:=INDEX([$actions.C$1:.C$1048576];[$actions_all.$B8]) -> USN | G8: of:=INDEX([$actions.D$1:.D$1048576];[$actions_all.$B8]) -> Search your deck for a squadron, reveal it, and place it on a territory you control. Then shuffle your deck. You must control a territory to play this card. | H8: of:=INDEX([$actions.E$1:.E$1048576];[$actions_all.$B8]) -> Images/nato.jpg | I8: of:=INDEX([$actions.F$1:.F$1048576];[$actions_all.$B8]) -> 
 | J8: of:=INDEX([$actions.G$1:.G$1048576];[$actions_all.$B8]) -> 0.0.2
A9: 1 | B9: 9 | C9: Tactic B | D9: of:=INDEX([$actions.A$1:.A$1048576];[$actions_all.$B9]) -> NATO Allies | E9: of:=INDEX([$actions.B$1:.B$1048576];[$actions_all.$B9]) -> Tactic | F9: of:=INDEX([$actions.C$1:.C$1048576];[$actions_all.$B9]) -> USN | G9: of:=INDEX([$actions.D$1:.D$1048576];[$actions_all.$B9]) -> Search your deck for a squadron, reveal it, and place it on a territory you control. Then shuffle your deck. You must control a territory to play this card. | H9: of:=INDEX([$actions.E$1:.E$1048576];[$actions_all.$B9]) -> Images/nato.jpg | I9: of:=INDEX([$actions.F$1:.F$1048576];[$actions_all.$B9]) -> 
 | J9: of:=INDEX([$actions.G$1:.G$1048576];[$actions_all.$B9]) -> 0.0.2
A10: 1 | B10: 9 | C10: Tactic C | D10: of:=INDEX([$actions.A$1:.A$1048576];[$actions_all.$B10]) -> NATO Allies | E10: of:=INDEX([$actions.B$1:.B$1048576];[$actions_all.$B10]) -> Tactic | F10: of:=INDEX([$actions.C$1:.C$1048576];[$actions_all.$B10]) -> USN | G10: of:=INDEX([$actions.D$1:.D$1048576];[$actions_all.$B10]) -> Search your deck for a squadron, reveal it, and place it on a territory you control. Then shuffle your deck. You must control a territory to play this card. | H10: of:=INDEX([$actions.E$1:.E$1048576];[$actions_all.$B10]) -> Images/nato.jpg | I10: of:=INDEX([$actions.F$1:.F$1048576];[$actions_all.$B10]) -> 
 | J10: of:=INDEX([$actions.G$1:.G$1048576];[$actions_all.$B10]) -> 0.0.2
A11: 1 | B11: 9 | C11: Tactic D | D11: of:=INDEX([$actions.A$1:.A$1048576];[$actions_all.$B11]) -> NATO Allies | E11: of:=INDEX([$actions.B$1:.B$1048576];[$actions_all.$B11]) -> Tactic | F11: of:=INDEX([$actions.C$1:.C$1048576];[$actions_all.$B11]) -> USN | G11: of:=INDEX([$actions.D$1:.D$1048576];[$actions_all.$B11]) -> Search your deck for a squadron, reveal it, and place it on a territory you control. Then shuffle your deck. You must control a territory to play this card. | H11: of:=INDEX([$actions.E$1:.E$1048576];[$actions_all.$B11]) -> Images/nato.jpg | I11: of:=INDEX([$actions.F$1:.F$1048576];[$actions_all.$B11]) -> 
 | J11: of:=INDEX([$actions.G$1:.G$1048576];[$actions_all.$B11]) -> 0.0.2
A12: 1 | B12: 10 | C12: Tactic A | D12: of:=INDEX([$actions.A$1:.A$1048576];[$actions_all.$B12]) -> Uncommon Valor Was A Common Virtue | E12: of:=INDEX([$actions.B$1:.B$1048576];[$actions_all.$B12]) -> Tactic | F12: of:=INDEX([$actions.C$1:.C$1048576];[$actions_all.$B12]) -> USN | G12: of:=INDEX([$actions.D$1:.D$1048576];[$actions_all.$B12]) -> You may immediately discard one military asset from an attack you've declared in order to add twice that asset's attack statistic to your damage total during the Normal Damage Step. | H12: of:=INDEX([$actions.E$1:.E$1048576];[$actions_all.$B12]) -> Images/valor.jpg | I12: of:=INDEX([$actions.F$1:.F$1048576];[$actions_all.$B12]) -> 
 | J12: of:=INDEX([$actions.G$1:.G$1048576];[$actions_all.$B12]) -> 0.0.2
A13: 1 | B13: 10 | C13: Tactic B | D13: of:=INDEX([$actions.A$1:.A$1048576];[$actions_all.$B13]) -> Uncommon Valor Was A Common Virtue | E13: of:=INDEX([$actions.B$1:.B$1048576];[$actions_all.$B13]) -> Tactic | F13: of:=INDEX([$actions.C$1:.C$1048576];[$actions_all.$B13]) -> USN | G13: of:=INDEX([$actions.D$1:.D$1048576];[$actions_all.$B13]) -> You may immediately discard one military asset from an attack you've declared in order to add twice that asset's attack statistic to your damage total during the Normal Damage Step. | H13: of:=INDEX([$actions.E$1:.E$1048576];[$actions_all.$B13]) -> Images/valor.jpg | I13: of:=INDEX([$actions.F$1:.F$1048576];[$actions_all.$B13]) -> 
 | J13: of:=INDEX([$actions.G$1:.G$1048576];[$actions_all.$B13]) -> 0.0.2
A14: 1 | B14: 11 | C14: Tactic A | D14: of:=INDEX([$actions.A$1:.A$1048576];[$actions_all.$B14]) -> I Have Not Yet Begun To Fight | E14: of:=INDEX([$actions.B$1:.B$1048576];[$actions_all.$B14]) -> Tactic | F14: of:=INDEX([$actions.C$1:.C$1048576];[$actions_all.$B14]) -> USN | G14: of:=INDEX([$actions.D$1:.D$1048576];[$actions_all.$B14]) -> Retrieve one card from your discard pile, reveal it, and put it on top of your deck. | H14: of:=INDEX([$actions.E$1:.E$1048576];[$actions_all.$B14]) -> Images/fight.jpg | I14: of:=INDEX([$actions.F$1:.F$1048576];[$actions_all.$B14]) -> 
 | J14: of:=INDEX([$actions.G$1:.G$1048576];[$actions_all.$B14]) -> 0.0.2
A15: 1 | B15: 11 | C15: Tactic B | D15: of:=INDEX([$actions.A$1:.A$1048576];[$actions_all.$B15]) -> I Have Not Yet Begun To Fight | E15: of:=INDEX([$actions.B$1:.B$1048576];[$actions_all.$B15]) -> Tactic | F15: of:=INDEX([$actions.C$1:.C$1048576];[$actions_all.$B15]) -> USN | G15: of:=INDEX([$actions.D$1:.D$1048576];[$actions_all.$B15]) -> Retrieve one card from your discard pile, reveal it, and put it on top of your deck. | H15: of:=INDEX([$actions.E$1:.E$1048576];[$actions_all.$B15]) -> Images/fight.jpg | I15: of:=INDEX([$actions.F$1:.F$1048576];[$actions_all.$B15]) -> 
 | J15: of:=INDEX([$actions.G$1:.G$1048576];[$actions_all.$B15]) -> 0.0.2
A16: 1 | B16: 11 | C16: Tactic C | D16: of:=INDEX([$actions.A$1:.A$1048576];[$actions_all.$B16]) -> I Have Not Yet Begun To Fight | E16: of:=INDEX([$actions.B$1:.B$1048576];[$actions_all.$B16]) -> Tactic | F16: of:=INDEX([$actions.C$1:.C$1048576];[$actions_all.$B16]) -> USN | G16: of:=INDEX([$actions.D$1:.D$1048576];[$actions_all.$B16]) -> Retrieve one card from your discard pile, reveal it, and put it on top of your deck. | H16: of:=INDEX([$actions.E$1:.E$1048576];[$actions_all.$B16]) -> Images/fight.jpg | I16: of:=INDEX([$actions.F$1:.F$1048576];[$actions_all.$B16]) -> 
 | J16: of:=INDEX([$actions.G$1:.G$1048576];[$actions_all.$B16]) -> 0.0.2
A17: 1 | B17: 25 | C17: Tactic A | D17: of:=INDEX([$actions.A$1:.A$1048576];[$actions_all.$B17]) -> That's the Spirit! | E17: of:=INDEX([$actions.B$1:.B$1048576];[$actions_all.$B17]) -> Tactic | F17: of:=INDEX([$actions.C$1:.C$1048576];[$actions_all.$B17]) -> USN | G17: of:=INDEX([$actions.D$1:.D$1048576];[$actions_all.$B17]) -> Immediately destroy one face-up military asset whose total defense including Help Defense and stationed aircraft is 6 or less. | H17: of:=INDEX([$actions.E$1:.E$1048576];[$actions_all.$B17]) -> Images/b2.jpg | I17: of:=INDEX([$actions.F$1:.F$1048576];[$actions_all.$B17]) -> 
 | J17: of:=INDEX([$actions.G$1:.G$1048576];[$actions_all.$B17]) -> 0.0.2
A18: 1 | B18: 25 | C18: Tactic B | D18: of:=INDEX([$actions.A$1:.A$1048576];[$actions_all.$B18]) -> That's the Spirit! | E18: of:=INDEX([$actions.B$1:.B$1048576];[$actions_all.$B18]) -> Tactic | F18: of:=INDEX([$actions.C$1:.C$1048576];[$actions_all.$B18]) -> USN | G18: of:=INDEX([$actions.D$1:.D$1048576];[$actions_all.$B18]) -> Immediately destroy one face-up military asset whose total defense including Help Defense and stationed aircraft is 6 or less. | H18: of:=INDEX([$actions.E$1:.E$1048576];[$actions_all.$B18]) -> Images/b2.jpg | I18: of:=INDEX([$actions.F$1:.F$1048576];[$actions_all.$B18]) -> 
 | J18: of:=INDEX([$actions.G$1:.G$1048576];[$actions_all.$B18]) -> 0.0.2
A19: 1 | B19: 7 | C19: Strategy A | D19: of:=INDEX([$actions.A$1:.A$1048576];[$actions_all.$B19]) -> Semper Fidelis | E19: of:=INDEX([$actions.B$1:.B$1048576];[$actions_all.$B19]) -> Strategy | F19: of:=INDEX([$actions.C$1:.C$1048576];[$actions_all.$B19]) -> USN | G19: of:=INDEX([$actions.D$1:.D$1048576];[$actions_all.$B19]) -> Whenever an opponent buys-back a territory card you control, they must discard an additional card from their deck. | H19: of:=INDEX([$actions.E$1:.E$1048576];[$actions_all.$B19]) -> Images/semperfi.jpg | I19: of:=INDEX([$actions.F$1:.F$1048576];[$actions_all.$B19]) -> 
 | J19: of:=INDEX([$actions.G$1:.G$1048576];[$actions_all.$B19]) -> 0.0.2
A20: 1 | B20: 7 | C20: Strategy B | D20: of:=INDEX([$actions.A$1:.A$1048576];[$actions_all.$B20]) -> Semper Fidelis | E20: of:=INDEX([$actions.B$1:.B$1048576];[$actions_all.$B20]) -> Strategy | F20: of:=INDEX([$actions.C$1:.C$1048576];[$actions_all.$B20]) -> USN | G20: of:=INDEX([$actions.D$1:.D$1048576];[$actions_all.$B20]) -> Whenever an opponent buys-back a territory card you control, they must discard an additional card from their deck. | H20: of:=INDEX([$actions.E$1:.E$1048576];[$actions_all.$B20]) -> Images/semperfi.jpg | I20: of:=INDEX([$actions.F$1:.F$1048576];[$actions_all.$B20]) -> 
 | J20: of:=INDEX([$actions.G$1:.G$1048576];[$actions_all.$B20]) -> 0.0.2
A21: 1 | B21: 8 | C21: Strategy A | D21: of:=INDEX([$actions.A$1:.A$1048576];[$actions_all.$B21]) -> Build 'Em Faster Than They Can Sink 'Em | E21: of:=INDEX([$actions.B$1:.B$1048576];[$actions_all.$B21]) -> Strategy | F21: of:=INDEX([$actions.C$1:.C$1048576];[$actions_all.$B21]) -> USN | G21: of:=INDEX([$actions.D$1:.D$1048576];[$actions_all.$B21]) -> Whenever you lose a military asset of logistics 3 or greater, you may draw a card. | H21: of:=INDEX([$actions.E$1:.E$1048576];[$actions_all.$B21]) -> Images/buildem.jpg | I21: of:=INDEX([$actions.F$1:.F$1048576];[$actions_all.$B21]) -> 
 | J21: of:=INDEX([$actions.G$1:.G$1048576];[$actions_all.$B21]) -> 0.0.2
A22: 1 | B22: 8 | C22: Strategy B | D22: of:=INDEX([$actions.A$1:.A$1048576];[$actions_all.$B22]) -> Build 'Em Faster Than They Can Sink 'Em | E22: of:=INDEX([$actions.B$1:.B$1048576];[$actions_all.$B22]) -> Strategy | F22: of:=INDEX([$actions.C$1:.C$1048576];[$actions_all.$B22]) -> USN | G22: of:=INDEX([$actions.D$1:.D$1048576];[$actions_all.$B22]) -> Whenever you lose a military asset of logistics 3 or greater, you may draw a card. | H22: of:=INDEX([$actions.E$1:.E$1048576];[$actions_all.$B22]) -> Images/buildem.jpg | I22: of:=INDEX([$actions.F$1:.F$1048576];[$actions_all.$B22]) -> 
 | J22: of:=INDEX([$actions.G$1:.G$1048576];[$actions_all.$B22]) -> 0.0.2
A23: 1 | B23: 26 | C23: Strategy A | D23: of:=INDEX([$actions.A$1:.A$1048576];[$actions_all.$B23]) -> Aerial Refueling | E23: of:=INDEX([$actions.B$1:.B$1048576];[$actions_all.$B23]) -> Strategy | F23: of:=INDEX([$actions.C$1:.C$1048576];[$actions_all.$B23]) -> USN | G23: of:=INDEX([$actions.D$1:.D$1048576];[$actions_all.$B23]) -> Carriers you control do not need to take part in the damage order of an attack in order for their aircraft to take part in an attack. Carriers are still considered to be attacking, and can still only attack one target per turn. | H23: of:=INDEX([$actions.E$1:.E$1048576];[$actions_all.$B23]) -> Images/refuel.jpg | I23: of:=INDEX([$actions.F$1:.F$1048576];[$actions_all.$B23]) -> 
 | J23: of:=INDEX([$actions.G$1:.G$1048576];[$actions_all.$B23]) -> 0.0.2
A24: 1 | B24: 26 | C24: Strategy B | D24: of:=INDEX([$actions.A$1:.A$1048576];[$actions_all.$B24]) -> Aerial Refueling | E24: of:=INDEX([$actions.B$1:.B$1048576];[$actions_all.$B24]) -> Strategy | F24: of:=INDEX([$actions.C$1:.C$1048576];[$actions_all.$B24]) -> USN | G24: of:=INDEX([$actions.D$1:.D$1048576];[$actions_all.$B24]) -> Carriers you control do not need to take part in the damage order of an attack in order for their aircraft to take part in an attack. Carriers are still considered to be attacking, and can still only attack one target per turn. | H24: of:=INDEX([$actions.E$1:.E$1048576];[$actions_all.$B24]) -> Images/refuel.jpg | I24: of:=INDEX([$actions.F$1:.F$1048576];[$actions_all.$B24]) -> 
 | J24: of:=INDEX([$actions.G$1:.G$1048576];[$actions_all.$B24]) -> 0.0.2
A25: 1 | B25: 15 | C25: Tactic A | D25: of:=INDEX([$actions.A$1:.A$1048576];[$actions_all.$B25]) -> Disinformation Campaigns | E25: of:=INDEX([$actions.B$1:.B$1048576];[$actions_all.$B25]) -> Tactic | F25: of:=INDEX([$actions.C$1:.C$1048576];[$actions_all.$B25]) -> RUS | G25: of:=INDEX([$actions.D$1:.D$1048576];[$actions_all.$B25]) -> Your opponent must discard 5 cards from their deck. | H25: of:=INDEX([$actions.E$1:.E$1048576];[$actions_all.$B25]) -> Images/disinformation.jpg | I25: of:=INDEX([$actions.F$1:.F$1048576];[$actions_all.$B25]) -> 
 | J25: of:=INDEX([$actions.G$1:.G$1048576];[$actions_all.$B25]) -> 0.0.2
A26: 1 | B26: 15 | C26: Tactic B | D26: of:=INDEX([$actions.A$1:.A$1048576];[$actions_all.$B26]) -> Disinformation Campaigns | E26: of:=INDEX([$actions.B$1:.B$1048576];[$actions_all.$B26]) -> Tactic | F26: of:=INDEX([$actions.C$1:.C$1048576];[$actions_all.$B26]) -> RUS | G26: of:=INDEX([$actions.D$1:.D$1048576];[$actions_all.$B26]) -> Your opponent must discard 5 cards from their deck. | H26: of:=INDEX([$actions.E$1:.E$1048576];[$actions_all.$B26]) -> Images/disinformation.jpg | I26: of:=INDEX([$actions.F$1:.F$1048576];[$actions_all.$B26]) -> 
 | J26: of:=INDEX([$actions.G$1:.G$1048576];[$actions_all.$B26]) -> 0.0.2
A27: 1 | B27: 15 | C27: Tactic C | D27: of:=INDEX([$actions.A$1:.A$1048576];[$actions_all.$B27]) -> Disinformation Campaigns | E27: of:=INDEX([$actions.B$1:.B$1048576];[$actions_all.$B27]) -> Tactic | F27: of:=INDEX([$actions.C$1:.C$1048576];[$actions_all.$B27]) -> RUS | G27: of:=INDEX([$actions.D$1:.D$1048576];[$actions_all.$B27]) -> Your opponent must discard 5 cards from their deck. | H27: of:=INDEX([$actions.E$1:.E$1048576];[$actions_all.$B27]) -> Images/disinformation.jpg | I27: of:=INDEX([$actions.F$1:.F$1048576];[$actions_all.$B27]) -> 
 | J27: of:=INDEX([$actions.G$1:.G$1048576];[$actions_all.$B27]) -> 0.0.2
A28: 1 | B28: 15 | C28: Tactic D | D28: of:=INDEX([$actions.A$1:.A$1048576];[$actions_all.$B28]) -> Disinformation Campaigns | E28: of:=INDEX([$actions.B$1:.B$1048576];[$actions_all.$B28]) -> Tactic | F28: of:=INDEX([$actions.C$1:.C$1048576];[$actions_all.$B28]) -> RUS | G28: of:=INDEX([$actions.D$1:.D$1048576];[$actions_all.$B28]) -> Your opponent must discard 5 cards from their deck. | H28: of:=INDEX([$actions.E$1:.E$1048576];[$actions_all.$B28]) -> Images/disinformation.jpg | I28: of:=INDEX([$actions.F$1:.F$1048576];[$actions_all.$B28]) -> 
 | J28: of:=INDEX([$actions.G$1:.G$1048576];[$actions_all.$B28]) -> 0.0.2
A29: 1 | B29: 22 | C29: Tactic A | D29: of:=INDEX([$actions.A$1:.A$1048576];[$actions_all.$B29]) -> Strategic Flexibility | E29: of:=INDEX([$actions.B$1:.B$1048576];[$actions_all.$B29]) -> Tactic | F29: of:=INDEX([$actions.C$1:.C$1048576];[$actions_all.$B29]) -> RUS | G29: of:=INDEX([$actions.D$1:.D$1048576];[$actions_all.$B29]) -> Search your deck for a strategy card, reveal that card and put it into your hand. Then shuffle your deck. | H29: of:=INDEX([$actions.E$1:.E$1048576];[$actions_all.$B29]) -> Images/dolls.jpeg | I29: of:=INDEX([$actions.F$1:.F$1048576];[$actions_all.$B29]) -> 
 | J29: of:=INDEX([$actions.G$1:.G$1048576];[$actions_all.$B29]) -> 0.0.2
A30: 1 | B30: 22 | C30: Tactic B | D30: of:=INDEX([$actions.A$1:.A$1048576];[$actions_all.$B30]) -> Strategic Flexibility | E30: of:=INDEX([$actions.B$1:.B$1048576];[$actions_all.$B30]) -> Tactic | F30: of:=INDEX([$actions.C$1:.C$1048576];[$actions_all.$B30]) -> RUS | G30: of:=INDEX([$actions.D$1:.D$1048576];[$actions_all.$B30]) -> Search your deck for a strategy card, reveal that card and put it into your hand. Then shuffle your deck. | H30: of:=INDEX([$actions.E$1:.E$1048576];[$actions_all.$B30]) -> Images/dolls.jpeg | I30: of:=INDEX([$actions.F$1:.F$1048576];[$actions_all.$B30]) -> 
 | J30: of:=INDEX([$actions.G$1:.G$1048576];[$actions_all.$B30]) -> 0.0.2
A31: 1 | B31: 21 | C31: Tactic A | D31: of:=INDEX([$actions.A$1:.A$1048576];[$actions_all.$B31]) -> Counter-Espionage | E31: of:=INDEX([$actions.B$1:.B$1048576];[$actions_all.$B31]) -> Tactic | F31: of:=INDEX([$actions.C$1:.C$1048576];[$actions_all.$B31]) -> RUS | G31: of:=INDEX([$actions.D$1:.D$1048576];[$actions_all.$B31]) -> Ignore the effects of a tactic card. | H31: of:=INDEX([$actions.E$1:.E$1048576];[$actions_all.$B31]) -> Images/putingun.jpg | I31: of:=INDEX([$actions.F$1:.F$1048576];[$actions_all.$B31]) -> 
 | J31: of:=INDEX([$actions.G$1:.G$1048576];[$actions_all.$B31]) -> 0.0.2
A32: 1 | B32: 21 | C32: Tactic B | D32: of:=INDEX([$actions.A$1:.A$1048576];[$actions_all.$B32]) -> Counter-Espionage | E32: of:=INDEX([$actions.B$1:.B$1048576];[$actions_all.$B32]) -> Tactic | F32: of:=INDEX([$actions.C$1:.C$1048576];[$actions_all.$B32]) -> RUS | G32: of:=INDEX([$actions.D$1:.D$1048576];[$actions_all.$B32]) -> Ignore the effects of a tactic card. | H32: of:=INDEX([$actions.E$1:.E$1048576];[$actions_all.$B32]) -> Images/putingun.jpg | I32: of:=INDEX([$actions.F$1:.F$1048576];[$actions_all.$B32]) -> 
 | J32: of:=INDEX([$actions.G$1:.G$1048576];[$actions_all.$B32]) -> 0.0.2
A33: 1 | B33: 21 | C33: Tactic C | D33: of:=INDEX([$actions.A$1:.A$1048576];[$actions_all.$B33]) -> Counter-Espionage | E33: of:=INDEX([$actions.B$1:.B$1048576];[$actions_all.$B33]) -> Tactic | F33: of:=INDEX([$actions.C$1:.C$1048576];[$actions_all.$B33]) -> RUS | G33: of:=INDEX([$actions.D$1:.D$1048576];[$actions_all.$B33]) -> Ignore the effects of a tactic card. | H33: of:=INDEX([$actions.E$1:.E$1048576];[$actions_all.$B33]) -> Images/putingun.jpg | I33: of:=INDEX([$actions.F$1:.F$1048576];[$actions_all.$B33]) -> 
 | J33: of:=INDEX([$actions.G$1:.G$1048576];[$actions_all.$B33]) -> 0.0.2
A34: 1 | B34: 18 | C34: Tactic A | D34: of:=INDEX([$actions.A$1:.A$1048576];[$actions_all.$B34]) -> Scorched Earth | E34: of:=INDEX([$actions.B$1:.B$1048576];[$actions_all.$B34]) -> Tactic | F34: of:=INDEX([$actions.C$1:.C$1048576];[$actions_all.$B34]) -> RUS | G34: of:=INDEX([$actions.D$1:.D$1048576];[$actions_all.$B34]) -> Destroy one territory belonging to your opponent that is under your control. | H34: of:=INDEX([$actions.E$1:.E$1048576];[$actions_all.$B34]) -> Images/scorched.jpg | I34: of:=INDEX([$actions.F$1:.F$1048576];[$actions_all.$B34]) -> 
 | J34: of:=INDEX([$actions.G$1:.G$1048576];[$actions_all.$B34]) -> 0.0.2
A35: 1 | B35: 18 | C35: Tactic B | D35: of:=INDEX([$actions.A$1:.A$1048576];[$actions_all.$B35]) -> Scorched Earth | E35: of:=INDEX([$actions.B$1:.B$1048576];[$actions_all.$B35]) -> Tactic | F35: of:=INDEX([$actions.C$1:.C$1048576];[$actions_all.$B35]) -> RUS | G35: of:=INDEX([$actions.D$1:.D$1048576];[$actions_all.$B35]) -> Destroy one territory belonging to your opponent that is under your control. | H35: of:=INDEX([$actions.E$1:.E$1048576];[$actions_all.$B35]) -> Images/scorched.jpg | I35: of:=INDEX([$actions.F$1:.F$1048576];[$actions_all.$B35]) -> 
 | J35: of:=INDEX([$actions.G$1:.G$1048576];[$actions_all.$B35]) -> 0.0.2
A36: 1 | B36: 28 | C36: Tactic A | D36: of:=INDEX([$actions.A$1:.A$1048576];[$actions_all.$B36]) -> Rapid Mobilization | E36: of:=INDEX([$actions.B$1:.B$1048576];[$actions_all.$B36]) -> Tactic | F36: of:=INDEX([$actions.C$1:.C$1048576];[$actions_all.$B36]) -> RUS | G36: of:=INDEX([$actions.D$1:.D$1048576];[$actions_all.$B36]) -> Search your library for military asset cards whose combined logistics is equal to or less than 4, put those cards into your hand, then shuffle your library. | H36: of:=INDEX([$actions.E$1:.E$1048576];[$actions_all.$B36]) -> Images/mobilization.jpg | I36: of:=INDEX([$actions.F$1:.F$1048576];[$actions_all.$B36]) -> 
 | J36: of:=INDEX([$actions.G$1:.G$1048576];[$actions_all.$B36]) -> 0.0.2
A37: 1 | B37: 28 | C37: Tactic B | D37: of:=INDEX([$actions.A$1:.A$1048576];[$actions_all.$B37]) -> Rapid Mobilization | E37: of:=INDEX([$actions.B$1:.B$1048576];[$actions_all.$B37]) -> Tactic | F37: of:=INDEX([$actions.C$1:.C$1048576];[$actions_all.$B37]) -> RUS | G37: of:=INDEX([$actions.D$1:.D$1048576];[$actions_all.$B37]) -> Search your library for military asset cards whose combined logistics is equal to or less than 4, put those cards into your hand, then shuffle your library. | H37: of:=INDEX([$actions.E$1:.E$1048576];[$actions_all.$B37]) -> Images/mobilization.jpg | I37: of:=INDEX([$actions.F$1:.F$1048576];[$actions_all.$B37]) -> 
 | J37: of:=INDEX([$actions.G$1:.G$1048576];[$actions_all.$B37]) -> 0.0.2
A38: 1 | B38: 13 | C38: Strategy A | D38: of:=INDEX([$actions.A$1:.A$1048576];[$actions_all.$B38]) -> The Long Winter | E38: of:=INDEX([$actions.B$1:.B$1048576];[$actions_all.$B38]) -> Strategy | F38: of:=INDEX([$actions.C$1:.C$1048576];[$actions_all.$B38]) -> RUS | G38: of:=INDEX([$actions.D$1:.D$1048576];[$actions_all.$B38]) -> Both players must discard 2 cards from their deck at the end of each turn. | H38: of:=INDEX([$actions.E$1:.E$1048576];[$actions_all.$B38]) -> Images/winter.jpg | I38: of:=INDEX([$actions.F$1:.F$1048576];[$actions_all.$B38]) -> 
 | J38: of:=INDEX([$actions.G$1:.G$1048576];[$actions_all.$B38]) -> 0.0.2
A39: 1 | B39: 13 | C39: Strategy B | D39: of:=INDEX([$actions.A$1:.A$1048576];[$actions_all.$B39]) -> The Long Winter | E39: of:=INDEX([$actions.B$1:.B$1048576];[$actions_all.$B39]) -> Strategy | F39: of:=INDEX([$actions.C$1:.C$1048576];[$actions_all.$B39]) -> RUS | G39: of:=INDEX([$actions.D$1:.D$1048576];[$actions_all.$B39]) -> Both players must discard 2 cards from their deck at the end of each turn. | H39: of:=INDEX([$actions.E$1:.E$1048576];[$actions_all.$B39]) -> Images/winter.jpg | I39: of:=INDEX([$actions.F$1:.F$1048576];[$actions_all.$B39]) -> 
 | J39: of:=INDEX([$actions.G$1:.G$1048576];[$actions_all.$B39]) -> 0.0.2
A40: 1 | B40: 14 | C40: Strategy A | D40: of:=INDEX([$actions.A$1:.A$1048576];[$actions_all.$B40]) -> State-Controlled Media | E40: of:=INDEX([$actions.B$1:.B$1048576];[$actions_all.$B40]) -> Strategy | F40: of:=INDEX([$actions.C$1:.C$1048576];[$actions_all.$B40]) -> RUS | G40: of:=INDEX([$actions.D$1:.D$1048576];[$actions_all.$B40]) -> Whenever you destroy a ship of logistics cost 3 or greater, you may look at the top card of your deck and may choose to put it on the bottom of your deck. | H40: of:=INDEX([$actions.E$1:.E$1048576];[$actions_all.$B40]) -> Images/statemedia.jpg | I40: of:=INDEX([$actions.F$1:.F$1048576];[$actions_all.$B40]) -> 
 | J40: of:=INDEX([$actions.G$1:.G$1048576];[$actions_all.$B40]) -> 0.0.2
A41: 1 | B41: 14 | C41: Strategy B | D41: of:=INDEX([$actions.A$1:.A$1048576];[$actions_all.$B41]) -> State-Controlled Media | E41: of:=INDEX([$actions.B$1:.B$1048576];[$actions_all.$B41]) -> Strategy | F41: of:=INDEX([$actions.C$1:.C$1048576];[$actions_all.$B41]) -> RUS | G41: of:=INDEX([$actions.D$1:.D$1048576];[$actions_all.$B41]) -> Whenever you destroy a ship of logistics cost 3 or greater, you may look at the top card of your deck and may choose to put it on the bottom of your deck. | H41: of:=INDEX([$actions.E$1:.E$1048576];[$actions_all.$B41]) -> Images/statemedia.jpg | I41: of:=INDEX([$actions.F$1:.F$1048576];[$actions_all.$B41]) -> 
 | J41: of:=INDEX([$actions.G$1:.G$1048576];[$actions_all.$B41]) -> 0.0.2
A42: 1 | B42: 17 | C42: Strategy A | D42: of:=INDEX([$actions.A$1:.A$1048576];[$actions_all.$B42]) -> The Russians Used a Pencil | E42: of:=INDEX([$actions.B$1:.B$1048576];[$actions_all.$B42]) -> Strategy | F42: of:=INDEX([$actions.C$1:.C$1048576];[$actions_all.$B42]) -> RUS | G42: of:=INDEX([$actions.D$1:.D$1048576];[$actions_all.$B42]) -> Each military asset you control requires 1 less logistics, with a minimum of 1 per military asset. | H42: of:=INDEX([$actions.E$1:.E$1048576];[$actions_all.$B42]) -> Images/sputnik.jpg | I42: of:=INDEX([$actions.F$1:.F$1048576];[$actions_all.$B42]) -> 
 | J42: of:=INDEX([$actions.G$1:.G$1048576];[$actions_all.$B42]) -> 0.0.2
A43: 1 | B43: 17 | C43: Strategy B | D43: of:=INDEX([$actions.A$1:.A$1048576];[$actions_all.$B43]) -> The Russians Used a Pencil | E43: of:=INDEX([$actions.B$1:.B$1048576];[$actions_all.$B43]) -> Strategy | F43: of:=INDEX([$actions.C$1:.C$1048576];[$actions_all.$B43]) -> RUS | G43: of:=INDEX([$actions.D$1:.D$1048576];[$actions_all.$B43]) -> Each military asset you control requires 1 less logistics, with a minimum of 1 per military asset. | H43: of:=INDEX([$actions.E$1:.E$1048576];[$actions_all.$B43]) -> Images/sputnik.jpg | I43: of:=INDEX([$actions.F$1:.F$1048576];[$actions_all.$B43]) -> 
 | J43: of:=INDEX([$actions.G$1:.G$1048576];[$actions_all.$B43]) -> 0.0.2
A44: 1 | B44: 27 | C44: Strategy A | D44: of:=INDEX([$actions.A$1:.A$1048576];[$actions_all.$B44]) -> Strategic Destabilization | E44: of:=INDEX([$actions.B$1:.B$1048576];[$actions_all.$B44]) -> Strategy | F44: of:=INDEX([$actions.C$1:.C$1048576];[$actions_all.$B44]) -> RUS | G44: of:=INDEX([$actions.D$1:.D$1048576];[$actions_all.$B44]) -> Your opponents territories provide 1 less logistics. | H44: of:=INDEX([$actions.E$1:.E$1048576];[$actions_all.$B44]) -> Images/electricgrid.jpg | I44: of:=INDEX([$actions.F$1:.F$1048576];[$actions_all.$B44]) -> 
 | J44: of:=INDEX([$actions.G$1:.G$1048576];[$actions_all.$B44]) -> 0.0.2
A45: 1 | B45: 27 | C45: Strategy B | D45: of:=INDEX([$actions.A$1:.A$1048576];[$actions_all.$B45]) -> Strategic Destabilization | E45: of:=INDEX([$actions.B$1:.B$1048576];[$actions_all.$B45]) -> Strategy | F45: of:=INDEX([$actions.C$1:.C$1048576];[$actions_all.$B45]) -> RUS | G45: of:=INDEX([$actions.D$1:.D$1048576];[$actions_all.$B45]) -> Your opponents territories provide 1 less logistics. | H45: of:=INDEX([$actions.E$1:.E$1048576];[$actions_all.$B45]) -> Images/electricgrid.jpg | I45: of:=INDEX([$actions.F$1:.F$1048576];[$actions_all.$B45]) -> 
 | J45: of:=INDEX([$actions.G$1:.G$1048576];[$actions_all.$B45]) -> 0.0.2

Sheet: actions_us_start
A1: Duplication | B1: Class | C1: Name | D1: of:=[$actions.A1] -> Title | E1: of:=[$actions.B1] -> Type | F1: of:=[$actions.C1] -> Roster | G1: of:=[$actions.D1] -> Description | H1: of:=[$actions.E1] -> Image | I1: of:=[$actions.F1] -> FlavorText | J1: of:=[$actions.G1] -> Version
A2: 1 | B2: 3 | C2: Tactic A | D2: of:=INDEX([$actions.A$1:.A$1048576];[$actions_us_start.$B2]) -> Scuttlebutt | E2: of:=INDEX([$actions.B$1:.B$1048576];[$actions_us_start.$B2]) -> Tactic | F2: of:=INDEX([$actions.C$1:.C$1048576];[$actions_us_start.$B2]) -> USN | G2: of:=INDEX([$actions.D$1:.D$1048576];[$actions_us_start.$B2]) -> Look at and reorder the top 4 cards of your deck. You may put any number on the bottom of your deck in any order. | H2: of:=INDEX([$actions.E$1:.E$1048576];[$actions_us_start.$B2]) -> Images/scuttlebutt.jpeg | I2: of:=INDEX([$actions.F$1:.F$1048576];[$actions_us_start.$B2]) -> 
 | J2: of:=INDEX([$actions.G$1:.G$1048576];[$actions_us_start.$B2]) -> 0.0.2
A3: 1 | B3: 3 | C3: Tactic B | D3: of:=INDEX([$actions.A$1:.A$1048576];[$actions_us_start.$B3]) -> Scuttlebutt | E3: of:=INDEX([$actions.B$1:.B$1048576];[$actions_us_start.$B3]) -> Tactic | F3: of:=INDEX([$actions.C$1:.C$1048576];[$actions_us_start.$B3]) -> USN | G3: of:=INDEX([$actions.D$1:.D$1048576];[$actions_us_start.$B3]) -> Look at and reorder the top 4 cards of your deck. You may put any number on the bottom of your deck in any order. | H3: of:=INDEX([$actions.E$1:.E$1048576];[$actions_us_start.$B3]) -> Images/scuttlebutt.jpeg | I3: of:=INDEX([$actions.F$1:.F$1048576];[$actions_us_start.$B3]) -> 
 | J3: of:=INDEX([$actions.G$1:.G$1048576];[$actions_us_start.$B3]) -> 0.0.2
A4: 0 | B4: 4 | C4: Tactic A | D4: of:=INDEX([$actions.A$1:.A$1048576];[$actions_us_start.$B4]) -> AF Is Short On Water | E4: of:=INDEX([$actions.B$1:.B$1048576];[$actions_us_start.$B4]) -> Tactic | F4: of:=INDEX([$actions.C$1:.C$1048576];[$actions_us_start.$B4]) -> USN | G4: of:=INDEX([$actions.D$1:.D$1048576];[$actions_us_start.$B4]) -> Take one asset card from your hand and put it face-up into play under your control; it may attack or defend this turn. If it is a squadron, it may be played on a carrier or territory. This asset must otherwise be valid to play. | H4: of:=INDEX([$actions.E$1:.E$1048576];[$actions_us_start.$B4]) -> Images/midway.jpg | I4: of:=INDEX([$actions.F$1:.F$1048576];[$actions_us_start.$B4]) -> 
 | J4: of:=INDEX([$actions.G$1:.G$1048576];[$actions_us_start.$B4]) -> 0.0.2
A5: 0 | B5: 4 | C5: Tactic B | D5: of:=INDEX([$actions.A$1:.A$1048576];[$actions_us_start.$B5]) -> AF Is Short On Water | E5: of:=INDEX([$actions.B$1:.B$1048576];[$actions_us_start.$B5]) -> Tactic | F5: of:=INDEX([$actions.C$1:.C$1048576];[$actions_us_start.$B5]) -> USN | G5: of:=INDEX([$actions.D$1:.D$1048576];[$actions_us_start.$B5]) -> Take one asset card from your hand and put it face-up into play under your control; it may attack or defend this turn. If it is a squadron, it may be played on a carrier or territory. This asset must otherwise be valid to play. | H5: of:=INDEX([$actions.E$1:.E$1048576];[$actions_us_start.$B5]) -> Images/midway.jpg | I5: of:=INDEX([$actions.F$1:.F$1048576];[$actions_us_start.$B5]) -> 
 | J5: of:=INDEX([$actions.G$1:.G$1048576];[$actions_us_start.$B5]) -> 0.0.2
A6: 0 | B6: 6 | C6: Tactic A | D6: of:=INDEX([$actions.A$1:.A$1048576];[$actions_us_start.$B6]) -> KH-11 Key Hole | E6: of:=INDEX([$actions.B$1:.B$1048576];[$actions_us_start.$B6]) -> Tactic | F6: of:=INDEX([$actions.C$1:.C$1048576];[$actions_us_start.$B6]) -> USN | G6: of:=INDEX([$actions.D$1:.D$1048576];[$actions_us_start.$B6]) -> Flip all military assets your opponent controls face up. You opponent must also reveal their hand. | H6: of:=INDEX([$actions.E$1:.E$1048576];[$actions_us_start.$B6]) -> Images/keyhole.jpg | I6: of:=INDEX([$actions.F$1:.F$1048576];[$actions_us_start.$B6]) -> 
 | J6: of:=INDEX([$actions.G$1:.G$1048576];[$actions_us_start.$B6]) -> 0.0.2
A7: 1 | B7: 6 | C7: Tactic B | D7: of:=INDEX([$actions.A$1:.A$1048576];[$actions_us_start.$B7]) -> KH-11 Key Hole | E7: of:=INDEX([$actions.B$1:.B$1048576];[$actions_us_start.$B7]) -> Tactic | F7: of:=INDEX([$actions.C$1:.C$1048576];[$actions_us_start.$B7]) -> USN | G7: of:=INDEX([$actions.D$1:.D$1048576];[$actions_us_start.$B7]) -> Flip all military assets your opponent controls face up. You opponent must also reveal their hand. | H7: of:=INDEX([$actions.E$1:.E$1048576];[$actions_us_start.$B7]) -> Images/keyhole.jpg | I7: of:=INDEX([$actions.F$1:.F$1048576];[$actions_us_start.$B7]) -> 
 | J7: of:=INDEX([$actions.G$1:.G$1048576];[$actions_us_start.$B7]) -> 0.0.2
A8: 0 | B8: 9 | C8: Tactic A | D8: of:=INDEX([$actions.A$1:.A$1048576];[$actions_us_start.$B8]) -> NATO Allies | E8: of:=INDEX([$actions.B$1:.B$1048576];[$actions_us_start.$B8]) -> Tactic | F8: of:=INDEX([$actions.C$1:.C$1048576];[$actions_us_start.$B8]) -> USN | G8: of:=INDEX([$actions.D$1:.D$1048576];[$actions_us_start.$B8]) -> Search your deck for a squadron, reveal it, and place it on a territory you control. Then shuffle your deck. You must control a territory to play this card. | H8: of:=INDEX([$actions.E$1:.E$1048576];[$actions_us_start.$B8]) -> Images/nato.jpg | I8: of:=INDEX([$actions.F$1:.F$1048576];[$actions_us_start.$B8]) -> 
 | J8: of:=INDEX([$actions.G$1:.G$1048576];[$actions_us_start.$B8]) -> 0.0.2
A9: 1 | B9: 9 | C9: Tactic B | D9: of:=INDEX([$actions.A$1:.A$1048576];[$actions_us_start.$B9]) -> NATO Allies | E9: of:=INDEX([$actions.B$1:.B$1048576];[$actions_us_start.$B9]) -> Tactic | F9: of:=INDEX([$actions.C$1:.C$1048576];[$actions_us_start.$B9]) -> USN | G9: of:=INDEX([$actions.D$1:.D$1048576];[$actions_us_start.$B9]) -> Search your deck for a squadron, reveal it, and place it on a territory you control. Then shuffle your deck. You must control a territory to play this card. | H9: of:=INDEX([$actions.E$1:.E$1048576];[$actions_us_start.$B9]) -> Images/nato.jpg | I9: of:=INDEX([$actions.F$1:.F$1048576];[$actions_us_start.$B9]) -> 
 | J9: of:=INDEX([$actions.G$1:.G$1048576];[$actions_us_start.$B9]) -> 0.0.2
A10: 1 | B10: 9 | C10: Tactic C | D10: of:=INDEX([$actions.A$1:.A$1048576];[$actions_us_start.$B10]) -> NATO Allies | E10: of:=INDEX([$actions.B$1:.B$1048576];[$actions_us_start.$B10]) -> Tactic | F10: of:=INDEX([$actions.C$1:.C$1048576];[$actions_us_start.$B10]) -> USN | G10: of:=INDEX([$actions.D$1:.D$1048576];[$actions_us_start.$B10]) -> Search your deck for a squadron, reveal it, and place it on a territory you control. Then shuffle your deck. You must control a territory to play this card. | H10: of:=INDEX([$actions.E$1:.E$1048576];[$actions_us_start.$B10]) -> Images/nato.jpg | I10: of:=INDEX([$actions.F$1:.F$1048576];[$actions_us_start.$B10]) -> 
 | J10: of:=INDEX([$actions.G$1:.G$1048576];[$actions_us_start.$B10]) -> 0.0.2
A11: 1 | B11: 9 | C11: Tactic D | D11: of:=INDEX([$actions.A$1:.A$1048576];[$actions_us_start.$B11]) -> NATO Allies | E11: of:=INDEX([$actions.B$1:.B$1048576];[$actions_us_start.$B11]) -> Tactic | F11: of:=INDEX([$actions.C$1:.C$1048576];[$actions_us_start.$B11]) -> USN | G11: of:=INDEX([$actions.D$1:.D$1048576];[$actions_us_start.$B11]) -> Search your deck for a squadron, reveal it, and place it on a territory you control. Then shuffle your deck. You must control a territory to play this card. | H11: of:=INDEX([$actions.E$1:.E$1048576];[$actions_us_start.$B11]) -> Images/nato.jpg | I11: of:=INDEX([$actions.F$1:.F$1048576];[$actions_us_start.$B11]) -> 
 | J11: of:=INDEX([$actions.G$1:.G$1048576];[$actions_us_start.$B11]) -> 0.0.2
A12: 0 | B12: 10 | C12: Tactic A | D12: of:=INDEX([$actions.A$1:.A$1048576];[$actions_us_start.$B12]) -> Uncommon Valor Was A Common Virtue | E12: of:=INDEX([$actions.B$1:.B$1048576];[$actions_us_start.$B12]) -> Tactic | F12: of:=INDEX([$actions.C$1:.C$1048576];[$actions_us_start.$B12]) -> USN | G12: of:=INDEX([$actions.D$1:.D$1048576];[$actions_us_start.$B12]) -> You may immediately discard one military asset from an attack you've declared in order to add twice that asset's attack statistic to your damage total during the Normal Damage Step. | H12: of:=INDEX([$actions.E$1:.E$1048576];[$actions_us_start.$B12]) -> Images/valor.jpg | I12: of:=INDEX([$actions.F$1:.F$1048576];[$actions_us_start.$B12]) -> 
 | J12: of:=INDEX([$actions.G$1:.G$1048576];[$actions_us_start.$B12]) -> 0.0.2
A13: 0 | B13: 10 | C13: Tactic B | D13: of:=INDEX([$actions.A$1:.A$1048576];[$actions_us_start.$B13]) -> Uncommon Valor Was A Common Virtue | E13: of:=INDEX([$actions.B$1:.B$1048576];[$actions_us_start.$B13]) -> Tactic | F13: of:=INDEX([$actions.C$1:.C$1048576];[$actions_us_start.$B13]) -> USN | G13: of:=INDEX([$actions.D$1:.D$1048576];[$actions_us_start.$B13]) -> You may immediately discard one military asset from an attack you've declared in order to add twice that asset's attack statistic to your damage total during the Normal Damage Step. | H13: of:=INDEX([$actions.E$1:.E$1048576];[$actions_us_start.$B13]) -> Images/valor.jpg | I13: of:=INDEX([$actions.F$1:.F$1048576];[$actions_us_start.$B13]) -> 
 | J13: of:=INDEX([$actions.G$1:.G$1048576];[$actions_us_start.$B13]) -> 0.0.2
A14: 1 | B14: 11 | C14: Tactic A | D14: of:=INDEX([$actions.A$1:.A$1048576];[$actions_us_start.$B14]) -> I Have Not Yet Begun To Fight | E14: of:=INDEX([$actions.B$1:.B$1048576];[$actions_us_start.$B14]) -> Tactic | F14: of:=INDEX([$actions.C$1:.C$1048576];[$actions_us_start.$B14]) -> USN | G14: of:=INDEX([$actions.D$1:.D$1048576];[$actions_us_start.$B14]) -> Retrieve one card from your discard pile, reveal it, and put it on top of your deck. | H14: of:=INDEX([$actions.E$1:.E$1048576];[$actions_us_start.$B14]) -> Images/fight.jpg | I14: of:=INDEX([$actions.F$1:.F$1048576];[$actions_us_start.$B14]) -> 
 | J14: of:=INDEX([$actions.G$1:.G$1048576];[$actions_us_start.$B14]) -> 0.0.2
A15: 1 | B15: 11 | C15: Tactic B | D15: of:=INDEX([$actions.A$1:.A$1048576];[$actions_us_start.$B15]) -> I Have Not Yet Begun To Fight | E15: of:=INDEX([$actions.B$1:.B$1048576];[$actions_us_start.$B15]) -> Tactic | F15: of:=INDEX([$actions.C$1:.C$1048576];[$actions_us_start.$B15]) -> USN | G15: of:=INDEX([$actions.D$1:.D$1048576];[$actions_us_start.$B15]) -> Retrieve one card from your discard pile, reveal it, and put it on top of your deck. | H15: of:=INDEX([$actions.E$1:.E$1048576];[$actions_us_start.$B15]) -> Images/fight.jpg | I15: of:=INDEX([$actions.F$1:.F$1048576];[$actions_us_start.$B15]) -> 
 | J15: of:=INDEX([$actions.G$1:.G$1048576];[$actions_us_start.$B15]) -> 0.0.2
A16: 0 | B16: 11 | C16: Tactic C | D16: of:=INDEX([$actions.A$1:.A$1048576];[$actions_us_start.$B16]) -> I Have Not Yet Begun To Fight | E16: of:=INDEX([$actions.B$1:.B$1048576];[$actions_us_start.$B16]) -> Tactic | F16: of:=INDEX([$actions.C$1:.C$1048576];[$actions_us_start.$B16]) -> USN | G16: of:=INDEX([$actions.D$1:.D$1048576];[$actions_us_start.$B16]) -> Retrieve one card from your discard pile, reveal it, and put it on top of your deck. | H16: of:=INDEX([$actions.E$1:.E$1048576];[$actions_us_start.$B16]) -> Images/fight.jpg | I16: of:=INDEX([$actions.F$1:.F$1048576];[$actions_us_start.$B16]) -> 
 | J16: of:=INDEX([$actions.G$1:.G$1048576];[$actions_us_start.$B16]) -> 0.0.2
A17: 1 | B17: 25 | C17: Tactic A | D17: of:=INDEX([$actions.A$1:.A$1048576];[$actions_us_start.$B17]) -> That's the Spirit! | E17: of:=INDEX([$actions.B$1:.B$1048576];[$actions_us_start.$B17]) -> Tactic | F17: of:=INDEX([$actions.C$1:.C$1048576];[$actions_us_start.$B17]) -> USN | G17: of:=INDEX([$actions.D$1:.D$1048576];[$actions_us_start.$B17]) -> Immediately destroy one face-up military asset whose total defense including Help Defense and stationed aircraft is 6 or less. | H17: of:=INDEX([$actions.E$1:.E$1048576];[$actions_us_start.$B17]) -> Images/b2.jpg | I17: of:=INDEX([$actions.F$1:.F$1048576];[$actions_us_start.$B17]) -> 
 | J17: of:=INDEX([$actions.G$1:.G$1048576];[$actions_us_start.$B17]) -> 0.0.2
A18: 1 | B18: 25 | C18: Tactic B | D18: of:=INDEX([$actions.A$1:.A$1048576];[$actions_us_start.$B18]) -> That's the Spirit! | E18: of:=INDEX([$actions.B$1:.B$1048576];[$actions_us_start.$B18]) -> Tactic | F18: of:=INDEX([$actions.C$1:.C$1048576];[$actions_us_start.$B18]) -> USN | G18: of:=INDEX([$actions.D$1:.D$1048576];[$actions_us_start.$B18]) -> Immediately destroy one face-up military asset whose total defense including Help Defense and stationed aircraft is 6 or less. | H18: of:=INDEX([$actions.E$1:.E$1048576];[$actions_us_start.$B18]) -> Images/b2.jpg | I18: of:=INDEX([$actions.F$1:.F$1048576];[$actions_us_start.$B18]) -> 
 | J18: of:=INDEX([$actions.G$1:.G$1048576];[$actions_us_start.$B18]) -> 0.0.2
A19: 0 | B19: 7 | C19: Strategy A | D19: of:=INDEX([$actions.A$1:.A$1048576];[$actions_us_start.$B19]) -> Semper Fidelis | E19: of:=INDEX([$actions.B$1:.B$1048576];[$actions_us_start.$B19]) -> Strategy | F19: of:=INDEX([$actions.C$1:.C$1048576];[$actions_us_start.$B19]) -> USN | G19: of:=INDEX([$actions.D$1:.D$1048576];[$actions_us_start.$B19]) -> Whenever an opponent buys-back a territory card you control, they must discard an additional card from their deck. | H19: of:=INDEX([$actions.E$1:.E$1048576];[$actions_us_start.$B19]) -> Images/semperfi.jpg | I19: of:=INDEX([$actions.F$1:.F$1048576];[$actions_us_start.$B19]) -> 
 | J19: of:=INDEX([$actions.G$1:.G$1048576];[$actions_us_start.$B19]) -> 0.0.2
A20: 0 | B20: 7 | C20: Strategy B | D20: of:=INDEX([$actions.A$1:.A$1048576];[$actions_us_start.$B20]) -> Semper Fidelis | E20: of:=INDEX([$actions.B$1:.B$1048576];[$actions_us_start.$B20]) -> Strategy | F20: of:=INDEX([$actions.C$1:.C$1048576];[$actions_us_start.$B20]) -> USN | G20: of:=INDEX([$actions.D$1:.D$1048576];[$actions_us_start.$B20]) -> Whenever an opponent buys-back a territory card you control, they must discard an additional card from their deck. | H20: of:=INDEX([$actions.E$1:.E$1048576];[$actions_us_start.$B20]) -> Images/semperfi.jpg | I20: of:=INDEX([$actions.F$1:.F$1048576];[$actions_us_start.$B20]) -> 
 | J20: of:=INDEX([$actions.G$1:.G$1048576];[$actions_us_start.$B20]) -> 0.0.2
A21: 0 | B21: 8 | C21: Strategy A | D21: of:=INDEX([$actions.A$1:.A$1048576];[$actions_us_start.$B21]) -> Build 'Em Faster Than They Can Sink 'Em | E21: of:=INDEX([$actions.B$1:.B$1048576];[$actions_us_start.$B21]) -> Strategy | F21: of:=INDEX([$actions.C$1:.C$1048576];[$actions_us_start.$B21]) -> USN | G21: of:=INDEX([$actions.D$1:.D$1048576];[$actions_us_start.$B21]) -> Whenever you lose a military asset of logistics 3 or greater, you may draw a card. | H21: of:=INDEX([$actions.E$1:.E$1048576];[$actions_us_start.$B21]) -> Images/buildem.jpg | I21: of:=INDEX([$actions.F$1:.F$1048576];[$actions_us_start.$B21]) -> 
 | J21: of:=INDEX([$actions.G$1:.G$1048576];[$actions_us_start.$B21]) -> 0.0.2
A22: 0 | B22: 8 | C22: Strategy B | D22: of:=INDEX([$actions.A$1:.A$1048576];[$actions_us_start.$B22]) -> Build 'Em Faster Than They Can Sink 'Em | E22: of:=INDEX([$actions.B$1:.B$1048576];[$actions_us_start.$B22]) -> Strategy | F22: of:=INDEX([$actions.C$1:.C$1048576];[$actions_us_start.$B22]) -> USN | G22: of:=INDEX([$actions.D$1:.D$1048576];[$actions_us_start.$B22]) -> Whenever you lose a military asset of logistics 3 or greater, you may draw a card. | H22: of:=INDEX([$actions.E$1:.E$1048576];[$actions_us_start.$B22]) -> Images/buildem.jpg | I22: of:=INDEX([$actions.F$1:.F$1048576];[$actions_us_start.$B22]) -> 
 | J22: of:=INDEX([$actions.G$1:.G$1048576];[$actions_us_start.$B22]) -> 0.0.2
A23: 0 | B23: 26 | C23: Strategy A | D23: of:=INDEX([$actions.A$1:.A$1048576];[$actions_us_start.$B23]) -> Aerial Refueling | E23: of:=INDEX([$actions.B$1:.B$1048576];[$actions_us_start.$B23]) -> Strategy | F23: of:=INDEX([$actions.C$1:.C$1048576];[$actions_us_start.$B23]) -> USN | G23: of:=INDEX([$actions.D$1:.D$1048576];[$actions_us_start.$B23]) -> Carriers you control do not need to take part in the damage order of an attack in order for their aircraft to take part in an attack. Carriers are still considered to be attacking, and can still only attack one target per turn. | H23: of:=INDEX([$actions.E$1:.E$1048576];[$actions_us_start.$B23]) -> Images/refuel.jpg | I23: of:=INDEX([$actions.F$1:.F$1048576];[$actions_us_start.$B23]) -> 
 | J23: of:=INDEX([$actions.G$1:.G$1048576];[$actions_us_start.$B23]) -> 0.0.2
A24: 0 | B24: 26 | C24: Strategy B | D24: of:=INDEX([$actions.A$1:.A$1048576];[$actions_us_start.$B24]) -> Aerial Refueling | E24: of:=INDEX([$actions.B$1:.B$1048576];[$actions_us_start.$B24]) -> Strategy | F24: of:=INDEX([$actions.C$1:.C$1048576];[$actions_us_start.$B24]) -> USN | G24: of:=INDEX([$actions.D$1:.D$1048576];[$actions_us_start.$B24]) -> Carriers you control do not need to take part in the damage order of an attack in order for their aircraft to take part in an attack. Carriers are still considered to be attacking, and can still only attack one target per turn. | H24: of:=INDEX([$actions.E$1:.E$1048576];[$actions_us_start.$B24]) -> Images/refuel.jpg | I24: of:=INDEX([$actions.F$1:.F$1048576];[$actions_us_start.$B24]) -> 
 | J24: of:=INDEX([$actions.G$1:.G$1048576];[$actions_us_start.$B24]) -> 0.0.2

Sheet: actions_ru_start
A1: Duplication | B1: Class | C1: Name | D1: of:=[$actions.A1] -> Title | E1: of:=[$actions.B1] -> Type | F1: of:=[$actions.C1] -> Roster | G1: of:=[$actions.D1] -> Description | H1: of:=[$actions.E1] -> Image | I1: of:=[$actions.F1] -> FlavorText | J1: of:=[$actions.G1] -> Version
A2: 0 | B2: 15 | C2: Tactic A | D2: of:=INDEX([$actions.A$1:.A$1048576];[$actions_ru_start.$B2]) -> Disinformation Campaigns | E2: of:=INDEX([$actions.B$1:.B$1048576];[$actions_ru_start.$B2]) -> Tactic | F2: of:=INDEX([$actions.C$1:.C$1048576];[$actions_ru_start.$B2]) -> RUS | G2: of:=INDEX([$actions.D$1:.D$1048576];[$actions_ru_start.$B2]) -> Your opponent must discard 5 cards from their deck. | H2: of:=INDEX([$actions.E$1:.E$1048576];[$actions_ru_start.$B2]) -> Images/disinformation.jpg | I2: of:=INDEX([$actions.F$1:.F$1048576];[$actions_ru_start.$B2]) -> 
 | J2: of:=INDEX([$actions.G$1:.G$1048576];[$actions_ru_start.$B2]) -> 0.0.2
A3: 0 | B3: 15 | C3: Tactic B | D3: of:=INDEX([$actions.A$1:.A$1048576];[$actions_ru_start.$B3]) -> Disinformation Campaigns | E3: of:=INDEX([$actions.B$1:.B$1048576];[$actions_ru_start.$B3]) -> Tactic | F3: of:=INDEX([$actions.C$1:.C$1048576];[$actions_ru_start.$B3]) -> RUS | G3: of:=INDEX([$actions.D$1:.D$1048576];[$actions_ru_start.$B3]) -> Your opponent must discard 5 cards from their deck. | H3: of:=INDEX([$actions.E$1:.E$1048576];[$actions_ru_start.$B3]) -> Images/disinformation.jpg | I3: of:=INDEX([$actions.F$1:.F$1048576];[$actions_ru_start.$B3]) -> 
 | J3: of:=INDEX([$actions.G$1:.G$1048576];[$actions_ru_start.$B3]) -> 0.0.2
A4: 0 | B4: 15 | C4: Tactic C | D4: of:=INDEX([$actions.A$1:.A$1048576];[$actions_ru_start.$B4]) -> Disinformation Campaigns | E4: of:=INDEX([$actions.B$1:.B$1048576];[$actions_ru_start.$B4]) -> Tactic | F4: of:=INDEX([$actions.C$1:.C$1048576];[$actions_ru_start.$B4]) -> RUS | G4: of:=INDEX([$actions.D$1:.D$1048576];[$actions_ru_start.$B4]) -> Your opponent must discard 5 cards from their deck. | H4: of:=INDEX([$actions.E$1:.E$1048576];[$actions_ru_start.$B4]) -> Images/disinformation.jpg | I4: of:=INDEX([$actions.F$1:.F$1048576];[$actions_ru_start.$B4]) -> 
 | J4: of:=INDEX([$actions.G$1:.G$1048576];[$actions_ru_start.$B4]) -> 0.0.2
A5: 0 | B5: 15 | C5: Tactic D | D5: of:=INDEX([$actions.A$1:.A$1048576];[$actions_ru_start.$B5]) -> Disinformation Campaigns | E5: of:=INDEX([$actions.B$1:.B$1048576];[$actions_ru_start.$B5]) -> Tactic | F5: of:=INDEX([$actions.C$1:.C$1048576];[$actions_ru_start.$B5]) -> RUS | G5: of:=INDEX([$actions.D$1:.D$1048576];[$actions_ru_start.$B5]) -> Your opponent must discard 5 cards from their deck. | H5: of:=INDEX([$actions.E$1:.E$1048576];[$actions_ru_start.$B5]) -> Images/disinformation.jpg | I5: of:=INDEX([$actions.F$1:.F$1048576];[$actions_ru_start.$B5]) -> 
 | J5: of:=INDEX([$actions.G$1:.G$1048576];[$actions_ru_start.$B5]) -> 0.0.2
A6: 1 | B6: 22 | C6: Tactic A | D6: of:=INDEX([$actions.A$1:.A$1048576];[$actions_ru_start.$B6]) -> Strategic Flexibility | E6: of:=INDEX([$actions.B$1:.B$1048576];[$actions_ru_start.$B6]) -> Tactic | F6: of:=INDEX([$actions.C$1:.C$1048576];[$actions_ru_start.$B6]) -> RUS | G6: of:=INDEX([$actions.D$1:.D$1048576];[$actions_ru_start.$B6]) -> Search your deck for a strategy card, reveal that card and put it into your hand. Then shuffle your deck. | H6: of:=INDEX([$actions.E$1:.E$1048576];[$actions_ru_start.$B6]) -> Images/dolls.jpeg | I6: of:=INDEX([$actions.F$1:.F$1048576];[$actions_ru_start.$B6]) -> 
 | J6: of:=INDEX([$actions.G$1:.G$1048576];[$actions_ru_start.$B6]) -> 0.0.2
A7: 1 | B7: 22 | C7: Tactic B | D7: of:=INDEX([$actions.A$1:.A$1048576];[$actions_ru_start.$B7]) -> Strategic Flexibility | E7: of:=INDEX([$actions.B$1:.B$1048576];[$actions_ru_start.$B7]) -> Tactic | F7: of:=INDEX([$actions.C$1:.C$1048576];[$actions_ru_start.$B7]) -> RUS | G7: of:=INDEX([$actions.D$1:.D$1048576];[$actions_ru_start.$B7]) -> Search your deck for a strategy card, reveal that card and put it into your hand. Then shuffle your deck. | H7: of:=INDEX([$actions.E$1:.E$1048576];[$actions_ru_start.$B7]) -> Images/dolls.jpeg | I7: of:=INDEX([$actions.F$1:.F$1048576];[$actions_ru_start.$B7]) -> 
 | J7: of:=INDEX([$actions.G$1:.G$1048576];[$actions_ru_start.$B7]) -> 0.0.2
A8: 1 | B8: 21 | C8: Tactic A | D8: of:=INDEX([$actions.A$1:.A$1048576];[$actions_ru_start.$B8]) -> Counter-Espionage | E8: of:=INDEX([$actions.B$1:.B$1048576];[$actions_ru_start.$B8]) -> Tactic | F8: of:=INDEX([$actions.C$1:.C$1048576];[$actions_ru_start.$B8]) -> RUS | G8: of:=INDEX([$actions.D$1:.D$1048576];[$actions_ru_start.$B8]) -> Ignore the effects of a tactic card. | H8: of:=INDEX([$actions.E$1:.E$1048576];[$actions_ru_start.$B8]) -> Images/putingun.jpg | I8: of:=INDEX([$actions.F$1:.F$1048576];[$actions_ru_start.$B8]) -> 
 | J8: of:=INDEX([$actions.G$1:.G$1048576];[$actions_ru_start.$B8]) -> 0.0.2
A9: 1 | B9: 21 | C9: Tactic B | D9: of:=INDEX([$actions.A$1:.A$1048576];[$actions_ru_start.$B9]) -> Counter-Espionage | E9: of:=INDEX([$actions.B$1:.B$1048576];[$actions_ru_start.$B9]) -> Tactic | F9: of:=INDEX([$actions.C$1:.C$1048576];[$actions_ru_start.$B9]) -> RUS | G9: of:=INDEX([$actions.D$1:.D$1048576];[$actions_ru_start.$B9]) -> Ignore the effects of a tactic card. | H9: of:=INDEX([$actions.E$1:.E$1048576];[$actions_ru_start.$B9]) -> Images/putingun.jpg | I9: of:=INDEX([$actions.F$1:.F$1048576];[$actions_ru_start.$B9]) -> 
 | J9: of:=INDEX([$actions.G$1:.G$1048576];[$actions_ru_start.$B9]) -> 0.0.2
A10: 0 | B10: 21 | C10: Tactic C | D10: of:=INDEX([$actions.A$1:.A$1048576];[$actions_ru_start.$B10]) -> Counter-Espionage | E10: of:=INDEX([$actions.B$1:.B$1048576];[$actions_ru_start.$B10]) -> Tactic | F10: of:=INDEX([$actions.C$1:.C$1048576];[$actions_ru_start.$B10]) -> RUS | G10: of:=INDEX([$actions.D$1:.D$1048576];[$actions_ru_start.$B10]) -> Ignore the effects of a tactic card. | H10: of:=INDEX([$actions.E$1:.E$1048576];[$actions_ru_start.$B10]) -> Images/putingun.jpg | I10: of:=INDEX([$actions.F$1:.F$1048576];[$actions_ru_start.$B10]) -> 
 | J10: of:=INDEX([$actions.G$1:.G$1048576];[$actions_ru_start.$B10]) -> 0.0.2
A11: 0 | B11: 18 | C11: Tactic A | D11: of:=INDEX([$actions.A$1:.A$1048576];[$actions_ru_start.$B11]) -> Scorched Earth | E11: of:=INDEX([$actions.B$1:.B$1048576];[$actions_ru_start.$B11]) -> Tactic | F11: of:=INDEX([$actions.C$1:.C$1048576];[$actions_ru_start.$B11]) -> RUS | G11: of:=INDEX([$actions.D$1:.D$1048576];[$actions_ru_start.$B11]) -> Destroy one territory belonging to your opponent that is under your control. | H11: of:=INDEX([$actions.E$1:.E$1048576];[$actions_ru_start.$B11]) -> Images/scorched.jpg | I11: of:=INDEX([$actions.F$1:.F$1048576];[$actions_ru_start.$B11]) -> 
 | J11: of:=INDEX([$actions.G$1:.G$1048576];[$actions_ru_start.$B11]) -> 0.0.2
A12: 0 | B12: 18 | C12: Tactic B | D12: of:=INDEX([$actions.A$1:.A$1048576];[$actions_ru_start.$B12]) -> Scorched Earth | E12: of:=INDEX([$actions.B$1:.B$1048576];[$actions_ru_start.$B12]) -> Tactic | F12: of:=INDEX([$actions.C$1:.C$1048576];[$actions_ru_start.$B12]) -> RUS | G12: of:=INDEX([$actions.D$1:.D$1048576];[$actions_ru_start.$B12]) -> Destroy one territory belonging to your opponent that is under your control. | H12: of:=INDEX([$actions.E$1:.E$1048576];[$actions_ru_start.$B12]) -> Images/scorched.jpg | I12: of:=INDEX([$actions.F$1:.F$1048576];[$actions_ru_start.$B12]) -> 
 | J12: of:=INDEX([$actions.G$1:.G$1048576];[$actions_ru_start.$B12]) -> 0.0.2
A13: 0 | B13: 28 | C13: Tactic A | D13: of:=INDEX([$actions.A$1:.A$1048576];[$actions_ru_start.$B13]) -> Rapid Mobilization | E13: of:=INDEX([$actions.B$1:.B$1048576];[$actions_ru_start.$B13]) -> Tactic | F13: of:=INDEX([$actions.C$1:.C$1048576];[$actions_ru_start.$B13]) -> RUS | G13: of:=INDEX([$actions.D$1:.D$1048576];[$actions_ru_start.$B13]) -> Search your library for military asset cards whose combined logistics is equal to or less than 4, put those cards into your hand, then shuffle your library. | H13: of:=INDEX([$actions.E$1:.E$1048576];[$actions_ru_start.$B13]) -> Images/mobilization.jpg | I13: of:=INDEX([$actions.F$1:.F$1048576];[$actions_ru_start.$B13]) -> 
 | J13: of:=INDEX([$actions.G$1:.G$1048576];[$actions_ru_start.$B13]) -> 0.0.2
A14: 1 | B14: 28 | C14: Tactic B | D14: of:=INDEX([$actions.A$1:.A$1048576];[$actions_ru_start.$B14]) -> Rapid Mobilization | E14: of:=INDEX([$actions.B$1:.B$1048576];[$actions_ru_start.$B14]) -> Tactic | F14: of:=INDEX([$actions.C$1:.C$1048576];[$actions_ru_start.$B14]) -> RUS | G14: of:=INDEX([$actions.D$1:.D$1048576];[$actions_ru_start.$B14]) -> Search your library for military asset cards whose combined logistics is equal to or less than 4, put those cards into your hand, then shuffle your library. | H14: of:=INDEX([$actions.E$1:.E$1048576];[$actions_ru_start.$B14]) -> Images/mobilization.jpg | I14: of:=INDEX([$actions.F$1:.F$1048576];[$actions_ru_start.$B14]) -> 
 | J14: of:=INDEX([$actions.G$1:.G$1048576];[$actions_ru_start.$B14]) -> 0.0.2
A15: 0 | B15: 13 | C15: Strategy A | D15: of:=INDEX([$actions.A$1:.A$1048576];[$actions_ru_start.$B15]) -> The Long Winter | E15: of:=INDEX([$actions.B$1:.B$1048576];[$actions_ru_start.$B15]) -> Strategy | F15: of:=INDEX([$actions.C$1:.C$1048576];[$actions_ru_start.$B15]) -> RUS | G15: of:=INDEX([$actions.D$1:.D$1048576];[$actions_ru_start.$B15]) -> Both players must discard 2 cards from their deck at the end of each turn. | H15: of:=INDEX([$actions.E$1:.E$1048576];[$actions_ru_start.$B15]) -> Images/winter.jpg | I15: of:=INDEX([$actions.F$1:.F$1048576];[$actions_ru_start.$B15]) -> 
 | J15: of:=INDEX([$actions.G$1:.G$1048576];[$actions_ru_start.$B15]) -> 0.0.2
A16: 1 | B16: 13 | C16: Strategy B | D16: of:=INDEX([$actions.A$1:.A$1048576];[$actions_ru_start.$B16]) -> The Long Winter | E16: of:=INDEX([$actions.B$1:.B$1048576];[$actions_ru_start.$B16]) -> Strategy | F16: of:=INDEX([$actions.C$1:.C$1048576];[$actions_ru_start.$B16]) -> RUS | G16: of:=INDEX([$actions.D$1:.D$1048576];[$actions_ru_start.$B16]) -> Both players must discard 2 cards from their deck at the end of each turn. | H16: of:=INDEX([$actions.E$1:.E$1048576];[$actions_ru_start.$B16]) -> Images/winter.jpg | I16: of:=INDEX([$actions.F$1:.F$1048576];[$actions_ru_start.$B16]) -> 
 | J16: of:=INDEX([$actions.G$1:.G$1048576];[$actions_ru_start.$B16]) -> 0.0.2
A17: 0 | B17: 14 | C17: Strategy A | D17: of:=INDEX([$actions.A$1:.A$1048576];[$actions_ru_start.$B17]) -> State-Controlled Media | E17: of:=INDEX([$actions.B$1:.B$1048576];[$actions_ru_start.$B17]) -> Strategy | F17: of:=INDEX([$actions.C$1:.C$1048576];[$actions_ru_start.$B17]) -> RUS | G17: of:=INDEX([$actions.D$1:.D$1048576];[$actions_ru_start.$B17]) -> Whenever you destroy a ship of logistics cost 3 or greater, you may look at the top card of your deck and may choose to put it on the bottom of your deck. | H17: of:=INDEX([$actions.E$1:.E$1048576];[$actions_ru_start.$B17]) -> Images/statemedia.jpg | I17: of:=INDEX([$actions.F$1:.F$1048576];[$actions_ru_start.$B17]) -> 
 | J17: of:=INDEX([$actions.G$1:.G$1048576];[$actions_ru_start.$B17]) -> 0.0.2
A18: 1 | B18: 14 | C18: Strategy B | D18: of:=INDEX([$actions.A$1:.A$1048576];[$actions_ru_start.$B18]) -> State-Controlled Media | E18: of:=INDEX([$actions.B$1:.B$1048576];[$actions_ru_start.$B18]) -> Strategy | F18: of:=INDEX([$actions.C$1:.C$1048576];[$actions_ru_start.$B18]) -> RUS | G18: of:=INDEX([$actions.D$1:.D$1048576];[$actions_ru_start.$B18]) -> Whenever you destroy a ship of logistics cost 3 or greater, you may look at the top card of your deck and may choose to put it on the bottom of your deck. | H18: of:=INDEX([$actions.E$1:.E$1048576];[$actions_ru_start.$B18]) -> Images/statemedia.jpg | I18: of:=INDEX([$actions.F$1:.F$1048576];[$actions_ru_start.$B18]) -> 
 | J18: of:=INDEX([$actions.G$1:.G$1048576];[$actions_ru_start.$B18]) -> 0.0.2
A19: 0 | B19: 17 | C19: Strategy A | D19: of:=INDEX([$actions.A$1:.A$1048576];[$actions_ru_start.$B19]) -> The Russians Used a Pencil | E19: of:=INDEX([$actions.B$1:.B$1048576];[$actions_ru_start.$B19]) -> Strategy | F19: of:=INDEX([$actions.C$1:.C$1048576];[$actions_ru_start.$B19]) -> RUS | G19: of:=INDEX([$actions.D$1:.D$1048576];[$actions_ru_start.$B19]) -> Each military asset you control requires 1 less logistics, with a minimum of 1 per military asset. | H19: of:=INDEX([$actions.E$1:.E$1048576];[$actions_ru_start.$B19]) -> Images/sputnik.jpg | I19: of:=INDEX([$actions.F$1:.F$1048576];[$actions_ru_start.$B19]) -> 
 | J19: of:=INDEX([$actions.G$1:.G$1048576];[$actions_ru_start.$B19]) -> 0.0.2
A20: 1 | B20: 17 | C20: Strategy B | D20: of:=INDEX([$actions.A$1:.A$1048576];[$actions_ru_start.$B20]) -> The Russians Used a Pencil | E20: of:=INDEX([$actions.B$1:.B$1048576];[$actions_ru_start.$B20]) -> Strategy | F20: of:=INDEX([$actions.C$1:.C$1048576];[$actions_ru_start.$B20]) -> RUS | G20: of:=INDEX([$actions.D$1:.D$1048576];[$actions_ru_start.$B20]) -> Each military asset you control requires 1 less logistics, with a minimum of 1 per military asset. | H20: of:=INDEX([$actions.E$1:.E$1048576];[$actions_ru_start.$B20]) -> Images/sputnik.jpg | I20: of:=INDEX([$actions.F$1:.F$1048576];[$actions_ru_start.$B20]) -> 
 | J20: of:=INDEX([$actions.G$1:.G$1048576];[$actions_ru_start.$B20]) -> 0.0.2
A21: 0 | B21: 27 | C21: Strategy A | D21: of:=INDEX([$actions.A$1:.A$1048576];[$actions_ru_start.$B21]) -> Strategic Destabilization | E21: of:=INDEX([$actions.B$1:.B$1048576];[$actions_ru_start.$B21]) -> Strategy | F21: of:=INDEX([$actions.C$1:.C$1048576];[$actions_ru_start.$B21]) -> RUS | G21: of:=INDEX([$actions.D$1:.D$1048576];[$actions_ru_start.$B21]) -> Your opponents territories provide 1 less logistics. | H21: of:=INDEX([$actions.E$1:.E$1048576];[$actions_ru_start.$B21]) -> Images/electricgrid.jpg | I21: of:=INDEX([$actions.F$1:.F$1048576];[$actions_ru_start.$B21]) -> 
 | J21: of:=INDEX([$actions.G$1:.G$1048576];[$actions_ru_start.$B21]) -> 0.0.2
A22: 1 | B22: 27 | C22: Strategy B | D22: of:=INDEX([$actions.A$1:.A$1048576];[$actions_ru_start.$B22]) -> Strategic Destabilization | E22: of:=INDEX([$actions.B$1:.B$1048576];[$actions_ru_start.$B22]) -> Strategy | F22: of:=INDEX([$actions.C$1:.C$1048576];[$actions_ru_start.$B22]) -> RUS | G22: of:=INDEX([$actions.D$1:.D$1048576];[$actions_ru_start.$B22]) -> Your opponents territories provide 1 less logistics. | H22: of:=INDEX([$actions.E$1:.E$1048576];[$actions_ru_start.$B22]) -> Images/electricgrid.jpg | I22: of:=INDEX([$actions.F$1:.F$1048576];[$actions_ru_start.$B22]) -> 
 | J22: of:=INDEX([$actions.G$1:.G$1048576];[$actions_ru_start.$B22]) -> 0.0.2

Sheet: territories_all
A1: Duplication | B1: Class | C1: Name | D1: of:=[$territories.A1] -> Title | E1: of:=[$territories.B1] -> LogisticsCapacity | F1: of:=[$territories.C1] -> ShoreDefense | G1: of:=[$territories.D1] -> Description | H1: of:=[$territories.E1] -> Roster | I1: of:=[$territories.F1] -> FlavorText | J1: of:=[$territories.G1] -> Image | K1: of:=[$territories.H1] -> Version
A2: 1 | B2: 2 | C2: Naval Station Norfolk | D2: of:=INDEX([$territories.A$1:.A$1048576];[$territories_all.$B2]) -> US Naval Base | E2: of:=INDEX([$territories.B$1:.B$1048576];[$territories_all.$B2]) -> 6 | F2: of:=INDEX([$territories.C$1:.C$1048576];[$territories_all.$B2]) -> 2 | G2: of:=INDEX([$territories.D$1:.D$1048576];[$territories_all.$B2]) -> 
 | H2: of:=INDEX([$territories.E$1:.E$1048576];[$territories_all.$B2]) -> USN | I2: of:=INDEX([$territories.F$1:.F$1048576];[$territories_all.$B2]) -> 
 | J2: of:=INDEX([$territories.G$1:.G$1048576];[$territories_all.$B2]) -> Images/navalbase.jpg | K2: of:=INDEX([$territories.H$1:.H$1048576];[$territories_all.$B2]) -> 0.0.2
A3: 1 | B3: 4 | C3: Joint Base Pearl Harbor | D3: of:=INDEX([$territories.A$1:.A$1048576];[$territories_all.$B3]) -> Joint Base Pearl Harbor | E3: of:=INDEX([$territories.B$1:.B$1048576];[$territories_all.$B3]) -> 5 | F3: of:=INDEX([$territories.C$1:.C$1048576];[$territories_all.$B3]) -> 4 | G3: of:=INDEX([$territories.D$1:.D$1048576];[$territories_all.$B3]) -> Grants 2 logistics capacity to the USN player if controlled by their opponent. | H3: of:=INDEX([$territories.E$1:.E$1048576];[$territories_all.$B3]) -> USN | I3: of:=INDEX([$territories.F$1:.F$1048576];[$territories_all.$B3]) -> "I believe that I interpret the will of the Congress and of the people when I assert that we will not only defend ourselves to the uttermost, but will make it very certain that this form of treachery shall never again endanger us." - FDR | J3: of:=INDEX([$territories.G$1:.G$1048576];[$territories_all.$B3]) -> Images/pearlharbor.jpg | K3: of:=INDEX([$territories.H$1:.H$1048576];[$territories_all.$B3]) -> 0.0.2
A4: 1 | B4: 2 | C4: Naval Air Station Jacksonville | D4: of:=INDEX([$territories.A$1:.A$1048576];[$territories_all.$B4]) -> US Naval Base | E4: of:=INDEX([$territories.B$1:.B$1048576];[$territories_all.$B4]) -> 6 | F4: of:=INDEX([$territories.C$1:.C$1048576];[$territories_all.$B4]) -> 2 | G4: of:=INDEX([$territories.D$1:.D$1048576];[$territories_all.$B4]) -> 
 | H4: of:=INDEX([$territories.E$1:.E$1048576];[$territories_all.$B4]) -> USN | I4: of:=INDEX([$territories.F$1:.F$1048576];[$territories_all.$B4]) -> 
 | J4: of:=INDEX([$territories.G$1:.G$1048576];[$territories_all.$B4]) -> Images/navalbase.jpg | K4: of:=INDEX([$territories.H$1:.H$1048576];[$territories_all.$B4]) -> 0.0.2
A5: 1 | B5: 2 | C5: Naval Base San Diego | D5: of:=INDEX([$territories.A$1:.A$1048576];[$territories_all.$B5]) -> US Naval Base | E5: of:=INDEX([$territories.B$1:.B$1048576];[$territories_all.$B5]) -> 6 | F5: of:=INDEX([$territories.C$1:.C$1048576];[$territories_all.$B5]) -> 2 | G5: of:=INDEX([$territories.D$1:.D$1048576];[$territories_all.$B5]) -> 
 | H5: of:=INDEX([$territories.E$1:.E$1048576];[$territories_all.$B5]) -> USN | I5: of:=INDEX([$territories.F$1:.F$1048576];[$territories_all.$B5]) -> 
 | J5: of:=INDEX([$territories.G$1:.G$1048576];[$territories_all.$B5]) -> Images/navalbase.jpg | K5: of:=INDEX([$territories.H$1:.H$1048576];[$territories_all.$B5]) -> 0.0.2
A6: 1 | B6: 2 | C6: Naval Station Mayport | D6: of:=INDEX([$territories.A$1:.A$1048576];[$territories_all.$B6]) -> US Naval Base | E6: of:=INDEX([$territories.B$1:.B$1048576];[$territories_all.$B6]) -> 6 | F6: of:=INDEX([$territories.C$1:.C$1048576];[$territories_all.$B6]) -> 2 | G6: of:=INDEX([$territories.D$1:.D$1048576];[$territories_all.$B6]) -> 
 | H6: of:=INDEX([$territories.E$1:.E$1048576];[$territories_all.$B6]) -> USN | I6: of:=INDEX([$territories.F$1:.F$1048576];[$territories_all.$B6]) -> 
 | J6: of:=INDEX([$territories.G$1:.G$1048576];[$territories_all.$B6]) -> Images/navalbase.jpg | K6: of:=INDEX([$territories.H$1:.H$1048576];[$territories_all.$B6]) -> 0.0.2
A7: 1 | B7: 2 | C7: Naval Air Station Corpus Christi | D7: of:=INDEX([$territories.A$1:.A$1048576];[$territories_all.$B7]) -> US Naval Base | E7: of:=INDEX([$territories.B$1:.B$1048576];[$territories_all.$B7]) -> 6 | F7: of:=INDEX([$territories.C$1:.C$1048576];[$territories_all.$B7]) -> 2 | G7: of:=INDEX([$territories.D$1:.D$1048576];[$territories_all.$B7]) -> 
 | H7: of:=INDEX([$territories.E$1:.E$1048576];[$territories_all.$B7]) -> USN | I7: of:=INDEX([$territories.F$1:.F$1048576];[$territories_all.$B7]) -> 
 | J7: of:=INDEX([$territories.G$1:.G$1048576];[$territories_all.$B7]) -> Images/navalbase.jpg | K7: of:=INDEX([$territories.H$1:.H$1048576];[$territories_all.$B7]) -> 0.0.2
A8: 1 | B8: 2 | C8: Naval Air Station Joint Reserve Base Fort Worth | D8: of:=INDEX([$territories.A$1:.A$1048576];[$territories_all.$B8]) -> US Naval Base | E8: of:=INDEX([$territories.B$1:.B$1048576];[$territories_all.$B8]) -> 6 | F8: of:=INDEX([$territories.C$1:.C$1048576];[$territories_all.$B8]) -> 2 | G8: of:=INDEX([$territories.D$1:.D$1048576];[$territories_all.$B8]) -> 
 | H8: of:=INDEX([$territories.E$1:.E$1048576];[$territories_all.$B8]) -> USN | I8: of:=INDEX([$territories.F$1:.F$1048576];[$territories_all.$B8]) -> 
 | J8: of:=INDEX([$territories.G$1:.G$1048576];[$territories_all.$B8]) -> Images/navalbase.jpg | K8: of:=INDEX([$territories.H$1:.H$1048576];[$territories_all.$B8]) -> 0.0.2
A9: 1 | B9: 2 | C9: Naval Base Kitsap | D9: of:=INDEX([$territories.A$1:.A$1048576];[$territories_all.$B9]) -> US Naval Base | E9: of:=INDEX([$territories.B$1:.B$1048576];[$territories_all.$B9]) -> 6 | F9: of:=INDEX([$territories.C$1:.C$1048576];[$territories_all.$B9]) -> 2 | G9: of:=INDEX([$territories.D$1:.D$1048576];[$territories_all.$B9]) -> 
 | H9: of:=INDEX([$territories.E$1:.E$1048576];[$territories_all.$B9]) -> USN | I9: of:=INDEX([$territories.F$1:.F$1048576];[$territories_all.$B9]) -> 
 | J9: of:=INDEX([$territories.G$1:.G$1048576];[$territories_all.$B9]) -> Images/navalbase.jpg | K9: of:=INDEX([$territories.H$1:.H$1048576];[$territories_all.$B9]) -> 0.0.2
A10: 1 | B10: 2 | C10: Naval Air Station Patuxent River | D10: of:=INDEX([$territories.A$1:.A$1048576];[$territories_all.$B10]) -> US Naval Base | E10: of:=INDEX([$territories.B$1:.B$1048576];[$territories_all.$B10]) -> 6 | F10: of:=INDEX([$territories.C$1:.C$1048576];[$territories_all.$B10]) -> 2 | G10: of:=INDEX([$territories.D$1:.D$1048576];[$territories_all.$B10]) -> 
 | H10: of:=INDEX([$territories.E$1:.E$1048576];[$territories_all.$B10]) -> USN | I10: of:=INDEX([$territories.F$1:.F$1048576];[$territories_all.$B10]) -> 
 | J10: of:=INDEX([$territories.G$1:.G$1048576];[$territories_all.$B10]) -> Images/navalbase.jpg | K10: of:=INDEX([$territories.H$1:.H$1048576];[$territories_all.$B10]) -> 0.0.2
A11: 1 | B11: 2 | C11: Naval Base Coronado | D11: of:=INDEX([$territories.A$1:.A$1048576];[$territories_all.$B11]) -> US Naval Base | E11: of:=INDEX([$territories.B$1:.B$1048576];[$territories_all.$B11]) -> 6 | F11: of:=INDEX([$territories.C$1:.C$1048576];[$territories_all.$B11]) -> 2 | G11: of:=INDEX([$territories.D$1:.D$1048576];[$territories_all.$B11]) -> 
 | H11: of:=INDEX([$territories.E$1:.E$1048576];[$territories_all.$B11]) -> USN | I11: of:=INDEX([$territories.F$1:.F$1048576];[$territories_all.$B11]) -> 
 | J11: of:=INDEX([$territories.G$1:.G$1048576];[$territories_all.$B11]) -> Images/navalbase.jpg | K11: of:=INDEX([$territories.H$1:.H$1048576];[$territories_all.$B11]) -> 0.0.2
A12: 1 | B12: 3 | C12: Pine Gap | D12: of:=INDEX([$territories.A$1:.A$1048576];[$territories_all.$B12]) -> Pine Gap | E12: of:=INDEX([$territories.B$1:.B$1048576];[$territories_all.$B12]) -> 4 | F12: of:=INDEX([$territories.C$1:.C$1048576];[$territories_all.$B12]) -> 2 | G12: of:=INDEX([$territories.D$1:.D$1048576];[$territories_all.$B12]) -> RAINFALL: During your first deployment phase each turn, select a face down asset controlled by your opponent. Your opponent must reveal this asset. It remains face down afterwards. | H12: of:=INDEX([$territories.E$1:.E$1048576];[$territories_all.$B12]) -> USN | I12: of:=INDEX([$territories.F$1:.F$1048576];[$territories_all.$B12]) -> 
 | J12: of:=INDEX([$territories.G$1:.G$1048576];[$territories_all.$B12]) -> Images/pinegap.jpg | K12: of:=INDEX([$territories.H$1:.H$1048576];[$territories_all.$B12]) -> 0.0.2
A13: 1 | B13: 2 | C13: United States Fleet Activities Yokosuka | D13: of:=INDEX([$territories.A$1:.A$1048576];[$territories_all.$B13]) -> US Naval Base | E13: of:=INDEX([$territories.B$1:.B$1048576];[$territories_all.$B13]) -> 6 | F13: of:=INDEX([$territories.C$1:.C$1048576];[$territories_all.$B13]) -> 2 | G13: of:=INDEX([$territories.D$1:.D$1048576];[$territories_all.$B13]) -> 
 | H13: of:=INDEX([$territories.E$1:.E$1048576];[$territories_all.$B13]) -> USN | I13: of:=INDEX([$territories.F$1:.F$1048576];[$territories_all.$B13]) -> 
 | J13: of:=INDEX([$territories.G$1:.G$1048576];[$territories_all.$B13]) -> Images/navalbase.jpg | K13: of:=INDEX([$territories.H$1:.H$1048576];[$territories_all.$B13]) -> 0.0.2
A14: 1 | B14: 5 | C14: Severomorsk | D14: of:=INDEX([$territories.A$1:.A$1048576];[$territories_all.$B14]) -> Russian Naval Base | E14: of:=INDEX([$territories.B$1:.B$1048576];[$territories_all.$B14]) -> 5 | F14: of:=INDEX([$territories.C$1:.C$1048576];[$territories_all.$B14]) -> 4 | G14: of:=INDEX([$territories.D$1:.D$1048576];[$territories_all.$B14]) -> Partisans: Provides -4 logistics capacity if controlled by a non-Russian player. | H14: of:=INDEX([$territories.E$1:.E$1048576];[$territories_all.$B14]) -> RUS | I14: of:=INDEX([$territories.F$1:.F$1048576];[$territories_all.$B14]) -> 
 | J14: of:=INDEX([$territories.G$1:.G$1048576];[$territories_all.$B14]) -> Images/russnavybase.jpg | K14: of:=INDEX([$territories.H$1:.H$1048576];[$territories_all.$B14]) -> 0.0.2
A15: 1 | B15: 5 | C15: Kaliningrad, Kaliningrad Oblast | D15: of:=INDEX([$territories.A$1:.A$1048576];[$territories_all.$B15]) -> Russian Naval Base | E15: of:=INDEX([$territories.B$1:.B$1048576];[$territories_all.$B15]) -> 5 | F15: of:=INDEX([$territories.C$1:.C$1048576];[$territories_all.$B15]) -> 4 | G15: of:=INDEX([$territories.D$1:.D$1048576];[$territories_all.$B15]) -> Partisans: Provides -4 logistics capacity if controlled by a non-Russian player. | H15: of:=INDEX([$territories.E$1:.E$1048576];[$territories_all.$B15]) -> RUS | I15: of:=INDEX([$territories.F$1:.F$1048576];[$territories_all.$B15]) -> 
 | J15: of:=INDEX([$territories.G$1:.G$1048576];[$territories_all.$B15]) -> Images/russnavybase.jpg | K15: of:=INDEX([$territories.H$1:.H$1048576];[$territories_all.$B15]) -> 0.0.2
A16: 1 | B16: 5 | C16: Sevastopol | D16: of:=INDEX([$territories.A$1:.A$1048576];[$territories_all.$B16]) -> Russian Naval Base | E16: of:=INDEX([$territories.B$1:.B$1048576];[$territories_all.$B16]) -> 5 | F16: of:=INDEX([$territories.C$1:.C$1048576];[$territories_all.$B16]) -> 4 | G16: of:=INDEX([$territories.D$1:.D$1048576];[$territories_all.$B16]) -> Partisans: Provides -4 logistics capacity if controlled by a non-Russian player. | H16: of:=INDEX([$territories.E$1:.E$1048576];[$territories_all.$B16]) -> RUS | I16: of:=INDEX([$territories.F$1:.F$1048576];[$territories_all.$B16]) -> 
 | J16: of:=INDEX([$territories.G$1:.G$1048576];[$territories_all.$B16]) -> Images/russnavybase.jpg | K16: of:=INDEX([$territories.H$1:.H$1048576];[$territories_all.$B16]) -> 0.0.2
A17: 1 | B17: 5 | C17: Atstrakhan | D17: of:=INDEX([$territories.A$1:.A$1048576];[$territories_all.$B17]) -> Russian Naval Base | E17: of:=INDEX([$territories.B$1:.B$1048576];[$territories_all.$B17]) -> 5 | F17: of:=INDEX([$territories.C$1:.C$1048576];[$territories_all.$B17]) -> 4 | G17: of:=INDEX([$territories.D$1:.D$1048576];[$territories_all.$B17]) -> Partisans: Provides -4 logistics capacity if controlled by a non-Russian player. | H17: of:=INDEX([$territories.E$1:.E$1048576];[$territories_all.$B17]) -> RUS | I17: of:=INDEX([$territories.F$1:.F$1048576];[$territories_all.$B17]) -> 
 | J17: of:=INDEX([$territories.G$1:.G$1048576];[$territories_all.$B17]) -> Images/russnavybase.jpg | K17: of:=INDEX([$territories.H$1:.H$1048576];[$territories_all.$B17]) -> 0.0.2
A18: 1 | B18: 5 | C18: Vladivostok | D18: of:=INDEX([$territories.A$1:.A$1048576];[$territories_all.$B18]) -> Russian Naval Base | E18: of:=INDEX([$territories.B$1:.B$1048576];[$territories_all.$B18]) -> 5 | F18: of:=INDEX([$territories.C$1:.C$1048576];[$territories_all.$B18]) -> 4 | G18: of:=INDEX([$territories.D$1:.D$1048576];[$territories_all.$B18]) -> Partisans: Provides -4 logistics capacity if controlled by a non-Russian player. | H18: of:=INDEX([$territories.E$1:.E$1048576];[$territories_all.$B18]) -> RUS | I18: of:=INDEX([$territories.F$1:.F$1048576];[$territories_all.$B18]) -> 
 | J18: of:=INDEX([$territories.G$1:.G$1048576];[$territories_all.$B18]) -> Images/russnavybase.jpg | K18: of:=INDEX([$territories.H$1:.H$1048576];[$territories_all.$B18]) -> 0.0.2
A19: 1 | B19: 5 | C19: Petrapavlovsk-Kamchatskiy | D19: of:=INDEX([$territories.A$1:.A$1048576];[$territories_all.$B19]) -> Russian Naval Base | E19: of:=INDEX([$territories.B$1:.B$1048576];[$territories_all.$B19]) -> 5 | F19: of:=INDEX([$territories.C$1:.C$1048576];[$territories_all.$B19]) -> 4 | G19: of:=INDEX([$territories.D$1:.D$1048576];[$territories_all.$B19]) -> Partisans: Provides -4 logistics capacity if controlled by a non-Russian player. | H19: of:=INDEX([$territories.E$1:.E$1048576];[$territories_all.$B19]) -> RUS | I19: of:=INDEX([$territories.F$1:.F$1048576];[$territories_all.$B19]) -> 
 | J19: of:=INDEX([$territories.G$1:.G$1048576];[$territories_all.$B19]) -> Images/russnavybase.jpg | K19: of:=INDEX([$territories.H$1:.H$1048576];[$territories_all.$B19]) -> 0.0.2
A20: 1 | B20: 5 | C20: Mekhachkala | D20: of:=INDEX([$territories.A$1:.A$1048576];[$territories_all.$B20]) -> Russian Naval Base | E20: of:=INDEX([$territories.B$1:.B$1048576];[$territories_all.$B20]) -> 5 | F20: of:=INDEX([$territories.C$1:.C$1048576];[$territories_all.$B20]) -> 4 | G20: of:=INDEX([$territories.D$1:.D$1048576];[$territories_all.$B20]) -> Partisans: Provides -4 logistics capacity if controlled by a non-Russian player. | H20: of:=INDEX([$territories.E$1:.E$1048576];[$territories_all.$B20]) -> RUS | I20: of:=INDEX([$territories.F$1:.F$1048576];[$territories_all.$B20]) -> 
 | J20: of:=INDEX([$territories.G$1:.G$1048576];[$territories_all.$B20]) -> Images/russnavybase.jpg | K20: of:=INDEX([$territories.H$1:.H$1048576];[$territories_all.$B20]) -> 0.0.2
A21: 1 | B21: 5 | C21: Novorossiysk | D21: of:=INDEX([$territories.A$1:.A$1048576];[$territories_all.$B21]) -> Russian Naval Base | E21: of:=INDEX([$territories.B$1:.B$1048576];[$territories_all.$B21]) -> 5 | F21: of:=INDEX([$territories.C$1:.C$1048576];[$territories_all.$B21]) -> 4 | G21: of:=INDEX([$territories.D$1:.D$1048576];[$territories_all.$B21]) -> Partisans: Provides -4 logistics capacity if controlled by a non-Russian player. | H21: of:=INDEX([$territories.E$1:.E$1048576];[$territories_all.$B21]) -> RUS | I21: of:=INDEX([$territories.F$1:.F$1048576];[$territories_all.$B21]) -> 
 | J21: of:=INDEX([$territories.G$1:.G$1048576];[$territories_all.$B21]) -> Images/russnavybase.jpg | K21: of:=INDEX([$territories.H$1:.H$1048576];[$territories_all.$B21]) -> 0.0.2
A22: 1 | B22: 5 | C22: Baltiysk | D22: of:=INDEX([$territories.A$1:.A$1048576];[$territories_all.$B22]) -> Russian Naval Base | E22: of:=INDEX([$territories.B$1:.B$1048576];[$territories_all.$B22]) -> 5 | F22: of:=INDEX([$territories.C$1:.C$1048576];[$territories_all.$B22]) -> 4 | G22: of:=INDEX([$territories.D$1:.D$1048576];[$territories_all.$B22]) -> Partisans: Provides -4 logistics capacity if controlled by a non-Russian player. | H22: of:=INDEX([$territories.E$1:.E$1048576];[$territories_all.$B22]) -> RUS | I22: of:=INDEX([$territories.F$1:.F$1048576];[$territories_all.$B22]) -> 
 | J22: of:=INDEX([$territories.G$1:.G$1048576];[$territories_all.$B22]) -> Images/russnavybase.jpg | K22: of:=INDEX([$territories.H$1:.H$1048576];[$territories_all.$B22]) -> 0.0.2
A23: 1 | B23: 5 | C23: Kronshtadt | D23: of:=INDEX([$territories.A$1:.A$1048576];[$territories_all.$B23]) -> Russian Naval Base | E23: of:=INDEX([$territories.B$1:.B$1048576];[$territories_all.$B23]) -> 5 | F23: of:=INDEX([$territories.C$1:.C$1048576];[$territories_all.$B23]) -> 4 | G23: of:=INDEX([$territories.D$1:.D$1048576];[$territories_all.$B23]) -> Partisans: Provides -4 logistics capacity if controlled by a non-Russian player. | H23: of:=INDEX([$territories.E$1:.E$1048576];[$territories_all.$B23]) -> RUS | I23: of:=INDEX([$territories.F$1:.F$1048576];[$territories_all.$B23]) -> 
 | J23: of:=INDEX([$territories.G$1:.G$1048576];[$territories_all.$B23]) -> Images/russnavybase.jpg | K23: of:=INDEX([$territories.H$1:.H$1048576];[$territories_all.$B23]) -> 0.0.2
A24: 1 | B24: 5 | C24: Tartus, Syria | D24: of:=INDEX([$territories.A$1:.A$1048576];[$territories_all.$B24]) -> Russian Naval Base | E24: of:=INDEX([$territories.B$1:.B$1048576];[$territories_all.$B24]) -> 5 | F24: of:=INDEX([$territories.C$1:.C$1048576];[$territories_all.$B24]) -> 4 | G24: of:=INDEX([$territories.D$1:.D$1048576];[$territories_all.$B24]) -> Partisans: Provides -4 logistics capacity if controlled by a non-Russian player. | H24: of:=INDEX([$territories.E$1:.E$1048576];[$territories_all.$B24]) -> RUS | I24: of:=INDEX([$territories.F$1:.F$1048576];[$territories_all.$B24]) -> 
 | J24: of:=INDEX([$territories.G$1:.G$1048576];[$territories_all.$B24]) -> Images/russnavybase.jpg | K24: of:=INDEX([$territories.H$1:.H$1048576];[$territories_all.$B24]) -> 0.0.2
A25: 1 | B25: 5 | C25: Arkhangelsk | D25: of:=INDEX([$territories.A$1:.A$1048576];[$territories_all.$B25]) -> Russian Naval Base | E25: of:=INDEX([$territories.B$1:.B$1048576];[$territories_all.$B25]) -> 5 | F25: of:=INDEX([$territories.C$1:.C$1048576];[$territories_all.$B25]) -> 4 | G25: of:=INDEX([$territories.D$1:.D$1048576];[$territories_all.$B25]) -> Partisans: Provides -4 logistics capacity if controlled by a non-Russian player. | H25: of:=INDEX([$territories.E$1:.E$1048576];[$territories_all.$B25]) -> RUS | I25: of:=INDEX([$territories.F$1:.F$1048576];[$territories_all.$B25]) -> 
 | J25: of:=INDEX([$territories.G$1:.G$1048576];[$territories_all.$B25]) -> Images/russnavybase.jpg | K25: of:=INDEX([$territories.H$1:.H$1048576];[$territories_all.$B25]) -> 0.0.2

Sheet: territories_us_start
A1: Duplication | B1: Class | C1: Name | D1: of:=[$territories.A1] -> Title | E1: of:=[$territories.B1] -> LogisticsCapacity | F1: of:=[$territories.C1] -> ShoreDefense | G1: of:=[$territories.D1] -> Description | H1: of:=[$territories.E1] -> Roster | I1: of:=[$territories.F1] -> FlavorText | J1: of:=[$territories.G1] -> Image | K1: of:=[$territories.H1] -> Version
A2: 1 | B2: 2 | C2: Naval Station Norfolk | D2: of:=INDEX([$territories.A$1:.A$1048576];[$territories_us_start.$B2]) -> US Naval Base | E2: of:=INDEX([$territories.B$1:.B$1048576];[$territories_us_start.$B2]) -> 6 | F2: of:=INDEX([$territories.C$1:.C$1048576];[$territories_us_start.$B2]) -> 2 | G2: of:=INDEX([$territories.D$1:.D$1048576];[$territories_us_start.$B2]) -> 
 | H2: of:=INDEX([$territories.E$1:.E$1048576];[$territories_us_start.$B2]) -> USN | I2: of:=INDEX([$territories.F$1:.F$1048576];[$territories_us_start.$B2]) -> 
 | J2: of:=INDEX([$territories.G$1:.G$1048576];[$territories_us_start.$B2]) -> Images/navalbase.jpg | K2: of:=INDEX([$territories.H$1:.H$1048576];[$territories_us_start.$B2]) -> 0.0.2
A3: 0 | B3: 4 | C3: Joint Base Pearl Harbor | D3: of:=INDEX([$territories.A$1:.A$1048576];[$territories_us_start.$B3]) -> Joint Base Pearl Harbor | E3: of:=INDEX([$territories.B$1:.B$1048576];[$territories_us_start.$B3]) -> 5 | F3: of:=INDEX([$territories.C$1:.C$1048576];[$territories_us_start.$B3]) -> 4 | G3: of:=INDEX([$territories.D$1:.D$1048576];[$territories_us_start.$B3]) -> Grants 2 logistics capacity to the USN player if controlled by their opponent. | H3: of:=INDEX([$territories.E$1:.E$1048576];[$territories_us_start.$B3]) -> USN | I3: of:=INDEX([$territories.F$1:.F$1048576];[$territories_us_start.$B3]) -> "I believe that I interpret the will of the Congress and of the people when I assert that we will not only defend ourselves to the uttermost, but will make it very certain that this form of treachery shall never again endanger us." - FDR | J3: of:=INDEX([$territories.G$1:.G$1048576];[$territories_us_start.$B3]) -> Images/pearlharbor.jpg | K3: of:=INDEX([$territories.H$1:.H$1048576];[$territories_us_start.$B3]) -> 0.0.2
A4: 1 | B4: 2 | C4: Naval Air Station Jacksonville | D4: of:=INDEX([$territories.A$1:.A$1048576];[$territories_us_start.$B4]) -> US Naval Base | E4: of:=INDEX([$territories.B$1:.B$1048576];[$territories_us_start.$B4]) -> 6 | F4: of:=INDEX([$territories.C$1:.C$1048576];[$territories_us_start.$B4]) -> 2 | G4: of:=INDEX([$territories.D$1:.D$1048576];[$territories_us_start.$B4]) -> 
 | H4: of:=INDEX([$territories.E$1:.E$1048576];[$territories_us_start.$B4]) -> USN | I4: of:=INDEX([$territories.F$1:.F$1048576];[$territories_us_start.$B4]) -> 
 | J4: of:=INDEX([$territories.G$1:.G$1048576];[$territories_us_start.$B4]) -> Images/navalbase.jpg | K4: of:=INDEX([$territories.H$1:.H$1048576];[$territories_us_start.$B4]) -> 0.0.2
A5: 1 | B5: 2 | C5: Naval Base San Diego | D5: of:=INDEX([$territories.A$1:.A$1048576];[$territories_us_start.$B5]) -> US Naval Base | E5: of:=INDEX([$territories.B$1:.B$1048576];[$territories_us_start.$B5]) -> 6 | F5: of:=INDEX([$territories.C$1:.C$1048576];[$territories_us_start.$B5]) -> 2 | G5: of:=INDEX([$territories.D$1:.D$1048576];[$territories_us_start.$B5]) -> 
 | H5: of:=INDEX([$territories.E$1:.E$1048576];[$territories_us_start.$B5]) -> USN | I5: of:=INDEX([$territories.F$1:.F$1048576];[$territories_us_start.$B5]) -> 
 | J5: of:=INDEX([$territories.G$1:.G$1048576];[$territories_us_start.$B5]) -> Images/navalbase.jpg | K5: of:=INDEX([$territories.H$1:.H$1048576];[$territories_us_start.$B5]) -> 0.0.2
A6: 1 | B6: 2 | C6: Naval Station Mayport | D6: of:=INDEX([$territories.A$1:.A$1048576];[$territories_us_start.$B6]) -> US Naval Base | E6: of:=INDEX([$territories.B$1:.B$1048576];[$territories_us_start.$B6]) -> 6 | F6: of:=INDEX([$territories.C$1:.C$1048576];[$territories_us_start.$B6]) -> 2 | G6: of:=INDEX([$territories.D$1:.D$1048576];[$territories_us_start.$B6]) -> 
 | H6: of:=INDEX([$territories.E$1:.E$1048576];[$territories_us_start.$B6]) -> USN | I6: of:=INDEX([$territories.F$1:.F$1048576];[$territories_us_start.$B6]) -> 
 | J6: of:=INDEX([$territories.G$1:.G$1048576];[$territories_us_start.$B6]) -> Images/navalbase.jpg | K6: of:=INDEX([$territories.H$1:.H$1048576];[$territories_us_start.$B6]) -> 0.0.2
A7: 1 | B7: 2 | C7: Naval Air Station Corpus Christi | D7: of:=INDEX([$territories.A$1:.A$1048576];[$territories_us_start.$B7]) -> US Naval Base | E7: of:=INDEX([$territories.B$1:.B$1048576];[$territories_us_start.$B7]) -> 6 | F7: of:=INDEX([$territories.C$1:.C$1048576];[$territories_us_start.$B7]) -> 2 | G7: of:=INDEX([$territories.D$1:.D$1048576];[$territories_us_start.$B7]) -> 
 | H7: of:=INDEX([$territories.E$1:.E$1048576];[$territories_us_start.$B7]) -> USN | I7: of:=INDEX([$territories.F$1:.F$1048576];[$territories_us_start.$B7]) -> 
 | J7: of:=INDEX([$territories.G$1:.G$1048576];[$territories_us_start.$B7]) -> Images/navalbase.jpg | K7: of:=INDEX([$territories.H$1:.H$1048576];[$territories_us_start.$B7]) -> 0.0.2
A8: 1 | B8: 2 | C8: Naval Air Station Joint Reserve Base Fort Worth | D8: of:=INDEX([$territories.A$1:.A$1048576];[$territories_us_start.$B8]) -> US Naval Base | E8: of:=INDEX([$territories.B$1:.B$1048576];[$territories_us_start.$B8]) -> 6 | F8: of:=INDEX([$territories.C$1:.C$1048576];[$territories_us_start.$B8]) -> 2 | G8: of:=INDEX([$territories.D$1:.D$1048576];[$territories_us_start.$B8]) -> 
 | H8: of:=INDEX([$territories.E$1:.E$1048576];[$territories_us_start.$B8]) -> USN | I8: of:=INDEX([$territories.F$1:.F$1048576];[$territories_us_start.$B8]) -> 
 | J8: of:=INDEX([$territories.G$1:.G$1048576];[$territories_us_start.$B8]) -> Images/navalbase.jpg | K8: of:=INDEX([$territories.H$1:.H$1048576];[$territories_us_start.$B8]) -> 0.0.2
A9: 1 | B9: 2 | C9: Naval Base Kitsap | D9: of:=INDEX([$territories.A$1:.A$1048576];[$territories_us_start.$B9]) -> US Naval Base | E9: of:=INDEX([$territories.B$1:.B$1048576];[$territories_us_start.$B9]) -> 6 | F9: of:=INDEX([$territories.C$1:.C$1048576];[$territories_us_start.$B9]) -> 2 | G9: of:=INDEX([$territories.D$1:.D$1048576];[$territories_us_start.$B9]) -> 
 | H9: of:=INDEX([$territories.E$1:.E$1048576];[$territories_us_start.$B9]) -> USN | I9: of:=INDEX([$territories.F$1:.F$1048576];[$territories_us_start.$B9]) -> 
 | J9: of:=INDEX([$territories.G$1:.G$1048576];[$territories_us_start.$B9]) -> Images/navalbase.jpg | K9: of:=INDEX([$territories.H$1:.H$1048576];[$territories_us_start.$B9]) -> 0.0.2
A10: 1 | B10: 2 | C10: Naval Air Station Patuxent River | D10: of:=INDEX([$territories.A$1:.A$1048576];[$territories_us_start.$B10]) -> US Naval Base | E10: of:=INDEX([$territories.B$1:.B$1048576];[$territories_us_start.$B10]) -> 6 | F10: of:=INDEX([$territories.C$1:.C$1048576];[$territories_us_start.$B10]) -> 2 | G10: of:=INDEX([$territories.D$1:.D$1048576];[$territories_us_start.$B10]) -> 
 | H10: of:=INDEX([$territories.E$1:.E$1048576];[$territories_us_start.$B10]) -> USN | I10: of:=INDEX([$territories.F$1:.F$1048576];[$territories_us_start.$B10]) -> 
 | J10: of:=INDEX([$territories.G$1:.G$1048576];[$territories_us_start.$B10]) -> Images/navalbase.jpg | K10: of:=INDEX([$territories.H$1:.H$1048576];[$territories_us_start.$B10]) -> 0.0.2
A11: 1 | B11: 2 | C11: Naval Base Coronado | D11: of:=INDEX([$territories.A$1:.A$1048576];[$territories_us_start.$B11]) -> US Naval Base | E11: of:=INDEX([$territories.B$1:.B$1048576];[$territories_us_start.$B11]) -> 6 | F11: of:=INDEX([$territories.C$1:.C$1048576];[$territories_us_start.$B11]) -> 2 | G11: of:=INDEX([$territories.D$1:.D$1048576];[$territories_us_start.$B11]) -> 
 | H11: of:=INDEX([$territories.E$1:.E$1048576];[$territories_us_start.$B11]) -> USN | I11: of:=INDEX([$territories.F$1:.F$1048576];[$territories_us_start.$B11]) -> 
 | J11: of:=INDEX([$territories.G$1:.G$1048576];[$territories_us_start.$B11]) -> Images/navalbase.jpg | K11: of:=INDEX([$territories.H$1:.H$1048576];[$territories_us_start.$B11]) -> 0.0.2
A12: 1 | B12: 3 | C12: Pine Gap | D12: of:=INDEX([$territories.A$1:.A$1048576];[$territories_us_start.$B12]) -> Pine Gap | E12: of:=INDEX([$territories.B$1:.B$1048576];[$territories_us_start.$B12]) -> 4 | F12: of:=INDEX([$territories.C$1:.C$1048576];[$territories_us_start.$B12]) -> 2 | G12: of:=INDEX([$territories.D$1:.D$1048576];[$territories_us_start.$B12]) -> RAINFALL: During your first deployment phase each turn, select a face down asset controlled by your opponent. Your opponent must reveal this asset. It remains face down afterwards. | H12: of:=INDEX([$territories.E$1:.E$1048576];[$territories_us_start.$B12]) -> USN | I12: of:=INDEX([$territories.F$1:.F$1048576];[$territories_us_start.$B12]) -> 
 | J12: of:=INDEX([$territories.G$1:.G$1048576];[$territories_us_start.$B12]) -> Images/pinegap.jpg | K12: of:=INDEX([$territories.H$1:.H$1048576];[$territories_us_start.$B12]) -> 0.0.2
A13: 1 | B13: 2 | C13: United States Fleet Activities Yokosuka | D13: of:=INDEX([$territories.A$1:.A$1048576];[$territories_us_start.$B13]) -> US Naval Base | E13: of:=INDEX([$territories.B$1:.B$1048576];[$territories_us_start.$B13]) -> 6 | F13: of:=INDEX([$territories.C$1:.C$1048576];[$territories_us_start.$B13]) -> 2 | G13: of:=INDEX([$territories.D$1:.D$1048576];[$territories_us_start.$B13]) -> 
 | H13: of:=INDEX([$territories.E$1:.E$1048576];[$territories_us_start.$B13]) -> USN | I13: of:=INDEX([$territories.F$1:.F$1048576];[$territories_us_start.$B13]) -> 
 | J13: of:=INDEX([$territories.G$1:.G$1048576];[$territories_us_start.$B13]) -> Images/navalbase.jpg | K13: of:=INDEX([$territories.H$1:.H$1048576];[$territories_us_start.$B13]) -> 0.0.2

Sheet: territories_ru_start
A1: Duplication | B1: Class | C1: Name | D1: of:=[$territories.A1] -> Title | E1: of:=[$territories.B1] -> LogisticsCapacity | F1: of:=[$territories.C1] -> ShoreDefense | G1: of:=[$territories.D1] -> Description | H1: of:=[$territories.E1] -> Roster | I1: of:=[$territories.F1] -> FlavorText | J1: of:=[$territories.G1] -> Image | K1: of:=[$territories.H1] -> Version
A2: 1 | B2: 5 | C2: Severomorsk | D2: of:=INDEX([$territories.A$1:.A$1048576];[$territories_ru_start.$B2]) -> Russian Naval Base | E2: of:=INDEX([$territories.B$1:.B$1048576];[$territories_ru_start.$B2]) -> 5 | F2: of:=INDEX([$territories.C$1:.C$1048576];[$territories_ru_start.$B2]) -> 4 | G2: of:=INDEX([$territories.D$1:.D$1048576];[$territories_ru_start.$B2]) -> Partisans: Provides -4 logistics capacity if controlled by a non-Russian player. | H2: of:=INDEX([$territories.E$1:.E$1048576];[$territories_ru_start.$B2]) -> RUS | I2: of:=INDEX([$territories.F$1:.F$1048576];[$territories_ru_start.$B2]) -> 
 | J2: of:=INDEX([$territories.G$1:.G$1048576];[$territories_ru_start.$B2]) -> Images/russnavybase.jpg | K2: of:=INDEX([$territories.H$1:.H$1048576];[$territories_ru_start.$B2]) -> 0.0.2
A3: 1 | B3: 5 | C3: Kaliningrad, Kaliningrad Oblast | D3: of:=INDEX([$territories.A$1:.A$1048576];[$territories_ru_start.$B3]) -> Russian Naval Base | E3: of:=INDEX([$territories.B$1:.B$1048576];[$territories_ru_start.$B3]) -> 5 | F3: of:=INDEX([$territories.C$1:.C$1048576];[$territories_ru_start.$B3]) -> 4 | G3: of:=INDEX([$territories.D$1:.D$1048576];[$territories_ru_start.$B3]) -> Partisans: Provides -4 logistics capacity if controlled by a non-Russian player. | H3: of:=INDEX([$territories.E$1:.E$1048576];[$territories_ru_start.$B3]) -> RUS | I3: of:=INDEX([$territories.F$1:.F$1048576];[$territories_ru_start.$B3]) -> 
 | J3: of:=INDEX([$territories.G$1:.G$1048576];[$territories_ru_start.$B3]) -> Images/russnavybase.jpg | K3: of:=INDEX([$territories.H$1:.H$1048576];[$territories_ru_start.$B3]) -> 0.0.2
A4: 1 | B4: 5 | C4: Sevastopol | D4: of:=INDEX([$territories.A$1:.A$1048576];[$territories_ru_start.$B4]) -> Russian Naval Base | E4: of:=INDEX([$territories.B$1:.B$1048576];[$territories_ru_start.$B4]) -> 5 | F4: of:=INDEX([$territories.C$1:.C$1048576];[$territories_ru_start.$B4]) -> 4 | G4: of:=INDEX([$territories.D$1:.D$1048576];[$territories_ru_start.$B4]) -> Partisans: Provides -4 logistics capacity if controlled by a non-Russian player. | H4: of:=INDEX([$territories.E$1:.E$1048576];[$territories_ru_start.$B4]) -> RUS | I4: of:=INDEX([$territories.F$1:.F$1048576];[$territories_ru_start.$B4]) -> 
 | J4: of:=INDEX([$territories.G$1:.G$1048576];[$territories_ru_start.$B4]) -> Images/russnavybase.jpg | K4: of:=INDEX([$territories.H$1:.H$1048576];[$territories_ru_start.$B4]) -> 0.0.2
A5: 1 | B5: 5 | C5: Atstrakhan | D5: of:=INDEX([$territories.A$1:.A$1048576];[$territories_ru_start.$B5]) -> Russian Naval Base | E5: of:=INDEX([$territories.B$1:.B$1048576];[$territories_ru_start.$B5]) -> 5 | F5: of:=INDEX([$territories.C$1:.C$1048576];[$territories_ru_start.$B5]) -> 4 | G5: of:=INDEX([$territories.D$1:.D$1048576];[$territories_ru_start.$B5]) -> Partisans: Provides -4 logistics capacity if controlled by a non-Russian player. | H5: of:=INDEX([$territories.E$1:.E$1048576];[$territories_ru_start.$B5]) -> RUS | I5: of:=INDEX([$territories.F$1:.F$1048576];[$territories_ru_start.$B5]) -> 
 | J5: of:=INDEX([$territories.G$1:.G$1048576];[$territories_ru_start.$B5]) -> Images/russnavybase.jpg | K5: of:=INDEX([$territories.H$1:.H$1048576];[$territories_ru_start.$B5]) -> 0.0.2
A6: 1 | B6: 5 | C6: Vladivostok | D6: of:=INDEX([$territories.A$1:.A$1048576];[$territories_ru_start.$B6]) -> Russian Naval Base | E6: of:=INDEX([$territories.B$1:.B$1048576];[$territories_ru_start.$B6]) -> 5 | F6: of:=INDEX([$territories.C$1:.C$1048576];[$territories_ru_start.$B6]) -> 4 | G6: of:=INDEX([$territories.D$1:.D$1048576];[$territories_ru_start.$B6]) -> Partisans: Provides -4 logistics capacity if controlled by a non-Russian player. | H6: of:=INDEX([$territories.E$1:.E$1048576];[$territories_ru_start.$B6]) -> RUS | I6: of:=INDEX([$territories.F$1:.F$1048576];[$territories_ru_start.$B6]) -> 
 | J6: of:=INDEX([$territories.G$1:.G$1048576];[$territories_ru_start.$B6]) -> Images/russnavybase.jpg | K6: of:=INDEX([$territories.H$1:.H$1048576];[$territories_ru_start.$B6]) -> 0.0.2
A7: 1 | B7: 5 | C7: Petrapavlovsk-Kamchatskiy | D7: of:=INDEX([$territories.A$1:.A$1048576];[$territories_ru_start.$B7]) -> Russian Naval Base | E7: of:=INDEX([$territories.B$1:.B$1048576];[$territories_ru_start.$B7]) -> 5 | F7: of:=INDEX([$territories.C$1:.C$1048576];[$territories_ru_start.$B7]) -> 4 | G7: of:=INDEX([$territories.D$1:.D$1048576];[$territories_ru_start.$B7]) -> Partisans: Provides -4 logistics capacity if controlled by a non-Russian player. | H7: of:=INDEX([$territories.E$1:.E$1048576];[$territories_ru_start.$B7]) -> RUS | I7: of:=INDEX([$territories.F$1:.F$1048576];[$territories_ru_start.$B7]) -> 
 | J7: of:=INDEX([$territories.G$1:.G$1048576];[$territories_ru_start.$B7]) -> Images/russnavybase.jpg | K7: of:=INDEX([$territories.H$1:.H$1048576];[$territories_ru_start.$B7]) -> 0.0.2
A8: 1 | B8: 5 | C8: Mekhachkala | D8: of:=INDEX([$territories.A$1:.A$1048576];[$territories_ru_start.$B8]) -> Russian Naval Base | E8: of:=INDEX([$territories.B$1:.B$1048576];[$territories_ru_start.$B8]) -> 5 | F8: of:=INDEX([$territories.C$1:.C$1048576];[$territories_ru_start.$B8]) -> 4 | G8: of:=INDEX([$territories.D$1:.D$1048576];[$territories_ru_start.$B8]) -> Partisans: Provides -4 logistics capacity if controlled by a non-Russian player. | H8: of:=INDEX([$territories.E$1:.E$1048576];[$territories_ru_start.$B8]) -> RUS | I8: of:=INDEX([$territories.F$1:.F$1048576];[$territories_ru_start.$B8]) -> 
 | J8: of:=INDEX([$territories.G$1:.G$1048576];[$territories_ru_start.$B8]) -> Images/russnavybase.jpg | K8: of:=INDEX([$territories.H$1:.H$1048576];[$territories_ru_start.$B8]) -> 0.0.2
A9: 1 | B9: 5 | C9: Novorossiysk | D9: of:=INDEX([$territories.A$1:.A$1048576];[$territories_ru_start.$B9]) -> Russian Naval Base | E9: of:=INDEX([$territories.B$1:.B$1048576];[$territories_ru_start.$B9]) -> 5 | F9: of:=INDEX([$territories.C$1:.C$1048576];[$territories_ru_start.$B9]) -> 4 | G9: of:=INDEX([$territories.D$1:.D$1048576];[$territories_ru_start.$B9]) -> Partisans: Provides -4 logistics capacity if controlled by a non-Russian player. | H9: of:=INDEX([$territories.E$1:.E$1048576];[$territories_ru_start.$B9]) -> RUS | I9: of:=INDEX([$territories.F$1:.F$1048576];[$territories_ru_start.$B9]) -> 
 | J9: of:=INDEX([$territories.G$1:.G$1048576];[$territories_ru_start.$B9]) -> Images/russnavybase.jpg | K9: of:=INDEX([$territories.H$1:.H$1048576];[$territories_ru_start.$B9]) -> 0.0.2
A10: 1 | B10: 5 | C10: Baltiysk | D10: of:=INDEX([$territories.A$1:.A$1048576];[$territories_ru_start.$B10]) -> Russian Naval Base | E10: of:=INDEX([$territories.B$1:.B$1048576];[$territories_ru_start.$B10]) -> 5 | F10: of:=INDEX([$territories.C$1:.C$1048576];[$territories_ru_start.$B10]) -> 4 | G10: of:=INDEX([$territories.D$1:.D$1048576];[$territories_ru_start.$B10]) -> Partisans: Provides -4 logistics capacity if controlled by a non-Russian player. | H10: of:=INDEX([$territories.E$1:.E$1048576];[$territories_ru_start.$B10]) -> RUS | I10: of:=INDEX([$territories.F$1:.F$1048576];[$territories_ru_start.$B10]) -> 
 | J10: of:=INDEX([$territories.G$1:.G$1048576];[$territories_ru_start.$B10]) -> Images/russnavybase.jpg | K10: of:=INDEX([$territories.H$1:.H$1048576];[$territories_ru_start.$B10]) -> 0.0.2
A11: 1 | B11: 5 | C11: Kronshtadt | D11: of:=INDEX([$territories.A$1:.A$1048576];[$territories_ru_start.$B11]) -> Russian Naval Base | E11: of:=INDEX([$territories.B$1:.B$1048576];[$territories_ru_start.$B11]) -> 5 | F11: of:=INDEX([$territories.C$1:.C$1048576];[$territories_ru_start.$B11]) -> 4 | G11: of:=INDEX([$territories.D$1:.D$1048576];[$territories_ru_start.$B11]) -> Partisans: Provides -4 logistics capacity if controlled by a non-Russian player. | H11: of:=INDEX([$territories.E$1:.E$1048576];[$territories_ru_start.$B11]) -> RUS | I11: of:=INDEX([$territories.F$1:.F$1048576];[$territories_ru_start.$B11]) -> 
 | J11: of:=INDEX([$territories.G$1:.G$1048576];[$territories_ru_start.$B11]) -> Images/russnavybase.jpg | K11: of:=INDEX([$territories.H$1:.H$1048576];[$territories_ru_start.$B11]) -> 0.0.2
A12: 0 | B12: 5 | C12: Tartus, Syria | D12: of:=INDEX([$territories.A$1:.A$1048576];[$territories_ru_start.$B12]) -> Russian Naval Base | E12: of:=INDEX([$territories.B$1:.B$1048576];[$territories_ru_start.$B12]) -> 5 | F12: of:=INDEX([$territories.C$1:.C$1048576];[$territories_ru_start.$B12]) -> 4 | G12: of:=INDEX([$territories.D$1:.D$1048576];[$territories_ru_start.$B12]) -> Partisans: Provides -4 logistics capacity if controlled by a non-Russian player. | H12: of:=INDEX([$territories.E$1:.E$1048576];[$territories_ru_start.$B12]) -> RUS | I12: of:=INDEX([$territories.F$1:.F$1048576];[$territories_ru_start.$B12]) -> 
 | J12: of:=INDEX([$territories.G$1:.G$1048576];[$territories_ru_start.$B12]) -> Images/russnavybase.jpg | K12: of:=INDEX([$territories.H$1:.H$1048576];[$territories_ru_start.$B12]) -> 0.0.2
A13: 0 | B13: 5 | C13: Arkhangelsk | D13: of:=INDEX([$territories.A$1:.A$1048576];[$territories_ru_start.$B13]) -> Russian Naval Base | E13: of:=INDEX([$territories.B$1:.B$1048576];[$territories_ru_start.$B13]) -> 5 | F13: of:=INDEX([$territories.C$1:.C$1048576];[$territories_ru_start.$B13]) -> 4 | G13: of:=INDEX([$territories.D$1:.D$1048576];[$territories_ru_start.$B13]) -> Partisans: Provides -4 logistics capacity if controlled by a non-Russian player. | H13: of:=INDEX([$territories.E$1:.E$1048576];[$territories_ru_start.$B13]) -> RUS | I13: of:=INDEX([$territories.F$1:.F$1048576];[$territories_ru_start.$B13]) -> 
 | J13: of:=INDEX([$territories.G$1:.G$1048576];[$territories_ru_start.$B13]) -> Images/russnavybase.jpg | K13: of:=INDEX([$territories.H$1:.H$1048576];[$territories_ru_start.$B13]) -> 0.0.2